标题,标题链接,头像,user-detail__name,resource_date
感觉还行吧，适合休闲散步，人少。,https://gs.ctrip.com/html5/you/comment/detail/65217/11/155114035.html,https://dimg04.c-ctrip.com/images/fd/headphoto/g1/M03/5D/B8/CghzfFTAiHOAQQwwAACS4tO0ktA313_C_180_180.jpg,138****5897,2018-06-02
很好，安静，今天陪儿子抓鱼很开心,https://gs.ctrip.com/html5/you/comment/detail/65217/11/154619716.html,https://dimg04.c-ctrip.com/images/Z80p180000013uw9yF21F_C_180_180.jpg,lc****4,2018-04-29
很大的一个景点，环境很美，把渔文化保留展示得很极致。管理也非常到位，工作人员态度和善热情。适合悠闲的全家游。需要坐两次船，一次大船一次小船，带着2岁的宝宝，前后在公园玩了4.5个小时，很尽兴。,https://gs.ctrip.com/html5/you/comment/detail/65217/11/138791526.html,https://dimg04.c-ctrip.com/images/Z80p180000013uw9yF21F_C_180_180.jpg,LU****808,2017-10-08
景区行程设计合理，游船减少旅客舟车劳顿，服务不错，但是摇撸船太坑了，说是座一段玩经典还能接着座第二段摇撸船，走了半天都走到大船等候点都没看到有摇撸船，这也太坑爹了吧，所以建议游客不要选择摇撸船,https://gs.ctrip.com/html5/you/comment/detail/65217/11/138652895.html,https://dimg04.c-ctrip.com/images/t1/headphoto/258/512/704/6bce7506eecc48f8a4a6d3177e0acf24_C_180_180.jpg,M50****832,2017-10-04
游玩一天，景色不错，还会推荐给朋友来观光，回来还带了特产，很开心的一天哟,https://gs.ctrip.com/html5/you/comment/detail/65217/11/121113616.html,https://dimg04.c-ctrip.com/images/t1/headphoto/646/318/109/a865fe5f5465407d8befd5dc487a8554_C_180_180.jpg,M22****2300,2017-09-04
取票方便，景区一般般吧！天气太热,https://gs.ctrip.com/html5/you/comment/detail/65217/11/116918708.html,https://dimg04.c-ctrip.com/images/Z80v0z000000ntaqy0E73_C_180_180.jpg,win****82,2017-07-16
平时去的，人很少，适合在里面漫步，悠闲的旅游才是真正的休闲。不错的选择。,https://gs.ctrip.com/html5/you/comment/detail/65217/11/109835479.html,https://dimg04.c-ctrip.com/images/Z80p180000013uw9yF21F_C_180_180.jpg,110****442,2017-06-11
空气非常好，很适合带小朋友去走走,https://gs.ctrip.com/html5/you/comment/detail/65217/11/74574847.html,https://dimg04.c-ctrip.com/images/Z80h180000013xc9e3F64_C_180_180.jpg,kathyli,2016-06-10
"很典型的湿地，人不算太多，排队时间可以接受。坐船比较多，其实也可以自己走的。

里面有个体育公园，小孩很喜欢",https://gs.ctrip.com/html5/you/comment/detail/65217/11/58626321.html,https://dimg04.c-ctrip.com/images/Z80p180000013uw9yF21F_C_180_180.jpg,118****868,2015-10-05
也许还没到季节，略微有点萧瑟，空气还是不错的。相对门票，性价比soso…,https://gs.ctrip.com/html5/you/comment/detail/65217/11/13750298.html,https://dimg04.c-ctrip.com/images/Z80h180000013xc9e3F64_C_180_180.jpg,60****115,2015-03-26
景点倒是一般，但是坐船到其中一个小岛上荷花盛开，四处无人，宁静致远的感觉。溱湖度假酒店的房间相当大，正合我意。药师佛的雕像在高速上都能看见。毕竟是苏北，要营造江南的风格尚有差距。但是值得一去。,https://gs.ctrip.com/html5/you/comment/detail/65217/11/10848923.html,https://dimg04.c-ctrip.com/images/fd/headphoto/g1/M01/63/AC/CghzfVTMhjSAZuMlAAJIgm_LqaE355_C_180_180.jpg,230****352,2014-09-13
服务挺好的。天热，游客不太多。,https://gs.ctrip.com/html5/you/comment/detail/65217/11/156288385.html,https://dimg04.c-ctrip.com/images/Z80l0j000000aiji4E841_C_180_180.jpg,138****0793,2018-08-25
还可以，没什么好看的，一直坐船,https://gs.ctrip.com/html5/you/comment/detail/65217/11/154945746.html,https://dimg04.c-ctrip.com/images/Z80h180000013xc9e3F64_C_180_180.jpg,M21****01,2018-05-21
公园比较大，随意走走也挺惬意。,https://gs.ctrip.com/html5/you/comment/detail/65217/11/154477846.html,https://dimg04.c-ctrip.com/images/Z80h180000013xc9e3F64_C_180_180.jpg,202****158,2018-04-19
整体和以前没有啥区别，古镇还是那8个故居，不过外面乱七八糟的，不知道有没有考虑整治下。溱湖外面显示人太多了，车都没法进去，绕了好大圈，不过进去还好，时间不够，全部选择的船出行，没怎么好好逛！,https://gs.ctrip.com/html5/you/comment/detail/65217/11/138797640.html,https://dimg04.c-ctrip.com/images/t1/headphoto/588/075/614/bc0b3ae9be8d4d8c8cf5dd5e49cb5822_C_180_180.jpg,AlecWu,2017-10-08
今天天气超好、全家人一起去游玩溱湖公园，景色棒棒的，主要家人玩的开心。,https://gs.ctrip.com/html5/you/comment/detail/65217/11/138732489.html,https://dimg04.c-ctrip.com/images/Z80v0k000000cdp829BAF_C_180_180.jpg,_CFT01****6521072,2017-10-06
全程游走，感受到公园的设计，管理，就是很多设施老旧了，需要好好维护，可能不太适合夏天，别的季节应该都好，溱湖水很干净，里面湿地倒水质不佳，请继续努力。,https://gs.ctrip.com/html5/you/comment/detail/65217/11/116707283.html,https://dimg04.c-ctrip.com/images/Z8070u000000jl52aF33E_C_180_180.jpg,filifili,2017-06-01
携全家旅游，过了一个愉快的周末,https://gs.ctrip.com/html5/you/comment/detail/65217/11/116438673.html,https://dimg04.c-ctrip.com/images/fd/headphoto/g1/M06/A4/B8/CghzfVV8E6KATrOsAAFDoQkyp6o024_C_180_180.jpg,100****920,2017-04-07
环境不错，值得游玩，后续再来。,https://gs.ctrip.com/html5/you/comment/detail/65217/11/116424591.html,https://dimg04.c-ctrip.com/images/Z80p180000013uw9yF21F_C_180_180.jpg,海鹰,2017-04-05
这是第二次去了，节假日人很多，但是景点做的比较到位，基本没有排队现象。,https://gs.ctrip.com/html5/you/comment/detail/65217/11/58737530.html,https://dimg04.c-ctrip.com/images/Z80p180000013uw9yF21F_C_180_180.jpg,hx****0,2015-10-12
暴走江苏泰州5a景区溱湖湿地，掠过无数大妈和小学生团体，寂静之处，方有天人合一。第二次游了，谁道故地不可重游。,https://gs.ctrip.com/html5/you/comment/detail/65217/11/15788274.html,https://dimg04.c-ctrip.com/images/fd/headphoto/g2/M08/06/8F/Cghzf1VIOR2AKq8CAATVVhunJFk595_C_180_180.jpg,逗一逗,2015-05-08
冬天 没有什么动物 没有什么候鸟 整个公园设计的不错 科普 观赏 很适合带孩子玩哦,https://gs.ctrip.com/html5/you/comment/detail/65217/11/13479445.html,https://dimg04.c-ctrip.com/images/fd/headphoto/g2/M06/34/77/Cghzf1WHoYqASMPTAAETl8Mfs_g306_C_180_180.jpg,七星瓢虫安娜,2015-02-23
湿地人挺少的，空气不错。景区大概有7平方公里，可以选择摇橹船或者步行。,https://gs.ctrip.com/html5/you/comment/detail/65217/11/11576786.html,https://dimg04.c-ctrip.com/images/Z80h180000013xc9e3F64_C_180_180.jpg,YY****WEI,2014-11-30
一般吧 可以去玩下 看看风景挺好,https://gs.ctrip.com/html5/you/comment/detail/65217/11/157417194.html,https://dimg04.c-ctrip.com/images/t1/headphoto/491/056/464/eb3c7472323e4c3598f58ffa8a6fce99_C_180_180.jpg,飞翔在蓝天之上,2018-12-12
空气蛮新鲜的 园子好大 走的好累,https://gs.ctrip.com/html5/you/comment/detail/65217/11/157041259.html,https://dimg04.c-ctrip.com/images/Z80k0h0000008voxzDC97_C_180_180.jpg,冲绳latte,2018-10-21
主要就是坐船游玩，地方很大，走下全程不容易，新建的湿地科普馆不错，这个时间去已经很热了，可以免费去药师王菩萨到场转转，我们不知道还单独买了门票去的。,https://gs.ctrip.com/html5/you/comment/detail/65217/11/154228559.html,https://dimg04.c-ctrip.com/images/Z8090r000000gs12h7A3D_C_180_180.jpg,果糖新娘,2018-04-03
正在玩的途中，抽个空先来点评下，这个季节坐个船溜溜湿地，感觉杠杠的。,https://gs.ctrip.com/html5/you/comment/detail/65217/11/154183504.html,https://dimg04.c-ctrip.com/images/t1/headphoto/272/077/772/76b262d0cc24492abc5c6784c903c2ab_C_180_180.jpg,M36****746,2018-03-31
临时决定去泰州溱湖游玩，离家不是很远，带着家里老人一起玩玩看看，古镇小吃也比较多，湿地公园风景优美，我们去的中午开始下雨，以后天气好了，还是可以来逛逛的，放松心情，休闲……总的来说，还不错,https://gs.ctrip.com/html5/you/comment/detail/65217/11/153871536.html,https://dimg04.c-ctrip.com/images/Z80p180000013uw9yF21F_C_180_180.jpg,M17****742,2018-03-16
一日溱湖之旅，与大自然亲密接触，自然氧吧，大家很开心，玩得很high,https://gs.ctrip.com/html5/you/comment/detail/65217/11/116613026.html,https://dimg04.c-ctrip.com/images/t1/headphoto/463/352/613/9d877effaa3d4bd0b951bb4c60209b3b_C_180_180.jpg,_WeCh****34364,2017-05-14
国家5A景点，湿地公园，占地超大，可以看到各种珍稀的湿地动物。以前一直想来过，现在自己来，感觉不太一样，脚都走酸了，但看到了很多可爱的动物，也是值了。住宿的化选择其实不多，周边有温泉酒店。,https://gs.ctrip.com/html5/you/comment/detail/65217/11/115871460.html,https://dimg04.c-ctrip.com/images/headphoto/686/839/541/e4e93a4c302f4108807ab56273b46d42_C_180_180.jpg,allgoaway,2016-07-11
挺有特色的湿地公园。特别是里面的湿地科普管感觉很好，适合带小孩长知识,https://gs.ctrip.com/html5/you/comment/detail/65217/11/58568136.html,https://dimg04.c-ctrip.com/images/Z80p180000013uw9yF21F_C_180_180.jpg,M70****52,2015-10-02
不错的地方，景点安排合理。电瓶船省时省力。各种有关农家的展示好看。,https://gs.ctrip.com/html5/you/comment/detail/65217/11/153369442.html,https://dimg04.c-ctrip.com/images/t1/headphoto/724/518/802/e201a429d7a54f72ade0df32a3d59b2f_C_180_180.jpg,M22****5112,2018-02-18
觉得环境很好，很悠闲很放松的一天，还增长了很多见识，值得带家人来。,https://gs.ctrip.com/html5/you/comment/detail/65217/11/141746921.html,https://dimg04.c-ctrip.com/images/Z80h180000013xc9e3F64_C_180_180.jpg,m40****10,2017-11-14
这里风景还是蛮原生态的，空气非常好，坐着摇船慢慢欣赏风景也很不错的,https://gs.ctrip.com/html5/you/comment/detail/65217/11/141602245.html,https://dimg04.c-ctrip.com/images/Z80h180000013xc9e3F64_C_180_180.jpg,138****4363,2017-11-06
挺大的地方，里面空气很好，可以玩的地方有很多。包船去的，有点小贵。,https://gs.ctrip.com/html5/you/comment/detail/65217/11/107230130.html,https://dimg04.c-ctrip.com/images/Z80u0g0000007y6ba2FD1_C_180_180.jpg,蹦哒蹦哒拉,2017-05-17
风景秀丽，心旷神怡，美中不足的是买了班船票里面还要再买电动船或者摇橹船的票，不然要徒步走七八公里，其实不怕门票贵，你把电动船包含进去不好吗，今天这么多人没有一个步行的，提升游客的体验感。,https://gs.ctrip.com/html5/you/comment/detail/65217/11/74587944.html,https://dimg04.c-ctrip.com/images/Z80p180000013uw9yF21F_C_180_180.jpg,文丑但是颜良,2016-06-10
景色不错，就是没有什么可玩的东西，散散步呼吸呼吸新鲜空气！门票太贵,https://gs.ctrip.com/html5/you/comment/detail/65217/11/65204507.html,https://dimg04.c-ctrip.com/images/Z80q060000001o05uE737_C_180_180.jpg,旭伟,2015-11-16
体验不佳，可玩性低，性价比低，夏天去的，园内没啥看头，麋鹿馆和鳄鱼馆形同虚设，根本没有看到迷路和鳄鱼，湖里的水浑浊，没有感受到5'A景区的风景。,https://gs.ctrip.com/html5/you/comment/detail/65217/11/164025854.html,https://dimg04.c-ctrip.com/images/t1/headphoto/463/352/613/9d877effaa3d4bd0b951bb4c60209b3b_C_180_180.jpg,M28****4591,2020-08-06
今天来湿地游玩，在携程网上面订票很方便。而且也优惠了很多，原本100元的一张门票在携程网上只有70元。并且小朋友也玩的很开心，学到很东西还玩了很多。小朋友还说今天玩的不过瘾下次还要来。,https://gs.ctrip.com/html5/you/comment/detail/65217/11/153384593.html,https://dimg04.c-ctrip.com/images/Z80h180000013xc9e3F64_C_180_180.jpg,136****9922,2018-02-18
挺好玩的，带老人周末出来呼吸新鲜空气，恰巧遇上品蟹大赛，看个热闹,https://gs.ctrip.com/html5/you/comment/detail/65217/11/141355742.html,https://dimg04.c-ctrip.com/images/t1/headphoto/397/132/243/542067aa29904ae9aca7e88f43eaeb6f_C_180_180.jpg,_WeCh****077182,2017-10-22
湿地，地球之肺，确实优美，应该多一些这样的公园，我们的环境才更好,https://gs.ctrip.com/html5/you/comment/detail/65217/11/138794555.html,https://dimg04.c-ctrip.com/images/t1/headphoto/397/132/243/542067aa29904ae9aca7e88f43eaeb6f_C_180_180.jpg,M44****303,2017-10-08
大景色还是不错的，门票取票也很方便，就是有些路途杂草丛生，感觉就像小时候的沟渠，多加管理规划就更好了，说是不走回头路，如果不是坐船，很容易在一个地方绕圈子，拍照很有新意，取照片也很方便,https://gs.ctrip.com/html5/you/comment/detail/65217/11/120939951.html,https://dimg04.c-ctrip.com/images/t1/headphoto/164/424/952/04eab99bd26f47acadef4fd3f95b9f37_C_180_180.jpg,M22****7400,2017-09-01
感觉一般，适合远离城市感受大自然的那种氛围！,https://gs.ctrip.com/html5/you/comment/detail/65217/11/110007427.html,https://dimg04.c-ctrip.com/images/t1/headphoto/424/398/503/0386f569fd0d4b488ff41b64bbc5743b_C_180_180.jpg,M22****4766,2017-06-20
总体环境不错，带老人游玩的，一切顺当，景区服务人员服务态度也蛮好,https://gs.ctrip.com/html5/you/comment/detail/65217/11/116495437.html,https://dimg04.c-ctrip.com/images/t1/headphoto/982/089/752/f8c7b21182c94524ac4df328fdc7b3dc_C_180_180.jpg,M60****855,2017-04-22
时间正好是初春，很多地方没有绿色，景区很多地方正在改扩建中，摆渡船人也特别多。加上清明长假，碰到交通管制。其实一般般的旅程。,https://gs.ctrip.com/html5/you/comment/detail/65217/11/100363812.html,https://dimg04.c-ctrip.com/images/Z8080x000000lfwz26181_C_180_180.jpg,神无之夜,2017-04-04
晚上住在泰州，早上吃过早茶到达溱湖湿地公园，用手机上网在携程购票，现场取票很方便，公园环境优美，坐着游船欣赏水乡风光，看到了当地的特色簖蟹，中午吃了当季的簖蟹溱湖八鲜，很好的一次旅行。,https://gs.ctrip.com/html5/you/comment/detail/65217/11/115462326.html,https://dimg04.c-ctrip.com/images/Z80p180000013uw9yF21F_C_180_180.jpg,133****0797,2015-10-13
"泰州溱潼湿地公园挺不错的，适宜周末来玩，下午到湿地公园
，晚上泡云海温泉，第二天早晨吃古镇早茶，上午游古镇，下午返程，轻松又休闲花费也就小几百。",https://gs.ctrip.com/html5/you/comment/detail/65217/11/58304278.html,https://dimg04.c-ctrip.com/images/fd/headphoto/g2/M07/06/62/Cghzf1UFmZaARX3bAAAp50mPGr8805_C_180_180.jpg,焱廿415,2015-09-15
公园还是不错的，真正意义上的湿地公园，占地大，空气好！但十一长假期间人流量大，交通疏导不算给力，到景区前还堵了一阵。但是七十岁以上老人免费还不用排队直接走绿色通道入园，这点非常人性化,https://gs.ctrip.com/html5/you/comment/detail/65217/11/138657273.html,https://dimg04.c-ctrip.com/images/Z80p180000013uw9yF21F_C_180_180.jpg,e31****61,2017-10-04
感觉一直都挺不错的，环境好，各方面都不错，去的时候人也不算多。,https://gs.ctrip.com/html5/you/comment/detail/65217/11/116401261.html,https://dimg04.c-ctrip.com/images/fd/headphoto/g4/M0B/47/2A/CggYHFZrv26ATC9MAADqq9z4UGM112_C_180_180.jpg,porsche潘潘,2017-04-03
溱湖湿地不是太出名，所以总的游客不是太多，国庆期间也不会人撞人，所以整个游玩过程才比较舒适。空气清新，最开心的是可以摸田螺，个大，多，就在湿地迷宫那一段，孩子开心的，大人也乐此不疲！,https://gs.ctrip.com/html5/you/comment/detail/65217/11/116047252.html,https://dimg04.c-ctrip.com/images/Z80p180000013uw9yF21F_C_180_180.jpg,110****642,2016-10-09
今天就在公园里先是要坐大船镜湖然后坐摇橹的小船进入河道摇船的都是年纪比较大的船娘很辛苦风景还是很秀丽的,https://gs.ctrip.com/html5/you/comment/detail/65217/11/67604688.html,https://dimg04.c-ctrip.com/images/fd/headphoto/g6/M04/72/34/CggYslbP4BuAfk5QAADrAq-WTlE702_C_180_180.jpg,yygui,2015-11-28
九月底去的，去的时间稍微早了一个月，应该等十月份中下旬去，因为簖蟹那时会更好。不过，尝了两只，还不错，味道也鲜美。整体感觉很好，换票很方便，人不多，景色也自然，空气相当好。值得一去。,https://gs.ctrip.com/html5/you/comment/detail/65217/11/115449650.html,https://dimg04.c-ctrip.com/images/Z80p180000013uw9yF21F_C_180_180.jpg,donald2000,2015-10-10
"正值双11光棍节期间，不能帮你们清空购物车，就推荐一个适合情侣打卡的景点， 愿每个人都不孤单！
泰州溱湖国家湿地公园是一座生态环境极佳，且体验感很强的国家5A级景点。天空中飞散的野鸭、清水里游弋的小鱼以及湿地上奔跑的麋鹿全部肉眼可见。
乘画舫、坐摇橹船、在木栈道里散步等等，就算玩上一天也不会无聊。饿了还能吃一口溱湖簖蟹，十一月中旬也是公蟹最为肥美的时候。
 溱湖国家湿地公园",https://gs.ctrip.com/html5/you/comment/detail/65217/11/161932171.html,https://dimg04.c-ctrip.com/images/Z80914000000w0txu2FFC_C_180_180.jpg,胡恩泰,2019-11-10
我们是自驾游的，买的溱湖国家湿地公园和溱潼古镇的联票，上午玩的溱潼古镇，下午玩的溱湖国家湿地公园，总体感觉还不错，就是觉得夏末去会更好，能看到荷花和更多绿色的植物，有机会下次再去。,https://gs.ctrip.com/html5/you/comment/detail/65217/11/141953891.html,https://dimg04.c-ctrip.com/images/t1/headphoto/293/406/308/22631089f44a497495c005fce85f6a6f_C_180_180.jpg,M24****1884,2017-11-27
环境真的很好，空气很新鲜，负氧离子很高，带家人出游值得推荐。,https://gs.ctrip.com/html5/you/comment/detail/65217/11/116534865.html,https://dimg04.c-ctrip.com/images/Z8090g0000007n98m2443_C_180_180.jpg,三月春风卍花落儒家,2017-04-30
进入景区先是有船摆渡到对岸，正好遇到溱潼会船的表演船队，非常壮观。登岸后步行游览，整个景区很大，花了一个多小时才走回到船码头，总体感觉还不错,https://gs.ctrip.com/html5/you/comment/detail/65217/11/116509256.html,https://dimg04.c-ctrip.com/images/Z805060000001o4qj593D_C_180_180.jpg,闷忒老栾侬想哪能,2017-04-25
湖面开阔干净，风光秀丽原生态，值得一游。,https://gs.ctrip.com/html5/you/comment/detail/65217/11/100346297.html,https://dimg04.c-ctrip.com/images/Z80p080000002ws0r32EF_C_180_180.jpg,M10****180,2017-04-03
每年溱湖湿地公园在清明开始搞一个月的会船节，场面声势浩大。由于家人没有时间，这次踏春就想到湿地公园玩玩，那里有麋鹿、野鸭、鸟等等，是踏春离上海比较近的好地方，以后会船节时再去玩玩。,https://gs.ctrip.com/html5/you/comment/detail/65217/11/116371942.html,https://dimg04.c-ctrip.com/images/Z80p180000013uw9yF21F_C_180_180.jpg,189****8906,2017-03-26
我们是周末带孩子出游的，路途适中，从上海开车大约4个小时左右就到了。周边环境幽雅，由于是早中午到的 游人并不多，等待了10分钟就乘上游船了。里面工作人员比较多，也热情。环境真的很棒。,https://gs.ctrip.com/html5/you/comment/detail/65217/11/116104637.html,https://dimg04.c-ctrip.com/images/Z805190000015no4m1410_C_180_180.jpg,妮妮宝贝404,2016-11-25
溱湖湿地值得去游一下的，最好是车进船游，慢慢品味的，鳄鱼池和鹿苑没啥花头，坐着小船慢慢体会是最开心的,https://gs.ctrip.com/html5/you/comment/detail/65217/11/58642215.html,https://dimg04.c-ctrip.com/images/Z80p180000013uw9yF21F_C_180_180.jpg,xue****69,2015-10-06
夏日的溱湖，泛舟湖面，穿梭在芦苇荡的河汊之间，真是别有洞天!,https://gs.ctrip.com/html5/you/comment/detail/65217/11/57851064.html,https://dimg04.c-ctrip.com/images/Z80p180000013uw9yF21F_C_180_180.jpg,E21****04,2015-08-15
雨中的湿地公园宁静，坐在摇摇船上看风景听船娘唱船歌思绪悠长,https://gs.ctrip.com/html5/you/comment/detail/65217/11/153449015.html,https://dimg04.c-ctrip.com/images/fd/headphoto/g1/M00/23/1D/CghzflWzLEOAEPQ4AAAi71Jo4I0768_C_180_180.jpg,139****7632,2018-02-20
风景优美，气候适宜，坐坐船，吹吹风，看看景色，走走小桥，很有感觉，摇橹船很有特色，都是年龄较大的老者，慢慢摇，看看孔雀和鸬鹚，别有一番感觉,https://gs.ctrip.com/html5/you/comment/detail/65217/11/138781549.html,https://dimg04.c-ctrip.com/images/Z80p180000013uw9yF21F_C_180_180.jpg,_M13****9018,2017-10-07
一家四口到公园游玩，坐船往返，水面上微风徐徐，清爽无比。主景区我们没有坐船，走着观赏沿途景色，还有小孩玩的乐园，一家人都很开心，还买了不少现采的菱回家，很甜哦，是一次不错的体验。,https://gs.ctrip.com/html5/you/comment/detail/65217/11/119921576.html,https://dimg04.c-ctrip.com/images/Z80p180000013uw9yF21F_C_180_180.jpg,浪客远风,2017-08-29
风景很好，适合与家人放松，还看到了赛龙舟，孩子很高兴，好评,https://gs.ctrip.com/html5/you/comment/detail/65217/11/116462304.html,https://dimg04.c-ctrip.com/images/t1/headphoto/057/777/943/0b93f8268d5546308915f4f9fcaa9483_C_180_180.jpg,M41****066,2017-04-14
很好，带小孩去蛮好的，附近还有秋雪湖水上世界可以一起玩一下,https://gs.ctrip.com/html5/you/comment/detail/65217/11/74750051.html,https://dimg04.c-ctrip.com/images/fd/headphoto/g2/M0B/BB/6B/Cghzf1T6rqKATBCDAAAvSXG2xw0721_C_180_180.jpg,黒色幽默,2016-06-20
景点很好，虽然天气已经很冷了，但是景色很不错，值得一去！,https://gs.ctrip.com/html5/you/comment/detail/65217/11/141722775.html,https://dimg04.c-ctrip.com/images/Z80p180000013uw9yF21F_C_180_180.jpg,M40****194,2017-11-13
"首先携程取票很方便，是去团队窗口取哦，赞一个。
停车场很大，一次10元。
坐船进出公园主景区是特色。
但是其他的就感觉一般了，大概因为去",https://gs.ctrip.com/html5/you/comment/detail/65217/11/116424133.html,https://dimg04.c-ctrip.com/images/Z80n1700000137y2aA594_C_180_180.jpg,约风,2017-04-05
很大很舒服，第二次来了，小朋友喜欢里面的勇敢者活动设施。,https://gs.ctrip.com/html5/you/comment/detail/65217/11/116413335.html,https://dimg04.c-ctrip.com/images/Z80p180000013uw9yF21F_C_180_180.jpg,118****431,2017-04-04
跟父母朋友一起去的，门票包含了大船票，小船的票要另外付钱的，若不坐船，走路也不远，但是乘船地方会说很远的，很多人就被忽悠坐船。我们一行10人有两个人走路了，没坐船，他们说也不错,https://gs.ctrip.com/html5/you/comment/detail/65217/11/115953534.html,https://dimg04.c-ctrip.com/images/fd/headphoto/g3/M09/99/0A/CggYGVXqrWaAVR1XAADUpXVo6lo018_C_180_180.jpg,rai****1017,2016-08-23
溱湖风景区还是比较漂亮的，尤其是里面的展馆，特别的漂亮。,https://gs.ctrip.com/html5/you/comment/detail/65217/11/58446590.html,https://dimg04.c-ctrip.com/images/fd/headphoto/g4/M00/F6/07/CggYHlX_XCuAMF0GAADRndNqSHM904_C_180_180.jpg,刘秀娟,2015-09-22
环境很好，有电动船来回，有科普的介绍，有拓展的活动，有麋鹿看，还有小马骑，适合一家老小去，很不错,https://gs.ctrip.com/html5/you/comment/detail/65217/11/13869545.html,https://dimg04.c-ctrip.com/images/Z80h180000013xc9e3F64_C_180_180.jpg,133****0245,2015-04-08
湿地公园很大，湖水很清澈。里面的工作人员推荐我们坐摇橹船，但是我们还是一路步行走完了这个公园，看到了麋鹿，公园还有游乐设施。现在正直秋冬过渡的季节，树叶颜色多边美丽，值得一去。,https://gs.ctrip.com/html5/you/comment/detail/65217/11/114494632.html,https://dimg04.c-ctrip.com/images/Z80h180000013xc9e3F64_C_180_180.jpg,205****690,2013-11-08
空气很好，让人很舒服。有游乐设施，小朋友们玩得很愉快!,https://gs.ctrip.com/html5/you/comment/detail/65217/11/138592174.html,https://dimg04.c-ctrip.com/images/0Z83w120008dvfuct6399_C_180_180.jpg,M23****7916,2017-10-02
以湿地良好生态环境和多样化湿地景观资源为基础，以湿地的科普宣教、湿地功能利用、弘扬湿地文化等为主题，并建有一定规模的旅游休闲设施，可供人们旅游观光、休闲娱乐的生态型主题公园。,https://gs.ctrip.com/html5/you/comment/detail/65217/11/91083110.html,https://dimg04.c-ctrip.com/images/Z80q080000003ipdv9A83_C_180_180.jpg,M61938jd9831,2016-11-07
苏中地区最具有特点的湿地公园！保护的很好，里面没有过多的去人为修葺。保持当地风土人情，值得一看,https://gs.ctrip.com/html5/you/comment/detail/65217/11/69149914.html,https://dimg04.c-ctrip.com/images/fd/headphoto/g1/M00/79/CC/CghzfFTM3neAFfLuAABslKU8s4s388_C_180_180.jpg,飘在江楠,2016-01-06
那里一共去了两次，一次是和同事几个家庭出游，国庆期间去的，另外一次和同学一起去了几个家庭。湿地公园里面的空气以及水都非常棒，只是国庆期间人多些，但是排队还是很快的。值得一游。,https://gs.ctrip.com/html5/you/comment/detail/65217/11/115520461.html,https://dimg04.c-ctrip.com/images/Z80p180000013uw9yF21F_C_180_180.jpg,二牛哥,2015-10-31
