标题,标题链接,头像,user-detail__name,resource_date
泰州二日游，第一个景点就来到这里，因为以前没有去过其他湿地公园，想象中还是挺美好的。坐船到一个岛，然后经过一个湿地科普馆跟迷宫一样，没啥特别的。接着后面就正式开始7.5公里的湿地内行走，如果选择坐船的话可能会错过一些有趣的娱乐区，建议步行。整体感觉景色一般，可能是因为我去的时间不对，如果选择春天应该会很美！,https://gs.ctrip.com/html5/you/comment/detail/65217/11/11235441.html,https://dimg04.c-ctrip.com/images/headphoto/182/673/151/f940110eb6c047eb9ab970b4180be8ae_C_180_180.jpg,anmy365,2014-10-26
生态保持的不错，环境很好。玩的很开心。,https://gs.ctrip.com/html5/you/comment/detail/65217/11/157422730.html,https://dimg04.c-ctrip.com/images/Z80p180000013uw9yF21F_C_180_180.jpg,m89****77,2018-12-13
节日期间人好多，排队上船，风景还可以，,https://gs.ctrip.com/html5/you/comment/detail/65217/11/156928605.html,https://dimg04.c-ctrip.com/images/Z80h180000013xc9e3F64_C_180_180.jpg,320****601,2018-10-09
地方很大，空气很好，水清湖美，给人以宁静，小朋友玩的地方不算多，小小宝不适合去,https://gs.ctrip.com/html5/you/comment/detail/65217/11/155315306.html,https://dimg04.c-ctrip.com/images/t1/headphoto/397/132/243/542067aa29904ae9aca7e88f43eaeb6f_C_180_180.jpg,M26****0004,2018-06-18
很漂亮，景色优美，下次一定会再带孩子来,https://gs.ctrip.com/html5/you/comment/detail/65217/11/154629921.html,https://dimg04.c-ctrip.com/images/Z80h180000013xc9e3F64_C_180_180.jpg,小红,2018-04-30
溱湖还是不错的，进湿地公园需要坐船进去，船班次也很快，里面可以做摇橹船游玩，摆船大妈还给唱歌助兴，整体一个多小时能游完,https://gs.ctrip.com/html5/you/comment/detail/65217/11/138665867.html,https://dimg04.c-ctrip.com/images/Z80p180000013uw9yF21F_C_180_180.jpg,_CFT01****6159226,2017-10-04
很好玩，第一次做这种船，孩子玩很开心,https://gs.ctrip.com/html5/you/comment/detail/65217/11/154762955.html,https://dimg04.c-ctrip.com/images/t1/headphoto/685/724/771/3cd584c18f744104b47d3f3d075d10e3_C_180_180.jpg,_WeCh****530188,2018-05-08
空气干净，环境优美，植物花鸟多多，不错。携程的联票，取票方便，可省一些银子。,https://gs.ctrip.com/html5/you/comment/detail/65217/11/154629311.html,https://dimg04.c-ctrip.com/images/Z80p180000013uw9yF21F_C_180_180.jpg,37****529,2018-05-01
出票快，取票方便。自然生态，空气清新。今年的会船节8号开幕，去早了有点遗憾。,https://gs.ctrip.com/html5/you/comment/detail/65217/11/154286324.html,https://dimg04.c-ctrip.com/images/fd/headphoto/g3/M0B/28/3A/CggYG1arGyGAGHiUAAAU0Rd_On0711_C_180_180.jpg,幽幽鸡,2018-04-07
挺不错的地方，坐船进去 里面是大公园,https://gs.ctrip.com/html5/you/comment/detail/65217/11/155218263.html,https://dimg04.c-ctrip.com/images/Z80o0v000000jn8gtBE48_C_180_180.jpg,凤与轩,2018-06-10
一般吧，天太热，人很少，没啥看头。,https://gs.ctrip.com/html5/you/comment/detail/65217/11/154876536.html,https://dimg04.c-ctrip.com/images/Z80p180000013uw9yF21F_C_180_180.jpg,D63****56,2018-05-16
一次不错的旅行，放松心情的绝佳桃源，风景真的很美，全程走下来也没觉得有多累,https://gs.ctrip.com/html5/you/comment/detail/65217/11/154811550.html,https://dimg04.c-ctrip.com/images/Z80p180000013uw9yF21F_C_180_180.jpg,西夏刚哥,2018-05-11
适宜的天气来这里走走非常舒服，含氧量很高的空气，鸟语花香，绿树成荫。尤其适合带小朋友来玩儿，可以学到很多自然常识。,https://gs.ctrip.com/html5/you/comment/detail/65217/11/154546519.html,https://dimg04.c-ctrip.com/images/t1/headphoto/045/144/448/993ea3374c5d46049ed98001e1ebd776_C_180_180.jpg,zoe****ang,2018-04-24
湿地公园环境优美，但景区方向提示路标还需增加；古镇景点与温地公园间10公里可乘公交816路到达；2处景点值得一玩。,https://gs.ctrip.com/html5/you/comment/detail/65217/11/118377708.html,https://dimg04.c-ctrip.com/images/t1/headphoto/982/089/752/f8c7b21182c94524ac4df328fdc7b3dc_C_180_180.jpg,M22****0199,2017-08-13
刚入三伏天，天气太热，但仍然带着亲戚去泰州五星级景点游玩，虽然很热，但景色很美，水道漫漫，载舟徜徉，心情舒畅。有老人的话，建议乘船游玩，半天时间也差不多。,https://gs.ctrip.com/html5/you/comment/detail/65217/11/116953707.html,https://dimg04.c-ctrip.com/images/Z80p180000013uw9yF21F_C_180_180.jpg,M11****528,2017-07-21
景色非常美，大约需要一天时间，带孩子的带点干粮和水，还有推车，景点内吃的东西不多，只有一个小餐饮店还有一个八鲜馆，战线也非常长，漂流孩子还是非常喜欢的，价格有点小贵，120一条船，总体还是不错的,https://gs.ctrip.com/html5/you/comment/detail/65217/11/83927718.html,https://dimg04.c-ctrip.com/images/Z80p180000013uw9yF21F_C_180_180.jpg,随缘77,2016-07-18
不错 空气很好 一家人出来走走 环境保护,https://gs.ctrip.com/html5/you/comment/detail/65217/11/15864671.html,https://dimg04.c-ctrip.com/images/t1/headphoto/347/183/477/19413f10dd2a4a34bea498b0b2db131b_C_180_180.jpg,小弟一家亲,2015-05-16
听导游说全程需要走7.5公里，但实际走下来似乎还可以，大概两个多小时的样子。里面风景听去过西溪湿地的人说不如西溪湿地。但是里面有个黑天鹅的池子，黑天鹅觅食的时候好有意思哦！屁股翘起来的，笑死我。,https://gs.ctrip.com/html5/you/comment/detail/65217/11/11251984.html,https://dimg04.c-ctrip.com/images/headphoto/493/388/482/e05580240f3f4c3dabfa542345b9c3a4_C_180_180.jpg,Youkee,2014-10-28
游玩时的天气不错，坐船进入景区，一路景色不错。还有摇橹船，船娘还会唱歌。,https://gs.ctrip.com/html5/you/comment/detail/65217/11/155002497.html,https://dimg04.c-ctrip.com/images/Z80h180000013xc9e3F64_C_180_180.jpg,138****6386,2018-05-25
很美，但是，真的很冷啊。。很冷很冷的天气啊。。出来玩一定要看好天气啊。。,https://gs.ctrip.com/html5/you/comment/detail/65217/11/154286217.html,https://dimg04.c-ctrip.com/images/t1/headphoto/903/173/918/eb4b7bea9720440dac09eab89328ab00_C_180_180.jpg,ktawg,2018-04-07
人少、地方大、空气好、取票快、,https://gs.ctrip.com/html5/you/comment/detail/65217/11/156199179.html,https://dimg04.c-ctrip.com/images/Z80p180000013uw9yF21F_C_180_180.jpg,130****4739,2018-08-18
泰州的5A景区。去兴化看水上油菜花时顺便去的。湿地风貌明显，景色宜人。,https://gs.ctrip.com/html5/you/comment/detail/65217/11/154901526.html,https://dimg04.c-ctrip.com/images/t1/headphoto/699/910/854/683dab66bb374136af9930ea204dfc7e_C_180_180.jpg,guoqunl,2018-05-18
还不错，景色很好，就是单调了点,https://gs.ctrip.com/html5/you/comment/detail/65217/11/154640050.html,https://dimg04.c-ctrip.com/images/fd/headphoto/g2/M0A/85/AC/CghzgFSVLEGAZXhOAAEAOzqzCnQ354_C_180_180.jpg,m36****90,2018-04-30
上午湿地公园，因下雨人不多，免费游船半小时一班，景区较大。中午去古镇，古镇较小，与江南小镇比缺了些特色，不过在小镇上品偿的溱湖八鲜令人回味。在携程订票取票方便，性价比高。,https://gs.ctrip.com/html5/you/comment/detail/65217/11/153713386.html,https://dimg04.c-ctrip.com/images/t1/headphoto/699/910/854/683dab66bb374136af9930ea204dfc7e_C_180_180.jpg,M53****816,2018-03-05
凌晨进行的预定，不错。两个景点离了不远，适合自驾游。门票包含了大船，去里面可以自费坐25元一人的电动船，很方便。国家级的景点要错过高峰期出游！棒棒哒！,https://gs.ctrip.com/html5/you/comment/detail/65217/11/141199562.html,https://dimg04.c-ctrip.com/images/Z80p180000013uw9yF21F_C_180_180.jpg,王-嘉尔,2017-10-13
水绝对的清澈见底。在里面静静的游来游去，秋天的芦苇，金黄树叶。秋天所有的感觉都到了，但是算来门票挺贵的....,https://gs.ctrip.com/html5/you/comment/detail/65217/11/91704829.html,https://dimg04.c-ctrip.com/images/fd/headphoto/g3/M0A/D3/2C/CggYG1X8qCiAMr9aAADUVeIYkXQ454_C_180_180.jpg,angle007,2016-11-16
带朋友去的，自己是第二次去游玩，天气不错只是风比较大，整体感觉不错。,https://gs.ctrip.com/html5/you/comment/detail/65217/11/154375738.html,https://dimg04.c-ctrip.com/images/Z80p180000013uw9yF21F_C_180_180.jpg,139****6997,2018-04-11
风景真的很漂亮，就是天气原因，没看见太多野生动物，不过还是不虚此行！,https://gs.ctrip.com/html5/you/comment/detail/65217/11/154310284.html,https://dimg04.c-ctrip.com/images/t1/headphoto/057/777/943/0b93f8268d5546308915f4f9fcaa9483_C_180_180.jpg,M22****5455,2018-04-08
溱湖国家湿地公园这样一个去处，游客不是特别多，非常原生态。在这里可以拿起相机尽情地捕捉湿地风光，可以带小朋友去水上游乐园，可以去拜访珍惜保护动物麋鹿,https://gs.ctrip.com/html5/you/comment/detail/65217/11/142192336.html,https://dimg04.c-ctrip.com/images/Z80t10000000p5ip49CFD_C_180_180.jpg,hua****4483,2017-12-13
溱湖国家湿地公园可坐船穿行于芦苇荡中，岛上有麋鹿、黑天鹅、孔雀，高81米的药师佛塔台基伸入溱湖中，佛塔佛像分三面耸立于莲花坐上，分别为药师如来的法身、报身和应身，是世界上最高的药师佛铜像。,https://gs.ctrip.com/html5/you/comment/detail/65217/11/141268910.html,https://dimg04.c-ctrip.com/images/Z80h050000000j2rdA057_C_180_180.jpg,wy51,2017-10-17
挺不错的，第一次玩这样的公园，2个多小时，逛逛看看，适合带小朋友。,https://gs.ctrip.com/html5/you/comment/detail/65217/11/157043461.html,https://dimg04.c-ctrip.com/images/t1/headphoto/982/089/752/f8c7b21182c94524ac4df328fdc7b3dc_C_180_180.jpg,M22****1589,2018-10-21
景点还不错 首先进入的是一个科普馆 科普馆还蛮大 转完科普馆出来就是湿地公园 我们租了一辆观光车一路游览 天虽然很热坐在车上还是比较凉快的 春秋天去玩比较适宜,https://gs.ctrip.com/html5/you/comment/detail/65217/11/116917710.html,https://dimg04.c-ctrip.com/images/Z80p180000013uw9yF21F_C_180_180.jpg,M96****63,2017-07-16
里面很大，带孩子们坐的最老的摇橹船，很兴奋，岸边有孔雀和其他湿地鸟类，湿地环境保护得很好，还有麋鹿是特色。,https://gs.ctrip.com/html5/you/comment/detail/65217/11/116581395.html,https://dimg04.c-ctrip.com/images/fd/headphoto/g4/M01/90/1C/CggYHlXPL6uAffpkAAAcJhaZ4bw899_C_180_180.jpg,铁小铁,2017-05-06
溱湖景区景色不错，进门没有检票，走整个景区要坐很多次船，其他的小景点没有太大意思。博物馆还可以建议去看看。,https://gs.ctrip.com/html5/you/comment/detail/65217/11/57944183.html,https://dimg04.c-ctrip.com/images/Z80p180000013uw9yF21F_C_180_180.jpg,北部区高德佛里,2015-08-23
太大了，带着小孩转一圈很累，小孩喜欢里面的各种爬网爬高的那个区域,https://gs.ctrip.com/html5/you/comment/detail/65217/11/154987881.html,https://dimg04.c-ctrip.com/images/Z80p180000013uw9yF21F_C_180_180.jpg,我全力以赴,2018-05-24
生态环境很好的一个旅游圣地，已经第二次去旅游了，感觉总是棒棒的。,https://gs.ctrip.com/html5/you/comment/detail/65217/11/154385539.html,https://dimg04.c-ctrip.com/images/Z80p180000013uw9yF21F_C_180_180.jpg,205****759,2018-04-12
保护非常好的一个湿地公园，摇橹的老人80多岁还给我们唱了几首小调 ，湖水清澈透明，鱼儿尽情嬉游，簖蟹味美鲜，梅府家宴名不虚传！,https://gs.ctrip.com/html5/you/comment/detail/65217/11/141727830.html,https://dimg04.c-ctrip.com/images/t1/headphoto/062/938/215/f5f05c77006946428867e3c0dae6f4eb_C_180_180.jpg,_WeCh****579501,2017-11-13
带孩子去玩玩蛮好的 空气好 湿地绿化多 不晒不热  有不少适合孩子玩的设施 坐船进去走走很好 体力好的话就不要做电动船摇橹船了 价格有点小贵,https://gs.ctrip.com/html5/you/comment/detail/65217/11/89192453.html,https://dimg04.c-ctrip.com/images/fd/headphoto/g3/M08/CE/5A/CggYGVXWkeCASvuHAACfRm862nY835_C_180_180.jpg,安琪妈妈,2016-10-05
空气很好，游览线路设计合理，适合双休出游。八鲜味道鲜美(^-^),https://gs.ctrip.com/html5/you/comment/detail/65217/11/58638352.html,https://dimg04.c-ctrip.com/images/fd/headphoto/g2/M03/40/AE/CghzgFS-0gqAMAPeAAASWkIErrM298_C_180_180.jpg,小猪lacy,2015-10-06
一日游真的是不错的选择，都没看到全部，地方太大了，景点也很多！,https://gs.ctrip.com/html5/you/comment/detail/65217/11/154624677.html,https://dimg04.c-ctrip.com/images/Z80q0e000000739kt7F31_C_180_180.jpg,M57****591,2018-04-30
湿地公园很不错，老人和孩子都玩的很尽兴，唯一遗憾的是没看到会船,https://gs.ctrip.com/html5/you/comment/detail/65217/11/154351072.html,https://dimg04.c-ctrip.com/images/Z80p180000013uw9yF21F_C_180_180.jpg,M13****258,2018-04-10
非常不错的地方，空气新鲜 景色怡人，值得一去,https://gs.ctrip.com/html5/you/comment/detail/65217/11/154321675.html,https://dimg04.c-ctrip.com/images/Z80t080000002xiqi18D8_C_180_180.jpg,M92****73,2018-04-09
蛮开心的一次自驾，古镇+湿地公园正好一天，古镇古朴大方，人文历史渊厚，湿地公园环境清新，心旷神怡，赞！,https://gs.ctrip.com/html5/you/comment/detail/65217/11/138746795.html,https://dimg04.c-ctrip.com/images/Z80h0g0000007nf1t6626_C_180_180.jpg,勤劳的孙小砺,2017-10-07
天很热，但阵阵凉风吹的很舒服，我们主要选择坐船游览，总体感觉除了天太热了外，景色还是不错的，值得一游。,https://gs.ctrip.com/html5/you/comment/detail/65217/11/117055236.html,https://dimg04.c-ctrip.com/images/Z80h180000013xc9e3F64_C_180_180.jpg,y****zb,2017-07-31
环境一如既往的美，恰逢会船节，增添了一份景色，大家玩的很开心！,https://gs.ctrip.com/html5/you/comment/detail/65217/11/116560762.html,https://dimg04.c-ctrip.com/images/t1/headphoto/258/512/704/6bce7506eecc48f8a4a6d3177e0acf24_C_180_180.jpg,M23****970,2017-05-02
溱湖湿地国家公园位于泰州的姜堰！自然景色绝美、坐着摇橹船停着船娘唱的小曲儿惬意呢！里面还有麋鹿、鳄鱼！,https://gs.ctrip.com/html5/you/comment/detail/65217/11/57848630.html,https://dimg04.c-ctrip.com/images/fd/headphoto/g4/M0B/87/0C/CggYHlXOBLqAMf15AADcRCm1At4073_C_180_180.jpg,顺齐自然之,2015-08-14
"推荐游玩时间：2-3小时因为麋鹿的珍稀，所以湿地公园中的麋鹿园成为了游客们必去的地方
溱湖国家湿地公园

推荐游玩时间：2-3小时
适合人群：所有人
人间四月天，正是万紫千红时。
“天街小雨润如酥，草色遥看近却无。最是一年春好处，绝胜烟柳满皇都。”溱湖的春天就像诗里写的美得不要不要的。

“喜鹊湖的美不因时序的更迭而褪色，不因黑夜的降临而黯淡。晴空下的波光云影令人意畅神迷。细雨霏霏，明月朗照，秋风瑟瑟里‘芦花天气’总会翻出销魂况味！” 当代诗人刘镇笔下那无论晴雨都令人神往的“喜鹊湖”，便是溱湖。溱湖一带的自然环境吸引了无数喜鹊在此筑巢定居，而喜鹊自古以来都是吉祥鸟，所以当地人称溱湖叫做“喜鹊湖”。如今，这个位于泰州市溱潼镇的湿地，已经成了全国首家经过试点验收的国家级湿地公园，它就是江苏泰州溱湖国家湿地公园。
进入溱湖国家湿地公园，游客需要坐上班船，当班船在溱湖上启动的那一秒，一段奇妙的身心之旅就算是开始了。

溱湖是天然形成的湖泊，东西长1.4公里，南北长1.5公里，面积约2.1平方公里。班船在湖中航行的速度不快，但略带潮湿的风与清新的空气仍一阵阵扑面而来。目之所及，伴着那荡漾着的湖水，就是“苍苍”的“蒹葭”。密密麻麻的芦苇包围着一个个大大小小的湖中岛屿，芦苇随风摇摆，随浪轻舞，芦叶间窸窸窣窣的声音传递着人类听不懂却能感到美的自然物语。如果是冬天去溱湖，说不定还能看到“白露为霜”呢！

有芦苇的地方，自然少不了野鸭的身影。在芦苇荡里，你可以很容易见到畅游着的野鸭和家鸭。同行的小伙伴问：野鸭和家鸭有什么区别？有人告诉他，除了体型不同外，最大的区别是野鸭会飞，家鸭不会飞。他刚说完这句话，一只体型硕大的家鸭也在水面上飞了起来。不知是谁家的家鸭一不小心闯进了这片神奇的水面，竟也萌发了野性，挥动着翅膀，与水鸟共舞。

与江南水乡的青砖绿瓦、烟雾氤氲不同，溱湖湿地公园内蒲草丰茂，湛蓝的湖泊、交织的河网、星罗棋布的洲滩岛屿，让局部空气特别清新。蓝天白云，群鸟翔集，乍看还以为在云贵川某处湿地。

天然湿地生态系统包容有众多水生生物、湿地生物和陆生生物，类型多样，资源优越，多种国家级保护动物以此为主要的栖息地，游走于溱湖湿地公园，时时有水鸟唱于芦丛之中，野凫绕于游船之旁。这里还是麋鹿栖息之地，有“麋鹿故乡”之称。据《麋鹿生境考察》一书记载，溱湖地区是麋鹿的故乡。与此相印证的是，从这一地区出土的麋鹿化石最多，在全国也最为典型，泰州市博物馆珍藏的国内唯一一具完好的麋鹿化石标本便由此出土。

由于种种原因，麋鹿野生种群已在1000年前绝迹，直至20世纪80年代，这些流落海外的国宝级珍稀动物才万里迢迢从英国返回故园，现在通过人工养殖，溱湖地区约有50头麋鹿，在得天独厚的自然环境下，这个数字还在不断上升。因为麋鹿的珍稀，所以湿地公园中的麋鹿园成为了游客们必去的地方。

班船在一个湖心小岛上靠岸，这个占地约20亩的岛屿是湿地公园的核心游览区。从现在开始，每个人都需要步行近8公里来领略这座湿地公园的自然之美。步行8公里，放在平时，似乎是一个让人闻而却步的事情，而在这里，眼前的景色会让人忘记一切，你不会把这8公里步行当做一件难熬的事情。这里的湖水是如此清澈、平静，各色的睡莲和荷花上凝结着粒粒水珠，在阳光的照耀下熠熠生辉，仿佛天宫中的的瑶池美景。当然了你也可以选择电瓶车火车摇摆船来代替不行。说起船就会想到每到清明，溱湖上会出现会一只又一只会船和贡船争奇斗艳，十分壮观。",https://gs.ctrip.com/html5/you/comment/detail/65217/11/163330458.html,https://dimg04.c-ctrip.com/images/0Z84m120008hveig1C753_C_180_180.jpg,夏吹夏夜风,2020-04-28
空气新鲜，大自然的氧吧！让人心旷神怡。蓝天白云，碧到支荡漾！,https://gs.ctrip.com/html5/you/comment/detail/65217/11/157473007.html,https://dimg04.c-ctrip.com/images/Z80s0z000000nxkj6EA28_C_180_180.jpg,石书中,2018-12-20
挺方便的，直接二维码进园，就是船要半小时一班，时间间隔有点长,https://gs.ctrip.com/html5/you/comment/detail/65217/11/157047401.html,https://dimg04.c-ctrip.com/images/Z80p180000013uw9yF21F_C_180_180.jpg,300****951,2018-10-22
鸟类很多，湖内的鱼也很多，负氧离子很高，景区内还有游乐项目。,https://gs.ctrip.com/html5/you/comment/detail/65217/11/154950863.html,https://dimg04.c-ctrip.com/images/t1/headphoto/057/777/943/0b93f8268d5546308915f4f9fcaa9483_C_180_180.jpg,M38****907,2018-05-21
客流51人挺多的，散步路线很长，走走停停玩玩也要3个小时以上,https://gs.ctrip.com/html5/you/comment/detail/65217/11/154635186.html,https://dimg04.c-ctrip.com/images/fd/headphoto/g1/M07/CD/A5/CghzflTZug6ABYgiAARivbQF8xQ953_C_180_180.jpg,窝草头等红杏,2018-04-30
应该是很不错的地方 雨天虽然刹了些风景，但是真正让人无语的是，16:00抵达说是船不开了，让我们包了快艇，接着到了又推荐我们包了船，第一次来也不熟悉又付了240元。看到的风景太不值了,https://gs.ctrip.com/html5/you/comment/detail/65217/11/138724205.html,https://dimg04.c-ctrip.com/images/Z80p180000013uw9yF21F_C_180_180.jpg,烟云70,2017-10-06
景区风景挺好的，空气清新，水系发达，溱湖八鲜挺好吃的，不贵。昨天人超多，景区管理急需加强，有点混乱。,https://gs.ctrip.com/html5/you/comment/detail/65217/11/116412725.html,https://dimg04.c-ctrip.com/images/t1/headphoto/258/512/704/6bce7506eecc48f8a4a6d3177e0acf24_C_180_180.jpg,M39****892,2017-04-04
非常好的景点，已经不知道第几次来这了，游玩感受还是很OK.,https://gs.ctrip.com/html5/you/comment/detail/65217/11/156847004.html,https://dimg04.c-ctrip.com/images/Z80p180000013uw9yF21F_C_180_180.jpg,_3310****066062,2018-10-05
携程方便，点个赞。可惜出行遇到雨天，但溱湖湿地的风景不错。,https://gs.ctrip.com/html5/you/comment/detail/65217/11/155720040.html,https://dimg04.c-ctrip.com/images/t1/headphoto/293/406/308/22631089f44a497495c005fce85f6a6f_C_180_180.jpg,doris,2018-07-16
还是不错的，首先门票加船票不贵，景色很美，人不多，性价比高,https://gs.ctrip.com/html5/you/comment/detail/65217/11/155329438.html,https://dimg04.c-ctrip.com/images/Z80h180000013xc9e3F64_C_180_180.jpg,_shai****11605,2018-06-19
不错，风景很好，地方也大，没有白跑一趟，下次有机会还去玩。,https://gs.ctrip.com/html5/you/comment/detail/65217/11/154805210.html,https://dimg04.c-ctrip.com/images/t1/headphoto/295/828/780/6e6c2151ed65497c850945d5d2b702ae_C_180_180.jpg,M47****199,2018-05-11
景点挺有意思的，另外花钱买了船票，空气很好，适合全家出游~,https://gs.ctrip.com/html5/you/comment/detail/65217/11/154706850.html,https://dimg04.c-ctrip.com/images/fd/headphoto/g3/M08/FF/D8/CggYGVZFttaALyo-AACmBNo3TUE544_C_180_180.jpg,大美妞,2018-05-04
景色优美，管理规范。交通便利，配套设施齐全。附近是华侨城。,https://gs.ctrip.com/html5/you/comment/detail/65217/11/154636687.html,https://dimg04.c-ctrip.com/images/Z80p180000013uw9yF21F_C_180_180.jpg,yaoli68,2018-04-30
地方很大，风景不错，就是今天有点热了，四月初去应该比较好！,https://gs.ctrip.com/html5/you/comment/detail/65217/11/154634134.html,https://dimg04.c-ctrip.com/images/t1/headphoto/397/132/243/542067aa29904ae9aca7e88f43eaeb6f_C_180_180.jpg,M24****6786,2018-04-30
盛春时节，湿地公园里走走，深度体验空气清新、鸟语花香...,https://gs.ctrip.com/html5/you/comment/detail/65217/11/154617957.html,https://dimg04.c-ctrip.com/images/Z80p180000013uw9yF21F_C_180_180.jpg,120****669,2018-04-29
清明小长假去的，坐船上岛游玩，里面空气好，享受大自然的氧吧,https://gs.ctrip.com/html5/you/comment/detail/65217/11/154275418.html,https://dimg04.c-ctrip.com/images/fd/headphoto/g1/M08/1E/C4/CghzfVV-3zWAQBWjAADZWljnak4005_C_180_180.jpg,lq****0,2018-04-06
景区很大，要乘船进入景区，有很多小动物,https://gs.ctrip.com/html5/you/comment/detail/65217/11/154278458.html,https://dimg04.c-ctrip.com/images/Z80h180000013xc9e3F64_C_180_180.jpg,161****251,2018-04-06
家乡的景点，风景秀丽，环境优美，湿地很大，还有许多动物，玩的比较开心，以后推荐外地的朋友过来游玩。,https://gs.ctrip.com/html5/you/comment/detail/65217/11/138825496.html,https://dimg04.c-ctrip.com/images/t1/headphoto/397/132/243/542067aa29904ae9aca7e88f43eaeb6f_C_180_180.jpg,_CFT0****6597,2017-10-09
"溱湖湿地是个不错的公园。
景色怡人，可以看到小桥流水，呼吸新鲜空气，感受一份恬静。
逛完湿地公园，再去品尝溱湖八仙，真的是一种人生的享受。",https://gs.ctrip.com/html5/you/comment/detail/65217/11/100325747.html,https://dimg04.c-ctrip.com/images/Z80u0i0000009njxgB002_C_180_180.jpg,琳达Linda琳达,2017-04-01
結合生態、保育、自然風光的濕地景觀，乘坐小船，漫遊湖間，與美景相伴，放鬆心情、洗滌心靈、揮別塵囂、返璞歸真，泰州之行，首選於此......,https://gs.ctrip.com/html5/you/comment/detail/65217/11/94226147.html,https://dimg04.c-ctrip.com/images/0Z82n221558elw2w0CA82_C_180_180.jpg,Sam_Hsieh,2016-12-28
公园很大，环境挺好的，生态保护的挺好,https://gs.ctrip.com/html5/you/comment/detail/65217/11/156130819.html,https://dimg04.c-ctrip.com/images/Z80h180000013xc9e3F64_C_180_180.jpg,_m13****5518,2018-08-13
溱湖国家湿地公园风景不错，面积很大，景点很多，很值得游玩,https://gs.ctrip.com/html5/you/comment/detail/65217/11/154768503.html,https://dimg04.c-ctrip.com/images/Z80u0b0000005f2wnCEF5_C_180_180.jpg,璇璇游,2018-05-08
出票方便快速，自然风景秀丽，带孩子出去走走是个蛮好的选择,https://gs.ctrip.com/html5/you/comment/detail/65217/11/154282263.html,https://dimg04.c-ctrip.com/images/t1/headphoto/903/173/918/eb4b7bea9720440dac09eab89328ab00_C_180_180.jpg,_WeCh****758408,2018-04-06
湿地环境很好，空气清新，地方很大，可以坐摇船欣赏美景，摇船阿姨朴实热情，给我们唱了好几首当地民歌,https://gs.ctrip.com/html5/you/comment/detail/65217/11/142047516.html,https://dimg04.c-ctrip.com/images/fd/headphoto/g1/M04/78/2A/CghzfFT2lHWACIN3AAKPn6BmvXU523_C_180_180.jpg,love哈小贝,2017-12-04
