标题,标题链接,头像,user-detail__name,resource_date
从入口进入之后要想到主景区还需要另外坐船，整点和半点发船，需要看好时间点，如果错过了前一半班船就要等30分钟，船票的费用是包含在门票中的。景区规划的比较好，顺时针转一圈，不用走回头路。下船后一上岸，先进入一个展览馆参观，出了展览馆之后就到了户外，可以看到很多植物和动物。在景区中看到了麋鹿，但是没有看到鳄鱼，因为鳄鱼冬天在冬眠，还有其他的很多鸟类也只看到很少少数，可能是冬季天气冷的缘故吧。有一个地方给我印象比较深刻是模仿了一户农家，门前是一片地，用来种菜，农家小院子以及屋内摆设都还原了农民的生活，很写实，对城市里长大的人来说，有机会参观一下很不错。总体来说整个公园风景好，原生态，天气暖和的时候来会更好。整个景区慢慢逛的话，需要大半天的时间。,https://gs.ctrip.com/html5/you/comment/detail/65217/11/165842028.html,https://dimg04.c-ctrip.com/images/0Z84h120008fo6rwm1868_C_180_180.jpg,Grace_cyt,2021-02-26
国庆节带着一家人来到了泰州的溱湖湿地，这里离泰州市区大约30多分钟的车程。整个自然环境非常的优越，到处都是森林和湖泊，湖水十分的清澈，可以看到里面的小鱼在水草间游来游去。这里的生态环境保持的非常的好，空气中的氧离子十分的丰富，让人感觉十分的舒服。大家可以选择步行或者是乘船旅行，浏览时间大约需要3~4个小时。其中的花海，儿童乐园，麋鹿园和鳄鱼池，都很值得一去。,https://gs.ctrip.com/html5/you/comment/detail/65217/11/164638657.html,https://dimg04.c-ctrip.com/images/Z80q0i0000009eocq0B60_C_180_180.jpg,juki235,2020-10-05
"在公园逗留一个小时，把整个区域区域基本浏览了一遍。他们说的是湿地科普馆和环城绿化展示馆还没正式开放。
公园出入口非常有特色，拍照不错，反正进去只好原路返回的。",https://gs.ctrip.com/html5/you/comment/detail/65217/11/165636781.html,https://dimg04.c-ctrip.com/images/headphoto/628/254/330/b0dd97ed081b4e1c91ba26311570ff67_C_180_180.jpg,无目的闲逛,2021-01-30
"【景色】
【趣味】
【性价比】第二次去溱湖国家湿地公园，相隔五六年吧，变化很大，开发的越来越好，但野趣也少了一些，总的来说还想来看看春天的溱湖",https://gs.ctrip.com/html5/you/comment/detail/65217/11/165931188.html,https://dimg04.c-ctrip.com/images/Z80p180000013uw9yF21F_C_180_180.jpg,七月四月,2021-03-10
溱湖湿地公园是泰州一处非常贴近自然的湿地自然公园，这里有着非常大面积的湿地，湖泊以及沼泽草原森林植被茂密，有着各式各样的动植物，大家可以徒步游览，也可以乘坐景区的木船进行游览，非常的有意思，而且这里的空气也十分的清新，绝对让人感觉很舒服。,https://gs.ctrip.com/html5/you/comment/detail/65217/11/164667165.html,https://dimg04.c-ctrip.com/images/t1/headphoto/491/056/464/eb3c7472323e4c3598f58ffa8a6fce99_C_180_180.jpg,pxy0705,2020-10-06
泰州的溱湖湿地国家公园占地面积非常的大，这里水网纵横，森林茂密，生活着许多珍稀的鸟类和动植物资源。游览的路程分为水路和路路两条，各有各的特色，大家可以根据自己的喜好选择。景色真的十分的优美，让人心旷神怡，尤其是五颜六色的花海，真的是特别的漂亮，仿佛进入了童话世界。,https://gs.ctrip.com/html5/you/comment/detail/65217/11/164639901.html,https://dimg04.c-ctrip.com/images/Z80t0w000000kdq4dC02F_C_180_180.jpg,乖小咪,2020-10-05
泰州溱湖国家湿地公园总面积26平方公里，区内的湖泊、河流等合占景区总面积37%左右，素有“水乡明珠”之称。湛蓝的湖泊、交织的河网、星罗棋布的洲滩岛屿，以及特有的湿地生态环境与里下河水乡民俗文化，是其独有的景观特色。经过长期的积累和发展，园内现已形成以溱湖为主体的水环境景区，以“麋鹿故乡园”为品牌的湿地生态景区，以“全球生态500佳”为基础的生态农业园区，以溱湖地热资源综合开发利用而形成的温泉休闲度假区，以及以溱潼古镇、中国姜堰溱潼会船节为代表的人文景观。,https://gs.ctrip.com/html5/you/comment/detail/65217/11/165278784.html,https://dimg04.c-ctrip.com/images/Z80u0z000000mjidnB6BF_C_180_180.jpg,出发travel,2020-12-10
性价比高，景色不错，总体超赞，支持携程！,https://gs.ctrip.com/html5/you/comment/detail/65217/11/165765779.html,https://dimg04.c-ctrip.com/images/Z80p180000013uw9yF21F_C_180_180.jpg,137****6879,2021-02-17
泰州溱（qín）湖国家湿地公园，位于江苏省泰州市姜堰区，是由国家林局批准设立的江苏首家国家级湿地公园，2012年3月31日被评为国家5A级旅游景区。地处江苏中部，江淮之间，溱湖已作为江苏省重点旅游开发项目列入《江苏省旅游业发展”十五“计划和2020年远景目标纲要》。,https://gs.ctrip.com/html5/you/comment/detail/65217/11/164581370.html,https://dimg04.c-ctrip.com/images/t1/headphoto/757/757/889/3b86691007a54fe684f07e198432d09b_C_180_180.jpg,_WeCh****426624,2020-10-01
"天然的氧吧，美景天城，现在去人少，就是景点在完善中，不尽人意。
景点中的麋鹿本应是亮点，结果只有2只，而且远远的躲在一边。",https://gs.ctrip.com/html5/you/comment/detail/65217/11/165945178.html,https://dimg04.c-ctrip.com/images/t1/headphoto/685/724/771/3cd584c18f744104b47d3f3d075d10e3_C_180_180.jpg,M25****3948,2021-03-12
"溱湖湿地素有水乡明珠之称的溱湖国家湿地公园位于江苏中部的里下河地区，地处泰州市东郊，2003年开园，2005年11月被国家旅游局批准为国家AAAA级旅游区，同年被国家林业局批准为国家湿地公园，成为江苏首家，全国第二家国家级湿地公园。景区总体规划面积26平方公里，这里水草丰茂，远古时期曾是珍稀动物麋鹿群居的乐园。虽经沧海桑田，依然保持着洁净的水域环境、原始的湿地生态，加之稀有的地热温泉，更显弥足珍贵。湖东面的河横村被联合国环境规划署命名为生态环境“全球500佳”，2005年被国家旅游局命名为全国农业观光旅游示范点，为部省共建的社会主义新农村示范点。湖北面的溱潼是中国历史文化名镇，繁富千年，历代文人墨客留下众多佳词丽句。“溱湖八景”充满诗情画意，溱潼会船更以其浓郁的民俗风情独步天下。湖南面桥头镇有被誉为“十七世弓马世家，五百年衣冠旧地”的刘状元府旧址，清乾隆年间，刘氏兄弟三科两中武状元，传为美谈佳话。溱湖地区水土肥美，气候温和，人民勤劳智慧，各类水产极为丰饶，尤以簖蟹、鱼饼、虾球名闻遐迩，“溱湖八鲜 ”堪称水乡饮食文化中的珍品杰作，2007年被评为“中国十大饮食类节庆”。　　溱潼古镇最早得名于明代。原名秦潼。后乾隆经此，朗声念道“秦潼”,然后略作沉思说:“此处四面环水,名字也应该字字含水,现在只有‘潼’字带水,朕给‘秦’字也加上三点水。”自此溱潼的名字就流传下来了。从名字来看,命中注定了溱潼与水的不解之缘。清代中叶起，溱潼农业、渔业和窑业日渐兴盛，又处姜兴河、泰东河的交汇之地，占航运之利，是漕运盐运必经之地。随之人烟稠密，店铺林立，成为水乡的闻名市镇。二十年代至抗战初期，溱潼粮食贸易繁荣，米厂、油坊越办越多，茶馆、饭店、浴室兴起，交通运输业、金融业、商业相应发展。镇上有电灯照明，电话、电报成了商家的通讯手段。《溱湖日报》、《溱报》相继问世。溱潼一度有'小上海'之称。发展至今天，溱潼已成为闻名遐迩的历史名镇、全国重点镇。溱湖农业生态园　　溱湖湿地农业生态园，由泰州市中艺农业生态园园艺有限公司独家投资。位于江苏泰州姜堰溱潼古镇，东临国家4A级湿地公园，西与千亩果林接壤。于2007 年11月15日正式动工新建，占地300余亩，总投资约1.2亿元人民币。园区共分为两大区域，以沈马公路为分界，以南是蔬菜新品种研发，深加工及餐饮、休闲、商务、生活区交通 隐藏",https://gs.ctrip.com/html5/you/comment/detail/65217/11/165660002.html,https://dimg04.c-ctrip.com/images/Z80h180000013xc9e3F64_C_180_180.jpg,小猪罗比,2021-02-03
值得一去的湿地公园，风景秀丽，线路设计合理不重复，进门要坐船摆渡上岛，首先是一个展馆，知识性与趣味性结合。坐揺橹船穿行在芦苇荡很有感觉，中秋去的，正赶上簖蟹上市,https://gs.ctrip.com/html5/you/comment/detail/65217/11/164837506.html,https://dimg04.c-ctrip.com/images/Z80p180000013uw9yF21F_C_180_180.jpg,新月光,2020-10-20
比预料中要好！爸妈和小孩都很喜欢，空气好，绿化不错，人挺多的，不过大家都玩得挺开心。最后一段路我们另外出钱坐了电动船和皮划艇。里面有挺多孩子可以玩的东西，我觉得要比去上海的公园省钱多了哈哈哈，世纪公园里儿童乐园电动项目一会就一百多烧掉了，这里免费的探险项目还能锻炼身体，有益身心。有趣好玩，景色不错，体验很好，值得推荐，看到了麋鹿❤️,https://gs.ctrip.com/html5/you/comment/detail/65217/11/164707890.html,https://dimg04.c-ctrip.com/images/Z80s1g000001h9j8x51EA_C_180_180.jpg,上海时幻鲨,2020-10-08
溱湖风景优美最奇为候鸟数量众多或在湖面上空飞翔，或在湖面上游来游去，场面非常壮观。溱湖湿地内河汊交汇，河水清澈，水草茂盛，鱼儿乐在其中，珍希的野鸭这里随处可见，真是好生态呀。,https://gs.ctrip.com/html5/you/comment/detail/65217/11/165087296.html,https://dimg04.c-ctrip.com/images/t1/headphoto/207/494/838/fa687736cf3f484480526cfc0eb6c073_C_180_180.jpg,M32****1790,2020-11-16
相对于其他景区人不是那么多，周边可以去看看,https://gs.ctrip.com/html5/you/comment/detail/65217/11/165988544.html,https://dimg04.c-ctrip.com/images/Z80p180000013uw9yF21F_C_180_180.jpg,ch****zd,2021-03-18
亲子游的好地方水乡美景乘船游览更是美哉！,https://gs.ctrip.com/html5/you/comment/detail/65217/11/165933612.html,https://dimg04.c-ctrip.com/images/headphoto/192/795/712/da39ccbb76b8480eaef7c8e5eee8bd88_C_180_180.jpg,139****2267,2021-03-11
"泰州溱（qín）湖国家湿地公园，位于江苏省泰州市姜堰区，是由国家林局批准设立的江苏首家国家级湿地公园，2012年3月31日被评为国家5A级旅游景区。

地处江苏中部，江淮之间，溱湖已作为江苏省重点旅游开发项目列入《江苏省旅游业发展”十五“计划和2020年远景目标纲要》。",https://gs.ctrip.com/html5/you/comment/detail/65217/11/164710903.html,https://dimg04.c-ctrip.com/images/t1/headphoto/295/828/780/6e6c2151ed65497c850945d5d2b702ae_C_180_180.jpg,M41****305,2020-10-08
湿地风景挺美的，坐船慢悠悠地欣赏,https://gs.ctrip.com/html5/you/comment/detail/65217/11/165901323.html,https://dimg04.c-ctrip.com/images/t1/headphoto/295/828/780/6e6c2151ed65497c850945d5d2b702ae_C_180_180.jpg,M21****483,2021-03-06
现在建的真是越来越漂亮了，挺好玩,https://gs.ctrip.com/html5/you/comment/detail/65217/11/165901331.html,https://dimg04.c-ctrip.com/images/t1/headphoto/397/132/243/542067aa29904ae9aca7e88f43eaeb6f_C_180_180.jpg,M31****5725,2021-03-06
这一片湿地知道人不多欢迎大家来。,https://gs.ctrip.com/html5/you/comment/detail/65217/11/165381964.html,https://dimg04.c-ctrip.com/images/headphoto/769/739/986/1c5b3d575818422fbd56e16db2e55902_C_180_180.jpg,与人为善有容乃大,2020-12-24
景色非常美，适合带佳人游玩！！,https://gs.ctrip.com/html5/you/comment/detail/65217/11/165790756.html,https://dimg04.c-ctrip.com/images/Z8090g0000008nldo458B_C_180_180.jpg,8867518,2021-02-20
整个湿地公园逛了一圈，3个半小时，空气好，风景好，休闲游，很不错,https://gs.ctrip.com/html5/you/comment/detail/65217/11/164665570.html,https://dimg04.c-ctrip.com/images/fd/headphoto/g1/M07/88/F1/CghzfVWYgQeAZqX7AAAfzSXjf9o332_C_180_180.jpg,guobaoxuan,2020-10-06
"找了全网没找到个正经攻略。我今天刚回来，首先停车是按时间收费的，并不是10元一次！进出都要坐大船，这是包含在门票里。记得半小时一班(整点和30分一班，去早了只能等。)然后整个景区如果你不想花钱，你得早上就进，然后走的跟狗子一样才能到你要去的景点，你要去看下麋鹿，你得走7公里左右。其他的还要走路。当然你可以坐船，或者电瓶车。摇橹船240可以座6个人还有贵的座8个人的。还有还有电动观光车300块钱还是多少的。反正都是几大百，然后你还不好找拼车拼船的。反正最贵的是600还是800的。如果不是好多人组团，你就别费劲了，没意思的。花几百块钱也没多长时间。我是坐的电动班船，30块钱一个人，如果想少花钱，建议坐这个，很多地方你还是要自己跑腿。因为只能坐两站路，第二次就让你回到出口了。(切记，坐船时买的票不能扔，因为第二次坐船还是需要的，没有就回不去了，只能走路，班船也是半小时一次)
我这一路上只看到了三只圈养麋鹿，鳄鱼正在冬眠，最后回去坐大船的时候在水里看到几只黑天鹅和几只鸳鸯！其他什么都没有！什么都没有！真的什么都没有！
景区时间8.30－17.00(15.30是最后一班大船进去，过了就进不去了)",https://gs.ctrip.com/html5/you/comment/detail/65217/11/165739027.html,https://dimg04.c-ctrip.com/images/t1/headphoto/295/828/780/6e6c2151ed65497c850945d5d2b702ae_C_180_180.jpg,Andrefool,2021-02-15
泰州有座溱湖国家湿地公园，绝对是当地必打卡的景区。这里的水环境极佳，适合租一条摇橹船在水面荡漾；这里也是麋鹿的故乡，曾出土国内唯一一具完好的麋鹿化石；这个季节还少不了品尝簖蟹的美味，它是国家地理标志产品。,https://gs.ctrip.com/html5/you/comment/detail/65217/11/165298872.html,https://dimg04.c-ctrip.com/images/Z80v0j000000a8s855B37_C_180_180.jpg,世界美食游走达人,2020-12-13
坐船进入景区后游览路程7.5公里，很大很大，景色宜人，慢悠悠的逛一圈也不会感觉很累。总体而言还是很不错的一个地点，值得去玩一下，唯一的缺点是室内展馆部分较逊色，没有特色没有新意没有趣味，如能改进必然增色不少。,https://gs.ctrip.com/html5/you/comment/detail/65217/11/164776109.html,https://dimg04.c-ctrip.com/images/Z80p180000013uw9yF21F_C_180_180.jpg,117****008,2020-10-14
携程网上购票，二维码扫描，非常方便，门票包含游船票。空气很好，景色也很好，沿着木栈道慢慢逛，心情也好。整个湿地全部逛下来费时3.5个小时。,https://gs.ctrip.com/html5/you/comment/detail/65217/11/164674899.html,https://dimg04.c-ctrip.com/images/fd/headphoto/g1/M07/88/F1/CghzfVWYgQeAZqX7AAAfzSXjf9o332_C_180_180.jpg,guobaoxuan,2020-10-06
值得一游，景色不错，游船安排合理 ，游览线路设计的也可以，还有电瓶车选择 ，船也有手摇船，电动船选择，当然如果年轻选择步行也是不错的选择。,https://gs.ctrip.com/html5/you/comment/detail/65217/11/164755853.html,https://dimg04.c-ctrip.com/images/Z80l0f0000007hq8yCC87_C_180_180.jpg,johnybh,2020-10-12
十一出游第一站 吸吸氧还不错 进去先坐船去里面湿地 全程一条道不走回头路 全程走下来还是挺长的中间有自费船自费电瓶车可选,https://gs.ctrip.com/html5/you/comment/detail/65217/11/164611005.html,https://dimg04.c-ctrip.com/images/Z80b0y000000m3xna2CD4_C_180_180.jpg,yayoimina,2020-10-03
"景色不错，环境很好，绿色生态，水陆交辉，鱼鸟相称！
有趣好玩，有一些小孩喜欢的冒险娱乐项目，小孩很喜欢！值得推荐，这次是第二次去了！",https://gs.ctrip.com/html5/you/comment/detail/65217/11/164692163.html,https://dimg04.c-ctrip.com/images/Z80p180000013uw9yF21F_C_180_180.jpg,行-人,2020-10-07
泰州的5A级景区溱湖湿地公园非常美丽，而且相对游客不算拥挤，休闲又开心，旅游感知超好，溱潼古城不大，朴素又安静，适合闲庭信步。,https://gs.ctrip.com/html5/you/comment/detail/65217/11/164717139.html,https://dimg04.c-ctrip.com/images/Z80h180000013xc9e3F64_C_180_180.jpg,程志红,2020-10-09
这家的门票还挺贵的要80块钱一个人，但是这个价钱是包含了从西边的游船码头坐船到东边的景区集中点游玩的船票。总体来说价格马马虎虎还行吧。所有的景区基本上都在东边的半区，都比较集中，而且会有很明确的指示牌告诉游客游览路线是什么，在园区内没有额外的景点收费了。,https://gs.ctrip.com/html5/you/comment/detail/65217/11/164858518.html,https://dimg04.c-ctrip.com/images/Z8020z000000neew46E85_C_180_180.jpg,Chef Z,2020-10-22
值得推荐，十一出行人还是蛮多的，唯一不满的是明明，订单上写的可以领门票，实际去了说没有门票领，因为网上订的。景色很美，景区蛮大的，适合慢慢走慢慢玩，景区里有船可以坐，如果走不动建议坐船，但是景点有几个是坐船玩不到的，所以还是建议走路，几个小时就能玩下来，来回都是坐船，这个是包在门票了面的，还有疫情期间，排队进进去要出示健康码和佩戴口罩。,https://gs.ctrip.com/html5/you/comment/detail/65217/11/164691391.html,https://dimg04.c-ctrip.com/images/Z80p180000013uw9yF21F_C_180_180.jpg,Zhu****ong,2020-10-07
溱湖适合休闲游，人比较少，也不会太匆忙，上午9点到溱湖湿地公园，坐了摇橹船，中午12点多出公园，周围吃了个饭，也不贵，下午去秦湖古镇转了一圈，买了些特产，大概3点半回家。觉得溱湖公园5A景区肯定达不到，溱湖古镇4A景区也达不到，古镇里面有点乱，导航都找不到入口，里面的游览方向也不太清楚。,https://gs.ctrip.com/html5/you/comment/detail/65217/11/164689221.html,https://dimg04.c-ctrip.com/images/t1/headphoto/424/398/503/0386f569fd0d4b488ff41b64bbc5743b_C_180_180.jpg,M25****4919,2020-10-07
踏青郊游的好去处！坐船游玩嬉戏赏花吸氧体验生活很全面，而且公园超级大！“春色满园关不住”一点不为过！门票60好像，免费大船，快艇一两百！特意清明第二天来这里，因为可以参加一年一次的大型会船节活动！附近有个喜鹊桥，那条街绿草坪上BBQ的人超级多！很惬意！基本私家车都在这边停放，然后统一乘坐免费的接送公交车进景区！如果不去千垛景区，可以从古寿圣寺后门出来沿着别墅区走一趟，全是旺盛的油菜花，而且人少清净！哈哈！说到这里！有机会还去！,https://gs.ctrip.com/html5/you/comment/detail/65217/11/158350156.html,https://dimg04.c-ctrip.com/images/fd/headphoto/g5/M0A/C0/17/CggYsFbm0-eAWuBxAACt8G7pQsE451_C_180_180.jpg,_CFT01****3861914,2019-04-09
门票包括来回船票，虽然人多，但游船班次多、座位也多，所以几乎没怎么排队就坐上了。这里比较适合带孩子来玩，即有湿地科普馆，又有探险乐园，还有很多好玩的独木桥、浮桥等，还可以看麋鹿，就是比较废腿,https://gs.ctrip.com/html5/you/comment/detail/65217/11/164889403.html,https://dimg04.c-ctrip.com/images/Z80h180000013xc9e3F64_C_180_180.jpg,ann****ng,2020-10-25
整体感觉非常不错，国庆出游好去处，里面景点超级多，走路，要走好几个小时的。所以要养足精神，带点干粮，水什么。里面小吃环境卫生非常一般，要加强改进。,https://gs.ctrip.com/html5/you/comment/detail/65217/11/165805887.html,https://dimg04.c-ctrip.com/images/t1/headphoto/258/512/704/6bce7506eecc48f8a4a6d3177e0acf24_C_180_180.jpg,公子圣,2021-02-21
逛完一圈大概需要两个小时，刚开始的时候还挺有意思的，看了一个馆，还有小娱乐设施可以玩，中间的路程就有点无聊了，景色重复，引导牌也少，不知道要怎么走就会走的很心累。在园区里看到一只超小的猫咪，跟着走了好久，还掉沟里了，差点忍不住带回去。,https://gs.ctrip.com/html5/you/comment/detail/65217/11/165061466.html,https://dimg04.c-ctrip.com/images/headphoto/698/551/605/18a439d68d284134bb95fbad8ed662ec_C_180_180.jpg,lycheezhang,2020-11-13
总体来说，是一个带着老人孩子一起踏青吸氧的好地方,https://gs.ctrip.com/html5/you/comment/detail/65217/11/165950113.html,https://dimg04.c-ctrip.com/images/Z80p180000013uw9yF21F_C_180_180.jpg,卡夫卡,2021-03-13
溱湖是里下河地区的一个代表性的湿地景点，吃喝玩乐，在这里都能让你满意,https://gs.ctrip.com/html5/you/comment/detail/65217/11/165610574.html,https://dimg04.c-ctrip.com/images/fd/headphoto/g4/M03/DB/1C/CggYHlXXoUOAal32AAAfcDm3W4Q608_C_180_180.jpg,闲人部落,2021-01-25
总体超赞，性价比高，有趣好玩，景色不错，,https://gs.ctrip.com/html5/you/comment/detail/65217/11/166018648.html,https://dimg04.c-ctrip.com/images/t1/headphoto/982/089/752/f8c7b21182c94524ac4df328fdc7b3dc_C_180_180.jpg,M23****2419,2021-03-22
景色一般，这个季节去不适合，到四五月份估计就好点了，现在是枯黄一片，挺大的，一圈逛下来三小时了，可玩性低，有待改进，哈哈,https://gs.ctrip.com/html5/you/comment/detail/65217/11/165796475.html,https://dimg04.c-ctrip.com/images/Z80p180000013uw9yF21F_C_180_180.jpg,M45****7277,2021-02-20
附近的5A，从盐城开过去一个多小时，携程票便宜好多，进去有免费船坐到景区，不想等可以坐快艇，今天是五一假期人超级多但等船也没花多少时间还是比较快的，里面空气很好阴凉的地方也很多，但夏天最好还是不要到中午来，春秋天来最好，我们180元租了一条摇橹船，慢慢悠悠的逛圈感觉也蛮好，不过其实不是太大，有体力的还是走一圈吧，感觉应该也不错，湖水也清，宝宝喂了小鱼和黑天鹅，看到了孔雀开屏，麋鹿和鳄鱼都有看到不过没啥意思，倒是在探险乐园里玩了好久，设施齐全服务也还好，收费的项目大家不玩就是，感觉还是值得来一次的，毕竟环境真的还不错，里面只有一家餐厅，就是农事乐园那里，菜烧的不错环境不咋地，大家可以自己带点东西进去吃，吃完了宝宝还去骑了马60元一圈，哈哈，她开心就好！,https://gs.ctrip.com/html5/you/comment/detail/65217/11/154640383.html,https://dimg04.c-ctrip.com/images/Z80h180000013xc9e3F64_C_180_180.jpg,_WeCh****69913,2018-04-30
景色不错，总体超赞，性价比高，,https://gs.ctrip.com/html5/you/comment/detail/65217/11/165900955.html,https://dimg04.c-ctrip.com/images/0Z84p120008gqg5uwC372_C_180_180.jpg,呆小da,2021-03-06
很值得去的地方，很好玩的地方。,https://gs.ctrip.com/html5/you/comment/detail/65217/11/165808759.html,https://dimg04.c-ctrip.com/images/Z80s0j0000009vsgoE594_C_180_180.jpg,龙阿帅,2021-02-22
今天天气不怎么样，还有些冷但是总体来说还是不错的,https://gs.ctrip.com/html5/you/comment/detail/65217/11/165256871.html,https://dimg04.c-ctrip.com/images/fd/headphoto/g2/M0B/AE/4B/Cghzf1UM7EaAEpx3AAEKc-qt3gE345_C_180_180.jpg,139****0918,2020-12-07
风景不错，转一圈，心旷神怡,https://gs.ctrip.com/html5/you/comment/detail/65217/11/165799444.html,https://dimg04.c-ctrip.com/images/t1/headphoto/057/777/943/0b93f8268d5546308915f4f9fcaa9483_C_180_180.jpg,GH飘雪,2021-02-21
总体超赞，性价比高，,https://gs.ctrip.com/html5/you/comment/detail/65217/11/165883248.html,https://dimg04.c-ctrip.com/images/Z80u16000001063f56171_C_180_180.jpg,尛曖昧,2021-03-04
散散心景色不错，不错,https://gs.ctrip.com/html5/you/comment/detail/65217/11/165848317.html,https://dimg04.c-ctrip.com/images/t1/headphoto/295/828/780/6e6c2151ed65497c850945d5d2b702ae_C_180_180.jpg,M28****4073,2021-02-27
游客不多，坐船到湿地，慢慢的走一圈特别舒服，空气好景色优美。,https://gs.ctrip.com/html5/you/comment/detail/65217/11/164488871.html,https://dimg04.c-ctrip.com/images/Z80h180000013xc9e3F64_C_180_180.jpg,小lynn,2020-09-20
景色不错性价比超高,https://gs.ctrip.com/html5/you/comment/detail/65217/11/165797385.html,https://dimg04.c-ctrip.com/images/t1/headphoto/164/424/952/04eab99bd26f47acadef4fd3f95b9f37_C_180_180.jpg,M24****319,2021-02-20
5A级景区门票只有50元(还包括游船往返)，在门口扫码买票更便宜。景区就像一个大公园，休闲转转不错。但景区维护不佳很多地方都已经杂草丛生。,https://gs.ctrip.com/html5/you/comment/detail/65217/11/164659335.html,https://dimg04.c-ctrip.com/images/Z80l0i0000009ip4k5E7A_C_180_180.jpg,乐咚,2020-10-06
景色不错，性价比高，有趣好玩，总体超赞，我觉得挺好玩的。,https://gs.ctrip.com/html5/you/comment/detail/65217/11/164853580.html,https://dimg04.c-ctrip.com/images/fd/headphoto/g3/M0A/44/DE/CggYGlXkCduAG0hiAAAkMWL7kPg414_C_180_180.jpg,玖蓝文志,2020-10-22
