标题,标题链接,头像,user-detail__name,totalStarIcon1,resource_date
寒山寺属于禅宗中的临济宗。唐代贞观年间，当时的名僧寒山、希迁两位高僧创建寒山寺。1000多年内寒山寺先后5次遭到火毁(一说是7次)，最后一次重建是清代光绪年间。历史上寒山寺曾是中国十大名寺之一，寺内古迹甚多，有张继诗的石刻碑文，寒山、拾得的石刻像。,https://gs.ctrip.com/html5/you/comment/detail/3765/11/165347559.html,https://dimg04.c-ctrip.com/images/Z80813000000tuiq21A55_C_180_180.jpg,勇猛十温柔,5分,2020/12/20
"去年腊八节，
老父亲带回寒山寺的粥，
希望保佑外婆平安健康，
不知不觉一年过去了，
长大以后，
遗憾慢慢积累多了，
就全都不是遗憾了。
节日也不用来庆祝，
用来怀念。

过完腊八就是年，
能料想到今后的每一年，
都不会像先前那样欢聚一堂，
外婆走了以后，
仿佛奔赴团聚这件事失去了意义。
我想大家的亲情关系，
都会随着老人的离逝，
变得支离破碎。

偶尔我在院子里晒太阳的时候，
听到有老人说话，
恍惚间会以为是外婆，
一瞬间欢呼雀跃的心情又冒出来了。
我有些期待那样的时刻，
除了梦里，
很难在清醒的时刻再尝到拥有的快乐。

我一直都坚信不移的，
她一定在平行世界，
带着祝福和爱，
等待我们有天和她团聚，
我甚至觉得，
只有萌生这样的念头，
才能聊以慰藉，
才能苟且偷生。",https://gs.ctrip.com/html5/you/comment/detail/3765/11/165615181.html,https://dimg04.c-ctrip.com/images/0Z80k120008d39lht25E8_C_180_180.jpg,sinkpj,5分,2021/1/26
"唐太宗贞观初(627--649)名僧寒山子，来此缚茆起居，唐玄宗时著名禅师希迁(700--790)在此创建伽蓝，题额曰寒山寺。
北宋太宗太平兴国初(976--983)节度使孙承佑重建佛塔七成(层)。.北宋仁宗嘉佑二年(1057)郇国公王因书张继诗，易封桥为枫桥。
南宋高宗绍兴年间(1131-1162年)称枫桥寺。
洪武年间(1368-1398年)僧昌崇僻建。寒山寺归并寺三：秀峰寺、慧庆寺、南峰寺；庵四：文殊、云皋、射渎，其一失。据此可见寒山寺在明初尚为丛林。
辛亥革命后至1949年，寒山寺亦处危境，香烟稀少，门庭冷落，收入无着，住僧星散。1941年秋，高冠吾等曾将原藏经楼略事修葺，易名为霜钟阁。日军侵占苏州时期，寒山寺殿堂房舍曾一度沦为日军仓库马厩。
1954年原常州接待寺僧演林至寺协助照管香火，寒山寺才又有僧人。同年有苏州名士宋鸿钊者，将其祖传名楼花篮楼施赠寒山寺，移建于碑廊西南隙地，易名为""枫江楼""。
1958年苏州市寺庙集中管理，部分法像被集中到西园戒幢律寺。隆庆寺龙藏经被调入寒山寺。
1966-1976年""文化大革命""期间，寒山寺一度成为造反派刑讯逼供的牢房。佛像、法器、殿阁受损，寺藏文物被查抄。性空法师事先采取保护措施，使碑刻、藏经、罗汉等得以保存。
1978年11月15日，全国政协副主席、中国佛教协会会长赵朴初，第一次到寒山寺视察并指导修复工作。寒山寺由此开始修复。",https://gs.ctrip.com/html5/you/comment/detail/3765/11/165347773.html,https://dimg04.c-ctrip.com/images/Z80413000000ttay762F0_C_180_180.jpg,恰似您的温柔,5分,2020/12/20
这个季节嫩绿明亮，桃花初开，选了一个周一的早上开始我的寒山慢游，安静、适合用心的朝拜，寒山寺是我这次苏州之行最最值得推荐之处。其实每一个地方都需要自己去观看、发现，如果介绍太多，带着期望值去欣赏，多多少少会有点带入个人想象了。所以值得去发现吧,https://gs.ctrip.com/html5/you/comment/detail/3765/11/165974664.html,https://dimg04.c-ctrip.com/images/Z80t1f000001gb8t8BF35_C_180_180.jpg,迪拉基嬴政,5分,24小时前
"寒山寺位于苏州城西阊门外的枫桥镇，始建于南朝萧梁代天监年间（公元502-519）距现在已有1400多年了，初名“妙利善明塔院。
寒山寺因唐代诗人张继《枫桥夜泊》中“姑苏城外寒山寺，夜半钟声到客船”其诗句而闻名天下。寺内的钟楼便是“夜半钟声”的来源之处，宏亮悠扬的钟声是寒山寺的象征。如今的大钟虽非张继诗中那口钟，而是晚清的古迹，但每天来寺中撞钟，祈福的信徒络绎不绝……",https://gs.ctrip.com/html5/you/comment/detail/3765/11/165811647.html,https://dimg04.c-ctrip.com/images/Z80h180000013xc9e3F64_C_180_180.jpg,胭脂2021,5分,2021/2/22
寒山寺位于姑苏区枫桥路，始建于南朝，清朝光绪年间重修，是中国十大名寺之一。院内有一座普明宝塔，寒山寺初名“妙利普明塔院”，寺内还有脍炙人口的张继寺的时刻碑文“枫桥夜泊”。,https://gs.ctrip.com/html5/you/comment/detail/3765/11/165771429.html,https://dimg04.c-ctrip.com/images/Z80t11000000qn2bj83A0_C_180_180.jpg,黄大小姐,5分,2021/2/18
"“姑苏城外寒山寺”
那次去苏州，特意去打卡了一下诗句中曾提到的寒山寺。每次去寺庙，都感觉特别的放松，感觉内心踏实。
但是，寒山寺给我感觉也有点太商业化了，比如我们进北区的园内，必须要经过一个佛堂，里边全部是大呼小叫的卖东西的。寒山寺里边，也有好多卖东西的。曾经我去过一个寺庙，里边连公德箱都没有设，真的是没法比………
交通：交通还算便捷，苏州旅游业发达，有专门的一条公交线路是往各大景点接送人的，3元/人。淡季好像是半个多小时一趟吧，旺季的话车辆多，用不着半个多小时",https://gs.ctrip.com/html5/you/comment/detail/3765/11/165956387.html,https://dimg04.c-ctrip.com/images/0Z851120003eawmwa50CF_C_180_180.jpg,徐徐霞客Rr,5分,2021/3/14
寒山寺以唐朝诗人张继的诗句“姑苏城外寒山寺，夜半钟声到客船”而闻名，但在以前的苏州，寒山寺并不算标志性景区。这几年寒山寺被修葺一新，又与周边枫桥地区以及铁铃关一起组成枫桥景区，既有秀美的自然风光，也有精彩的历史故事。值得走走逛逛,https://gs.ctrip.com/html5/you/comment/detail/3765/11/164978062.html,https://dimg04.c-ctrip.com/images/0Z804120008g820vo33A2_C_180_180.jpg,听足音,5分,2020/11/3
唐朝诗人张继所作诗篇《枫桥夜泊》诗曰：“月落乌啼霜满天，江枫渔火对愁眠。姑苏城外寒山寺，夜半钟声到客船。”诗韵钟声千载流传，寒山古刹因此名扬天下。 现在基本来游玩的人都是冲着枫桥夜泊的名头来的。张继的枫桥夜泊保证了寒山寺上千年的旺盛香火，钟越铸越大，碑也越修越高，双双进入了吉尼斯纪录。但此钟早已不是彼钟，当年启发张继的钟早已不知去向。寒山寺始建于六朝时期的梁代天监年间（公元502-519年），距今已有1400多年。原名“妙利普明塔院”。寺院坐东朝西，寺内主要建筑有：大雄宝殿、庑殿(偏殿)藏经楼、碑廊、钟楼、枫江楼等。内部很简单，环境幽静，绿化很好，没有太多花哨，很适合佛门清净地。,https://gs.ctrip.com/html5/you/comment/detail/3765/11/164469640.html,https://dimg04.c-ctrip.com/images/Z8020i0000009bqe17BF7_C_180_180.jpg,静静de黎明,5分,2020/9/18
寒山寺位于苏州市姑苏区，始建于南朝萧梁代天监年间(公元502~519年)，初名"妙利普明塔院"。寒山寺占地面积约1.3万平方米，建筑面积三千四百余平方米。,https://gs.ctrip.com/html5/you/comment/detail/3765/11/165347557.html,https://dimg04.c-ctrip.com/images/Z8070a0000004m9t7BB14_C_180_180.jpg,周游列国,5分,2020/12/20
"姑苏城外寒山寺，夜半钟声到客船
就这首诗的意境，必须到寒山寺来感受一下，很不错的地方，古色古香，充满了古诗文人的意境，很棒的体验。",https://gs.ctrip.com/html5/you/comment/detail/3765/11/165958249.html,https://dimg04.c-ctrip.com/images/Z8071f000001gkctn0EF6_C_180_180.jpg,Lucifinil forever,5分,2021/3/14
提到寒山寺，首先想到的就是枫桥夜泊，张继，月落乌啼霜满天，江枫渔火对愁眠，姑苏城外寒山寺，夜半钟声到客船。这次去寒山寺还学到了一句诗，千江有水千江月，万里无云万里天特别的开心，哈哈哈,https://gs.ctrip.com/html5/you/comment/detail/3765/11/165704198.html,https://dimg04.c-ctrip.com/images/t1/headphoto/272/077/772/76b262d0cc24492abc5c6784c903c2ab_C_180_180.jpg,_WeCh****225890,5分,2021/2/10
"来苏州旅游不能错过的寒山寺旅游攻略
????
寒山寺，位于苏州市姑苏区，苏州城区周边比较出名的一个景点，游客人来人往，来苏州必玩的一个景点，提供旅游攻略如下：

景点名：寒山寺

交通：可以打车前往，也可以乘游3线、313、301路公交车，到何山大桥站下。。

玩法：购票进园。门票大概20元每人次。依次参观法堂、大雄宝殿、藏经楼、钟楼、碑廊、霜钟阁等。可以过桥参观枫桥风景名胜区。沿途游客可以驻足拍照留下回忆。一路上绿树成荫，非常不错的风景。主要是清朝的建筑物为主。寺中处处皆院，错落相通。

推荐理由：姑苏城外寒山寺，寒山寺佛像雕塑别具一格，碑刻艺术天下闻名，以晚清俞樾书张继诗碑最为著名。非常值得一看的一个景点。",https://gs.ctrip.com/html5/you/comment/detail/3765/11/165872204.html,https://dimg04.c-ctrip.com/images/0Z80x1200083724clD9E8_C_180_180.jpg,萨拉热窝的夏雨荷,5分,2021/3/2
性价比高，20 块钱一张票我觉得是可以接受的，寒山寺不大，里面有各种版本枫桥夜泊，然后可以刷二维码捐助寺院，我稍微拜了各个佛像，大约40分钟左右吧，名气挺大，年里虽然有疫情的关系，人还是不少的，如果外地过来要注意停车的问题，我到地方发现好几个停车场都满了，饶了两圈终于看见有辆车要出来，我就开了进去，周围马路也有划线处可停车，停一次20块。景色不错，,https://gs.ctrip.com/html5/you/comment/detail/3765/11/165745971.html,https://dimg04.c-ctrip.com/images/Z8060s000000i8xcrAA31_C_180_180.jpg,苏州小姚,5分,2021/2/15
"??月落乌啼霜满天，江枫渔火对愁眠。姑苏城外寒山寺，夜半钟声到客船。让人魂牵梦萦的寒山寺，让人流连忘返的寒山寺，让人难以忘怀的寒山寺……故地重游别有一番滋味在心头。六年前十月末来过苏州去了拙政园、苏州博物馆、周庄，逛了山塘街和观前街，还去了的木渎古镇……前年十月底又来到了苏州。这次是从青岛自驾过来，和家人住在七天宾馆，第二天上午先去了枫桥景区，然后去了它隔壁的寒山寺。

??地理位置
江苏省苏州市姑苏区寒山寺弄24号。
??交通
乘游3线、313、6、9、17、21、31、301路车，何山大桥站下。
??门票
18元
1?身高1.2米以下儿童免票；身高1.2~1.5米儿童，门票半价优惠。
2?60~69周岁老年人凭有效证件，门票半价优惠；70周岁以上（含70周岁）老年人凭有效证件免票。
3?现役军人凭有效证件免票。
?开放时间
07：30－17：00。

??看点:  新年快到了，有机会可以去寒山寺听听
钟声：寒山寺素以钟声闻名天下。每年除夕阳或元旦晚上，寒山寺都会举行敲钟仪式，钟敲108下。每一下代表一个烦恼，听完钟声，来年烦恼便随风而去。据说当年唐代诗人张继夜泊枫桥，在客船听钟声，也是因为屡试不中，听人指点也前来扫除烦恼。",https://gs.ctrip.com/html5/you/comment/detail/3765/11/165626205.html,https://dimg04.c-ctrip.com/images/zc02170000011l03o44C7_C_180_180.jpg,Yanni777,5分,2021/1/28
姑苏城外寒山寺，夜半钟声到客船。来苏州怎能不到寒山寺？！我对于寒山寺的第一印象就是儿时学过的《枫桥夜泊》。寺内一整面墙上都是各个时代名人题写的此首诗，使我印象深刻。还有个小插曲：跟随我多年、一直系在我书包上的小葫芦居然掉到普明宝塔前。寒山寺旁边就是枫桥景区，我追随古人的足迹，在夜泊处驻足许久。,https://gs.ctrip.com/html5/you/comment/detail/3765/11/165511700.html,https://dimg04.c-ctrip.com/images/t1/headphoto/672/839/406/da5d539779ab40d89c7f9c2690bf121d_C_180_180.jpg,云鹤熙熙,5分,2021/1/10
寒山寺属于禅宗中的临济宗。唐代贞观年间，当时的名僧寒山、希迁两位高僧创建寒山寺。1000多年内寒山寺先后5次遭到火毁（一说是7次），最后一次重建是清代光绪年间。历史上寒山寺曾是中国十大名寺之一，寺内古迹甚多，有张继诗的石刻碑文，寒山、拾得的石刻像，文徵明、唐寅所书碑文残片等。,https://gs.ctrip.com/html5/you/comment/detail/3765/11/165905031.html,https://dimg04.c-ctrip.com/images/Z80f0b000000594pd8831_C_180_180.jpg,freewangyong,4分,2021/3/7
"月落乌啼霜满天，江枫渔火对愁眠。
姑苏城外寒山寺，夜半钟声到客船。
唐代诗人张继的这首《枫桥夜泊》自小吟诵了有三十多年。终于有机会实地踏查一下。寺庙不大，但这里是和合二仙的祖庭，江湖地位还是很高的。寺后就是枫桥，相必当年张继就是在这附近的小船上听寒山寺的钟声吧！",https://gs.ctrip.com/html5/you/comment/detail/3765/11/165365174.html,https://dimg04.c-ctrip.com/images/fd/headphoto/g4/M02/47/D6/CggYHlX3raaAOqR-AAFTbrk4OGw773_C_180_180.jpg,迪迪猫,5分,2020/12/22
很难忘的旅行，尤其和老同学一起。佛法无边，普渡众生。一首《枫桥夜泊》流传千古，也为寒山寺带来了无限生机。枫桥景区就在寺院门口，怪不得张继老先生听得这么清楚。景色不错，总体超赞，有趣好玩，性价比高，,https://gs.ctrip.com/html5/you/comment/detail/3765/11/165776360.html,https://dimg04.c-ctrip.com/images/t1/headphoto/982/089/752/f8c7b21182c94524ac4df328fdc7b3dc_C_180_180.jpg,M22****987,5分,2021/2/18
非常值得去，有内涵，有知识。不同于一般的寺庙，享受书法的盛宴。各种风格，各位大家，各个朝代的书法作品，令人赏心悦目 目不暇接。,https://gs.ctrip.com/html5/you/comment/detail/3765/11/165745512.html,https://dimg04.c-ctrip.com/images/Z80p180000013uw9yF21F_C_180_180.jpg,65****827,5分,2021/2/15
"真心话，小时候就一直听“姑苏城外寒山寺、夜半钟声到客船”到了寒山寺觉得真的很有感悟：
1、停车??方便
2、真的非常有文化底蕴的地方
3、门票便宜
4、老人也非常喜欢",https://gs.ctrip.com/html5/you/comment/detail/3765/11/165562244.html,https://dimg04.c-ctrip.com/images/Z80o11000000qi5hgE0AA_C_180_180.jpg,天下的无双,5分,2021/1/18
"唐代贞观年间，当时的名僧寒山、希迁两位高僧创建寒山寺。历史上寒山寺曾是中国十大名寺之一，寺内古迹甚多，有张继诗的石刻碑文，寒山、拾得的石刻像，文徵明、唐寅所书碑文残片等。
还未进古寺，已听到阵阵悠远的钟声。
“枫桥夜泊处”离寒山寺很近，确禁止通行，很遗憾。",https://gs.ctrip.com/html5/you/comment/detail/3765/11/165318224.html,https://dimg04.c-ctrip.com/images/0Z83m1200085c95heBAAB_C_180_180.jpg,悠悠的风103,5分,2020/12/16
第三次来寒山寺了，这次来发现了这只好萌的小狮子哈哈哈哈太可爱了，身上这么光亮看来游客们也都很喜欢它??，前面两次来这里一次是盛夏，一次是初冬，下次要在下雪的时候再来一次~每个季节的美都不一样~每次发现的景色也不一样，寒山寺古色古香的江南园林风格搭配现代风格粉红色的墙太好看了~赞叹设计师的美学构思???,https://gs.ctrip.com/html5/you/comment/detail/3765/11/164481243.html,https://dimg04.c-ctrip.com/images/zc0h170000011fhu3CEE3_C_180_180.jpg,139****3478,5分,2020/9/20
寒山寺的入口是正对着枫桥景区的。从寒山寺出来后想去枫桥景区还要折返回去。很多导游在带逛寺庙的时候都会告知不走回头路，所以从主门进来的话要从侧门离开。寒山寺是有香火的。寺庙不大，里面也有庙里的僧人！寒山寺里面的景色还是挺不错的。来到苏州，当然是要到这里瞧一瞧的了！,https://gs.ctrip.com/html5/you/comment/detail/3765/11/163118168.html,https://dimg04.c-ctrip.com/images/Z80d1g000001ha0bgB427_C_180_180.jpg,卖牛奶的猪,5分,2020/3/27
不高的小山却非常幽静，充满了江南园林的味道，处处有景处处有文化,https://gs.ctrip.com/html5/you/comment/detail/3765/11/165813893.html,https://dimg04.c-ctrip.com/images/Z80t12000000sg3du8160_C_180_180.jpg,枫舞知秋,5分,2021/2/22
夜半钟声到客船，寒山寺因为这首诗出名，门票15元，单独逛寒山寺要付门票，但是如果只是逛枫桥夜泊景区不需要，寒山寺里还有枫桥夜泊那首诗的真迹,https://gs.ctrip.com/html5/you/comment/detail/3765/11/165441616.html,https://dimg04.c-ctrip.com/images/Z80h180000013xc9e3F64_C_180_180.jpg,alpha1015,5分,2021/1/1
许多年前来过一次，这次来感觉又不一样，买了讲解，有很多地方都有了很好的了解，对寒山寺的由来，那座塔的由来，还有那巨型大钟如何建成都了解了,https://gs.ctrip.com/html5/you/comment/detail/3765/11/165855801.html,https://dimg04.c-ctrip.com/images/t1/headphoto/491/056/464/eb3c7472323e4c3598f58ffa8a6fce99_C_180_180.jpg,M27****0133,5分,2021/2/28
"和合二仙之典故/昔日寒山问拾得曰：
“世间有人谤我、欺我、辱我、笑我、轻我、贱我、恶我、骗我，如何处置乎？”
拾得曰：
“只是忍他、让他、由他、避他、耐他、敬他、不要理他，再待几年，你且看他。”",https://gs.ctrip.com/html5/you/comment/detail/3765/11/165758193.html,https://dimg04.c-ctrip.com/images/t1/headphoto/397/132/243/542067aa29904ae9aca7e88f43eaeb6f_C_180_180.jpg,M24****9457,5分,2021/2/16
寒山寺位于苏州市姑苏区，始建于南朝萧梁代天监年间（公元502～519年），初名“妙利普明塔院”。寒山寺占地面积约1.3万平方米，建筑面积三千四百余平方米。唐代贞观年间，当时的名僧寒山、希迁两位高僧创建寒山寺。1000多年内寒山寺先后5次遭到火毁（一说是7次），最后一次重建是清代光绪年间。历史上寒山寺曾是中国十大名寺之一，寺内古迹甚多，有张继诗的石刻碑文，寒山、拾得的石刻像，文徵明、唐寅所书碑文残片等。,https://gs.ctrip.com/html5/you/comment/detail/3765/11/165733393.html,https://dimg04.c-ctrip.com/images/Z8060z000000mnckuCC07_C_180_180.jpg,慢樱花,5分,2021/2/14
"不禁想起唐代诗人张继途经寒山寺时写下的这首羁旅诗―《枫桥夜泊》。
月落乌啼霜满天，江枫渔火对愁眠。
姑苏城外寒山寺，夜半钟声到客船。

寒山寺位于苏州市姑苏区，始建于南朝萧梁代天监年间（公元502～519年），初名“妙利普明塔院”，属于禅宗中的临济宗。
寒山寺先后5次遭到火毁（也有说是7次），最后一次重建是清代光绪年间，历史上寒山寺曾是中国十大名寺之一。",https://gs.ctrip.com/html5/you/comment/detail/3765/11/165407557.html,https://dimg04.c-ctrip.com/images/Z80i0c00000062f831AB3_C_180_180.jpg,D23****498,4分,2020/12/28
一年一度寒山感恩，感恩我佛菩萨庇佑！祈盼国泰民安，家和万兴，南无阿弥陀佛。,https://gs.ctrip.com/html5/you/comment/detail/3765/11/165773420.html,https://dimg04.c-ctrip.com/images/fd/headphoto/g2/M05/27/F9/CghzgFWTm0iAeBoFAAAdL1NyXwk845_C_180_180.jpg,威武斑大人,5分,2021/2/18
此地之所以成为人们纷纷的打卡之地，是因张继的那首《枫桥夜泊》。导游的讲解让我们知道了，诗句里的“江”和“枫”分别指的是“江村桥”和“枫桥”，还了解到这首诗是张继落榜归家时因无法进城所作。,https://gs.ctrip.com/html5/you/comment/detail/3765/11/164939997.html,https://dimg04.c-ctrip.com/images/Z80e0u000000j04cj0566_C_180_180.jpg,_WeCh****620683,5分,2020/10/30
景色不错，有趣好玩，性价比高，总体超赞，地方大，人多也不拥挤。,https://gs.ctrip.com/html5/you/comment/detail/3765/11/165820720.html,https://dimg04.c-ctrip.com/images/Z80p180000013uw9yF21F_C_180_180.jpg,233****375,5分,2021/2/23
寒山寺景色宜人，风景优美，空气清新，天气有点冷，但没有影响游玩的心情，趣味性强，感受感受，挺舒服的，不错的选择，心情舒畅。,https://gs.ctrip.com/html5/you/comment/detail/3765/11/165325985.html,https://dimg04.c-ctrip.com/images/Z806180000014r4pz3AE0_C_180_180.jpg,gz当地向导伊妹儿,5分,2020/12/18
寒山寺殿宇大多为清代建筑，主要有大雄宝殿、藏经楼、钟楼、碑廊、枫江楼、霜钟阁等。如今的大钟为清光绪三十二年（1906）江苏巡抚陈夔龙督造，为仿唐式的直桶平口古铜钟，总重量达108吨，重量居梵钟之首。,https://gs.ctrip.com/html5/you/comment/detail/3765/11/164599484.html,https://dimg04.c-ctrip.com/images/0Z86912000821xpnp981A_C_180_180.jpg,卜一样的旅行,5分,2020/10/2
寒山寺最吸引我的地方，锦鲤被游客养的很不错,https://gs.ctrip.com/html5/you/comment/detail/3765/11/165960571.html,https://dimg04.c-ctrip.com/images/t1/headphoto/397/132/243/542067aa29904ae9aca7e88f43eaeb6f_C_180_180.jpg,叁横壹竖峰峰,5分,2021/3/14
值得一游，景色宜人，趣味十足，性价比超高。,https://gs.ctrip.com/html5/you/comment/detail/3765/11/165796044.html,https://dimg04.c-ctrip.com/images/Z80p180000013uw9yF21F_C_180_180.jpg,233****375,4分,2021/2/20
苏州的著名景点，外面的黄墙配上绿字搭配很美。很小的一个寺，所以无法建成高塔，香火还是很旺的，寒山精神也是在海外远播，单就一个景点而言时间不够的话可以忽略，大多数人只为那一首古诗产生了朝圣的念头，一口古钟作为出口也是醉了。,https://gs.ctrip.com/html5/you/comment/detail/3765/11/165716628.html,https://dimg04.c-ctrip.com/images/t1/headphoto/857/872/237/edc9e981b00e436a8dcee595001d62fa_C_180_180.jpg,_wech****045076,3分,2021/2/12
月落乌啼霜满天，江枫渔火对愁眠。姑苏城外寒山寺，夜半钟声到客船。寒山寺的钟声太有名了，很多人大老远地赶来，就是为了就是为了听一听寒山寺的钟声。 在藏经楼南侧，有一座六角形重檐亭阁，这就是以“夜半钟声”闻名遐迩的钟楼。,https://gs.ctrip.com/html5/you/comment/detail/3765/11/165222204.html,https://dimg04.c-ctrip.com/images/0Z8441200085chlq0E563_C_180_180.jpg,红糖泡泡,5分,2020/12/3
来苏州旅游，怎么能不去寒山寺呢，这也是当地最有名的寺庙，前来烧香祈福的人真的不少，整个寺庙并不算大，个人建议可以花上2-3个小时，在这边，这样安排会比较合理。,https://gs.ctrip.com/html5/you/comment/detail/3765/11/164775202.html,https://dimg04.c-ctrip.com/images/Z80c0n000000ei4azCB29_C_180_180.jpg,M49****629,5分,2020/10/13
"香火挺旺的。寒山寺其实不太大，旁边有好几个纪念馆貌似是免费的。景色不错，金黄色的落叶铺在地上很好看。


如果想好要去的话可以提前一天买票，会便宜3块钱（应该）。",https://gs.ctrip.com/html5/you/comment/detail/3765/11/165380474.html,https://dimg04.c-ctrip.com/images/0Z80x12000817irfuD2A2_C_180_180.jpg,豆豆喜欢出去玩,5分,2020/12/24
姑苏城外寒山寺，夜半钟声到客船。终于到了小时候课本上的古诗里了,https://gs.ctrip.com/html5/you/comment/detail/3765/11/165568252.html,https://dimg04.c-ctrip.com/images/Z80b12000000t8r8k8B4B_C_180_180.jpg,疯狂牢鼠,5分,2021/1/18
总体超赞，景色不错，性价比高，有趣好玩，名声都传到国外去了的名胜古迹。南门处的河道应该就是几百年前的客运码头吧，原来的郊外现在的市中心。,https://gs.ctrip.com/html5/you/comment/detail/3765/11/165582377.html,https://dimg04.c-ctrip.com/images/Z803080000002zi1h822A_C_180_180.jpg,jiamings,5分,2021/1/21
寒山寺景区历史悠久，管理很好，适合老人，小孩一家人去。可以看运河上的船，近距离的。真正体验古诗中的意境。附近还有一个古街区，步行可达。,https://gs.ctrip.com/html5/you/comment/detail/3765/11/164905519.html,https://dimg04.c-ctrip.com/images/t1/headphoto/258/512/704/6bce7506eecc48f8a4a6d3177e0acf24_C_180_180.jpg,M24****3433,5分,2020/10/27
月落乌啼霜满天，江枫渔火对愁眠，姑苏城外寒山寺，夜半钟声到客船，因为这首诗去打卡的寒山寺和枫桥景区，环境很好，秋色也很浓。景色不错，,https://gs.ctrip.com/html5/you/comment/detail/3765/11/165401929.html,https://dimg04.c-ctrip.com/images/zc0l170000011e3741A91_C_180_180.jpg,敏儿叨叨念,5分,2020/12/27
寒山寺位于苏州西郊，已有一千四百多年的历史，因唐代诗人张继的名诗《枫桥夜泊》中“姑苏城外寒山寺、夜半钟声到客船”一句而闻名天下。非常值得一去，心诚则灵。拍的照片也非常喜欢。,https://gs.ctrip.com/html5/you/comment/detail/3765/11/164786414.html,https://dimg04.c-ctrip.com/images/0Z84h1200086tw6b2FB6C_C_180_180.jpg,pp2018,5分,2020/10/15
