标题,标题链接,头像,user-detail__name,totalStarIcon1,resource_date
毕竟是个寺庙，面积不算大，但风格独特，除了佛教建筑，也有些湖石、池塘、亭台，颇具江南园林风格。普明塔院整个院内的所有建筑，包括塔身都是粉色的，很可爱，池里的鲤鱼巨大无比，快成精了。,https://gs.ctrip.com/html5/you/comment/detail/3765/11/162251265.html,https://dimg04.c-ctrip.com/images/t1/headphoto/057/777/943/0b93f8268d5546308915f4f9fcaa9483_C_180_180.jpg,M26****3840,5分,2019/12/10
性价比低，可玩性低，景色一般，隔壁有个别院免费的，还更好看,https://gs.ctrip.com/html5/you/comment/detail/3765/11/164943560.html,https://dimg04.c-ctrip.com/images/Z80p180000013uw9yF21F_C_180_180.jpg,_M13****7324,3分,2020/10/31
姑苏城外寒山寺 夜半钟声到客船，一首古诗词引的游人络绎不绝,https://gs.ctrip.com/html5/you/comment/detail/3765/11/164666836.html,https://dimg04.c-ctrip.com/images/t1/headphoto/295/828/780/6e6c2151ed65497c850945d5d2b702ae_C_180_180.jpg,M18****103,3分,2020/10/6
趁着出差去苏州，玩了寒山寺。寺院整体不大香火旺盛，水里养的那些锦鲤真的是很漂亮。入寺之前的枫桥沿着河畔走一走风景很美。门票价格合理，值得去看一看走一走。,https://gs.ctrip.com/html5/you/comment/detail/3765/11/163922474.html,https://dimg04.c-ctrip.com/images/fd/headphoto/g2/M00/F7/BD/Cghzf1WGdSOARGezAACdJb58QYs303_C_180_180.jpg,mai****ning,4分,2020/7/26
值得推荐，景色不错，许久未来寒山寺了，周边景区扩大不少，但古寺还是没变，小巧精致，坐在长廊，清晰的钟声阵阵入耳。,https://gs.ctrip.com/html5/you/comment/detail/3765/11/163918878.html,https://dimg04.c-ctrip.com/images/fd/headphoto/g1/M07/F7/9D/CghzfFW-HMSAdLecAAA1o-VhYqg366_C_180_180.jpg,西西上仙,5分,2020/7/25
喜欢旅游，希望能去更多更美的地方,https://gs.ctrip.com/html5/you/comment/detail/3765/11/163210603.html,https://dimg04.c-ctrip.com/images/Z8011f000001h1go89FE9_C_180_180.jpg,90后的星星沙,5分,2020/4/10
“姑苏城外寒山寺，夜半钟声到客船”每次读到这两句诗，心里都会觉得很孤寂，我深深体会张继写这首诗内心的孤独，眼前的寒山寺，变得热闹了，我久久的在寒山寺伫立，内心无法平静。。。,https://gs.ctrip.com/html5/you/comment/detail/3765/11/162942478.html,https://dimg04.c-ctrip.com/images/Z80p180000013uw9yF21F_C_180_180.jpg,怡然自得oy,4分,2020/3/3
每年会去一次，古朴的寺庙如今焕发新的光彩。不愧为名寺，有种气势。交通更是方便。周边也有很多好吃的，逛累了可以去山塘街老街找很多小吃。,https://gs.ctrip.com/html5/you/comment/detail/3765/11/162782175.html,https://dimg04.c-ctrip.com/images/t1/headphoto/207/494/838/fa687736cf3f484480526cfc0eb6c073_C_180_180.jpg,110****071,5分,2020/2/3
姑苏城外寒山寺，夜半钟声到客船。寒山寺应该是因为这首诗出名的，寒山二字乃明朝江南四大才子之祝枝山所提，携程买票很方便，直接入园，最好跟个导游，要不然很多东西都看不懂。满意。,https://gs.ctrip.com/html5/you/comment/detail/3765/11/159407658.html,https://dimg04.c-ctrip.com/images/Z80p180000013uw9yF21F_C_180_180.jpg,137****3632,5分,2019/6/23
姑苏城外寒山寺，夜半钟声到客船！一直以来，都是喜欢姑苏的温婉，还有一种文人骚客的书卷气！到过以后，我才发现，自己只是因为这首诗而产生的情怀，因一首诗喜欢上这个传说中的钟声！,https://gs.ctrip.com/html5/you/comment/detail/3765/11/159186798.html,https://dimg04.c-ctrip.com/images/Z80l0y000000ls7yg134D_C_180_180.jpg,温上亿小哥,5分,2019/6/6
门票不包括钟楼的门票，要另外买，不过不贵五元一张，算是敲钟祈福。一大早去的，人不多，大概走了一个多小时，然后等素菜馆开门吃斋。寒山寺的素面一般，太油了。,https://gs.ctrip.com/html5/you/comment/detail/3765/11/158351014.html,https://dimg04.c-ctrip.com/images/Z80h180000013xc9e3F64_C_180_180.jpg,鱼眼看天下,5分,2019/4/10
体验很好，值得推荐，有趣好玩，,https://gs.ctrip.com/html5/you/comment/detail/3765/11/164406826.html,https://dimg04.c-ctrip.com/images/Z80o180000013ulo9C34A_C_180_180.jpg,M42****9022,5分,2020/9/12
体验很好，值得推荐，景色不错，,https://gs.ctrip.com/html5/you/comment/detail/3765/11/164237309.html,https://dimg04.c-ctrip.com/images/Z80w190000015tkp3C215_C_180_180.jpg,雪山十三哥,5分,2020/8/25
到了苏州，一定要去江南古刹寒山寺，为了唐代大诗人张继那首脍炙人口的《枫桥夜泊》诗：“月落乌啼霜满天，江枫渔火对愁眠。姑苏城外寒山寺，夜半钟声到客船。”,https://gs.ctrip.com/html5/you/comment/detail/3765/11/163943337.html,https://dimg04.c-ctrip.com/images/Z80h180000013xc9e3F64_C_180_180.jpg,9049,5分,2020/7/28
人很多，匆匆忙忙走了一趟，时间紧张的话不建议过去,https://gs.ctrip.com/html5/you/comment/detail/3765/11/164430410.html,https://dimg04.c-ctrip.com/images/0Z82p1200082z1cph85A8_C_180_180.jpg,M31****2391,3分,2020/9/14
古寺，鸟语花香，钟声很好听。,https://gs.ctrip.com/html5/you/comment/detail/3765/11/164034295.html,https://dimg04.c-ctrip.com/images/t1/headphoto/258/512/704/6bce7506eecc48f8a4a6d3177e0acf24_C_180_180.jpg,M36****930,5分,2020/8/7
姑苏城外寒山寺 夜半钟声到客船，千古名句！自小喜欢谈好东西，唐诗宋词，真的觉得就是一种享受！在这里，可以找到自己喜欢的东西南北，推荐推荐推荐突突突突！,https://gs.ctrip.com/html5/you/comment/detail/3765/11/163938618.html,https://dimg04.c-ctrip.com/images/t1/headphoto/699/910/854/683dab66bb374136af9930ea204dfc7e_C_180_180.jpg,M22****5360,5分,2020/7/27
烧香拜佛的地方，如果不烧香拜佛一会儿就逛完了。,https://gs.ctrip.com/html5/you/comment/detail/3765/11/164736765.html,https://dimg04.c-ctrip.com/images/t1/headphoto/295/828/780/6e6c2151ed65497c850945d5d2b702ae_C_180_180.jpg,M33****805,3分,2020/10/10
里面买香要50元一扎，蜡烛80元一对，超贵！,https://gs.ctrip.com/html5/you/comment/detail/3765/11/165279020.html,https://dimg04.c-ctrip.com/images/Z80p180000013uw9yF21F_C_180_180.jpg,柏林仔,3分,2020/12/10
寒山寺景观非常壮观，让人心旷神怡，流连忘返。,https://gs.ctrip.com/html5/you/comment/detail/3765/11/163778419.html,https://dimg04.c-ctrip.com/images/Z80810000000obg09826E_C_180_180.jpg,添熙,5分,2020/7/6
节假日一定要早到，不然就是中间那场景。大钟苑在寒山寺外面，不要错过。出来后左后转弯走小路，可以路过免费开放的图书馆，接着到枫桥，可惜这次枫桥没有开放，急的我想游过去,https://gs.ctrip.com/html5/you/comment/detail/3765/11/158621861.html,https://dimg04.c-ctrip.com/images/t1/headphoto/903/173/918/eb4b7bea9720440dac09eab89328ab00_C_180_180.jpg,133****1815,5分,2019/5/2
对宗教信仰不是很感兴趣的，进去的意义不大。,https://gs.ctrip.com/html5/you/comment/detail/3765/11/164682319.html,https://dimg04.c-ctrip.com/images/Z80o180000013ulur1D76_C_180_180.jpg,_WeCh****284334,3分,2020/10/7
寺庙 ? ? 不多做评价 ?,https://gs.ctrip.com/html5/you/comment/detail/3765/11/164090976.html,https://dimg04.c-ctrip.com/images/t1/headphoto/258/512/704/6bce7506eecc48f8a4a6d3177e0acf24_C_180_180.jpg,M17****392,5分,2020/8/12
“姑苏城外寒山寺，夜半钟声到客船”，寒山寺，慕名而去，我国古代佛教d文化，在这里根深蒂固，虽然又经过了几次修建，但依然能体会到她曾经的那种辉煌,https://gs.ctrip.com/html5/you/comment/detail/3765/11/163273701.html,https://dimg04.c-ctrip.com/images/Z80q0m000000do9fdFCE5_C_180_180.jpg,白灵,5分,2020/4/20
好，很好，非常好，好，很好，非常好好，很好，非常好好，很好，非常好好，很好，非常好好，很好，非常好好，很好，非常好好，很好，非常好好，很好，非常好好，很好，非常好,https://gs.ctrip.com/html5/you/comment/detail/3765/11/161679811.html,https://dimg04.c-ctrip.com/images/t1/headphoto/136/299/437/649eb217e3e54746b7a53b8665e14b00_C_180_180.jpg,M23****400,5分,2019/10/23
冲着张继那首诗过去的，本以为会是个很高的山上寺庙，其实不是。适合老人孩子游览，关键是傍晚时分，虽然时有蚊虫叮咬，但是游客减少的寺院，景色宜人。,https://gs.ctrip.com/html5/you/comment/detail/3765/11/159817758.html,https://dimg04.c-ctrip.com/images/t1/headphoto/982/089/752/f8c7b21182c94524ac4df328fdc7b3dc_C_180_180.jpg,M39****377,5分,2019/7/19
打卡质地而已，枫桥在维修，完全没诗中意境,https://gs.ctrip.com/html5/you/comment/detail/3765/11/164558854.html,https://dimg04.c-ctrip.com/images/Z80h180000013xc9e3F64_C_180_180.jpg,苏尔卢瓦尔术赤,3分,2020/9/28
苏州城外寒山寺，哈哈哈哈！这个地方很不错滴，苏州园林甲天下啊！有机会还要再去，就是人比较多，真的是挺好玩，推荐推荐推荐推荐推荐推荐集体经济。,https://gs.ctrip.com/html5/you/comment/detail/3765/11/163603445.html,https://dimg04.c-ctrip.com/images/t1/headphoto/699/910/854/683dab66bb374136af9930ea204dfc7e_C_180_180.jpg,M22****5360,5分,2020/6/7
经典诗篇枫桥夜泊中的千年古寺庙，位于苏州！参观寒山寺，感受庙宇的古朴典雅，感受历史的底蕴，了解寒山寺的故事，非常有收获！,https://gs.ctrip.com/html5/you/comment/detail/3765/11/162744319.html,https://dimg04.c-ctrip.com/images/Z80i0f0000007ayr498E0_C_180_180.jpg,Newflyyy,5分,2020/1/27
月落乌啼霜满天，江枫渔火对愁眠，姑苏城外寒山寺，夜半钟声到客船。这首千古名诗使寒山寺成为古今名寺。落魄的诗人张籍与虔诚的僧人寒山，绝不会想到，自后千年。诗应寺而成，寺因诗而名，拾得一寺成一诗，修得一诗名一寺，千古绝唱百世流芳。愁泊枫桥听钟声，修须寒山听梵音。,https://gs.ctrip.com/html5/you/comment/detail/3765/11/157831864.html,https://dimg04.c-ctrip.com/images/Z80s11000000qrzjhD05E_C_180_180.jpg,_WeCh****57411,5分,2019/2/9
交通：公交301、307到“寒山寺南站”，由于离市中心较远，公交报站声音也小，游客需留心不要坐过站；适宜节令：元旦前夜（好像全苏州的人都喜欢在这一夜仰望烟花，静听零点祈福钟声）、深秋（满目枫叶）；适宜天气：清晨（寺庙是礼佛之地，宜早拜访，以示诚意），微雨（清雨后的寒山寺，更有禅意）；景色：鲜有寺庙是红色的外墙，更别说满墙壁不同字体的《枫桥夜泊》碑刻，长廊上挂了很多菩提之类的禅语，适合静静感受半天。,https://gs.ctrip.com/html5/you/comment/detail/3765/11/87522573.html,https://dimg04.c-ctrip.com/images/fd/headphoto/g4/M01/BD/EA/CggYHlYOpDOAX57wAAMTu85eDWE232_C_180_180.jpg,到处浪,5分,2016/9/15
没看到月落乌啼霜满天的寒山寺感觉一般般,https://gs.ctrip.com/html5/you/comment/detail/3765/11/164682288.html,https://dimg04.c-ctrip.com/images/Z80h180000013xc9e3F64_C_180_180.jpg,dsc****ang,3分,2020/10/7
寒山寺给我感觉最深的就是那悠扬的钟声。一首《枫桥夜泊》的千古绝唱造就了寒山寺的名气，令无数文人骚客慕名而来，给后人留下了无数佳句和墨宝，成了寒山寺的无尽财富,https://gs.ctrip.com/html5/you/comment/detail/3765/11/161374453.html,https://dimg04.c-ctrip.com/images/Z80p180000013uw9yF21F_C_180_180.jpg,201****278,5分,2019/10/5
寒山寺，苏州宗教之旅第二名！《风桥夜泊》千年古诗：姑苏城外寒山寺，夜半钟声到客船！家喻户晓，孩童时期就在吟吟学唱的古诗词，真是有名啊！今天终于看到了大钟！,https://gs.ctrip.com/html5/you/comment/detail/3765/11/158440291.html,https://dimg04.c-ctrip.com/images/Z80n1g000001h82fm75B1_C_180_180.jpg,别塔乐羊,5分,2019/4/17
没什么可看的，也就为那首诗打个卡,https://gs.ctrip.com/html5/you/comment/detail/3765/11/164541047.html,https://dimg04.c-ctrip.com/images/t1/headphoto/757/757/889/3b86691007a54fe684f07e198432d09b_C_180_180.jpg,M31****3864,3分,2020/9/26
很不错的地方,https://gs.ctrip.com/html5/you/comment/detail/3765/11/164261797.html,https://dimg04.c-ctrip.com/images/t1/headphoto/882/320/089/158cae5ddb6143c0b6ae18523614cf08_C_180_180.jpg,InNow,5分,2020/8/27
还不错哦 名寺,https://gs.ctrip.com/html5/you/comment/detail/3765/11/163725472.html,https://dimg04.c-ctrip.com/images/Z8010c0000006p0kyEE4F_C_180_180.jpg,gdqin2020,5分,2020/6/27
景色一般，性价比低，可玩性低，,https://gs.ctrip.com/html5/you/comment/detail/3765/11/164719686.html,https://dimg04.c-ctrip.com/images/Z8041c000001cdn1g58AA_C_180_180.jpg,_WeCh****731098,3分,2020/10/9
枫桥夜泊。,https://gs.ctrip.com/html5/you/comment/detail/3765/11/164357508.html,https://dimg04.c-ctrip.com/images/zc0l170000011e3741A91_C_180_180.jpg,M10****332,5分,2020/9/6
小巧而精致,https://gs.ctrip.com/html5/you/comment/detail/3765/11/163264133.html,https://dimg04.c-ctrip.com/images/Z80p180000013uw9yF21F_C_180_180.jpg,M86****84,5分,2020/4/18
有空车位居然不让停体验不佳，,https://gs.ctrip.com/html5/you/comment/detail/3765/11/164616685.html,https://dimg04.c-ctrip.com/images/Z80o180000013ulo9C34A_C_180_180.jpg,M43****4896,3分,2020/10/3
人太多了，没有一点古刹的感觉,https://gs.ctrip.com/html5/you/comment/detail/3765/11/164554005.html,https://dimg04.c-ctrip.com/images/t1/headphoto/982/089/752/f8c7b21182c94524ac4df328fdc7b3dc_C_180_180.jpg,M25****6274,3分,2020/9/28
一首枫桥夜泊，流传千年，让我们记住了寒山寺。枫桥还在，寒山寺历经多次重建，穿过历史的时空，我仿佛依然?可以听到夜半钟声到客船。,https://gs.ctrip.com/html5/you/comment/detail/3765/11/163649767.html,https://dimg04.c-ctrip.com/images/Z80o170000011h4amC1E0_C_180_180.jpg,叮咚598,5分,2020/6/14
苏州的千年古刹，姑苏城外寒山寺，夜半钟声到客船的诗文让寒山寺闻名天下，来到寒山寺，看到了了古寺庙，古佛塔，还有古钟等！不枉此行！,https://gs.ctrip.com/html5/you/comment/detail/3765/11/160251566.html,https://dimg04.c-ctrip.com/images/Z8020k000000c0c4w8944_C_180_180.jpg,轻快的行走脚步,5分,2019/8/11
人太多，地方太小，门票太贵,https://gs.ctrip.com/html5/you/comment/detail/3765/11/164682579.html,https://dimg04.c-ctrip.com/images/t1/headphoto/982/089/752/f8c7b21182c94524ac4df328fdc7b3dc_C_180_180.jpg,M32****992,3分,2020/10/7
门票也就5块钱不能奢求太多,https://gs.ctrip.com/html5/you/comment/detail/3765/11/164655185.html,https://dimg04.c-ctrip.com/images/t1/headphoto/982/089/752/f8c7b21182c94524ac4df328fdc7b3dc_C_180_180.jpg,M27****5078,3分,2020/10/5
"姑苏城外寒山寺 夜半钟声到客船
现在寒山寺已经不在姑苏城外了，在姑苏区内了
周围也不再冷冷清清了，可以说是风景独好啊
去时也是清场时，门口望了望，感受下吧",https://gs.ctrip.com/html5/you/comment/detail/3765/11/160209569.html,https://dimg04.c-ctrip.com/images/Z80h180000013xc9e3F64_C_180_180.jpg,203****096,5分,2019/8/9
今天下午去的寒山寺，可能是因为淡季的原因，人不是很多。落日余晖下的寒山寺还是很美的！现在可以提前一天在网上订好票，直接刷身份证进去，还是很方便的。,https://gs.ctrip.com/html5/you/comment/detail/3765/11/159190996.html,https://dimg04.c-ctrip.com/images/Z80p180000013uw9yF21F_C_180_180.jpg,_zfb20****5936574,5分,2019/6/6
"月落乌啼霜满天，江枫渔火对愁眠！
姑苏城外寒山寺，夜半钟声到客船。
一首诗成就了张继的千年名声！到现在读来还能感觉出他当时的落寞！",https://gs.ctrip.com/html5/you/comment/detail/3765/11/158439512.html,https://dimg04.c-ctrip.com/images/Z80c0s000000hyv0tD4CD_C_180_180.jpg,K-COCK,5分,2019/4/17
千年古刹，进去就是香火环绕，人声鼎沸！只有在默默的转角伫立一会，才能从心底里感受得到关于这个古刹的祥和！古刹的占地面积不大，但是我们走了两个小时！,https://gs.ctrip.com/html5/you/comment/detail/3765/11/158357514.html,https://dimg04.c-ctrip.com/images/Z80l0y000000ls7yg134D_C_180_180.jpg,温上亿小哥,5分,2019/4/10
还行吧 就看了那首诗才去的,https://gs.ctrip.com/html5/you/comment/detail/3765/11/165017358.html,https://dimg04.c-ctrip.com/images/Z804180000013uqy3DB02_C_180_180.jpg,M42****3747,3分,2020/11/8
不是专门拜佛的话没必要去,https://gs.ctrip.com/html5/you/comment/detail/3765/11/164932039.html,https://dimg04.c-ctrip.com/images/t1/headphoto/757/757/889/3b86691007a54fe684f07e198432d09b_C_180_180.jpg,活呢鹿鹿,3分,2020/10/30
除了名气，没什么可观看的,https://gs.ctrip.com/html5/you/comment/detail/3765/11/164704116.html,https://dimg04.c-ctrip.com/images/fd/headphoto/g2/M0B/06/EC/CghzgFWGyqaAKPyZAAAemf5AfPQ068_C_180_180.jpg,ziyouzizai,3分,2020/10/8
对于信佛之人还是挺不错的,https://gs.ctrip.com/html5/you/comment/detail/3765/11/164611074.html,https://dimg04.c-ctrip.com/images/Z80p180000013uw9yF21F_C_180_180.jpg,M27****745,3分,2020/10/3
苏州就是人超多，寒山寺作为知名景点，人当然也很多。寺庙翻修了不少地方，玩的时候注意安全。人太多了，拍照不方便，其他都还好的。,https://gs.ctrip.com/html5/you/comment/detail/3765/11/164078139.html,https://dimg04.c-ctrip.com/images/0Z8011200082xtby2B16F_C_180_180.jpg,Samantha Wang,5分,2020/8/11
枫桥夜泊，姑苏古寺。寒山寺并没有山，这是我去了才知道，还是很有感觉，毕竟从小就知道的地方，去了还是感受不同，其实景点不大，可以花5块钱去撞钟。,https://gs.ctrip.com/html5/you/comment/detail/3765/11/161728442.html,https://dimg04.c-ctrip.com/images/0Z82p12000812j4p7B80A_C_180_180.jpg,一树渡己不渡人,5分,2019/10/27
寒山寺，因《枫桥夜泊》这首诗而来，寺里不算很大，刚刚好拜下佛，逛一逛一小时刚好，还有在寺里抄下经书和去钟楼撞下钟也很不好。,https://gs.ctrip.com/html5/you/comment/detail/3765/11/158791388.html,https://dimg04.c-ctrip.com/images/Z80s0r000000he0va1FC3_C_180_180.jpg,博打博习,5分,2019/5/13
苏州必去景点，20元的门票含有大钟苑，按照现在的门票市场价格，物有取值。推荐寒山寺里面的素食馆，里面的素面和素食都不错的。,https://gs.ctrip.com/html5/you/comment/detail/3765/11/158192819.html,https://dimg04.c-ctrip.com/images/Z80l0x000000la0g6D400_C_180_180.jpg,美梦如画,5分,2019/3/25
景色一般，可玩性低，,https://gs.ctrip.com/html5/you/comment/detail/3765/11/165028051.html,https://dimg04.c-ctrip.com/images/t1/headphoto/903/173/918/eb4b7bea9720440dac09eab89328ab00_C_180_180.jpg,M43****297,3分,2020/11/9
有趣好玩，景色不错，体验很好，值得推荐，,https://gs.ctrip.com/html5/you/comment/detail/3765/11/164191457.html,https://dimg04.c-ctrip.com/images/t1/headphoto/463/352/613/9d877effaa3d4bd0b951bb4c60209b3b_C_180_180.jpg,M16****410,5分,2020/8/21
因为张继的《枫桥夜泊》为人熟知，进去景区之后自然要去看大钟了，不过现在的这口钟的现代打造的，并非古迹，有一块大碑介绍了铸造这口钟的事迹，有兴趣可以去看看。进去寺庙后就有吃素斋的地方，我进去点了一碗罗汉面，味道还行。寺庙内人不多，很幽静，能静下心来逛逛看看还是很好的，庙内有座钟楼，不大，可能这口是原来留下来的所以进去要另外买票，上去之后可以敲钟三下（我没进去，别人进去了，我听了个响）。,https://gs.ctrip.com/html5/you/comment/detail/3765/11/164074942.html,https://dimg04.c-ctrip.com/images/Z80p180000013uw9yF21F_C_180_180.jpg,LMA7,4分,2020/8/10
对于旅行，从来都记忆模糊。记不得都去了哪些地方，看了哪些风景，遇到哪些人。尽管同学说，去旅行不在于记忆，而在于当时的那份心情。可是旅行的彼时那刻我的心情一直是好的吗？一直有记日记的习惯，可是，旅行回来，都懒得写日记来记录，可见内心底对旅行是多么的淡漠。,https://gs.ctrip.com/html5/you/comment/detail/3765/11/163132334.html,https://dimg04.c-ctrip.com/images/t1/headphoto/295/828/780/6e6c2151ed65497c850945d5d2b702ae_C_180_180.jpg,猫拉夫斯基呀,5分,2020/3/29
其实就是个中规中矩的寺庙，只因一首诗成就了一座寺。今天是新年第一天，来上香的人很多。名声在外，来苏州必看的景点。寺外的免费景区也很值得一游。,https://gs.ctrip.com/html5/you/comment/detail/3765/11/162505215.html,https://dimg04.c-ctrip.com/images/headphoto/472/888/213/6948d48b555e4bf190e7e54d5d705b61_C_180_180.jpg,彪悠,5分,2020/1/1
寒山寺始建于公元502年的梁天监年间。到了二百年后的唐代，相传唐时僧人寒山曾在该寺居住，故改名为“寒山寺”。这座寺庙，历经数代，屡建屡毁于火，现在的建筑是清末重建的。自从唐代诗人张继题了《枫桥夜泊》一诗后，该寺便闻名了。,https://gs.ctrip.com/html5/you/comment/detail/3765/11/162166218.html,https://dimg04.c-ctrip.com/images/Z80p180000013uw9yF21F_C_180_180.jpg,203****072,4分,2019/12/1
景色宜人，布局合理，如果人少点真是个静修的好地方，真想在这个地方出家，可是红尘俗却是不能扔一边，真的很喜欢这样的好地方！,https://gs.ctrip.com/html5/you/comment/detail/3765/11/159630030.html,https://dimg04.c-ctrip.com/images/t1/headphoto/491/056/464/eb3c7472323e4c3598f58ffa8a6fce99_C_180_180.jpg,M20****732,5分,2019/7/7
慕名而来，苏州名寺,https://gs.ctrip.com/html5/you/comment/detail/3765/11/165148610.html,https://dimg04.c-ctrip.com/images/0Z84z120008aasgpw2AC0_C_180_180.jpg,realxmu,3分,2020/11/24
不拜佛的话不用去了,https://gs.ctrip.com/html5/you/comment/detail/3765/11/164653858.html,https://dimg04.c-ctrip.com/images/t1/headphoto/463/352/613/9d877effaa3d4bd0b951bb4c60209b3b_C_180_180.jpg,_WeCh****669549,3分,2020/10/5
非常失望没有历史感,https://gs.ctrip.com/html5/you/comment/detail/3765/11/164626599.html,https://dimg04.c-ctrip.com/images/Z80s0d0000006qr9qB29C_C_180_180.jpg,purenjie,3分,2020/10/4
非常好，是个不错的打卡胜地。景点的景色不错，人流量也还好。,https://gs.ctrip.com/html5/you/comment/detail/3765/11/164172464.html,https://dimg04.c-ctrip.com/images/Z8071f000001gkctn0EF6_C_180_180.jpg,Lucifinil forever,5分,2020/8/19
在寒山寺有一钟楼，休闲可以去的，里面人不算多，可以在里面呼吸新鲜空气，锻炼身体，是一处休闲娱乐的好地方，适合老人值得推荐，年轻人来游玩的。国庆期间人应该会很多，建议错峰出来，以免拥堵影响游玩的心情。,https://gs.ctrip.com/html5/you/comment/detail/3765/11/163808831.html,https://dimg04.c-ctrip.com/images/Z80l0h0000008xmn19767_C_180_180.jpg,到处玩的小胖子,5分,2020/7/11
体验感一般 人太多,https://gs.ctrip.com/html5/you/comment/detail/3765/11/164768856.html,https://dimg04.c-ctrip.com/images/t1/headphoto/757/757/889/3b86691007a54fe684f07e198432d09b_C_180_180.jpg,M17****236,3分,2020/10/13
淡季好些，慢点看,https://gs.ctrip.com/html5/you/comment/detail/3765/11/164661282.html,https://dimg04.c-ctrip.com/images/t1/headphoto/882/320/089/158cae5ddb6143c0b6ae18523614cf08_C_180_180.jpg,M35****7881,3分,2020/10/6
苏州寒山寺值得推荐，祈福平安，旁边就是枫桥风景区，景色不错，下着雨体验很好，,https://gs.ctrip.com/html5/you/comment/detail/3765/11/163700125.html,https://dimg04.c-ctrip.com/images/Z80h180000013xc9e3F64_C_180_180.jpg,M00****06,5分,2020/6/22
属于禅宗寺院，我国的十大名寺之一，留有许多珍贵的古迹，这里有“天下第一佛钟”的仿唐式古铜钟，重量达到108吨，新年撞钟祈福一直流传至今。,https://gs.ctrip.com/html5/you/comment/detail/3765/11/162946781.html,https://dimg04.c-ctrip.com/images/Z80s11000000qj6wiE602_C_180_180.jpg,姜如意,5分,2020/3/4
随着一首枫桥夜泊而使寒山寺名声大噪，寺院具有悠久的历史，坐落在苏州枫桥附近，四周的环境幽静雅致，古老的运河及岸上人家正是苏州城市的写照。,https://gs.ctrip.com/html5/you/comment/detail/3765/11/162888674.html,https://dimg04.c-ctrip.com/images/Z80s11000000qj6wiE602_C_180_180.jpg,姜如意,5分,2020/2/23
商业化没意思,https://gs.ctrip.com/html5/you/comment/detail/3765/11/164973945.html,https://dimg04.c-ctrip.com/images/Z80p180000013uw9yF21F_C_180_180.jpg,M44****669,3分,2020/11/3
就是古诗考古,https://gs.ctrip.com/html5/you/comment/detail/3765/11/164867990.html,https://dimg04.c-ctrip.com/images/Z80p180000013uw9yF21F_C_180_180.jpg,D84****53,3分,2020/10/23
寒山寺的塔不能上去，里面转了一圈，有个小花园，游客挺多的。景色不错，有很多佛，烧香的人也多。去的那天天气太热了。,https://gs.ctrip.com/html5/you/comment/detail/3765/11/164380466.html,https://dimg04.c-ctrip.com/images/headphoto/270/889/775/f8166bf380a049249a206d5a071ac55e_C_180_180.jpg,爱旅游的小鹿子,5分,2020/9/9
月落乌啼霜满天，江枫渔火对愁眠。姑苏城外寒山寺，夜半钟声到客船。唐代诗人张继的《枫桥夜泊》是世人再熟悉不过一首七言绝句，江南千年古刹~寒山寺，也因此诗而声名远扬，现今也成为苏州旅游的必到之处。,https://gs.ctrip.com/html5/you/comment/detail/3765/11/163264564.html,https://dimg04.c-ctrip.com/images/0Z801120008gv5ci3EF67_C_180_180.jpg,君颜异梦,5分,2020/4/18
