标题,标题链接,头像,user-detail__name,totalStarIcon1,resource_date
购票方便入园，也很快，网上的评论也可以借鉴，所以很是值得购买。购票方便入园，也很快，网上的评论也可以借鉴，所以很是值得购买。,https://gs.ctrip.com/html5/you/comment/detail/3765/11/162551541.html,https://dimg04.c-ctrip.com/images/t1/headphoto/368/208/681/c029fc4008f64a81bb51fa4983991ef9_C_180_180.jpg,通辽孔子,5分,2020/1/6
每当我读到：月落乌啼霜满天，江枫渔火对愁眠。姑苏城外寒山寺，夜半钟声到客船。我都会想到这里，一直想去这次终于得偿所愿。真棒！,https://gs.ctrip.com/html5/you/comment/detail/3765/11/161911665.html,https://dimg04.c-ctrip.com/images/Z80d0m000000deesiDE73_C_180_180.jpg,梦醉梦碎梦醒,5分,2019/11/9
基本上都是为了那首诗来的。记得当时在苏州用导游证唯一进去的景点就是寒山寺了。门票不贵，20元，但是进去敲打大钟还要10块钱。,https://gs.ctrip.com/html5/you/comment/detail/3765/11/160035380.html,https://dimg04.c-ctrip.com/images/Z80v0b0000005oflx4C3F_C_180_180.jpg,AURURA木木,4分,2019/7/31
值得一去的景点，门票价格便宜，人文气氛浓厚。,https://gs.ctrip.com/html5/you/comment/detail/3765/11/159740309.html,https://dimg04.c-ctrip.com/images/Z80p180000013uw9yF21F_C_180_180.jpg,罗_伊,5分,2019/7/14
不错挺好的，物有所值，来苏州都应该过来看看。,https://gs.ctrip.com/html5/you/comment/detail/3765/11/158910698.html,https://dimg04.c-ctrip.com/images/Z80p180000013uw9yF21F_C_180_180.jpg,_WeCh****29373,5分,2019/5/22
可玩性低，性价比低，体验不佳，景色一般，寺庙还收门票，第一次见,https://gs.ctrip.com/html5/you/comment/detail/3765/11/164245661.html,https://dimg04.c-ctrip.com/images/0Z83n1200084dmvkq54C2_C_180_180.jpg,ELLA_LH7,3分,2020/8/26
门票真便宜，这么大一个景区只20元，妹妹还背会了枫桥夜泊哈哈哈,https://gs.ctrip.com/html5/you/comment/detail/3765/11/163928793.html,https://dimg04.c-ctrip.com/images/t1/headphoto/293/406/308/22631089f44a497495c005fce85f6a6f_C_180_180.jpg,_WeCh****335562,5分,2020/7/26
历史悠久，古诗名人的数百幅书法碑文很撼动！,https://gs.ctrip.com/html5/you/comment/detail/3765/11/161449229.html,https://dimg04.c-ctrip.com/images/t1/headphoto/295/828/780/6e6c2151ed65497c850945d5d2b702ae_C_180_180.jpg,M23****8108,5分,2019/10/8
出门右转做好运1路可到各个景点，门票3元，很方便，就是30分钟一班车，间隔时间长。,https://gs.ctrip.com/html5/you/comment/detail/3765/11/160237678.html,https://dimg04.c-ctrip.com/images/Z80h180000013xc9e3F64_C_180_180.jpg,m10****197,5分,2019/8/11
抱着从小在课本上学到的诗句来到寒山寺，真是失望。处处收费，进门收费，请香请蜡烛，50元30元，敲钟3下5元，每一个大殿里都坐着人，招呼进殿的人捐功德，厚厚的本子摊在那里。佛塔不让上，所有的佛像没有说明，怪不得进门时候工作人员一直在劝，让租个讲解器。最可笑的是，后殿鱼池，养着快住不下的鱼，号称摸鱼交好运，喂鱼10元。最后说素斋，这个餐厅是外边人承包的，食材，点心，月饼都是批发来的，不是自己制作的，价格挺贵的。大家看图吧。反正挺失望的。体验不佳，性价比低，,https://gs.ctrip.com/html5/you/comment/detail/3765/11/164493267.html,https://dimg04.c-ctrip.com/images/Z80h180000013xc9e3F64_C_180_180.jpg,晴天083,2分,2020/9/21
不错，姑苏城外寒山寺，香火很旺，人不少，有很多锦鲤值得推荐，,https://gs.ctrip.com/html5/you/comment/detail/3765/11/164299541.html,https://dimg04.c-ctrip.com/images/t1/headphoto/857/872/237/edc9e981b00e436a8dcee595001d62fa_C_180_180.jpg,M25****5199,5分,2020/8/31
"因为一首诗恋上一座城。参与苏州的人才引进，顺便去看看寒山寺，满足一个心愿。
景色不错，只是天气太热。去撞了祈愿钟，愿一切安好，愿一切随心如意！",https://gs.ctrip.com/html5/you/comment/detail/3765/11/163988302.html,https://dimg04.c-ctrip.com/images/Z80p180000013uw9yF21F_C_180_180.jpg,M15****168,4分,2020/8/2
景色不错，有趣好玩，,https://gs.ctrip.com/html5/you/comment/detail/3765/11/163775017.html,https://dimg04.c-ctrip.com/images/Z80h180000013xc9e3F64_C_180_180.jpg,_M13****7897,5分,2020/7/5
寒山寺不算大，位置有点远，当然人也很少，喜欢幽静的朋友可以去看看，毕竟有历史渊源,https://gs.ctrip.com/html5/you/comment/detail/3765/11/163206801.html,https://dimg04.c-ctrip.com/images/Z80h180000013xc9e3F64_C_180_180.jpg,wangms,4分,2020/4/10
寒山寺名气还是很大的，寺边就是京杭大运河，如果游玩苏州时间充足可以作为一个景点。,https://gs.ctrip.com/html5/you/comment/detail/3765/11/162557728.html,https://dimg04.c-ctrip.com/images/Z80p180000013uw9yF21F_C_180_180.jpg,206****805,5分,2020/1/7
寺里有很多人去，因为是寺庙，所以没拍照。这是我去过的比较小的寺庙，但是佛像的工艺水平还是可圈可点的。很多人去这里是为了那句“姑苏城外寒山寺，夜半钟声到客船”，听寺里的钟声，感受跨越两百多年，感受那个在渔船上因落第的文人的所思所感,https://gs.ctrip.com/html5/you/comment/detail/3765/11/162255854.html,https://dimg04.c-ctrip.com/images/t1/headphoto/646/318/109/a865fe5f5465407d8befd5dc487a8554_C_180_180.jpg,M28****7684,5分,2019/12/10
终于能一睹寒山寺的真容了，很兴奋！一路上脑子里全是张继那首著名的诗《枫桥夜泊》，但当真正走进寒山寺，在宏伟的建筑里，看着游人如织，在袅袅的香火中，却无法想象诗人当时的心情。据说诗人当时听到钟声的大钟已经丢失了，现在的钟是乾隆年间寒山寺重建时日本人捐造的，那么这后来的钟声与诗人当时听到的是否是同样的声音呢？,https://gs.ctrip.com/html5/you/comment/detail/3765/11/161667158.html,https://dimg04.c-ctrip.com/images/t1/headphoto/258/512/704/6bce7506eecc48f8a4a6d3177e0acf24_C_180_180.jpg,M26****365,5分,2019/10/22
感觉挺好的，和日本浅草寺建筑风格是一样的,https://gs.ctrip.com/html5/you/comment/detail/3765/11/161440334.html,https://dimg04.c-ctrip.com/images/t1/headphoto/272/077/772/76b262d0cc24492abc5c6784c903c2ab_C_180_180.jpg,措利科芬寇准,5分,2019/10/8
名刹，香火旺。但不要节假去，破坏了感觉。,https://gs.ctrip.com/html5/you/comment/detail/3765/11/161381488.html,https://dimg04.c-ctrip.com/images/Z80p180000013uw9yF21F_C_180_180.jpg,e09****61,5分,2019/10/6
趁着天好，赶早坐车到了寒山寺，竟然还是有很多游客，可见寒山寺的名气真不小。提前在携程上预订了门票，很顺利地扫码进入，四处兜兜转转，游客来自各地，香火很旺，虽然没找导游，但个人觉得还是很值得自己慢慢看的。之后，又去了大钟苑，可惜赶时间去其它景点，不然，还很想尝尝素斋面呢，下次再来吧。,https://gs.ctrip.com/html5/you/comment/detail/3765/11/161315674.html,https://dimg04.c-ctrip.com/images/Z80h180000013xc9e3F64_C_180_180.jpg,cathy,5分,2019/10/4
除了人多了点，都不错，有很多枫桥夜泊的诗,https://gs.ctrip.com/html5/you/comment/detail/3765/11/161311818.html,https://dimg04.c-ctrip.com/images/Z80h180000013xc9e3F64_C_180_180.jpg,之之1,5分,2019/10/4
苏州寒山名寺，还是值得一去的。曲径通幽处，听听水流声，整个人都感觉到放空舒服了。,https://gs.ctrip.com/html5/you/comment/detail/3765/11/160903942.html,https://dimg04.c-ctrip.com/images/t1/headphoto/903/173/918/eb4b7bea9720440dac09eab89328ab00_C_180_180.jpg,M29****5222,4分,2019/9/13
很棒，！！！！！！！！！！！！！！！！！！！！！！！！！！怎么这么棒，真好玩！！！！！！！！！！！！！！！！！！！很棒，！！！！！！！！！！！！！！！！！！！！！！！！！！怎么这么棒，真好玩！！！！！！！！！！！！！！！！！！！,https://gs.ctrip.com/html5/you/comment/detail/3765/11/160749980.html,https://dimg04.c-ctrip.com/images/t1/headphoto/424/398/503/0386f569fd0d4b488ff41b64bbc5743b_C_180_180.jpg,M31****797,5分,2019/9/3
"寒山寺位于苏州市姑苏区，始建于南朝萧梁代天监年间(公元502~519年)，初名""妙利普明塔院""。寒山寺占地面积约1.3万平方米，建筑面积三千四百余平方米。
寒山寺属于禅宗中的临济宗。唐代贞观年间，当时的名僧寒山、希迁两位高僧创建寒山寺。1000多年内寒山寺先后5次遭到火毁(一说是7次)，最后一次重建是清代光绪年间。历史上寒山寺曾是中国十大名寺之一，寺内古迹甚多，有张继诗的石刻碑文，寒山、拾得的石刻像，文徵明、唐寅所书碑文残片等。寒山寺自从唐代诗人张继题了《枫桥夜泊》一诗后，该寺便闻名了。寒山寺佛像雕塑别具一格，碑刻艺术天下闻名，碑廊陈列着历代名人岳飞、唐伯虎、董其昌、康有为等人的诗碑，其中当推晚清俞樾书张继诗碑最为著名。",https://gs.ctrip.com/html5/you/comment/detail/3765/11/160688704.html,https://dimg04.c-ctrip.com/images/fd/headphoto/g1/M0A/0A/9E/CghzfVVJOP6AR1h7AAAtE69q_0I205_C_180_180.jpg,cocojigyw,5分,2019/8/30
很多年前到过寒山寺，觉得印象一直都很好，这次去的感觉没有以前好，因为新造了很多建筑，里面的商业氛围呢，也比以前的重，所以没有了那种山寺的感觉了！总的面积不大，因为建筑物太多，显得比较拥挤，然后游客又很多，所以就会觉得很嘈杂。整个景区里面到处都是《枫桥夜泊》的诗，没有看到是这么夸张的。塔都没有开放，人员不可以登塔，我们玩了也就半小时左右。,https://gs.ctrip.com/html5/you/comment/detail/3765/11/160593766.html,https://dimg04.c-ctrip.com/images/fd/headphoto/g1/M02/C2/0F/CghzfFVoRcWAceYcAAELr-z3eZU966_C_180_180.jpg,千晖堂,3分,2019/8/25
跟了一个团，听导游解说，真的是很好的体验。比如“寒山寺”进门的三个字是谁写的？比如这个三字前尽量不要拍照，是类似照妖镜这样的作用，比如大雄宝殿4个字怎么解释？比如到寒山寺有学生的家庭应该跪拜谁？又比如为何要绕塔走一圈？,https://gs.ctrip.com/html5/you/comment/detail/3765/11/160520241.html,https://dimg04.c-ctrip.com/images/t1/headphoto/062/938/215/f5f05c77006946428867e3c0dae6f4eb_C_180_180.jpg,有态度的萝卜,5分,2019/8/21
"大家评论很多,我不赘述了,只是提醒一下：1.原来的素斋馆在进入寒山寺检票口后向左，现在因为在维修，所以迁到大钟苑里了，大钟苑现在好像不要门票。2.枫桥景区在维修，应该是要到2019年底会变成免费开放，所以现在完全进不去。",https://gs.ctrip.com/html5/you/comment/detail/3765/11/160477792.html,https://dimg04.c-ctrip.com/images/Z80q070000002se8yB02A_C_180_180.jpg,tzkw,5分,2019/8/19
热，太热了，热死了，真是热，热啊。寺庙都是重建的，部分地方还在施工，听说是历史上也是烧毁了很多次。香客很多，门口一边一个，两个大烛台，烛台上燃烧着一颗颗红蜡烛，油腻腻的烛油滴落在下方的水里，飘了一薄层油。庙里供奉的释迦摩尼佛，老公拉着我想拜拜，我想了想，也没啥求的，还是别耽误真正有需要人时间了，身边导游反复强调“信仰不同，信仰自由”。庙里多石碑书法，大多提的都是“月落乌啼……”带孩子来好好学习学习这首诗，身临其境的教育不错。庙里有卖首饰和请佛的店，里面凉快，有好闻的味道，呆了好久。那个钟也不响啊，走了好长一段砖路，就看到一个锁着大锁头的塔，底下做了一圈热的吐舌头的游客。最后照片是枫桥留念,https://gs.ctrip.com/html5/you/comment/detail/3765/11/159985798.html,https://dimg04.c-ctrip.com/images/Z80214000000vzwq72405_C_180_180.jpg,三河武士,4分,2019/7/29
佛教的寺庙，虽然烟雾缭绕，但是还是很不不错的的哦～～～～～～,https://gs.ctrip.com/html5/you/comment/detail/3765/11/159337816.html,https://dimg04.c-ctrip.com/images/t1/headphoto/057/777/943/0b93f8268d5546308915f4f9fcaa9483_C_180_180.jpg,M33****1384,5分,2019/6/17
很好很好很好很好很好很好很好很好很好很好很好很好很好很好很好很好很好很好很好很好很好很好很好很好很好很好很好很好很好很好很好很好很好很好很好很好很好很好很好很好很好很好很好很好很好很好很好很好很好很好很好很好很好很好很好很好很好很好很好很好很好很好很好,https://gs.ctrip.com/html5/you/comment/detail/3765/11/158847938.html,https://dimg04.c-ctrip.com/images/Z80b16000000z3o1g8F1D_C_180_180.jpg,旅行路上lxls,5分,2019/5/17
还不错，玩的很开心，爸爸妈妈都很高兴，拍照也是美美滴！以后还想去哦！还不错，玩的很开心，爸爸妈妈都很高兴，拍照也是美美滴！以后还想去哦！还不错，玩的很开心，爸爸妈妈都很高兴，拍照也是美美滴！以后还想去哦！,https://gs.ctrip.com/html5/you/comment/detail/3765/11/158790288.html,https://dimg04.c-ctrip.com/images/Z80p180000013uw9yF21F_C_180_180.jpg,meteorlau,5分,2019/5/13
不用预约，从观前街过去坐公交打车还算方便,https://gs.ctrip.com/html5/you/comment/detail/3765/11/158720305.html,https://dimg04.c-ctrip.com/images/fd/headphoto/g1/M01/D1/30/CghzfFTHFPWAULruAAAxwWVmD6c529_C_180_180.jpg,大连海客,5分,2019/5/7
不错不错不错不错不错不错不错不错不错不错不错不错不错不错不错不错不错不错不错不错不错不错不错不错不错不错不错不错不错不错不错不错不错不错不错不错不错不错不错不错不错不错不错不错不错不错不错不错不错不错不错,https://gs.ctrip.com/html5/you/comment/detail/3765/11/158596841.html,https://dimg04.c-ctrip.com/images/Z805090000003x7k44528_C_180_180.jpg,丫头飞飞飞,5分,2019/4/30
"特色1千年名寺。
特色2诗句“姑苏城外寒山寺”的出处，来此撞钟、祈福。
到苏州，如不到寒山寺，则不算苏州客。因为，寒山寺和苏州园林一样，都是姑苏的象征，苏州人的骄傲。寒山寺始建于公元502年的梁天监年间。到了二百年后的唐代，相传唐时僧人寒山曾在该寺居住，故改名为“寒山寺”。这座寺庙，历经数代，屡建屡毁于火，现在的建筑是清末重建的。自从唐代诗人张继题了《枫桥夜泊》一诗后，该寺便闻名了。",https://gs.ctrip.com/html5/you/comment/detail/3765/11/158593157.html,https://dimg04.c-ctrip.com/images/fd/headphoto/g2/M06/54/5D/Cghzf1S_g8SAYN3yAACrNvI3TjE706_C_180_180.jpg,木人青,5分,2019/4/30
古迹众多、古寺庄严，游览圣境、游心怡然！,https://gs.ctrip.com/html5/you/comment/detail/3765/11/158434616.html,https://dimg04.c-ctrip.com/images/Z80m12000000rvtou1F96_C_180_180.jpg,M31****0482,5分,2019/4/17
"春寻古寺幽，相与话前。
来苏州怎么能不来寒山寺？一句“姑苏城外寒山寺，夜半钟声到客船。”道尽了我对这座寺庙的向往与神驰。
寒山寺始建于南朝萧梁代天监年间，曾是中国历史上十大名寺之一。寺院里有众多碑文、古迹，非常值得学习、借鉴、赏析一番。古寺清幽、宜人，确是自省、修心、养性的好地方。",https://gs.ctrip.com/html5/you/comment/detail/3765/11/157956510.html,https://dimg04.c-ctrip.com/images/0Z84b120008c5hir7DCAE_C_180_180.jpg,灯火阑珊处的小薇,5分,2019/2/20
这里有两个景区分开买票：一个是寒山寺（20元）、一个是枫桥景区（25元）；在枫桥景区里可以看到运河里繁忙的航运；寒山寺的门票包括了钟苑，一口巨型大钟和巨大石碑值得一看。唯一不满意的是停车场管理不太好。,https://gs.ctrip.com/html5/you/comment/detail/3765/11/154342385.html,https://dimg04.c-ctrip.com/images/fd/headphoto/g1/M07/5E/E4/CghzflUoypiAUH17AAKmqXGBbl8419_C_180_180.jpg,我和你在天涯,5分,2018/4/10
门票很便宜，真的是物有所值，正常20，学生党的我们只要10圆哦，风景是真的不错，许多大佛，去那里玩的人也不少，各种年龄段都有，寒山寺的钟声真的让人会觉得心都得到了洗涤，让整个人都平静下来了，作为十大名寺，真的推荐寒山寺，物超所值,https://gs.ctrip.com/html5/you/comment/detail/3765/11/58848660.html,https://dimg04.c-ctrip.com/images/t1/headphoto/207/494/838/fa687736cf3f484480526cfc0eb6c073_C_180_180.jpg,M25****419,5分,2015/10/17
一般，一堆人在拜拜景色一般，可玩性低，,https://gs.ctrip.com/html5/you/comment/detail/3765/11/165758665.html,https://dimg04.c-ctrip.com/images/Z804180000013uqy3DB02_C_180_180.jpg,马夫达沙特吴王僚,2分,2021/2/16
环境非常好，最好找一个导游，要不不明白历史，价格不贵50米,https://gs.ctrip.com/html5/you/comment/detail/3765/11/164284629.html,https://dimg04.c-ctrip.com/images/Z80o180000013ulur1D76_C_180_180.jpg,M41****7424,5分,2020/8/29
"寒山寺三个字就有故事。寒山二字跟寺是两个人写的。粗看看不出来，细看才能分辨。
进寺时，下了小雨，更觉别具风格。约了一个导游，有讲解才能更好地游览。
寺院不是很大，40-60分钟就能游览完。
值得到的地方。",https://gs.ctrip.com/html5/you/comment/detail/3765/11/162522673.html,https://dimg04.c-ctrip.com/images/0Z82d120008a1he2d58BA_C_180_180.jpg,HYing9999,5分,2020/1/3
枫桥夜泊，一到寒山寺就想到这首诗，还有毛宁的歌都有唱到，很有古韵味的一座寺庙！,https://gs.ctrip.com/html5/you/comment/detail/3765/11/162255369.html,https://dimg04.c-ctrip.com/images/Z80b13000000uahf5EC26_C_180_180.jpg,_WeCh****623369,5分,2019/12/10
姑苏城外寒山寺，现在很热闹了！特别是钟楼很气派，值得一游！还有很多名人题诗，可以长不少知识，到苏州一定要去寒山寺游玩！,https://gs.ctrip.com/html5/you/comment/detail/3765/11/160750197.html,https://dimg04.c-ctrip.com/images/0Z85312000861q7qf5333_C_180_180.jpg,守候蓝天,5分,2019/9/3
比去景点购买门票省2元，三个人共计省了6元，并且凭二维码即可迅速入园，非常方便,https://gs.ctrip.com/html5/you/comment/detail/3765/11/158833128.html,https://dimg04.c-ctrip.com/images/t1/headphoto/882/320/089/158cae5ddb6143c0b6ae18523614cf08_C_180_180.jpg,M40****979,5分,2019/5/16
Dvjfvjjssjnfdhjs h mnhjhffgjnf,https://gs.ctrip.com/html5/you/comment/detail/3765/11/163939406.html,https://dimg04.c-ctrip.com/images/t1/headphoto/164/424/952/04eab99bd26f47acadef4fd3f95b9f37_C_180_180.jpg,哈哈哈哈哈哈哈吃菜,5分,2020/7/28
来还愿，并许下新的愿望，希望可以成真,https://gs.ctrip.com/html5/you/comment/detail/3765/11/163778884.html,https://dimg04.c-ctrip.com/images/t1/headphoto/207/494/838/fa687736cf3f484480526cfc0eb6c073_C_180_180.jpg,M40****827,5分,2020/7/6
很震撼，月落乌啼霜满天，带孩子太感受一下当年诗人张继的写试感受，不虚此行啊。,https://gs.ctrip.com/html5/you/comment/detail/3765/11/162697605.html,https://dimg04.c-ctrip.com/images/Z80715000000y6qw700D0_C_180_180.jpg,M22****3677,5分,2020/1/21
还不错，带小朋友去寻找古诗中的地方。,https://gs.ctrip.com/html5/you/comment/detail/3765/11/162620775.html,https://dimg04.c-ctrip.com/images/Z80p180000013uw9yF21F_C_180_180.jpg,M11****623,5分,2020/1/14
不大的寺院，兜兜转转，不累人。挺好的,https://gs.ctrip.com/html5/you/comment/detail/3765/11/158499473.html,https://dimg04.c-ctrip.com/images/fd/headphoto/g1/M07/F6/09/CghzfVTtOnaAREc7AACoPoIyqFM322_C_180_180.jpg,ffdx,5分,2019/4/22
寒山寺虽小，但是很有情节的寺庙。性价比很高。门票不贵。,https://gs.ctrip.com/html5/you/comment/detail/3765/11/164254847.html,https://dimg04.c-ctrip.com/images/Z80p180000013uw9yF21F_C_180_180.jpg,Yudao123,4分,2020/8/26
还是值得一看的,https://gs.ctrip.com/html5/you/comment/detail/3765/11/163999377.html,https://dimg04.c-ctrip.com/images/t1/headphoto/433/605/705/5f2dd05029e24b66ba27c28a2b4b7396_C_180_180.jpg,齐齐妈,5分,2020/8/3
还是很不错的，在寒山寺请一个适合自己的东西还是很不错的,https://gs.ctrip.com/html5/you/comment/detail/3765/11/163856489.html,https://dimg04.c-ctrip.com/images/Z80h180000013xc9e3F64_C_180_180.jpg,d41****61,5分,2020/7/18
很好很强大，到寺一刷身份证就成功入场了，虽然景区工作人员对网上买票的有点迷之bs，不过反正他的态度也无法影响我们入场呵呵。希望业务拓展一下能把优惠票也网售就好了，不用去到还要在售票处买优惠票啦。,https://gs.ctrip.com/html5/you/comment/detail/3765/11/162556115.html,https://dimg04.c-ctrip.com/images/Z80h180000013xc9e3F64_C_180_180.jpg,M19****531,5分,2020/1/7
整体寒山寺比较小，感觉最有名的是门口寒山寺的三个字，去的时候听说不算人多了，但是还是感觉很挤，整体没有什么佛教圣地的庄严肃穆，不推荐了，其实在门口看看就行了，一眼望到头了，进去到出来20分钟不到,https://gs.ctrip.com/html5/you/comment/detail/3765/11/160859121.html,https://dimg04.c-ctrip.com/images/t1/headphoto/982/089/752/f8c7b21182c94524ac4df328fdc7b3dc_C_180_180.jpg,_WeCh****896418,3分,2019/9/10
我最喜欢的苏州景点，每到苏州必去寒山寺，位于苏州市西郊，始建于南朝，已有一千四百余年历史，属于禅宗中的临济宗。因唐代诗人张继的名诗《枫桥夜泊》中“姑苏城外寒山寺、夜半钟声到客船”一句而闻名天下。,https://gs.ctrip.com/html5/you/comment/detail/3765/11/158797128.html,https://dimg04.c-ctrip.com/images/Z80psa18135k7pij45650_C_180_180.jpg,sangchung,5分,2019/5/13
价钱不高，旁边的枫桥夜泊还免费，还可趁导游景色不错，,https://gs.ctrip.com/html5/you/comment/detail/3765/11/164066633.html,https://dimg04.c-ctrip.com/images/Z80p180000013uw9yF21F_C_180_180.jpg,lyndy,5分,2020/8/10
姑苏城外寒山寺，夜半钟声到客船。,https://gs.ctrip.com/html5/you/comment/detail/3765/11/162567483.html,https://dimg04.c-ctrip.com/images/t1/headphoto/757/757/889/3b86691007a54fe684f07e198432d09b_C_180_180.jpg,M25****2675,5分,2020/1/8
从小就知道，姑苏城外寒山寺，夜半钟声到客船。奔着这个诗词讲寒山寺列为本次旅行必游之地，但毕竟时过境迁，物是人非，如今的寒山寺并没有什么特别之处！如果很有时间，可以去看看，如果行程紧凑，不推荐了,https://gs.ctrip.com/html5/you/comment/detail/3765/11/161908568.html,https://dimg04.c-ctrip.com/images/fd/headphoto/g3/M04/39/1B/CggYGVYebCmAGI9aAAAnFEuRZ_E832_C_180_180.jpg,_CFT****0923,4分,2019/11/9
风景优美，很好很好，值得去游玩。,https://gs.ctrip.com/html5/you/comment/detail/3765/11/161425123.html,https://dimg04.c-ctrip.com/images/t1/headphoto/463/352/613/9d877effaa3d4bd0b951bb4c60209b3b_C_180_180.jpg,李子谦李子谦,5分,2019/10/7
停车略远，有摆渡车，景区停车场很小。人不多时，应该很赞的寺庙。人多简直…,https://gs.ctrip.com/html5/you/comment/detail/3765/11/161384750.html,https://dimg04.c-ctrip.com/images/t1/headphoto/903/173/918/eb4b7bea9720440dac09eab89328ab00_C_180_180.jpg,M22****7843,5分,2019/10/6
在携程预约非常方便，快速，特别好,https://gs.ctrip.com/html5/you/comment/detail/3765/11/161370591.html,https://dimg04.c-ctrip.com/images/t1/headphoto/463/352/613/9d877effaa3d4bd0b951bb4c60209b3b_C_180_180.jpg,_WeCh****126407,5分,2019/10/5
很好的一次行程，非常精彩，点赞哦,https://gs.ctrip.com/html5/you/comment/detail/3765/11/160863657.html,https://dimg04.c-ctrip.com/images/t1/headphoto/699/910/854/683dab66bb374136af9930ea204dfc7e_C_180_180.jpg,M41****751,5分,2019/9/10
山不在高，有仙则名。水不在深，有龙则灵，寒山寺虽然不大，但是几乎全中国人民都知道，因为一首脍炙人口的《枫桥夜泊》，寒山寺可以和枫桥一起游览，景色很不错。,https://gs.ctrip.com/html5/you/comment/detail/3765/11/160677780.html,https://dimg04.c-ctrip.com/images/t1/headphoto/757/757/889/3b86691007a54fe684f07e198432d09b_C_180_180.jpg,wind3757,4分,2019/8/29
张继笔下的枫桥夜泊令寒山寺名扬天下，寺院范围不大，正在整修，相信整修之后会更好。出寺之后别忘了去旁边的钟楼看看。,https://gs.ctrip.com/html5/you/comment/detail/3765/11/160591329.html,https://dimg04.c-ctrip.com/images/t1/headphoto/882/320/089/158cae5ddb6143c0b6ae18523614cf08_C_180_180.jpg,冬日暖阳321,4分,2019/8/25
姑苏城外寒山寺，夜半歌声到客船。门票20不贵，不来寒山寺，算不上来苏州。,https://gs.ctrip.com/html5/you/comment/detail/3765/11/160476283.html,https://dimg04.c-ctrip.com/images/t1/headphoto/062/938/215/f5f05c77006946428867e3c0dae6f4eb_C_180_180.jpg,_CFT01****3927325,4分,2019/8/19
寒山寺不大，最好请个导游讲解一下会比较好，里面有好多典故，不听讲解真的不知道呢。周边在施工，可能今后景区会扩大。,https://gs.ctrip.com/html5/you/comment/detail/3765/11/159882258.html,https://dimg04.c-ctrip.com/images/Z80h180000013xc9e3F64_C_180_180.jpg,jan****20,5分,2019/7/23
