标题,标题链接,头像,user-detail__name,totalStarIcon1,resource_date
鼋头渚有太湖第一胜景、世界三大赏樱胜地之誉，这里是太湖绝佳处，包孕了吴越最美的太湖水。每当春暖花开的季节，长春桥二边的樱花林一派花瓣雨纷纷飘入湖中的美景，江南仙岛之称名至实归。必须打卡的仙境！,https://gs.ctrip.com/html5/you/comment/detail/1775/11/163124233.html,https://dimg04.c-ctrip.com/images/Z80i180000013ma351E21_C_180_180.jpg,徐宝宝无问东西漫行,5分,2020-03-28
樱花季值得去看看。。。。。。。,https://gs.ctrip.com/html5/you/comment/detail/1775/11/165208456.html,https://dimg04.c-ctrip.com/images/Z80h180000013xc9e3F64_C_180_180.jpg,安县岳云,5分,2020-12-01
很美的一个地方，一年四季都很赞,https://gs.ctrip.com/html5/you/comment/detail/1775/11/165077652.html,https://dimg04.c-ctrip.com/images/Z80h180000013xc9e3F64_C_180_180.jpg,88****057,5分,2020-11-15
除了春天 秋天的鼋头渚也不错 寂静,https://gs.ctrip.com/html5/you/comment/detail/1775/11/164954354.html,https://dimg04.c-ctrip.com/images/Z80p180000013uw9yF21F_C_180_180.jpg,gokinto,5分,2020-11-01
非常不错的地方，还会再来光顾的,https://gs.ctrip.com/html5/you/comment/detail/1775/11/164939372.html,https://dimg04.c-ctrip.com/images/Z80p0s000000hqbylC4D3_C_180_180.jpg,刘倩文LQW,5分,2020-10-30
喜欢这里，环境好好，好美的地方,https://gs.ctrip.com/html5/you/comment/detail/1775/11/164699564.html,https://dimg04.c-ctrip.com/images/t1/headphoto/424/398/503/0386f569fd0d4b488ff41b64bbc5743b_C_180_180.jpg,thy月,5分,2020-10-08
风景秀丽！好似一幅美丽的画卷！,https://gs.ctrip.com/html5/you/comment/detail/1775/11/164579779.html,https://dimg04.c-ctrip.com/images/Z80p11000000qxjq09C66_C_180_180.jpg,diy****hi,5分,2020-10-01
景色很美啊，喜欢这里，喜欢无锡,https://gs.ctrip.com/html5/you/comment/detail/1775/11/164559503.html,https://dimg04.c-ctrip.com/images/t1/headphoto/424/398/503/0386f569fd0d4b488ff41b64bbc5743b_C_180_180.jpg,thy月,5分,2020-09-28
地方很大，风景很美，空气清新，,https://gs.ctrip.com/html5/you/comment/detail/1775/11/164506921.html,https://dimg04.c-ctrip.com/images/Z80r14000000vmek5010F_C_180_180.jpg,M17****018,5分,2020-09-22
经典景区，值得一游。但商业气息太浓，私家车停车场距景区实在太远，大约有三公里，这一段没有任何可以观赏的景色，逼着游客乘坐景区车辆（可能30元）才能到真正景区门口，再排队乘船，很不人性化。,https://gs.ctrip.com/html5/you/comment/detail/1775/11/165257339.html,https://dimg04.c-ctrip.com/images/Z80p180000013uw9yF21F_C_180_180.jpg,300****025,4分,2020-12-07
十几年前的景点，还是那么美,https://gs.ctrip.com/html5/you/comment/detail/1775/11/164859838.html,https://dimg04.c-ctrip.com/images/Z80h180000013xc9e3F64_C_180_180.jpg,mickey8268059,5分,2020-10-22
这个地方还是值得一游的，景色很美。我们去的时候下着雨，但似乎人们的兴致一点儿也没减少。景色不错，值得推荐，,https://gs.ctrip.com/html5/you/comment/detail/1775/11/164675545.html,https://dimg04.c-ctrip.com/images/t1/headphoto/982/089/752/f8c7b21182c94524ac4df328fdc7b3dc_C_180_180.jpg,M33****399,5分,2020-10-06
出票很快，直接刷身份证进入,https://gs.ctrip.com/html5/you/comment/detail/1775/11/164576948.html,https://dimg04.c-ctrip.com/images/Z80h180000013xc9e3F64_C_180_180.jpg,M07****66,5分,2020-09-30
疫情期间去的，人不多，是个值得旅游者游览的景点，景色优美，推荐！,https://gs.ctrip.com/html5/you/comment/detail/1775/11/165408651.html,https://dimg04.c-ctrip.com/images/t1/headphoto/295/828/780/6e6c2151ed65497c850945d5d2b702ae_C_180_180.jpg,M31****7385,4分,2020-12-28
有趣好玩，景色不错，,https://gs.ctrip.com/html5/you/comment/detail/1775/11/165386523.html,https://dimg04.c-ctrip.com/images/t1/headphoto/272/077/772/76b262d0cc24492abc5c6784c903c2ab_C_180_180.jpg,太阳系之主,4分,2020-12-25
有趣好玩，体验很好，,https://gs.ctrip.com/html5/you/comment/detail/1775/11/164820561.html,https://dimg04.c-ctrip.com/images/Z80h180000013xc9e3F64_C_180_180.jpg,_wf****5600,5分,2020-10-18
"鼋头渚风景区始建于1916年，面积达500公顷。是无锡境内横卧太湖西北岸的一个半岛，因巨石突入湖中形状酷似神龟昂首而得名。
鼋头渚风光，山清水秀、胜景天然，为太湖风景精粹所在，故有：“太湖第一名胜”之称。当代大诗人郭沫若的“太湖佳绝处，毕竟在鼋头”的诗句赞誉，更使鼋头渚风韵流扬境内海外。是驰名中外的旅游、度假、休闲胜地，现晋升为国家5A级风景区。",https://gs.ctrip.com/html5/you/comment/detail/1775/11/164354213.html,https://dimg04.c-ctrip.com/images/Z80s1f000001gnt3tC818_C_180_180.jpg,婉儿婉儿,5分,2020-09-06
总体可以，值得一游,https://gs.ctrip.com/html5/you/comment/detail/1775/11/165168393.html,https://dimg04.c-ctrip.com/images/t1/headphoto/903/173/918/eb4b7bea9720440dac09eab89328ab00_C_180_180.jpg,_WeCh****294491,4分,2020-11-26
"值得推荐，体验很好，景色不错，有趣好玩，
和西湖景色差不多",https://gs.ctrip.com/html5/you/comment/detail/1775/11/164653018.html,https://dimg04.c-ctrip.com/images/Z80w1f000001g2x52B3B7_C_180_180.jpg,_WeCh****27502,5分,2020-10-05
去的有些晚，玩的比较赶，总体还不错，如果春天去会更漂亮！,https://gs.ctrip.com/html5/you/comment/detail/1775/11/164579622.html,https://dimg04.c-ctrip.com/images/Z80q0k000000bivh2E64A_C_180_180.jpg,_WeCh****435295,4分,2020-10-01
鼋头渚无锡太湖的著名景点，从市里有公交车挺方便的就是路程远大约需要一个小时左右，我们是冬天去的，当天有雾，没有看见太湖的全貌，有点小遗憾，座船的时候有好多海欧挣食打架好不热闹,https://gs.ctrip.com/html5/you/comment/detail/1775/11/155014834.html,https://dimg04.c-ctrip.com/images/t1/headphoto/463/352/613/9d877effaa3d4bd0b951bb4c60209b3b_C_180_180.jpg,M35****207,5分,2018-05-26
很方便，直接刷身份证可以进景区。虽然不是旺季，登高望远还是不错的，景区范围好大，建议电瓶车。,https://gs.ctrip.com/html5/you/comment/detail/1775/11/164899953.html,https://dimg04.c-ctrip.com/images/Z80h180000013xc9e3F64_C_180_180.jpg,sonnyka,5分,2020-10-26
性价比高，,https://gs.ctrip.com/html5/you/comment/detail/1775/11/165253710.html,https://dimg04.c-ctrip.com/images/Z80911000000rell8794F_C_180_180.jpg,M25****0321,5分,2020-12-07
景色不错，,https://gs.ctrip.com/html5/you/comment/detail/1775/11/164776241.html,https://dimg04.c-ctrip.com/images/Z80p180000013uw9yF21F_C_180_180.jpg,印杜鲁瓦荀彧,5分,2020-10-14
景色一般。有点坑的是坐游船去那个仙岛，没什么看点。如果有老人和学生的话，不建议在携程上买票，携程上的票没有老人优惠和学生优惠票卖。,https://gs.ctrip.com/html5/you/comment/detail/1775/11/164726868.html,https://dimg04.c-ctrip.com/images/Z80o180000013ulur1D76_C_180_180.jpg,资州浪人,4分,2020-10-09
"无锡最著名的景点了 不过我们是九月底去的 景色肯定没有春天樱花盛开的时候美
建议买观光车的票 公园里很大 自己走会特别累 观光车一共有几站 其中一站直接到山上看风景 不用自己走会轻松很多",https://gs.ctrip.com/html5/you/comment/detail/1775/11/164576897.html,https://dimg04.c-ctrip.com/images/t1/headphoto/724/518/802/e201a429d7a54f72ade0df32a3d59b2f_C_180_180.jpg,D22****190,4分,2020-09-30
上午先去太湖仙岛，要尽量早点，值得一去，风景很好，文化氛围浓厚。下午再去樱花谷，很美。,https://gs.ctrip.com/html5/you/comment/detail/1775/11/164595805.html,https://dimg04.c-ctrip.com/images/t1/headphoto/397/132/243/542067aa29904ae9aca7e88f43eaeb6f_C_180_180.jpg,木浮仙水001,5分,2020-10-02
下午三点多才进景点，直接坐电瓶车到码头，挺冷的，坐船上仙人岛，岛上好多猫咪，我只逛了一部分，竟然有老子雕像，还有卧佛，挺乱的，沿湖拍照有种海边感觉，休闲游，还不错吧,https://gs.ctrip.com/html5/you/comment/detail/1775/11/164884529.html,https://dimg04.c-ctrip.com/images/Z80h180000013xc9e3F64_C_180_180.jpg,星际宝宝,4分,2020-10-25
能欣赏到太湖，真是太棒了，景色也不错，岛上很清凉，风景也好。让孩子跑跑真是不错的体验,https://gs.ctrip.com/html5/you/comment/detail/1775/11/164748146.html,https://dimg04.c-ctrip.com/images/Z80h180000013xc9e3F64_C_180_180.jpg,tr****312,5分,2020-10-11
有趣好玩，将近20年没去过了，环境还是一样的好，到鼋头渚来放松一下真的令人心旷神怡,https://gs.ctrip.com/html5/you/comment/detail/1775/11/164724389.html,https://dimg04.c-ctrip.com/images/Z80p180000013uw9yF21F_C_180_180.jpg,steven821206,5分,2020-10-09
非常好的下次再买一个。整个过程非常方便快捷，有面的套餐真不错，不用担心中午没有吃的,https://gs.ctrip.com/html5/you/comment/detail/1775/11/164712550.html,https://dimg04.c-ctrip.com/images/Z80p180000013uw9yF21F_C_180_180.jpg,kansheng,5分,2020-10-08
值得推荐，景色不错，不是节假日期间旅游景点人少，非常好，人少安静，可以静静的欣赏。,https://gs.ctrip.com/html5/you/comment/detail/1775/11/164567688.html,https://dimg04.c-ctrip.com/images/Z804180000013uqy3DB02_C_180_180.jpg,M43****8323,5分,2020-09-29
"鼋头渚是江苏无锡的著名景点，以太湖风光为特色，景区挺大的，要一天时间呢，在太湖风景绝佳处走走，看看美丽的太湖，一下子心境就开阔了。
鼋头渚最美的时光是樱花盛开时，早樱3月中旬，晚樱大约4月中开花。仲春四月，樱妍春桥，天高秋日，兰香小兰亭，各具风采。2012年10月26日，鼋头渚晋升为国家5A级风景区。",https://gs.ctrip.com/html5/you/comment/detail/1775/11/163120229.html,https://dimg04.c-ctrip.com/images/t1/headphoto/297/153/459/8cf4cb7ad36e4984be00782f499866e1_C_180_180.jpg,1361130****,4分,2020-03-27
"千朵万朵压枝低：无锡鼋头渚樱花花开荼靡
景点攻略
今年无锡鼋头渚的早樱如期绽放，花开荼靡，风一吹过，花瓣开始飘酒落成雨。
黄四娘家花满蹊，千朵万朵压枝低。
繁枝容易纷纷落，娇蕊商量细细开。
鼋头渚早樱品种有“椿寒樱”、“河津樱”、“福建山樱”，花开的时间最早，通常在每年的二月底、三月初就能开花，三月上旬就已经进入樱花的观赏期了。早樱的品种，主要分布在进入核心景区的水景苑、漕湾和樱花谷内，以樱花谷最为茂密。",https://gs.ctrip.com/html5/you/comment/detail/1775/11/163105335.html,https://dimg04.c-ctrip.com/images/1h631120008hmahcv66AE_C_180_180.jpg,Nashiwo,4分,2020-03-25
超赞！精华在樱花谷（赏樱楼）、长春桥，长春桥可以拍出很美的照片，现场看，樱花谷更胜一筹（个人观点，不喜勿喷），玩了整整一个上午。明年再来！,https://gs.ctrip.com/html5/you/comment/detail/1775/11/163158966.html,https://dimg04.c-ctrip.com/images/Z80e0f0000007d7j08FA1_C_180_180.jpg,苍浩山人,5分,2020-04-02
由于冬季出游，所以没有太多的风景可看，慕名吃了一碗素面，二十元一碗，鲜美的菌菇面，味道不错，这可能算是此行最大亮点了,https://gs.ctrip.com/html5/you/comment/detail/1775/11/165440873.html,https://dimg04.c-ctrip.com/images/Z80h180000013xc9e3F64_C_180_180.jpg,139****6711,3分,2021-01-01
性价比高，景色不错，总体超赞，胡不催,https://gs.ctrip.com/html5/you/comment/detail/1775/11/165089106.html,https://dimg04.c-ctrip.com/images/Z80p180000013uw9yF21F_C_180_180.jpg,M10****880,5分,2020-11-17
每年春天都会来鼋头渚看樱花，不愧为中华第一赏樱圣地。太湖佳绝处，毕竟在鼋头。,https://gs.ctrip.com/html5/you/comment/detail/1775/11/164950871.html,https://dimg04.c-ctrip.com/images/Z8091a0000018hzrqF231_C_180_180.jpg,尋隱追殤,5分,2020-11-01
鼋头渚赏樱的绝佳地点，在长春桥的前后有湖堤与太湖分隔。桥呈拱形，像颐和园的玉带桥，整个长堤上种植着日本著名的樱花树“染井吉野”，枝干粗大，每年樱花盛开时节，缤纷绚丽，华丽幽雅。,https://gs.ctrip.com/html5/you/comment/detail/1775/11/163121469.html,https://dimg04.c-ctrip.com/images/Z80813000000tuiq21A55_C_180_180.jpg,勇猛十温柔,5分,2020-03-28
小雨中游玩，兴致勃勃。景区还不错。,https://gs.ctrip.com/html5/you/comment/detail/1775/11/165429939.html,https://dimg04.c-ctrip.com/images/t1/headphoto/207/494/838/fa687736cf3f484480526cfc0eb6c073_C_180_180.jpg,米特拉克杰瑞,4分,2020-12-31
可惜的是去早了，没有看到遍部的樱花，看到一些早樱，不过周边环境其实也不错的，尤其刚进门那个绿化的地方，还有类似苏堤的一段路，其实个人觉得比西湖苏堤更有意境,https://gs.ctrip.com/html5/you/comment/detail/1775/11/165297766.html,https://dimg04.c-ctrip.com/images/t1/headphoto/062/938/215/f5f05c77006946428867e3c0dae6f4eb_C_180_180.jpg,平冢市诸葛亮,4分,2020-12-13
距离市区有点远，不过打车和公交都挺方便的，风景很好，来无锡玩一定不能错过～,https://gs.ctrip.com/html5/you/comment/detail/1775/11/164972670.html,https://dimg04.c-ctrip.com/images/zc02170000011l03o44C7_C_180_180.jpg,路随心远,5分,2020-11-03
…………………………………………………………………………………性价比高，,https://gs.ctrip.com/html5/you/comment/detail/1775/11/165307428.html,https://dimg04.c-ctrip.com/images/Z80p170000012mo34FEDD_C_180_180.jpg,亚君2019,5分,2020-12-14
有趣好玩，总体超赞，性价比高，景色不错，很好玩性价比高赞一个物美价廉呵呵,https://gs.ctrip.com/html5/you/comment/detail/1775/11/164962348.html,https://dimg04.c-ctrip.com/images/Z80311000000ria0t84C5_C_180_180.jpg,tangbao1981,5分,2020-11-02
每年3月15日-----4月10日，是樱花开放的时间。无锡的樱花（中樱）是最美的，一般在3月15日左右开放。去鼋头渚最好是自驾车，周边有停车场可以停车。,https://gs.ctrip.com/html5/you/comment/detail/1775/11/163268907.html,https://dimg04.c-ctrip.com/images/Z8081f000001gebbu98C3_C_180_180.jpg,M51****940,5分,2020-04-19
除了门票贵点，可以玩一天都不够,https://gs.ctrip.com/html5/you/comment/detail/1775/11/165545418.html,https://dimg04.c-ctrip.com/images/Z80u0h00000091hlk43FD_C_180_180.jpg,鱼跃在花涧,4分,2021-01-15
无锡名气比较大的一个景区。3月份去的，然后樱花正在开放的时候，非常的漂亮，晚上也有活动，这地方还是要挑季节去。,https://gs.ctrip.com/html5/you/comment/detail/1775/11/165358903.html,https://dimg04.c-ctrip.com/images/Z80r0v000000jtjzt7260_C_180_180.jpg,谁o0,3分,2020-12-21
好评，这次上山很轻松有趣好玩，,https://gs.ctrip.com/html5/you/comment/detail/1775/11/164928437.html,https://dimg04.c-ctrip.com/images/t1/headphoto/164/424/952/04eab99bd26f47acadef4fd3f95b9f37_C_180_180.jpg,M24****7362,5分,2020-10-29
太湖风光很好，可惜湖水不是很干净，景区空气很好，适合放松游玩，值得一游,https://gs.ctrip.com/html5/you/comment/detail/1775/11/164682193.html,https://dimg04.c-ctrip.com/images/Z80v1b000001c33nmAEE7_C_180_180.jpg,不知道灬都不知道,5分,2020-10-07
景色不错，体验很好，值得推荐，天香楼的素面也很好吃，没有想象的那么拥挤,https://gs.ctrip.com/html5/you/comment/detail/1775/11/164584323.html,https://dimg04.c-ctrip.com/images/t1/headphoto/272/077/772/76b262d0cc24492abc5c6784c903c2ab_C_180_180.jpg,沙滩0119,5分,2020-10-01
体验很好，值得推荐，有趣好玩，,https://gs.ctrip.com/html5/you/comment/detail/1775/11/164523701.html,https://dimg04.c-ctrip.com/images/t1/headphoto/272/077/772/76b262d0cc24492abc5c6784c903c2ab_C_180_180.jpg,_WeCh****588502,5分,2020-09-24
无锡太湖鼋头渚，在依托太湖最美的一段，整个景区三面环水，湖光山色，景色宜人。乘坐游船去湖心小岛时，成群结队的江鸥追随者游船，场面很是壮观，可玩性很高。,https://gs.ctrip.com/html5/you/comment/detail/1775/11/163879677.html,https://dimg04.c-ctrip.com/images/Z80s160000010jwbr7246_C_180_180.jpg,野枫印象,5分,2020-07-20
"夏日荷花绽放，鼋渚风光秀丽。

鼋头渚是横卧无锡太湖西北岸的一个半岛，因巨石突入湖中形状酷似神龟昂首而得名，鼋头渚始建于1916年，现面积达539公顷。",https://gs.ctrip.com/html5/you/comment/detail/1775/11/163766866.html,https://dimg04.c-ctrip.com/images/fd/headphoto/g2/M01/77/CF/CghzgVVg_peAQqkJAAAXXiPyfUo605_C_180_180.jpg,yangnizi,5分,2020-07-04
景色不错，十一之前过来人也不多。观光车价钱有点儿高，其他的都不错。,https://gs.ctrip.com/html5/you/comment/detail/1775/11/164543820.html,https://dimg04.c-ctrip.com/images/t1/headphoto/272/077/772/76b262d0cc24492abc5c6784c903c2ab_C_180_180.jpg,M46****007,5分,2020-09-27
太湖是中国第二大内陆淡水湖。鼋头渚门票虽然不便宜，但包含游船，算是划算了。由于之前连日下雨，水位上升严重，仙岛不能上去，但感受太湖之美和大，足矣。,https://gs.ctrip.com/html5/you/comment/detail/1775/11/164027549.html,https://dimg04.c-ctrip.com/images/Z80h180000013xc9e3F64_C_180_180.jpg,288****831,5分,2020-08-06
到无锡必去的就是鼋头渚，无论是春夏秋冬，这里的风景都很美，尤其是春天，鼋头渚绝对是赏樱花的圣地，不过鼋头渚的冬季也有他的另一番美景，湖里的残荷也有另一番美，冬季的红嘴鸥很多也是一道风景。,https://gs.ctrip.com/html5/you/comment/detail/1775/11/163216264.html,https://dimg04.c-ctrip.com/images/t1/headphoto/164/424/952/04eab99bd26f47acadef4fd3f95b9f37_C_180_180.jpg,殷姨,5分,2020-04-11
疫情原因，没有使用，遗憾,https://gs.ctrip.com/html5/you/comment/detail/1775/11/165524926.html,https://dimg04.c-ctrip.com/images/Z80h180000013xc9e3F64_C_180_180.jpg,M39****249,4分,2021-01-12
门票使用方便，景区很大，真的需要大半天的时间，建议坐电瓶车游览。,https://gs.ctrip.com/html5/you/comment/detail/1775/11/164890396.html,https://dimg04.c-ctrip.com/images/Z80h180000013xc9e3F64_C_180_180.jpg,an****5,5分,2020-10-25
景色不错，值得推荐，有趣好玩，体验很好，停车场管理水平有待提高。,https://gs.ctrip.com/html5/you/comment/detail/1775/11/164629739.html,https://dimg04.c-ctrip.com/images/Z80h180000013xc9e3F64_C_180_180.jpg,M97****60,5分,2020-10-04
有趣好玩，值得推荐，景色不错，体验很好，不错的景点，值得慢慢游玩,https://gs.ctrip.com/html5/you/comment/detail/1775/11/164600395.html,https://dimg04.c-ctrip.com/images/Z80h180000013xc9e3F64_C_180_180.jpg,151****9366,5分,2020-10-02
下次还得去到无锡鼋头渚,https://gs.ctrip.com/html5/you/comment/detail/1775/11/164737486.html,https://dimg04.c-ctrip.com/images/t1/headphoto/672/399/248/92e9e00baeeb40d6b5b4805be8b62005_C_180_180.jpg,无锡张先生,5分,2020-10-10
有趣好玩，值得推荐，体验很好，景色不错，大家要去玩哦……～……,https://gs.ctrip.com/html5/you/comment/detail/1775/11/164551350.html,https://dimg04.c-ctrip.com/images/t1/headphoto/857/872/237/edc9e981b00e436a8dcee595001d62fa_C_180_180.jpg,180****8252,5分,2020-09-27
风景很好，景区也很大,https://gs.ctrip.com/html5/you/comment/detail/1775/11/165687762.html,https://dimg04.c-ctrip.com/images/Z80p180000013uw9yF21F_C_180_180.jpg,fondshark_zy,4分,2021-02-07
总体超赞，景色不错，,https://gs.ctrip.com/html5/you/comment/detail/1775/11/165499829.html,https://dimg04.c-ctrip.com/images/Z80h180000013xc9e3F64_C_180_180.jpg,M21****67,4分,2021-01-08
风景不错，和朋友一起出来玩的，赶上了最后的樱花，好看，开心的,https://gs.ctrip.com/html5/you/comment/detail/1775/11/165200523.html,https://dimg04.c-ctrip.com/images/t1/headphoto/164/424/952/04eab99bd26f47acadef4fd3f95b9f37_C_180_180.jpg,_WeCh****808660,5分,2020-11-30
有趣好玩，景色不错，性价比高，总体超赞，挺不错的………………,https://gs.ctrip.com/html5/you/comment/detail/1775/11/165193927.html,https://dimg04.c-ctrip.com/images/Z80p180000013uw9yF21F_C_180_180.jpg,320****989,5分,2020-11-29
景区很适合游玩，设施齐全，服务很好，感觉不错。工作人员很周到,https://gs.ctrip.com/html5/you/comment/detail/1775/11/165102659.html,https://dimg04.c-ctrip.com/images/t1/headphoto/491/056/464/eb3c7472323e4c3598f58ffa8a6fce99_C_180_180.jpg,M45****883,5分,2020-11-18
值得推荐，体验很好，有趣好玩，景色不错，会再带孩子过来玩的。,https://gs.ctrip.com/html5/you/comment/detail/1775/11/164836127.html,https://dimg04.c-ctrip.com/images/Z80h180000013xc9e3F64_C_180_180.jpg,201****507,5分,2020-10-20
夏天去的，景色很不错，可以坐船去岛上，岛上也有吃饭的地方。。,https://gs.ctrip.com/html5/you/comment/detail/1775/11/164752393.html,https://dimg04.c-ctrip.com/images/Z80p180000013uw9yF21F_C_180_180.jpg,爱旅游的棒冰,5分,2020-10-11
景点非常好看，我喜欢景色不错，有趣好玩，体验很好，值得推荐，,https://gs.ctrip.com/html5/you/comment/detail/1775/11/164705897.html,https://dimg04.c-ctrip.com/images/Z80p180000013uw9yF21F_C_180_180.jpg,M45****091,5分,2020-10-08
冬天不适合，都没什么好看的，湖中岛没意思！一定要选对季节去。,https://gs.ctrip.com/html5/you/comment/detail/1775/11/164501402.html,https://dimg04.c-ctrip.com/images/Z80p180000013uw9yF21F_C_180_180.jpg,m14****53,5分,2020-09-22
无锡第一景，非常好的休闲去处，里面挺大，景点也比较多，特别是太湖中的那个人间仙境的岛，真有点仙风飘飘的味道，强力推荐呀！,https://gs.ctrip.com/html5/you/comment/detail/1775/11/163994469.html,https://dimg04.c-ctrip.com/images/Z80p180000013uw9yF21F_C_180_180.jpg,M70****96,5分,2020-08-03
"门票很值得，赶到这里的时候已经11点多了，现在进门要检查健康码和身份证，订的门票里包含一张游船门票，就是太湖里那个几层高的游轮。景区真的很大，至少半天才能大体走完，游轮是单独去一个小岛的，去时检查船票，回来直接上船就可以，不要在岛上一直打圈，没有别的出口，哈哈哈哈哈哈
然后就是各种上山下山，十里长堤啥的各种走，山都不大，但还是建议跟大部队走，去的时候刚下过雨，有点路滑，有一些穿汉服的小姐姐，也有租汉服帮忙化妆拍照的地方，PS：遇到一个穿着汉服画着女装的小哥哥在拍照📷
还有一个樱花园没进去，里面貌似也很大，太累了，而且快5点了赶紧出来了
总之，75块钱的门票太划算了",https://gs.ctrip.com/html5/you/comment/detail/1775/11/163360788.html,https://dimg04.c-ctrip.com/images/t1/headphoto/164/424/952/04eab99bd26f47acadef4fd3f95b9f37_C_180_180.jpg,Crystal想飞,5分,2020-05-03
“太湖佳绝处，毕竟在鼋头。”整个景区非常大，进来后可以先看看地图，去自己喜欢的地方随意溜溜，樱花季的话应该会非常美的，可惜我错过了，于是就直接坐船到太湖仙岛了～回来后可以选择乘坐游览车，很方便。景色看图啦，哈哈～大概在这边玩了半天多～,https://gs.ctrip.com/html5/you/comment/detail/1775/11/163347219.html,https://dimg04.c-ctrip.com/images/Z80c13000000u21m69843_C_180_180.jpg,橘笑之005,5分,2020-05-01
"无锡鼋头渚樱花谷满谷樱花盛开的时间约在3月25日至4月5日。樱花的“海洋”从太湖边长春桥畔连绵至鹿顶山山坡、山谷，其景美不胜收，流连忘返啊！另一个赏樱最好的地方就是赏樱楼了。
今年的樱花和往年类似，也是3月下旬全开，由于这几天风大，所以部分樱花已经开始飘落。尽量赶在清明前去，过了清明就可能只剩下树枝了。",https://gs.ctrip.com/html5/you/comment/detail/1775/11/163104390.html,https://dimg04.c-ctrip.com/images/Z8070a0000004m9t7BB14_C_180_180.jpg,周游列国,5分,2020-03-25
风景不错，尤其坐船到湖中岛的天街小吃多值得推荐，景色不错，,https://gs.ctrip.com/html5/you/comment/detail/1775/11/164646086.html,https://dimg04.c-ctrip.com/images/Z80p180000013uw9yF21F_C_180_180.jpg,134****0069,5分,2020-10-05
"又是一个太湖之滨无锡的一个知名的景点，去无锡的游客都会在这里留下足印，
性价比挺高的，拍照留念也是相当美，可以坐船游览。",https://gs.ctrip.com/html5/you/comment/detail/1775/11/163903777.html,https://dimg04.c-ctrip.com/images/Z80k0x000000l40wj67BA_C_180_180.jpg,我的黑郁金香,5分,2020-07-23
头一次我家人去鼋头渚，本来是因为名字有些特别才来，下岛后给人感觉有些仙境一般，在岛上游了一天，可以放松自己，也可以去道观净化下与沉淀内心……是休闲放松的好去处,https://gs.ctrip.com/html5/you/comment/detail/1775/11/163344339.html,https://dimg04.c-ctrip.com/images/fd/headphoto/g2/M07/D7/01/CghzgVTOzq2Aed_FAAAiaV9DVDA152_C_180_180.jpg,金莎儿,5分,2020-05-01
景色不错，疫情期间没什么人，所以可以获得非常好的旅游体验,https://gs.ctrip.com/html5/you/comment/detail/1775/11/164801281.html,https://dimg04.c-ctrip.com/images/fd/headphoto/g4/M0B/CA/E3/CggYHFZzi3-AMpEAAAVzs7fdCTI674_C_180_180.jpg,lengao,5分,2020-10-16
