标题,标题链接,头像,user-detail__name,totalStarIcon1,resource_date
非常值得一去，将太湖盛景尽收眼底，景区面积大，游船好玩体验很好，有趣好玩，,https://gs.ctrip.com/html5/you/comment/detail/1775/11/164168223.html,https://dimg04.c-ctrip.com/images/t1/headphoto/057/777/943/0b93f8268d5546308915f4f9fcaa9483_C_180_180.jpg,M34****8406,5分,2020-08-19
三月底带着家人一起去鼋头渚的，虽然不是樱花盛开的时候，但是也不错了，就是坐船的时候排了好长时间对，但是也算值得的。,https://gs.ctrip.com/html5/you/comment/detail/1775/11/161450285.html,https://dimg04.c-ctrip.com/images/Z80h180000013xc9e3F64_C_180_180.jpg,欣雨辉,5分,2019-10-08
3月底的鼋头渚真心的美，上岛时的小白鹭很壮观。就是人太多了，去岛上的船排队时间太长了，还有就是去的路实在是太堵了。,https://gs.ctrip.com/html5/you/comment/detail/1775/11/161241022.html,https://dimg04.c-ctrip.com/images/Z80h180000013xc9e3F64_C_180_180.jpg,E03****89,5分,2019-10-01
夏天去太热了，其他都还行。估计三四月份樱花盛开的季节比较适合。夏天荷花盛开，也挺不错的。下次再跟家人一起过来看樱花,https://gs.ctrip.com/html5/you/comment/detail/1775/11/160039009.html,https://dimg04.c-ctrip.com/images/Z80h180000013xc9e3F64_C_180_180.jpg,M52****137,5分,2019-08-01
携程预定优惠票，入园非常方便，刷身份证即可。鼋头渚集园林、水景、游船、爬山、祈福……于一体，景区空气清新，景色宜人,https://gs.ctrip.com/html5/you/comment/detail/1775/11/159402157.html,https://dimg04.c-ctrip.com/images/Z80h180000013xc9e3F64_C_180_180.jpg,M76****33,5分,2019-06-22
樱花季节的鼋头渚真是太湖绝佳处，夜景超美，就是白天人太多，我分两次入园，5店之后的夜场和清早的日场，还是很值得的。,https://gs.ctrip.com/html5/you/comment/detail/1775/11/158936024.html,https://dimg04.c-ctrip.com/images/t1/headphoto/757/757/889/3b86691007a54fe684f07e198432d09b_C_180_180.jpg,_WeCh****040760,5分,2019-05-24
清明节去的，天气很好，气温高，游人如织，景色美，漂亮，还可以看到晚樱，不好的是公交挤不上去，走两个站还是搭不上车。,https://gs.ctrip.com/html5/you/comment/detail/1775/11/158759036.html,https://dimg04.c-ctrip.com/images/t1/headphoto/057/777/943/0b93f8268d5546308915f4f9fcaa9483_C_180_180.jpg,_WeCh****372968,5分,2019-05-10
天然氧吧呀，空气清新带着淡淡花香，让人心旷神怡，景区面积大，需要细细了解体验，票价性价比高，建议到了无锡一定去看看,https://gs.ctrip.com/html5/you/comment/detail/1775/11/158572376.html,https://dimg04.c-ctrip.com/images/t1/headphoto/491/056/464/eb3c7472323e4c3598f58ffa8a6fce99_C_180_180.jpg,M23****6825,5分,2019-04-28
据说鼋头渚的樱花十分漂亮，那必须是春天来看，16年过去的时候是夏天，早已经过了樱花开放的季节，看不见樱花看看其他的景色也未尝不可。水上仙岛是在太湖中的一个小岛，自然和人文景观都很不错。值得一看。,https://gs.ctrip.com/html5/you/comment/detail/1775/11/158495759.html,https://dimg04.c-ctrip.com/images/Z80612000000tdcjh2DAB_C_180_180.jpg,LY3V1,4分,2019-04-22
无需出票，出示短信，身份证就可以入园了。鼋头渚到处都是美景，可惜天气比较阴冷，不能尽信游玩，明年再来看美丽的樱花。,https://gs.ctrip.com/html5/you/comment/detail/1775/11/158393101.html,https://dimg04.c-ctrip.com/images/Z80h180000013xc9e3F64_C_180_180.jpg,额格琪,5分,2019-04-13
是在樱花盛开的季节去的，无锡鼋头褚的樱花确实非常的漂亮，跟其他地方的樱花有点不太一样，就是每一棵树的规格都非常的大，还有就是品种过于单一，基本上全是漫山遍野的白色樱花，确实是一个比较值得去的地方,https://gs.ctrip.com/html5/you/comment/detail/1775/11/158340786.html,https://dimg04.c-ctrip.com/images/fd/headphoto/g4/M07/63/A9/CggYHFZaHEeAQiwEAAAhrH-fxKo709_C_180_180.jpg,龙行天下行,4分,2019-04-09
去无锡太湖鼋头渚看荷花也不错哦！,https://gs.ctrip.com/html5/you/comment/detail/1775/11/163709447.html,https://dimg04.c-ctrip.com/images/Z80s160000010fqahE677_C_180_180.jpg,妮妮8162,5分,2020-06-24
樱花开的时候去特别美！值得一去！,https://gs.ctrip.com/html5/you/comment/detail/1775/11/162805434.html,https://dimg04.c-ctrip.com/images/Z80p180000013uw9yF21F_C_180_180.jpg,archytjf82111,5分,2020-02-07
赶上阴雨天去游览，温度很合适，景区确实不小，只是蚊子有点多，人也不少，有的地方没有去。略有遗憾，下次找机会再来。,https://gs.ctrip.com/html5/you/comment/detail/1775/11/161378143.html,https://dimg04.c-ctrip.com/images/fd/headphoto/g2/M03/B1/EC/CghzgFW7OzGAHMjHAADnycFzqVQ208_C_180_180.jpg,cx822,5分,2019-10-06
说樱花是最尽情的花朵，就因为它的早死。就像男女间的一夜情一样，短暂而美妙，留下了一生的回想，或许感慨、或许悲凉。,https://gs.ctrip.com/html5/you/comment/detail/1775/11/158231300.html,https://dimg04.c-ctrip.com/images/Z80j13000000vm92i8FDE_C_180_180.jpg,冬哥D,5分,2019-03-30
景色不错，体验很好，值得推荐，,https://gs.ctrip.com/html5/you/comment/detail/1775/11/163922001.html,https://dimg04.c-ctrip.com/images/t1/headphoto/903/173/918/eb4b7bea9720440dac09eab89328ab00_C_180_180.jpg,M32****719,5分,2020-07-26
除了太热了，其他没毛病，这次买了电瓶车一直坐到山顶，可以一览太湖景，蛮好的，就是太湖蓝藻还有，，感觉水不是很清,https://gs.ctrip.com/html5/you/comment/detail/1775/11/163366942.html,https://dimg04.c-ctrip.com/images/t1/headphoto/639/456/966/cb4bfa951fb84e42a08caf373ace1183_C_180_180.jpg,Irisyangyang,5分,2020-05-03
我带着爸爸妈妈一起来无锡玩耍，没想到这两天天气有点阴冷，没有蓝天白云，太湖也不好看啊，但是非常适合溜达溜达，我们在公园里一直走进去，又走回来，不错哦！,https://gs.ctrip.com/html5/you/comment/detail/1775/11/161720229.html,https://dimg04.c-ctrip.com/images/t1/headphoto/903/173/918/eb4b7bea9720440dac09eab89328ab00_C_180_180.jpg,M31****1569,5分,2019-10-26
第三次游览鼋头渚了 极推荐！领略太湖之美～携程订票很方便 还有优惠 很不错！个人觉得无锡是个很洋气的城市 鼋头渚 灵山大佛 梵宫 三国城水浒城 都是非常不错的旅行选择,https://gs.ctrip.com/html5/you/comment/detail/1775/11/160091285.html,https://dimg04.c-ctrip.com/images/t1/headphoto/397/132/243/542067aa29904ae9aca7e88f43eaeb6f_C_180_180.jpg,M34****3626,5分,2019-08-04
真的是好美的一个地方，从网上搜了好多，看樱花的地方啊，然后就决定来这里开了将近9个小时的车，为了美景也是偏了，里面樱花真的是超级的多，而且当时去的时候，幸好还有一些樱花，也欣赏到了太湖的美景,https://gs.ctrip.com/html5/you/comment/detail/1775/11/159532109.html,https://dimg04.c-ctrip.com/images/Z80p16000000zciz2B981_C_180_180.jpg,我想遇到你,5分,2019-07-02
鼋头渚风景区在无锡，是有名的赏樱之地，从上海开车到鼋头渚大概2个半小时，5A级风景区，有充山隐秀、鹿顶迎晖、鼋渚春涛、横云山庄、广福寺、太湖仙岛等景点,https://gs.ctrip.com/html5/you/comment/detail/1775/11/158566295.html,https://dimg04.c-ctrip.com/images/fd/headphoto/g2/M0B/6C/63/CghzgFW4PGOAFa3sAAEYia467Dc689_C_180_180.jpg,aijun000,5分,2019-04-28
第三次去了，记得以前都不收门票的，现在到哪都要门票，也是无语……樱花林确实值得一看，人实在太多，而且游客素质参差不齐，为了拍照有摇树的，还有折花的有爬树的，希望景区加强管理，莫让美景受伤害。,https://gs.ctrip.com/html5/you/comment/detail/1775/11/158494610.html,https://dimg04.c-ctrip.com/images/fd/headphoto/g1/M02/8F/32/CghzflV1l_eAZAleAADV0rzDRqU077_C_180_180.jpg,hyh7612,4分,2019-04-22
我们23日去的时候樱花已经开了，有很多小姑娘自带衣服在拍古装昭照，风景优美，就是人太多了，乘船游览要等几个小时,https://gs.ctrip.com/html5/you/comment/detail/1775/11/158247515.html,https://dimg04.c-ctrip.com/images/t1/headphoto/293/406/308/22631089f44a497495c005fce85f6a6f_C_180_180.jpg,m29****0474,5分,2019-04-01
周末人太多 樱花真的很漂亮 尤其是夜樱 最好不要周末去人太多出门花了一个小时左右 推荐晚上去看樱花,https://gs.ctrip.com/html5/you/comment/detail/1775/11/158237419.html,https://dimg04.c-ctrip.com/images/Z80713000000tupsp301A_C_180_180.jpg,停留一刻,5分,2019-03-31
很漂亮，太湖美，美就美在太湖水，太湖是中国的第三大淡水湖，秀美的山水，绿波荡漾，鱼米之乡，水似美酒，湖似碧玉杯。旅游胜地，每年吸引着成千上万的游客前来。太湖仙岛风光旖旎，山猴嬉闹，富有乐趣。,https://gs.ctrip.com/html5/you/comment/detail/1775/11/92307984.html,https://dimg04.c-ctrip.com/images/Z80l090000003n0wt6DB7_C_180_180.jpg,徐凯丽,4分,2016-11-24
四月十号去的早樱都谢了 晚樱还是很惊艳 门票包括船票 游玩需要一天 园子很美 各种花 需要坐电瓶车 如果可以每站都停就好了,https://gs.ctrip.com/html5/you/comment/detail/1775/11/163211535.html,https://dimg04.c-ctrip.com/images/t1/headphoto/491/056/464/eb3c7472323e4c3598f58ffa8a6fce99_C_180_180.jpg,M18****471,5分,2020-04-10
由于大家都回家了 景区里人很少。喂了沙鸥去了仙境。感觉很放空。从景区门口一路走进去的，就像散步那样。感觉不像在景区而是在乡间郊外。,https://gs.ctrip.com/html5/you/comment/detail/1775/11/162692210.html,https://dimg04.c-ctrip.com/images/Z8030e00000072nwu2B53_C_180_180.jpg,_wf****875,5分,2020-01-20
号称国内最大品种最多的樱花园，确实名不虚传。非常值得去游玩。特别时赏樱楼和长春桥超级漂亮。门票包含坐游船上仙岛，航行时湖面上好多海鸥，喂食也很有趣。,https://gs.ctrip.com/html5/you/comment/detail/1775/11/158713291.html,https://dimg04.c-ctrip.com/images/Z80r0z000000mhbaj38B6_C_180_180.jpg,daguwang,5分,2019-05-06
冲着樱花节来的，结果早樱开过了，晚樱只有花苞。景区里连个椅子歇歇脚都没有，工作人员只有收费的点有人，想找个人问问哪有开着的樱花看都找不到。太坑了。,https://gs.ctrip.com/html5/you/comment/detail/1775/11/165960313.html,https://dimg04.c-ctrip.com/images/Z80h180000013xc9e3F64_C_180_180.jpg,206****631,1分,2021-03-14
鼋头渚是横卧无锡太湖西北岸的一个半岛，因巨石突入湖中形状酷似神龟昂首而得名。5a景区，是休闲度假的最佳去处,https://gs.ctrip.com/html5/you/comment/detail/1775/11/164455782.html,https://dimg04.c-ctrip.com/images/Z8011f000001gsbvaA8DC_C_180_180.jpg,糖豆糖豆子,5分,2020-09-17
鼋头渚樱花节期间太美了，尤其是长春桥附近真是美不胜收，移步异景！夜间樱花也别具风格，感觉赏樱不用去日本了！,https://gs.ctrip.com/html5/you/comment/detail/1775/11/161460899.html,https://dimg04.c-ctrip.com/images/Z80h180000013xc9e3F64_C_180_180.jpg,110****609,5分,2019-10-09
带着一家老小的太湖鼋头渚游，非常方便，玩的也很开心！景色宜人。下次樱花盛开的时候应该会更美！期待下次再来。,https://gs.ctrip.com/html5/you/comment/detail/1775/11/161151342.html,https://dimg04.c-ctrip.com/images/t1/headphoto/724/518/802/e201a429d7a54f72ade0df32a3d59b2f_C_180_180.jpg,西林阿诺,5分,2019-09-25
上海无锡一日游，无锡站北区一号公交车终点到终点根方便，无锡鼋头渚一定要去，门票购买也很方便，非常不错的景区,https://gs.ctrip.com/html5/you/comment/detail/1775/11/160770845.html,https://dimg04.c-ctrip.com/images/Z80d160000010ghw574D0_C_180_180.jpg,稀芸,5分,2019-09-04
门票价格一般，风景不错，不建议坐交通车和观光车，适合漫步，有时间的话，可以玩一天，停车方便，吃的地方太少。,https://gs.ctrip.com/html5/you/comment/detail/1775/11/160658969.html,https://dimg04.c-ctrip.com/images/Z80p180000013uw9yF21F_C_180_180.jpg,游出真我,5分,2019-08-28
值得点赞的是预售门票包含了车和船票，方便游客。鼋头渚景区在太湖边，包含了仙岛，风景优美空气优良，值得一看。,https://gs.ctrip.com/html5/you/comment/detail/1775/11/158707702.html,https://dimg04.c-ctrip.com/images/Z80p180000013uw9yF21F_C_180_180.jpg,河谷邀,5分,2019-05-06
很美很好的地方，可惜来晚了，樱花谢了一半，能想象的出当樱花盛开时一定是美不胜收，期待以后有机会能再来赏樱！,https://gs.ctrip.com/html5/you/comment/detail/1775/11/158494475.html,https://dimg04.c-ctrip.com/images/Z80h180000013xc9e3F64_C_180_180.jpg,储秀宫,5分,2019-04-22
真的是美咯，3月底去，刚刚好。樱花已经开了，观樱楼上面的景色真的是一斤了，建议大家多走几步，反正来都来了。,https://gs.ctrip.com/html5/you/comment/detail/1775/11/158452022.html,https://dimg04.c-ctrip.com/images/t1/headphoto/136/299/437/649eb217e3e54746b7a53b8665e14b00_C_180_180.jpg,_WeCh****256159,5分,2019-04-18
"景区很大 带孩子一起游览 就买了游览车票
登高一览太湖风景 鹿顶迎晖 风景独好
景区猫咪很多 孩子可喜欢了 玩得也很开心",https://gs.ctrip.com/html5/you/comment/detail/1775/11/161874541.html,https://dimg04.c-ctrip.com/images/fd/headphoto/g3/M07/28/D7/CggYG1XCFk2ADHgyAAAes02KFeQ581_C_180_180.jpg,正版绿豆芽,5分,2019-11-06
樱花真美，虽然人很多！但是抵挡不住这一片花海…………………………不枉此行啊！啊啊啊啊，下次穿汉服去哈……,https://gs.ctrip.com/html5/you/comment/detail/1775/11/161407799.html,https://dimg04.c-ctrip.com/images/fd/headphoto/g3/M05/06/EA/CggYGlXeedKAAm5cAAEG9aZQkiY555_C_180_180.jpg,M95****66,5分,2019-10-07
很方便！手机订票，检票时出示身份证即可！一起定三张门票，出示一个身份证立马通过！下次还用手机，携程订票！,https://gs.ctrip.com/html5/you/comment/detail/1775/11/160662785.html,https://dimg04.c-ctrip.com/images/t1/headphoto/491/056/464/eb3c7472323e4c3598f58ffa8a6fce99_C_180_180.jpg,M47****318,5分,2019-08-28
五A景区，果然不凡。可以在里面玩一天时间，门票包含船票，可以到湖心岛，观看玉皇大帝像，小心被忽悠了捐款。,https://gs.ctrip.com/html5/you/comment/detail/1775/11/159764804.html,https://dimg04.c-ctrip.com/images/Z80p180000013uw9yF21F_C_180_180.jpg,zhifang456,5分,2019-07-16
“太湖美～太湖美～美就美在太湖水～” 小时候听这首歌，唱这首歌，但一直都没有真实的见到过。这是第一次去到无锡，就被这样的景色所吸引。值得再去的地方,https://gs.ctrip.com/html5/you/comment/detail/1775/11/159531467.html,https://dimg04.c-ctrip.com/images/t1/headphoto/982/089/752/f8c7b21182c94524ac4df328fdc7b3dc_C_180_180.jpg,M21****707,5分,2019-07-02
樱花很漂亮，马拉松那天去的，赶在封路之前到的，人很少，等逛完结束再回头人超多的，还好天气很好，阳光不燥~,https://gs.ctrip.com/html5/you/comment/detail/1775/11/158693636.html,https://dimg04.c-ctrip.com/images/Z8030k000000bhrn0A399_C_180_180.jpg,M58****234,5分,2019-05-05
超级超级美，但是去的时候正好是花期，人很多，乘船的时候等了好久，不过还好还好，风景特别好，超级开心哇！！,https://gs.ctrip.com/html5/you/comment/detail/1775/11/158383738.html,https://dimg04.c-ctrip.com/images/t1/headphoto/272/077/772/76b262d0cc24492abc5c6784c903c2ab_C_180_180.jpg,_WeCh****203849,5分,2019-04-12
人很多，节假日时间车根本没法开过去，离大门3.6公里停路边了，今年清明樱花都落了，没看到大片樱花的景象。,https://gs.ctrip.com/html5/you/comment/detail/1775/11/158357133.html,https://dimg04.c-ctrip.com/images/zc02170000011l03o44C7_C_180_180.jpg,淡定人生0517,5分,2019-04-10
一直都在携程订票，挺方便快捷的，景点樱花也很美，就是景点人太多了，玩的有点累，哈哈，下次还会在携程订票的,https://gs.ctrip.com/html5/you/comment/detail/1775/11/158309369.html,https://dimg04.c-ctrip.com/images/t1/headphoto/177/080/529/285e9abeede347d9a7c1cc5e1b4c9287_C_180_180.jpg,M19****775,5分,2019-04-07
门票贵，游人如织；景色不错，但是太湖水为啥是黄的呢？搭个帐篷就叫樱花小镇，太牵强了吧？看春花觉得北京更好,https://gs.ctrip.com/html5/you/comment/detail/1775/11/158241404.html,https://dimg04.c-ctrip.com/images/t1/headphoto/857/872/237/edc9e981b00e436a8dcee595001d62fa_C_180_180.jpg,M54****547,5分,2019-03-31
"樱花真很。很赞
景色很美感受春天气息，适合拍照的好地方
唯一就是道路拥堵，那那都要排队，感觉7点就要到会好些",https://gs.ctrip.com/html5/you/comment/detail/1775/11/158239693.html,https://dimg04.c-ctrip.com/images/t1/headphoto/685/724/771/3cd584c18f744104b47d3f3d075d10e3_C_180_180.jpg,M25****9459,5分,2019-03-31
特别想去看樱花，今年有机会去了，真的很美，穿汉服会更美哦，推荐大家前去游玩，高铁大巴或者自驾游都很方便,https://gs.ctrip.com/html5/you/comment/detail/1775/11/160424990.html,https://dimg04.c-ctrip.com/images/Z80j0i0000009c5no1B63_C_180_180.jpg,鸡血妹子,5分,2019-08-17
特别棒，天气特别好，不是很晒也不是很热，微风习习，特别舒服，可以步行，也可以坐游览观光车。玩的特别开心,https://gs.ctrip.com/html5/you/comment/detail/1775/11/158607007.html,https://dimg04.c-ctrip.com/images/t1/headphoto/982/089/752/f8c7b21182c94524ac4df328fdc7b3dc_C_180_180.jpg,_WeCh****991446,5分,2019-05-01
这个时候没有樱花看了，有点可惜，不过景色不错，园区也很大，下次有机会一定会再去看樱花.........,https://gs.ctrip.com/html5/you/comment/detail/1775/11/158565095.html,https://dimg04.c-ctrip.com/images/fd/headphoto/g2/M08/3E/11/Cghzf1TQ68aAaEP8AADbnc9Jz-g747_C_180_180.jpg,M15****681,5分,2019-04-28
樱花季节挑一个工作日早晨，早些开进景区还有停车位，趁大批游客未到可以拍出不少好片，樱花满天，很美，只是步行的路比较长，一路拍拍拍，进去景区路比较狭窄，非常容易拥堵，管理水平有待改进。,https://gs.ctrip.com/html5/you/comment/detail/1775/11/158436936.html,https://dimg04.c-ctrip.com/images/Z80h180000013xc9e3F64_C_180_180.jpg,vih0714,4分,2019-04-17
感觉还不错吧  多好谈不上 中规中矩 打个卡啥的 反正不会再来下次了,https://gs.ctrip.com/html5/you/comment/detail/1775/11/164314108.html,https://dimg04.c-ctrip.com/images/t1/headphoto/062/938/215/f5f05c77006946428867e3c0dae6f4eb_C_180_180.jpg,雷丘爱上皮卡丘,4分,2020-09-02
景色很美，气温也刚刚,https://gs.ctrip.com/html5/you/comment/detail/1775/11/163177986.html,https://dimg04.c-ctrip.com/images/t1/headphoto/424/398/503/0386f569fd0d4b488ff41b64bbc5743b_C_180_180.jpg,横县阿道夫,5分,2020-04-05
里面挺大的，一早去的，空气环境挺不错的，里面有公交，进出很方便，去太湖仙岛，渡轮上可以欣赏太湖风光。,https://gs.ctrip.com/html5/you/comment/detail/1775/11/161272686.html,https://dimg04.c-ctrip.com/images/Z80k0g0000007nech55A9_C_180_180.jpg,布赖米省曹彬,5分,2019-10-03
山青水秀，天水一色的蓝，转一圈心旷神怡。大自然的美，游人的美，浑然一体，组成一副美轮美奂的人间仙境。,https://gs.ctrip.com/html5/you/comment/detail/1775/11/160681287.html,https://dimg04.c-ctrip.com/images/t1/headphoto/646/318/109/a865fe5f5465407d8befd5dc487a8554_C_180_180.jpg,M20****457,5分,2019-08-29
樱花季必须要去一次，人再多也要去一次，好多穿汉服去拍照的妹子，走到哪里都能看到，可惜了没带单反相机。,https://gs.ctrip.com/html5/you/comment/detail/1775/11/159916678.html,https://dimg04.c-ctrip.com/images/Z80p180000013uw9yF21F_C_180_180.jpg,gen****608,5分,2019-07-25
第二次来，有机会每年都想来看太漂亮了，壮观。。。。全部盛开了，太美了太美了，一定要把握花季。。。。。,https://gs.ctrip.com/html5/you/comment/detail/1775/11/158579185.html,https://dimg04.c-ctrip.com/images/Z80p180000013uw9yF21F_C_180_180.jpg,189****3018,5分,2019-04-29
作为三大赏樱圣地之一的鼋头渚樱花，已然绽放。还是来的稍微早了一点，再晚一周左右将进入盛花期。 鼋头渚,https://gs.ctrip.com/html5/you/comment/detail/1775/11/165972883.html,https://dimg04.c-ctrip.com/images/Z80c10000000pc1uy5824_C_180_180.jpg,天马行空境界,,2021-03-14
"整体服务不错😊可以穿汉服游玩岛屿，很喜欢。
特别是11-188号员工，小姑娘心细，帮忙换汉服，很喜欢她对服装的推荐和发饰的设计，人热情，服务特别好👍👍👍体验很好，景色不错，",https://gs.ctrip.com/html5/you/comment/detail/1775/11/163765734.html,https://dimg04.c-ctrip.com/images/Z80e080000002twu7E55F_C_180_180.jpg,Xuer,5分,2020-07-04
去了一次无锡之后，真的是特别喜欢，这里不但有太湖的风景比较美，而且整个无锡城市建设的那种风格特别有江南韵味，景区也是超级的大三四月份去最好能够看到漂亮的樱花。,https://gs.ctrip.com/html5/you/comment/detail/1775/11/163059099.html,https://dimg04.c-ctrip.com/images/Z804180000015365869F7_C_180_180.jpg,不如没有好,4分,2020-03-20
景区很大 景色很好 秩序井然 天气不错 游人很多 时间关系没有逛完 如果有时间可以逛一整天 太湖精华处 毕竟鼋头渚,https://gs.ctrip.com/html5/you/comment/detail/1775/11/160450679.html,https://dimg04.c-ctrip.com/images/fd/headphoto/g4/M04/1D/ED/CggYHFXfx4mAD1PhAADlk6qA9Go253_C_180_180.jpg,粉红朵朵-123,5分,2019-08-18
第二次去，你之前去扩大了，要走20分钟才到鼋头渚最美的地方。太湖的蓝藻还没治理好，乘船前往仙岛，一下船真的好臭。不过太湖之景色还是不错的。,https://gs.ctrip.com/html5/you/comment/detail/1775/11/159901905.html,https://dimg04.c-ctrip.com/images/Z80h180000013xc9e3F64_C_180_180.jpg,320****636,5分,2019-07-24
国内看樱花不错的选择地，挺漂亮，去过两次，可以坐船，很好,https://gs.ctrip.com/html5/you/comment/detail/1775/11/164306161.html,https://dimg04.c-ctrip.com/images/Z80p180000013uw9yF21F_C_180_180.jpg,M30****614,5分,2020-09-01
鼋头渚为太湖佳境景色宜人空气清新，湖光山色优美绝伦不愧是鬼斧神工，特别适合春夏季游玩，让人觉得来到世外桃源仙境一般甚是欢喜，太湖三白也是特别鲜美，值得推荐～,https://gs.ctrip.com/html5/you/comment/detail/1775/11/163273938.html,https://dimg04.c-ctrip.com/images/Z80s0f00000079iac28B1_C_180_180.jpg,CG新人类,5分,2020-04-20
"鼋头渚的春夏秋冬各有特色，推荐是春天的樱花，种类多，花期连续，万紫强红极有特色。不愧是国内赏樱的首选之地。
强烈推荐，就是人太太太太太太多",https://gs.ctrip.com/html5/you/comment/detail/1775/11/161706190.html,https://dimg04.c-ctrip.com/images/Z80p180000013uw9yF21F_C_180_180.jpg,白山黑水,5分,2019-10-25
鼋头渚每个季节都可以去，而且看到的风景也是不一样的，尤其是3月的时候一定要去看一下那里的樱花真的是美极了，特别喜欢，太湖波涛汹涌的感觉。,https://gs.ctrip.com/html5/you/comment/detail/1775/11/159253102.html,https://dimg04.c-ctrip.com/images/Z80p16000000zciz2B981_C_180_180.jpg,我想遇到你,5分,2019-06-11
景色很美，樱花绽放，尤其是夜樱为一绝，跟我以前曾经游览过的鼋头渚大不一样，但人、车进出很不方便。,https://gs.ctrip.com/html5/you/comment/detail/1775/11/158245831.html,https://dimg04.c-ctrip.com/images/t1/headphoto/699/910/854/683dab66bb374136af9930ea204dfc7e_C_180_180.jpg,_WeCh****204238,5分,2019-03-31
里面很大，公园一样没啥景点，就一个太湖，去的时候很热，随便逗了圈就出来了，电瓶车很贵要20无语,https://gs.ctrip.com/html5/you/comment/detail/1775/11/164077492.html,https://dimg04.c-ctrip.com/images/Z80p180000013uw9yF21F_C_180_180.jpg,189****6271,4分,2020-08-11
樱花盛开的时候最美啦啦啦啦，如果赶上圆月升空或者烟花节，简直美的不要不要的。不过需要善于发现美的眼睛以及好的摄影技术才可以拍下美丽的景色。下图为网络借图，感觉拍的比较有感觉。,https://gs.ctrip.com/html5/you/comment/detail/1775/11/160732352.html,https://dimg04.c-ctrip.com/images/Z80s180000013ujui4988_C_180_180.jpg,喜欢和你去旅行,5分,2019-09-02
很不错的景点 确实能称得上无锡的标志之一 带孩子的记得一定要从充山门进去哦 仙岛倒是可去可不去的地方,https://gs.ctrip.com/html5/you/comment/detail/1775/11/159806455.html,https://dimg04.c-ctrip.com/images/fd/headphoto/g2/M03/BF/16/CghzgFVnuj2AdxHQAAEMckSyjHQ968_C_180_180.jpg,ChrisQian,5分,2019-07-18
节假日里做游船去太湖仙岛给我一种印度人坐火车的感觉 但是天气太热啦，而且感觉太晒啦，只想坐在湖边吹吹风！但无锡就是这样，每次都有新感觉！,https://gs.ctrip.com/html5/you/comment/detail/1775/11/158649668.html,https://dimg04.c-ctrip.com/images/Z80j0l000000cz8er7377_C_180_180.jpg,百合1203,5分,2019-05-03
很好的地方！,https://gs.ctrip.com/html5/you/comment/detail/1775/11/163396075.html,https://dimg04.c-ctrip.com/images/headphoto/274/695/328/c0126239875d493295277cb57aa166d3_C_180_180.jpg,yi****g_,5分,2020-05-07
