标题,标题链接,头像,user-detail__name,totalStarIcon1,resource_date
一家三口陪着婆婆去茅山烧香，自然风光无限，在山顶犹如置身仙境，还有神奇的喜客泉，乐趣无穷，明年还要去。,https://gs.ctrip.com/html5/you/comment/detail/1935/11/141221847.html,https://dimg04.c-ctrip.com/images/Z8060i0000009ikfa53BF_C_180_180.jpg,M17****211,5分,2017-10-15
环境很好，空气清新，景点很多，值得推荐！亲爱的小朋友们，大家好！三月份去是最好的季节，不冷又不热，这是花开的季节！！！！,https://gs.ctrip.com/html5/you/comment/detail/1935/11/153897201.html,https://dimg04.c-ctrip.com/images/fd/headphoto/g3/M07/C3/C0/CggYGVXVgoWAHxQBAAAc_io7_Cw204_C_180_180.jpg,黎明前的黑夜,5分,2018-03-18
携程上订的优待票，出票很方便，整个茅山风景区非常大，要换乘景区的交通车，每个景点都很美，气势也很雄伟，山顶云雾缭绕，仙气十足。景区环境很好，很干净，就是吃饭贵，不过还是值得一玩的。,https://gs.ctrip.com/html5/you/comment/detail/1935/11/144342089.html,https://dimg04.c-ctrip.com/images/fd/headphoto/g4/M08/00/F3/CggYHlXc_ZiABM3dAAE7mnG-Kmo560_C_180_180.jpg,寒冰,5分,2017-12-17
茅山位于江苏省句容市与金坛交界处，南北约长10公里，东西约宽5公里，面积50多平方公里。茅山是指中国江苏省的一座道教名山，是道教上清派的发源地，被道家称为“上清宗坛”。有“第一福地，第八洞天”之美誉。茅山是中国江苏省的一座道教名山，是道教上清派的发源地，被道家称为“上清宗坛”。有“第一福地，第八洞天”之美誉！也是中国六大山区抗日根据地之一。位于江苏句容市。山上景点多，有九峰、十九泉、二十六洞、二十八池之胜景，峰峦叠嶂，云雾缭绕，气候宜人，山上奇岩怪石林立密集，大小溶洞深幽迂回，灵泉圣池星罗棋布，曲涧溪流纵横交织，绿树蔽山，青竹繁茂，物华天宝。茅山主峰大茅峰似绿色苍龙之首，也是茅山的最高峰海拔372.5米。茅山风景区1986年被省政府列为省级森林公园批准为省甲级风景名胜区。同时，这里既是道教圣地，又是抗日根据地，其自然景观、人文景观、森林景观、革命历史观融为一体，胜似仙境。总规划面积32平方公里，九霄万福宫雄居其上，二茅峰、三茅峰蜿蜒而下，与主峰高低起伏，相映成辉。,https://gs.ctrip.com/html5/you/comment/detail/1935/11/124567943.html,https://dimg04.c-ctrip.com/images/fd/headphoto/g1/M07/04/4C/CghzflTvyqqAb6HcAAKFX2al2Eg778_C_180_180.jpg,海布里岁月,5分,2017-09-30
"服务很好,特别是误多买了一次门票,纠纷办公室及时联系帮忙退票",https://gs.ctrip.com/html5/you/comment/detail/1935/11/116853921.html,https://dimg04.c-ctrip.com/images/t1/headphoto/164/424/952/04eab99bd26f47acadef4fd3f95b9f37_C_180_180.jpg,M22****4061,5分,2017-07-04
景区比十年前规范了！取票方便，网上定优惠力度大！值得一看！,https://gs.ctrip.com/html5/you/comment/detail/1935/11/153897028.html,https://dimg04.c-ctrip.com/images/Z80h180000013xc9e3F64_C_180_180.jpg,叮当可可豆,5分,2018-03-18
玩起来肯定很开心的。注意一下这个是茅山景区门票，不止一个点，所以不要浪费了。这个门票一定要走西门，句容市那边的，你要走常州这边的，切记！！,https://gs.ctrip.com/html5/you/comment/detail/1935/11/122153461.html,https://dimg04.c-ctrip.com/images/t1/headphoto/136/299/437/649eb217e3e54746b7a53b8665e14b00_C_180_180.jpg,M18****716,4分,2017-09-17
人少，空气好，景色适合散步休闲，但是确实少了一点指路牌，景区游览车配有讲解，坐车一站站游览，不累,https://gs.ctrip.com/html5/you/comment/detail/1935/11/157294945.html,https://dimg04.c-ctrip.com/images/Z80p180000013uw9yF21F_C_180_180.jpg,01****910,4分,2018-11-25
景色超级赞，只是还有很多景点正在维修，感觉没有完全开发完成，既然都到茅山了，去完一趟还是值得的。相信景区如果全部修建完成会更值得游玩的。,https://gs.ctrip.com/html5/you/comment/detail/1935/11/142011660.html,https://dimg04.c-ctrip.com/images/t1/headphoto/699/910/854/683dab66bb374136af9930ea204dfc7e_C_180_180.jpg,M25****9810,5分,2017-12-01
景点车挺方便，适合腿脚不何的老年人！吃饭建议去老鹅一条街,https://gs.ctrip.com/html5/you/comment/detail/1935/11/138808912.html,https://dimg04.c-ctrip.com/images/t1/headphoto/272/077/772/76b262d0cc24492abc5c6784c903c2ab_C_180_180.jpg,M15****626,5分,2017-10-08
仙境，尤其在山顶感觉很好，自驾方便，淡季人少，值得一玩。,https://gs.ctrip.com/html5/you/comment/detail/1935/11/57878508.html,https://dimg04.c-ctrip.com/images/fd/headphoto/g4/M09/16/A7/CggYHVYZ_PqAdOcjAAQnsYTAjS4259_C_180_180.jpg,139****0957,4分,2015-08-17
十一长假去的，九点多到茅山，取票很方便，人不多，出来的时候人就多了，景色宜人，空气很好。孩子们玩的很开心，坐了景区的大巴车，实际没走多少路，很舒服，看了老子像，孩子们更开心！,https://gs.ctrip.com/html5/you/comment/detail/1935/11/138623277.html,https://dimg04.c-ctrip.com/images/Z80p180000013uw9yF21F_C_180_180.jpg,_WeCh****64922,5分,2017-10-03
来评价下茅山，正在争创5A景区，人少环境好，原生态东西多。道教还是挺有特色相对于中国景点到处的佛教。仙人洞很不错，泉水很甜，值得一去！,https://gs.ctrip.com/html5/you/comment/detail/1935/11/5939717.html,https://dimg04.c-ctrip.com/images/Z80p180000013uw9yF21F_C_180_180.jpg,D94****95,4分,2014-07-15
来得比较早，人不是很多，比较舒适。我们是登山步道上去，然后从大巴车路线走下来的，两万步左右，个人觉得山里空气挺好，慢慢走也不是很累，时间充裕、体力可以的话建议徒步，不错的。,https://gs.ctrip.com/html5/you/comment/detail/1935/11/153348102.html,https://dimg04.c-ctrip.com/images/t1/headphoto/062/938/215/f5f05c77006946428867e3c0dae6f4eb_C_180_180.jpg,M51****074,4分,2018-02-17
"值得一去，道教是我们的本土教,茅山是我国道教上清派发源地,历史上曾经有四十五代宗师相继传承茅山道学文化。是开通智慧,祈福迎祥的一佳处",https://gs.ctrip.com/html5/you/comment/detail/1935/11/152474279.html,https://dimg04.c-ctrip.com/images/Z80h180000013xc9e3F64_C_180_180.jpg,135****2797,5分,2018-01-07
直接坐中巴到山顶，然后一一站一站往下走，茅山三怪，都看了一遍，挺不错的，体力好的可以选择徒步路线，时间充裕其实还有很多值得探索的地方，都说茅山抽签灵验，我也抽了个，上上签哟,https://gs.ctrip.com/html5/you/comment/detail/1935/11/141579154.html,https://dimg04.c-ctrip.com/images/Z80p0d0000006sazfD8DB_C_180_180.jpg,霓妳,5分,2017-11-05
山底新四军纪念馆，新四军纪念碑，山上的景色还不错，以前这是一个道教烧香点，现在改的还不错。,https://gs.ctrip.com/html5/you/comment/detail/1935/11/155697231.html,https://dimg04.c-ctrip.com/images/t1/headphoto/882/320/089/158cae5ddb6143c0b6ae18523614cf08_C_180_180.jpg,Sun丶grow,4分,2018-07-14
景色不错，管理规矩，很满意的！,https://gs.ctrip.com/html5/you/comment/detail/1935/11/93123020.html,https://dimg04.c-ctrip.com/images/Z80p180000013uw9yF21F_C_180_180.jpg,ab****088,5分,2016-12-11
这里的风景还是不错的，风景宜人，绿树成荫，青山绿水白水绕东城，春江潮水连海平，海上明月共潮生青山留不住，毕竟东流去，你们一定一定,https://gs.ctrip.com/html5/you/comment/detail/1935/11/153595740.html,https://dimg04.c-ctrip.com/images/t1/headphoto/882/320/089/158cae5ddb6143c0b6ae18523614cf08_C_180_180.jpg,M49****576,4分,2018-02-26
慕名而来，景区挺大的，坐交通车上到顶宫，然后再往下走游览其他景点，交通车也可以随时坐。印宫（仙人洞、华阳洞），喜客泉……值得去。,https://gs.ctrip.com/html5/you/comment/detail/1935/11/152377096.html,https://dimg04.c-ctrip.com/images/t1/headphoto/491/056/464/eb3c7472323e4c3598f58ffa8a6fce99_C_180_180.jpg,_WeCh****47132,5分,2017-12-31
跑去算命了，取缔了。遇到个假算命的说个几句就要钱,https://gs.ctrip.com/html5/you/comment/detail/1935/11/118143703.html,https://dimg04.c-ctrip.com/images/Z80m11000000qz10n14F0_C_180_180.jpg,M22****5605,5分,2017-08-04
是AAAAA风景区，景色不错，青山绿水，树木十分高大，还有高尔夫球场和茶博园，是旅游胜地,https://gs.ctrip.com/html5/you/comment/detail/1935/11/58596435.html,https://dimg04.c-ctrip.com/images/fd/headphoto/g4/M01/E7/01/CggYHVYTvBiAEH5kAAAdlut7Cyc600_C_180_180.jpg,_CFT01****4252928,4分,2015-10-04
上山非常快，下山很方便，想玩哪个景点都能直达。,https://gs.ctrip.com/html5/you/comment/detail/1935/11/138708486.html,https://dimg04.c-ctrip.com/images/t1/headphoto/463/352/613/9d877effaa3d4bd0b951bb4c60209b3b_C_180_180.jpg,阿勇安徽省,5分,2017-10-06
景点服务质量很好，环境优美，道家圣地值得朝圣！,https://gs.ctrip.com/html5/you/comment/detail/1935/11/73634128.html,https://dimg04.c-ctrip.com/images/headphoto/187/939/112/5109364f353947fc92975f68a32d5b67_C_180_180.jpg,黎燕,5分,2016-05-02
感觉还可以吧！全程都有专车接送，游客不是很多,https://gs.ctrip.com/html5/you/comment/detail/1935/11/155708229.html,https://dimg04.c-ctrip.com/images/fd/headphoto/g1/M03/45/3B/CghzfVVuYDGAZm-QAABmQTFafz0299_C_180_180.jpg,小小,4分,2018-07-15
仙雾缭绕，仙气飘飘，感受道家文化，不虚此行！,https://gs.ctrip.com/html5/you/comment/detail/1935/11/153509015.html,https://dimg04.c-ctrip.com/images/Z80h180000013xc9e3F64_C_180_180.jpg,300****273,5分,2018-02-22
总的来说还可以吧，不过错过了好几个好玩的景点,https://gs.ctrip.com/html5/you/comment/detail/1935/11/138720541.html,https://dimg04.c-ctrip.com/images/t1/headphoto/491/056/464/eb3c7472323e4c3598f58ffa8a6fce99_C_180_180.jpg,_WeCh****103666,5分,2017-10-06
上午烧香，中午周边农场农家乐吃饭，下午游玩。,https://gs.ctrip.com/html5/you/comment/detail/1935/11/58438786.html,https://dimg04.c-ctrip.com/images/fd/headphoto/g3/M07/92/28/CggYGVXqQlCASgOJAAAepGA5s78047_C_180_180.jpg,邱承飞,5分,2015-09-21
风景还不错，值得去玩一玩，记得买景区交通票,https://gs.ctrip.com/html5/you/comment/detail/1935/11/153898265.html,https://dimg04.c-ctrip.com/images/t1/headphoto/057/777/943/0b93f8268d5546308915f4f9fcaa9483_C_180_180.jpg,M26****2516,5分,2018-03-18
天气下雨，山顶雾气缭绕，茅山整体感觉不错。,https://gs.ctrip.com/html5/you/comment/detail/1935/11/153445653.html,https://dimg04.c-ctrip.com/images/Z80p180000013uw9yF21F_C_180_180.jpg,133****6805,5分,2018-02-20
上山时候走登山道上的，强度适中。总体环境很舒适。唯一感觉有点坑的是山上的巴士不管你坐单程还是往返都一样价格，感觉很不合理。,https://gs.ctrip.com/html5/you/comment/detail/1935/11/142023842.html,https://dimg04.c-ctrip.com/images/Z80p180000013uw9yF21F_C_180_180.jpg,psc_sh2,5分,2017-12-02
景区值得一游，一路乘坐景区游览车，不累，很休闲，景色怡人，天然大氧吧，只是进景区的路导航都识别不了，绕了一大圈才找到入口。,https://gs.ctrip.com/html5/you/comment/detail/1935/11/141360494.html,https://dimg04.c-ctrip.com/images/Z80h180000013xc9e3F64_C_180_180.jpg,118****097,4分,2017-10-22
景区景色秀美，景点管理和游览线路安排都超好,https://gs.ctrip.com/html5/you/comment/detail/1935/11/116620219.html,https://dimg04.c-ctrip.com/images/Z80p180000013uw9yF21F_C_180_180.jpg,D03****03,5分,2017-05-15
景区环境很美啊～交通也很方便，就是指示标牌有点混乱～虽然是小长假出游，但是人不算很多～总体还是赞赞哒。,https://gs.ctrip.com/html5/you/comment/detail/1935/11/100349969.html,https://dimg04.c-ctrip.com/images/Z80g0k000000bylwg1A92_C_180_180.jpg,bearjiejie,5分,2017-04-03
景区规划的不错，乘景区内的游览车很方便，,https://gs.ctrip.com/html5/you/comment/detail/1935/11/157796940.html,https://dimg04.c-ctrip.com/images/Z80w0v000000jqhd0F71D_C_180_180.jpg,136****8599,4分,2019-02-07
本来没抱太大期望，一个山而已能怎么样呢？但是实际大大出乎我的意料，景区非常成熟，环境建筑管理都非常棒，游玩体验很好，而且景区还在扩展新的功能区，非常期待。本来觉得门票有点贵，但是实际去过之后觉得值这个钱，推荐大家可以去玩一玩。携程订票有专门的出票口取票很方便，景区提供一定数量的储物柜可以放心存储不必要的东西，提醒一定要买景区的交通票，不然会后悔的，私家车不允许上山请注意。,https://gs.ctrip.com/html5/you/comment/detail/1935/11/153551705.html,https://dimg04.c-ctrip.com/images/t1/headphoto/547/156/391/ce8681dd9bc04cfdb2e22313e46962ee_C_180_180.jpg,妖妖sticky,5分,2018-02-24
道之所往，心之所向。仙道贵生，无量度人。,https://gs.ctrip.com/html5/you/comment/detail/1935/11/153483275.html,https://dimg04.c-ctrip.com/images/Z80p180000013uw9yF21F_C_180_180.jpg,_WB1****307,5分,2018-02-21
风景优美，人杰地灵，人间仙境，流连忘返！,https://gs.ctrip.com/html5/you/comment/detail/1935/11/153463679.html,https://dimg04.c-ctrip.com/images/t1/headphoto/724/518/802/e201a429d7a54f72ade0df32a3d59b2f_C_180_180.jpg,_WeCh****056998,5分,2018-02-21
红色之旅，道教圣地，景区观光车非常方便。,https://gs.ctrip.com/html5/you/comment/detail/1935/11/153448545.html,https://dimg04.c-ctrip.com/images/t1/headphoto/491/056/464/eb3c7472323e4c3598f58ffa8a6fce99_C_180_180.jpg,烟斗,5分,2018-02-20
不错的一次**，风景也很好看，就是有点冷,https://gs.ctrip.com/html5/you/comment/detail/1935/11/152410957.html,https://dimg04.c-ctrip.com/images/Z80v0k000000cia7p83D6_C_180_180.jpg,M21****451,5分,2018-01-02
网上买比现场买划算多了，就是写着中秋送月饼当天基本么有看到有人领。风景也是很不错的、也不需要爬山、车子可以送达各个景点。,https://gs.ctrip.com/html5/you/comment/detail/1935/11/138797759.html,https://dimg04.c-ctrip.com/images/fd/headphoto/g4/M06/95/7A/CggYHVXyigWALAlWAAC8m_Y6HKs245_C_180_180.jpg,一X三,5分,2017-10-08
"我一直以为茅山应该算是传统的旅游目的地，现在看来是我错了，除了传统的道教概念和新赋的养生福地概念，山上也在大兴土木，已经完成的景点，我基本都是近两年的。
整个景区还是很不错的，无论从自然景观还是人文色彩，都值得到此一游，只是在游客服务上，确实诸多问题。",https://gs.ctrip.com/html5/you/comment/detail/1935/11/121229085.html,https://dimg04.c-ctrip.com/images/Z80g14000000vol841788_C_180_180.jpg,Shuying,4分,2017-09-09
茅山位于江苏省句容市与金坛交界处，南北约长10公里，东西约宽5公里，面积50多平方公里。茅山是指中国江苏省的一座道教名山，是道教上清派的发源地，被道家称为“上清宗坛”。有“第一福地，第八洞天”之美誉。,https://gs.ctrip.com/html5/you/comment/detail/1935/11/119844838.html,https://dimg04.c-ctrip.com/images/Z80h180000013xc9e3F64_C_180_180.jpg,138****8553,5分,2017-08-25
早上去的，有很多景点，还不错，风景挺美的,https://gs.ctrip.com/html5/you/comment/detail/1935/11/116500867.html,https://dimg04.c-ctrip.com/images/t1/headphoto/903/173/918/eb4b7bea9720440dac09eab89328ab00_C_180_180.jpg,M46****098,5分,2017-04-23
7月22日，天好热，景区淡季，游人不多。单位集体活动，携程网订票很方便，一行人乘车只去了3个点，主要参观了新四军纪念馆。附近的饭店价格不贵，味道蛮好，14人分两桌共消费了450。店家还热心的告诉我们，八一节那天景区是免费开放的，一般人我不告诉他，呵呵。,https://gs.ctrip.com/html5/you/comment/detail/1935/11/115890308.html,https://dimg04.c-ctrip.com/images/Z80j060000001z6h2F10E_C_180_180.jpg,下雨天7741,5分,2016-07-24
景点服务很好，景色很好，道观香火很旺盛…,https://gs.ctrip.com/html5/you/comment/detail/1935/11/13996189.html,https://dimg04.c-ctrip.com/images/Z80p180000013uw9yF21F_C_180_180.jpg,_CFT01****9518888,5分,2015-04-19
景点还不错，风景很好，全程几乎不用走什么路都有景交车，很适合一家人去游玩，唯一一点也是最不满意的就是到想到下一个景点事的排队等交通车，但是那叫排队啊？！根本也没人管，插队，乱挤，攀爬，翻越护栏，一点秩序也没有，而且排队时人超多，希望大家避开这一点。,https://gs.ctrip.com/html5/you/comment/detail/1935/11/13813686.html,https://dimg04.c-ctrip.com/images/fd/headphoto/g4/M04/D9/55/CggYHFYR2YeAXNUCAADRWQ0KdRs224_C_180_180.jpg,M17****302,4分,2015-04-01
从镇江到茅山得在句容换趟车，有点折腾。作为道教圣山，很多东西都是新建新修的，专门去采风的人士会略感失望。作为纯粹是去踏青旅游的门外汉倒是倍感心旷神怡。游客不多，景区交通方便，最重要的是满目苍翠，令人流连忘返。,https://gs.ctrip.com/html5/you/comment/detail/1935/11/4580268.html,https://dimg04.c-ctrip.com/images/fd/headphoto/g1/M0A/17/C9/CghzfFTQch-AelFqAA0RdBxlcpM116_C_180_180.jpg,龙猪妈妈,5分,2014-04-29
茅山真没什么玩的，门票包含景区交通车应该在50元以下还可以看看，这个票价真不值,https://gs.ctrip.com/html5/you/comment/detail/1935/11/156748736.html,https://dimg04.c-ctrip.com/images//Z80s170000011mg19EEB3_C_180_180.jpg,M44****634,3分,2018-09-26
门票到那就拿到了，茅山也很好玩，喜欢。,https://gs.ctrip.com/html5/you/comment/detail/1935/11/116545679.html,https://dimg04.c-ctrip.com/images/t1/headphoto/062/938/215/f5f05c77006946428867e3c0dae6f4eb_C_180_180.jpg,_WeCh****78234,5分,2017-05-01
很干净，空气好，景区内交通很给力，方便,https://gs.ctrip.com/html5/you/comment/detail/1935/11/116505846.html,https://dimg04.c-ctrip.com/images/t1/headphoto/757/757/889/3b86691007a54fe684f07e198432d09b_C_180_180.jpg,M58****112,5分,2017-04-24
山上讓你感覺到心靈上的寧靜可以很平靜的在樹下悠閒的靜坐！也可打纜車一覽茅山之美,https://gs.ctrip.com/html5/you/comment/detail/1935/11/67608949.html,https://dimg04.c-ctrip.com/images/fd/headphoto/g3/M05/61/D8/CggYGVZakiWAfkvmAAE1fWmC8TE586_C_180_180.jpg,晨昕,5分,2015-11-29
风景很美，但是人真的好多，排队上景区的车排了大概快两个小时。还是很适合春游的。,https://gs.ctrip.com/html5/you/comment/detail/1935/11/13796102.html,https://dimg04.c-ctrip.com/images/fd/headphoto/g2/M05/52/09/CghzgVUJPbmAMYDLAADxb9mqpxc264_C_180_180.jpg,_CFT01****9651266,5分,2015-03-31
顶宫和老子像都挺壮观，爬山不高也不累,https://gs.ctrip.com/html5/you/comment/detail/1935/11/153561359.html,https://dimg04.c-ctrip.com/images/t1/headphoto/903/173/918/eb4b7bea9720440dac09eab89328ab00_C_180_180.jpg,maxwell7-11,5分,2018-02-24
玩的很开心，风景很好，以后还会再来。,https://gs.ctrip.com/html5/you/comment/detail/1935/11/153483153.html,https://dimg04.c-ctrip.com/images/Z8060o000000ff59jDB34_C_180_180.jpg,zola829,5分,2018-02-21
大巴乘到山顶一路走走玩玩！蛮轻松的！,https://gs.ctrip.com/html5/you/comment/detail/1935/11/138661567.html,https://dimg04.c-ctrip.com/images/t1/headphoto/424/398/503/0386f569fd0d4b488ff41b64bbc5743b_C_180_180.jpg,M24****4626,5分,2017-10-04
遵从道教文化的必须来看看 山色宜人 柳色青 空气湿润 环境很好  到处可见穿着各色道袍的道长和虔诚的香客 来这里品品素材 泡泡养生馆,https://gs.ctrip.com/html5/you/comment/detail/1935/11/109834099.html,https://dimg04.c-ctrip.com/images/Z80h0g0000008ob5c20CA_C_180_180.jpg,搏来的爱,5分,2017-06-11
玩的非常开心，下次还会来，五星好评,https://gs.ctrip.com/html5/you/comment/detail/1935/11/141652552.html,https://dimg04.c-ctrip.com/images/t1/headphoto/164/424/952/04eab99bd26f47acadef4fd3f95b9f37_C_180_180.jpg,M24****4994,5分,2017-11-08
非常不错的￣次旅行，下次还会去游玩,https://gs.ctrip.com/html5/you/comment/detail/1935/11/116418574.html,https://dimg04.c-ctrip.com/images/t1/headphoto/136/299/437/649eb217e3e54746b7a53b8665e14b00_C_180_180.jpg,_WeCh****12454,5分,2017-04-04
好好玩阿，下次和家人再一起来玩！,https://gs.ctrip.com/html5/you/comment/detail/1935/11/152404341.html,https://dimg04.c-ctrip.com/images/t1/headphoto/757/757/889/3b86691007a54fe684f07e198432d09b_C_180_180.jpg,M25****1057,5分,2018-01-02
不错，挺好的，环境优美，空气新鲜,https://gs.ctrip.com/html5/you/comment/detail/1935/11/116720010.html,https://dimg04.c-ctrip.com/images/Z80p0q000000gm2ks835D_C_180_180.jpg,航大大爱吃肉,5分,2017-06-05
茅山景点旅游景点无特色，但空气比较好。门票价格和景点不匹配，价格偏高。国庆假日人不多，游览比较轻松。总体不推荐。,https://gs.ctrip.com/html5/you/comment/detail/1935/11/58582669.html,https://dimg04.c-ctrip.com/images/Z80j0k000000c78n3F4DB_C_180_180.jpg,晏子YZ,5分,2015-10-03
时隔三年再游茅山，己是第三次登临茅山，感觉茅山的景区管理已上了一个台阶，尤其万寿宫的新建将不亚于顶宫和印宫，茅山景区的人文和自然景观相结合，不虚此行！,https://gs.ctrip.com/html5/you/comment/detail/1935/11/141488306.html,https://dimg04.c-ctrip.com/images/Z80p180000013uw9yF21F_C_180_180.jpg,118****628,5分,2017-10-30
比很久以前去的时候要好多了。先坐旅游巴士直接到山顶道观，然后顺着路向山下玩，巴士一站一站的停，还是比较方便的。,https://gs.ctrip.com/html5/you/comment/detail/1935/11/121133390.html,https://dimg04.c-ctrip.com/images/t1/headphoto/882/320/089/158cae5ddb6143c0b6ae18523614cf08_C_180_180.jpg,贪玩的武先生,5分,2017-09-04
地方特别好，确定时候天气也不错,https://gs.ctrip.com/html5/you/comment/detail/1935/11/117112096.html,https://dimg04.c-ctrip.com/images/Z80111000000rnq0zEB11_C_180_180.jpg,昵称,5分,2017-08-03
昔日烽烟地，今日遍黄花！！！！,https://gs.ctrip.com/html5/you/comment/detail/1935/11/89981819.html,https://dimg04.c-ctrip.com/images/fd/headphoto/g5/M06/CA/6F/CggYr1cLW-GALRTNAAAcv84IRMU089_C_180_180.jpg,M36****772,5分,2016-10-19
景色优美，一定要买含交通的票，旅途太远，都是盘山公路，玩了四个景点，都不错！尤其是顶宫，登高望远，风景美不胜收,https://gs.ctrip.com/html5/you/comment/detail/1935/11/15734735.html,https://dimg04.c-ctrip.com/images/Z80p180000013uw9yF21F_C_180_180.jpg,_WeCh****84604,5分,2015-05-03
茅山，多出名的地方，那天雾蒙蒙的看不清楚人也不多，感觉道观香火并不好,https://gs.ctrip.com/html5/you/comment/detail/1935/11/157652059.html,https://dimg04.c-ctrip.com/images/t1/headphoto/463/352/613/9d877effaa3d4bd0b951bb4c60209b3b_C_180_180.jpg,M54****707,4分,2019-01-17
上面没什么好的，可是山上的风景如画。在山顶敢 觉:一览重山小！！！！！,https://gs.ctrip.com/html5/you/comment/detail/1935/11/153092362.html,https://dimg04.c-ctrip.com/images/t1/headphoto/136/299/437/649eb217e3e54746b7a53b8665e14b00_C_180_180.jpg,_WeCh****029483,4分,2018-01-31
门票性价比不错，取票方便，虽然当天下雨，但人流相对少了，几大景点观感不错，可惜雨雾较大，未能看到山景全貌。,https://gs.ctrip.com/html5/you/comment/detail/1935/11/153929254.html,https://dimg04.c-ctrip.com/images/Z80p180000013uw9yF21F_C_180_180.jpg,tianfe****gqiang,5分,2018-03-20
三宫商业化严重，景区还没共享单车，想去五观看看吧，还要走老远去。,https://gs.ctrip.com/html5/you/comment/detail/1935/11/154328143.html,https://dimg04.c-ctrip.com/images/Z80i0v000000jhoxnA32F_C_180_180.jpg,嵩岳闲人,4分,2018-04-09
景区大，坐景区公交比较省力，服务态度也很好，休闲一下还是不错的,https://gs.ctrip.com/html5/you/comment/detail/1935/11/157325829.html,https://dimg04.c-ctrip.com/images/Z80p180000013uw9yF21F_C_180_180.jpg,蛋二,4分,2018-11-29
"茅山坐车一趟头，
说有景区实难求。
盘山汽车转又转，
不知看人是看山",https://gs.ctrip.com/html5/you/comment/detail/1935/11/154514051.html,https://dimg04.c-ctrip.com/images/t1/headphoto/699/910/854/683dab66bb374136af9930ea204dfc7e_C_180_180.jpg,118****242,4分,2018-04-21
回老家时顺便去的，离家只有20公里，小时候基本上年年去，那时候都是徒步上山，很有野趣，现在小巴上山省时省力，这个时间去风景很不错咯，我们那里的习惯是茅山要连去三年，明后年继续约咯?！,https://gs.ctrip.com/html5/you/comment/detail/1935/11/116420575.html,https://dimg04.c-ctrip.com/images/Z80p180000013uw9yF21F_C_180_180.jpg,_WeCh****22626,5分,2017-04-04
只去了一个部分 山顶 但是说好买门票送冰雪世界确实不太真 有点坑压根没看见什么冰雪世界 并且门口看门的大哥态度也就那样吧凶巴巴的,https://gs.ctrip.com/html5/you/comment/detail/1935/11/157117073.html,https://dimg04.c-ctrip.com/images/Z80h180000013xc9e3F64_C_180_180.jpg,_CFT01****0884473,3分,2018-10-31
门票的地图不准，有些地方还没完全弄好。。自己走的开心就好。。,https://gs.ctrip.com/html5/you/comment/detail/1935/11/156707778.html,https://dimg04.c-ctrip.com/images/Z80g0v000000jy6072749_C_180_180.jpg,M22****5052,4分,2018-09-22
