标题,标题链接,头像,user-detail__name,totalStarIcon1,resource_date
"不得不说，这里的夜景还不错，但是人超级多的
总而言之，还是推荐一下我最喜欢吃的吧！
1. 赵元山肉骨烧，强烈推荐一波猪蹄，真的超级棒，考的很烂，而且没有平常买的猪蹄的那种腥味，但是他那个扇骨有一些塞牙，价格好像是20块钱左右吧！性价比还是不错的
2. 狐狸家奶酪，听说焦糖味的比较好，但是我要的原味的也还可以，总体来说还是推荐的
3. 闻其香臭豆腐，超级想吃臭豆腐的我这个人很爱臭豆腐，可惜她不做了，好像是不让做了，还是怎样？但是那里还有鸡脚，可惜临近下班了，没吃上
4. 手工酸辣粉，吃完所有的东西，再来一份手工酸辣粉，真的就很饱。",https://gs.ctrip.com/html5/you/comment/detail/25486/11/159623114.html,https://dimg04.c-ctrip.com/images/t1/headphoto/272/077/772/76b262d0cc24492abc5c6784c903c2ab_C_180_180.jpg,M33****5907,4分,2019-07-07
第一次来三塘古街，江南水乡风情，各种小吃，评弹，真的很美哦！,https://gs.ctrip.com/html5/you/comment/detail/25486/11/158713191.html,https://dimg04.c-ctrip.com/images/t1/headphoto/982/089/752/f8c7b21182c94524ac4df328fdc7b3dc_C_180_180.jpg,M28****6972,5分,2019-05-06
苏州的七里山塘：七里山塘系大诗人白居易从杭州调任苏州刺史，为咗便利苏州水陆交通，开凿了一条西起虎丘东至阊门的山塘河，山塘河河北修建道路，称为“山塘街”，山塘河和山塘街长约七里，叫“七里山塘”。自古山塘街有“姑苏第一名街”之称。亦有民歌唱到：“上有天堂，下有苏杭。杭州有西湖，苏州有山塘。”,https://gs.ctrip.com/html5/you/comment/detail/25486/11/158269669.html,https://dimg04.c-ctrip.com/images/Z80d10000000ohpqw1187_C_180_180.jpg,魔女BB,4分,2019-04-04
山塘夜游是七点半左右才开始，本身街上没什么人，到了七点左右的时候人突然增多。看来都是慕名而来的。不过排起队了走的也很快，一艘船可以坐二十多个人。可以和站在附近的人聊聊天，旅行的时候认识各种各样的人也是很有意思的经验。夜游的船会驶向七里山塘的居民区，一切都是原始的样子没有现代化的改造。,https://gs.ctrip.com/html5/you/comment/detail/25486/11/87227464.html,https://dimg04.c-ctrip.com/images/fd/headphoto/g4/M01/BD/EA/CggYHlYOpDOAX57wAAMTu85eDWE232_C_180_180.jpg,到处浪,5分,2016-09-14
春节期间去的，晚上特别热闹，推荐大家去,https://gs.ctrip.com/html5/you/comment/detail/25486/11/164202931.html,https://dimg04.c-ctrip.com/images/Z80h180000013xc9e3F64_C_180_180.jpg,ncutzm,5分,2020-08-22
非常棒的地方古色与现代两种风格相结合,https://gs.ctrip.com/html5/you/comment/detail/25486/11/164291773.html,https://dimg04.c-ctrip.com/images/t1/headphoto/293/406/308/22631089f44a497495c005fce85f6a6f_C_180_180.jpg,M58****289,5分,2020-08-30
山塘街，优美的古街，好景色，值得推荐,https://gs.ctrip.com/html5/you/comment/detail/25486/11/163160811.html,https://dimg04.c-ctrip.com/images/fd/headphoto/g4/M00/A3/37/CggYHFa7LhOAYQqLAAAjetDKNH4582_C_180_180.jpg,唯思遁逸,5分,2020-04-03
七里山塘到虎丘，从阊门到虎丘很繁华,https://gs.ctrip.com/html5/you/comment/detail/25486/11/163699658.html,https://dimg04.c-ctrip.com/images/Z8011900000164du80A9A_C_180_180.jpg,峰行天下第一,5分,2020-06-22
夜晚漫步，吴侬软语，小曲儿很有意思,https://gs.ctrip.com/html5/you/comment/detail/25486/11/163213316.html,https://dimg04.c-ctrip.com/images/t1/headphoto/882/320/089/158cae5ddb6143c0b6ae18523614cf08_C_180_180.jpg,我爱妮妮宝贝,5分,2020-04-11
节假日超级多少人的，闲时又碰上下雨耶比较冷清相比于现代都市山塘街更有历史的气息，一路走下去不乏小礼品店铺，对于初来的人们可能会比较有吸引力，山塘街的小吃倒是不错，不贵且好吃。,https://gs.ctrip.com/html5/you/comment/detail/25486/11/159096855.html,https://dimg04.c-ctrip.com/images/Z80f14000000vs0m282DD_C_180_180.jpg,行走的岛屿,4分,2019-05-31
风景还行，来回40分钟很快就过去,https://gs.ctrip.com/html5/you/comment/detail/25486/11/163644105.html,https://dimg04.c-ctrip.com/images/Z80h180000013xc9e3F64_C_180_180.jpg,幼着点,5分,2020-06-13
山塘街还是蛮有特色的，卖吃的玩的穿的，也有酒吧，有意思的是过一座桥就是菜市场，很地道，可以体验老苏州的特色，一些建筑也是非常的苏试啦,https://gs.ctrip.com/html5/you/comment/detail/25486/11/160670218.html,https://dimg04.c-ctrip.com/images/fd/headphoto/g1/M04/5C/5F/CghzfFWBeKCAVNuiAADQ2E0h1ho572_C_180_180.jpg,佯装幸福,5分,2019-08-29
山塘夜景不错，小桥流水，古色古香，白日可去游船玩，山塘街还有许多苏州特色百年老店，比如油团子，马栋佩烧麦等，都深藏于山塘老街。,https://gs.ctrip.com/html5/you/comment/detail/25486/11/158550823.html,https://dimg04.c-ctrip.com/images/Z80b0u000000ivjr77AEE_C_180_180.jpg,M48****589,5分,2019-04-26
因为名气，白天的山塘经常摩肩接踵，人山人海，很难静下心来体会小桥流水人家的从容与平和。晚上来，倒是可以漫步小巷，包揽姑苏风韵。,https://gs.ctrip.com/html5/you/comment/detail/25486/11/158180871.html,https://dimg04.c-ctrip.com/images/Z8020e00000075vhtBEF2_C_180_180.jpg,洛神花开,5分,2019-03-23
非常好 风景很好 适合逛马路,https://gs.ctrip.com/html5/you/comment/detail/25486/11/163344674.html,https://dimg04.c-ctrip.com/images/zc0a170000011f8t5F2C8_C_180_180.jpg,史杜帕华里克,5分,2020-05-01
君到姑苏见，人家尽枕河！,https://gs.ctrip.com/html5/you/comment/detail/25486/11/161560341.html,https://dimg04.c-ctrip.com/images/Z80p180000013uw9yF21F_C_180_180.jpg,D25****56,5分,2019-10-15
山塘古街晚上特别美，很有当地特色，值得一去。,https://gs.ctrip.com/html5/you/comment/detail/25486/11/160698219.html,https://dimg04.c-ctrip.com/images/t1/headphoto/293/406/308/22631089f44a497495c005fce85f6a6f_C_180_180.jpg,随梦而飞_我心飞扬,5分,2019-08-30
山塘古街这里附近是苏州市区里的古街了，到了晚上这里人特别多啊，风景更是没话说来这里逛逛街非常的舒服景色很好相当的有情调啊。,https://gs.ctrip.com/html5/you/comment/detail/25486/11/160811413.html,https://dimg04.c-ctrip.com/images/Z80812000000s9zvsA29E_C_180_180.jpg,SFC申花魂,5分,2019-09-07
整体景色不错，时间大概1小时，但是游览河道在山塘街景区外面，订购的朋友注意一下。,https://gs.ctrip.com/html5/you/comment/detail/25486/11/165768592.html,https://dimg04.c-ctrip.com/images/t1/headphoto/724/518/802/e201a429d7a54f72ade0df32a3d59b2f_C_180_180.jpg,M28****865,2分,2021-02-17
"难得假期，约了闺蜜一起逛山塘街。

蓝天白云 让这条老街都变得更有韵味了些。
很多游客来这里 看老房子、工艺品，其实这里也藏了很多地道苏式小吃，绝对是吃货天堂。

每次来 我都会买马栋佩烧麦，这次也没例外，给她买了两个。赵元章肉骨烧的扇骨也是必点项目～还能去荣阳楼买两个油氽团子。

吃饱就想喝快乐水，还好山塘街也有茉沏。
我们喝了芝芝瓜瓜➕西柚多多，这两杯都属于清爽解渴的饮品。

晒太阳逛街出了一身汗，喝上一口 真是治愈。
这才是假期该有的模样吧～吃喝玩乐，开心！
【景色】
【趣味】",https://gs.ctrip.com/html5/you/comment/detail/25486/11/160987560.html,https://dimg04.c-ctrip.com/images/Z80l0a00000052x799832_C_180_180.jpg,_WeCh****57618,5分,2019-09-18
景美，虽然那天天气不太好，但沿途的风景真的超级超级好看！！！,https://gs.ctrip.com/html5/you/comment/detail/25486/11/159850764.html,https://dimg04.c-ctrip.com/images/t1/headphoto/207/494/838/fa687736cf3f484480526cfc0eb6c073_C_180_180.jpg,易贾人阿彤木,5分,2019-07-21
山塘街以其独特的地理位置、优越的水陆交通条件和独具特色的街区风貌，逐渐成为吴文化的展示窗口和苏式生活的体验地，是古城苏州城市发展的独特资源和文化旅游的特色名片。,https://gs.ctrip.com/html5/you/comment/detail/25486/11/158285732.html,https://dimg04.c-ctrip.com/images/Z8020x000000l9c89A7D0_C_180_180.jpg,不在意终点,4分,2019-04-05
十里山塘街 半部苏州史，富有历史韵味的水乡集市，虽然现在有点过于商业化，掩不住曾经的繁华与荣光，不变的只有一洗凉水。。。,https://gs.ctrip.com/html5/you/comment/detail/25486/11/161516315.html,https://dimg04.c-ctrip.com/images/Z80p180000013uw9yF21F_C_180_180.jpg,lwei16,5分,2019-10-12
七里山塘适合晚上去，最好夏天秋天，适合出游的时候，小吃的话看个人了，景区的吃的都不便宜，味道还不错，特色糕点每家都有自己的特色，也可以带一些给亲戚朋友尝一尝,https://gs.ctrip.com/html5/you/comment/detail/25486/11/162223379.html,https://dimg04.c-ctrip.com/images/Z80f1b000001a98erE85F_C_180_180.jpg,M36****8279,5分,2019-12-07
想拍照千万不要节假日期间去，人潮太多,https://gs.ctrip.com/html5/you/comment/detail/25486/11/161360422.html,https://dimg04.c-ctrip.com/images/t1/headphoto/685/724/771/3cd584c18f744104b47d3f3d075d10e3_C_180_180.jpg,M28****5840,5分,2019-10-05
城市里的古街，小桥流水人家全都有了,https://gs.ctrip.com/html5/you/comment/detail/25486/11/159589147.html,https://dimg04.c-ctrip.com/images/t1/headphoto/757/757/889/3b86691007a54fe684f07e198432d09b_C_180_180.jpg,拉姆斯盖特卓文君,5分,2019-07-05
夜景非常美，然后山塘街的表演挺好看的，里面布置的也很美，不过建议不要再那里拍古装照，超级坑。,https://gs.ctrip.com/html5/you/comment/detail/25486/11/164243155.html,https://dimg04.c-ctrip.com/images/Z80o180000013ulur1D76_C_180_180.jpg,M42****4210,5分,2020-08-25
订票需要过一个小时才可以用，在一个地方换票后到码头坐船，沿途景色还可以，有讲解，两边都是人家，感觉晚上会更热闹。,https://gs.ctrip.com/html5/you/comment/detail/25486/11/158573053.html,https://dimg04.c-ctrip.com/images/Z80g0a0000004oyde7769_C_180_180.jpg,甜筒q,5分,2019-04-28
长时间排队,https://gs.ctrip.com/html5/you/comment/detail/25486/11/163513160.html,https://dimg04.c-ctrip.com/images/t1/headphoto/646/318/109/a865fe5f5465407d8befd5dc487a8554_C_180_180.jpg,_WeCh****79259,4分,2020-05-24
夜景超级美，夏天白天太热，晚上逛吃逛吃，记得吃猪蹄哦，像不像打广告？其实真没有！到苏州必到山山塘街，想买的都有,https://gs.ctrip.com/html5/you/comment/detail/25486/11/159716342.html,https://dimg04.c-ctrip.com/images/Z80616000000yyh82819F_C_180_180.jpg,眉靓欣,5分,2019-07-13
非常好，离火车站仅一站地，属于市区的景点，人比想象的少，小吃挺丰富的，乘坐游船的确可以看到不一样的风景，推荐,https://gs.ctrip.com/html5/you/comment/detail/25486/11/160962571.html,https://dimg04.c-ctrip.com/images/Z80p180000013uw9yF21F_C_180_180.jpg,186****3691,5分,2019-09-16
晚上景色不错，再现江南古镇风韵，游玩时刚好淅淅沥沥下起了小雨，别有一番滋味在心头；希望再能把水质治理更好点。,https://gs.ctrip.com/html5/you/comment/detail/25486/11/158298574.html,https://dimg04.c-ctrip.com/images/Z80u0o000000eln6m8C68_C_180_180.jpg,西府布衣,4分,2019-04-06
逛山塘街最好就住在景区，晚上出来逛夜景，白天古老的街道，到了晚上就美丽得很。可以逛逛、吃吃，很惬意！,https://gs.ctrip.com/html5/you/comment/detail/25486/11/158593393.html,https://dimg04.c-ctrip.com/images/Z80d1b000001b2siaB0AA_C_180_180.jpg,_光影,5分,2019-04-30
山塘街以其独特的地理位置、优越的水陆交通条件和独具特色的街区风貌，逐渐成为吴文化的展示窗口和苏式生活的体验地，是古城苏州城市发展的独特资源和文化旅游的特色名片。山塘街有很多美食，酒吧，各种特色小店，很小资的生活调调。白天和晚上都很热闹，每次去苏州都要去山塘街各种物美食，听听小曲。,https://gs.ctrip.com/html5/you/comment/detail/25486/11/154473821.html,https://dimg04.c-ctrip.com/images/fd/headphoto/g4/M04/C0/BD/CggYHlbe-maAawmpAAAcsJ1TFCk176_C_180_180.jpg,crystal,5分,2018-04-18
"山塘古街地理位置不错就是苏州古城中心区域，交通便利山塘街地铁站步行6分钟左右，山塘街东西红尘中“一二等富贵风流之地”阊门，西至“吴中第一名胜”虎丘，全长约3600米，约合七华里，故称“七里山塘到虎丘”。
山塘街以其独特的地理位置、优越的水陆交通条件和独具特色的街区风貌，逐渐成为吴文化的展示窗口和苏式生活的体验地，是古城苏州城市发展的独特资源和文化旅游的特色名片。
餐饮也非常多有许多苏州当地小吃，也不乏国际知名连锁餐饮如星巴克、满记甜品等，不需要门票，来苏州推荐必玩景点之一！",https://gs.ctrip.com/html5/you/comment/detail/25486/11/154150495.html,https://dimg04.c-ctrip.com/images/Z80914000000w2yvp1E9F_C_180_180.jpg,新宇8晟世,5分,2018-03-28
七里山塘，美不胜收,https://gs.ctrip.com/html5/you/comment/detail/25486/11/162030184.html,https://dimg04.c-ctrip.com/images/t1/headphoto/164/424/952/04eab99bd26f47acadef4fd3f95b9f37_C_180_180.jpg,M28****305,5分,2019-11-19
山塘街很有名，老街古朴雅致，而且老建筑很多，很有江南水乡韵味，而且游客很多，老街小吃也很多，价格实惠，口味不错，交通便利，喜欢可以打卡！,https://gs.ctrip.com/html5/you/comment/detail/25486/11/161862833.html,https://dimg04.c-ctrip.com/images/t1/headphoto/903/173/918/eb4b7bea9720440dac09eab89328ab00_C_180_180.jpg,M22****3363,4分,2019-11-06
七里山塘很有江南韵味，小桥流水人家，古色古香的建筑，你所想象的江南水乡就是这个模样，人不算太多，悠闲的周末。让我想起了一首唐诗：君到姑苏见，人家尽枕河。古宫闲地少，水港小桥多。,https://gs.ctrip.com/html5/you/comment/detail/25486/11/161124116.html,https://dimg04.c-ctrip.com/images/Z80c0z000000mvhauE1E5_C_180_180.jpg,Cherry??2009^_^,4分,2019-09-23
古镇非常美丽，小桥流水人家，远离现代都市，品尝江南特色，坐游船观两岸屋前屋后，听董小宛与冒辟疆的故事。北码头可以赏民国风情建筑，一起回到民国初年。桥下吃乌梅，看绿树摇摆身姿！,https://gs.ctrip.com/html5/you/comment/detail/25486/11/161395372.html,https://dimg04.c-ctrip.com/images/t1/headphoto/491/056/464/eb3c7472323e4c3598f58ffa8a6fce99_C_180_180.jpg,M27****0444,5分,2019-10-06
需要提前一点订票，山塘街上船，半小时，电子讲解，船上有空调，环境还不错，船走的路线沿山塘街往虎丘方向走穿过民居，晚上的夜景有些地方不是太清楚，这趟可能白天坐会有不一样的感受。,https://gs.ctrip.com/html5/you/comment/detail/25486/11/159943475.html,https://dimg04.c-ctrip.com/images/t1/headphoto/272/077/772/76b262d0cc24492abc5c6784c903c2ab_C_180_180.jpg,M19****345,4分,2019-07-26
苏州山塘古街小桥流水人家，真的很精致，很特别，山塘古街，千年古街，有文化底蕴，趣味性强，性价比超高的，吃吃当地的美食，值得再来的地方。,https://gs.ctrip.com/html5/you/comment/detail/25486/11/158803186.html,https://dimg04.c-ctrip.com/images/Z806180000014r4pz3AE0_C_180_180.jpg,gz当地向导伊妹儿,4分,2019-05-14
苏州山塘街就是吃货的好去处，最让我难忘的美食就是臭豆腐，美味香囗。,https://gs.ctrip.com/html5/you/comment/detail/25486/11/161957135.html,https://dimg04.c-ctrip.com/images/Z80u190000016r29lB1E8_C_180_180.jpg,M10****724,5分,2019-11-13
啊呸，臭不要脸呢，别p了，建议别去，啥也不是,https://gs.ctrip.com/html5/you/comment/detail/25486/11/165466672.html,https://dimg04.c-ctrip.com/images/t1/headphoto/685/724/771/3cd584c18f744104b47d3f3d075d10e3_C_180_180.jpg,有些话想对狗说,1分,2021-01-04
苏州城内二条非常著名的古街，关键还是免费当的！游人非常多！保持的非常完好!就是商业味道比较浓!观赏古街最好晚上来比较有趣味!,https://gs.ctrip.com/html5/you/comment/detail/25486/11/159907056.html,https://dimg04.c-ctrip.com/images/fd/headphoto/g3/M06/55/43/CggYG1Yfq1CAZ3PwAAAZ7e-WWxc025_C_180_180.jpg,fuyanxiang,4分,2019-07-24
在昆曲馆观看了昆曲《牡丹亭》和评唱《春江花月夜》，了解苏州传统文化，大有收获。感叹，文化传承不易，珍惜。,https://gs.ctrip.com/html5/you/comment/detail/25486/11/159856780.html,https://dimg04.c-ctrip.com/images/0Z85i120007ixcb65B9C1_C_180_180.jpg,先生,5分,2019-07-21
七里山塘，应该是最有苏州特色的一条街，沿河而坐，来壶茶，听听评弹，感受的就是老苏州的生活。另外，也可以带点儿山塘特产山塘狸猫送人，比带吃的强。,https://gs.ctrip.com/html5/you/comment/detail/25486/11/95099940.html,https://dimg04.c-ctrip.com/images/fd/headphoto/g4/M02/35/D1/CggYHFYxwqeAZRmcAADUeq-bChg491_C_180_180.jpg,大虫子James,4分,2017-01-13
"七里山塘应该算是第一次来苏州必来的地方了，这里不仅可以感受到江南水乡最独特的气质，也会因为古建筑的风格把最直观的古典文化表现出来，品味属于江南的人文在山塘街感受慢时光

详细地址：苏州市姑苏区

人均消费：免费


营业时间：全天开放

交通攻略：轨道交通2号线山塘街3号出口

特色推荐：
山塘街靠着山塘河，全长3600米的道路上有老式建筑也有小桥流水特色，而存在里面的店铺延续着最古典的风格，把江南特有的色彩都展现在你的眼前

游船码头似乎是带你畅游苏州河流与美景不错的起始点，坐在船上看沿途的风景，山塘河连接着阊门与虎丘，这些也代表着姑苏传统文化延续，赏美景沉浸在江南环境氛围中

如果傍晚来游玩的话你不仅可以看到夜的静谧，也会看到大红灯笼高高挂呈现出来的喜庆特色，黄色的街灯与红色的灯笼交相辉映又把山塘街衬托出另外一种情调，白墙黑瓦中又带着古典韵味，是感性的也是触动的

实用tips：
进入山塘街需要带好口罩出示苏康码

七里山塘靠近石路步行街商圈，吃喝玩乐都可以满足哟

行走漫长又古老的街或许下一个转角你会发现姑苏的静谧，而游船的摆动又让整个氛围都有所提升。山塘街虽没有平江路那样漫长有看头，但她骨子中透露出的温婉尔雅和古典低调却一直都吸引着我去探索品味，会发现它所带给你的持续文化色彩，是感触的也是留念的",https://gs.ctrip.com/html5/you/comment/detail/25486/11/165606724.html,https://dimg04.c-ctrip.com/images/Z80f1f000001gb60923FE_C_180_180.jpg,别动我的火龙果,,2021-01-22
山塘街始建于唐代宝历年间，当时白居易奉命到苏州任刺史，着手开凿了山塘河。这条河在阊门与运河相接。在河塘旁筑堤，即山塘街。山塘街因其独特的地理位置和优越的水陆交通条件，曾是明清时期中国商贸、文化最为发达的街区之一。街道呈水陆并行、河街相邻的格局，建筑精致典雅、疏朗有致，街面店肆林立，会馆集聚，再现了山塘街的盛世繁华。,https://gs.ctrip.com/html5/you/comment/detail/25486/11/162739333.html,https://dimg04.c-ctrip.com/images/Z80b1f000001gt42bA1DB_C_180_180.jpg,王之号角,4分,2020-01-27
山塘街，七里山塘，游客比较多，逛逛小吃，看看风景，无锡有一条跟山塘街类似的古街好像叫清名桥，夜景好于山塘街，只是名气不够,https://gs.ctrip.com/html5/you/comment/detail/25486/11/158683220.html,https://dimg04.c-ctrip.com/images/Z804080000002xbbk59CD_C_180_180.jpg,爱尔兰小镇,4分,2019-05-04
七里山塘，千年古街。一千多年前苏州最繁华，最金粉之地。也是苏州城保留最完整的古街道之一，是苏州必玩景点！山塘街里面汇集了好多小吃，物美价廉，好吃不贵。而且山塘街地处市中心，却犹如远离喧嚣一般，悠闲自得，离火车站地铁一站地，推荐去苏州的游客能在山塘街停下脚步，欣赏下江南小桥流水。,https://gs.ctrip.com/html5/you/comment/detail/25486/11/158031399.html,https://dimg04.c-ctrip.com/images/Z80o0j000000a09ynBFDD_C_180_180.jpg,ID_Wang,5分,2019-03-02
山塘街位于苏州古城西北，东至红尘中“一二等富贵风流之地”阊门，西至“吴中第一名胜”虎丘，全长约3600米，约合七华里，故称“七里山塘到虎丘”。山塘街以其独特的地理位置、优越的水陆交通条件和独具特色的街区风貌，逐渐成为吴文化的展示窗口和苏式生活的体验地，是古城苏州城市发展的独特资源和文化旅游的特色名片。,https://gs.ctrip.com/html5/you/comment/detail/25486/11/157663759.html,https://dimg04.c-ctrip.com/images/Z80t11000000qn2bj83A0_C_180_180.jpg,黄大小姐,5分,2019-01-19
山塘街是由唐代诗人白居易在苏州做官时主持修建的，西北端至虎丘，东南端在阊门，全长约七里，故有“七里山塘”之称。可以自费乘游船，或是找家茶馆喝茶、听评弹。推荐几家特色小吃：1、乾生元，百年老店，生煎和面。2、大阿二生煎，顾名思义特色是生煎。3、赵元章，肉骨烧、猪蹄。4、山塘风味店，闻着臭吃着香的臭豆腐，一直都有人排队，只有一个小油锅在炸所以会等位比较久。5、其它的网红店：糖粥、狐狸家的酸奶、裕兴记的枫镇大面等。晚饭，我们选择的松鹤楼，百年老店，主要是去尝尝松鼠鱼、狮子头，还有苏式点心！吃完饭，我们步行回酒店，消消食，看看夜景。,https://gs.ctrip.com/html5/you/comment/detail/25486/11/155678766.html,https://dimg04.c-ctrip.com/images/Z80m1c000001dei0rC7D8_C_180_180.jpg,Y安然自若M,5分,2018-07-13
在苏州一共呆了两天，国庆节黄金周，所以你懂的，本来是想去看园林的，尽管也未必多懂，不过出租车师傅说了，去拙政园基本就是看人去了，所以晚上从酒店出来还是选择了山塘街，然还是一样一样的，人山人海接踵摩肩。。。我想冬天的山塘街一定会有点不同，好吧说说山塘街，应该是个有故事的老巷子，很多小店，有点像北京的南锣鼓巷，只不过多了小桥流水，显得更加的柔美，进口处是老字号松鹤楼，应该是苏帮菜的代表，本来想去吃被告知需要等至少两小时，所以放弃了，基本来说还是很不错的。。值得看看,https://gs.ctrip.com/html5/you/comment/detail/25486/11/58629986.html,https://dimg04.c-ctrip.com/images/fd/headphoto/g3/M04/6C/D9/CggYGlXnuCKAABPYAAAmxpdcabY204_C_180_180.jpg,tess,5分,2015-10-06
晚上过去的，相对而言，更加推荐平江路。山塘街给人的感觉…不好，到处都是赤膊在街上走的，不客气的说，有些脏乱差。还是去平江路吧，感觉好很多,https://gs.ctrip.com/html5/you/comment/detail/25486/11/164135085.html,https://dimg04.c-ctrip.com/images/t1/headphoto/857/872/237/edc9e981b00e436a8dcee595001d62fa_C_180_180.jpg,M29****907,3分,2020-08-16
这是一个走路，还有坐船都特别适合的一个地方，在这边的景观还是特别的不错，平常在这里的人也就十分的多，景色相当优美。,https://gs.ctrip.com/html5/you/comment/detail/25486/11/161988442.html,https://dimg04.c-ctrip.com/images/0Z86j120008cfgpu97DAF_C_180_180.jpg,人造人三号,4分,2019-11-16
夜晚的山塘家更为诱惑人。和许多江南水乡一样，这里也有依水而建的房屋。苏州街巷的布局和建筑特点都能在这里得见一二。美食美景还有一些趣味都可以在这里寻得。,https://gs.ctrip.com/html5/you/comment/detail/25486/11/159739584.html,https://dimg04.c-ctrip.com/images/Z80u0s000000hwezx351D_C_180_180.jpg,M26****9475,4分,2019-07-14
山塘街往里多走几步，就能听到苏州人闲话聊家常。白墙黛瓦，大红灯笼高悬。,https://gs.ctrip.com/html5/you/comment/detail/25486/11/159596605.html,https://dimg04.c-ctrip.com/images/t1/headphoto/295/828/780/6e6c2151ed65497c850945d5d2b702ae_C_180_180.jpg,红色利物浦1985,4分,2019-07-05
周末好天气特意来逛山塘街，人很多，现在商业氛围搞得不错，吃的也很多，河边的店里点个吃的喝的坐着看看游船划过，听听昆曲评弹也蛮有感觉的，就是老店不多。,https://gs.ctrip.com/html5/you/comment/detail/25486/11/161815615.html,https://dimg04.c-ctrip.com/images/Z80n0l000000d8r2j8536_C_180_180.jpg,紅氿,4分,2019-11-02
这边好多的苏州特色小吃，最推荐的就是在五芳斋的桂花圆子，是真的很好吃，糯糯的，口感简直了。这边的街道也是很有年代感，古香古色的。,https://gs.ctrip.com/html5/you/comment/detail/25486/11/160263016.html,https://dimg04.c-ctrip.com/images/zc02170000011l03o44C7_C_180_180.jpg,小民2011,4分,2019-08-12
