标题,标题链接,头像,user-detail__name,totalStarIcon1,resource_date
夜景很好！特色店很多！只是去的时候是七夕，人真的很多！坐船嘛，个人觉得没必要！都没看到什么景…,https://gs.ctrip.com/html5/you/comment/detail/25486/11/84457545.html,https://dimg04.c-ctrip.com/images/t1/headphoto/164/424/952/04eab99bd26f47acadef4fd3f95b9f37_C_180_180.jpg,M42****102,5分,2016-08-15
山塘街以小桥流水的样式出现，只可惜十一去的，人很多，但是还蛮好玩的。ps：那里的dq很有特色。,https://gs.ctrip.com/html5/you/comment/detail/25486/11/58598660.html,https://dimg04.c-ctrip.com/images/Z8010i0000009c4sq90D8_C_180_180.jpg,Esther_Zhao,5分,2015-10-04
美，晚上夜景更美、古色古香！完全突显出苏州的建筑的特色,https://gs.ctrip.com/html5/you/comment/detail/25486/11/58266738.html,https://dimg04.c-ctrip.com/images/fd/headphoto/g4/M07/A2/42/CggYHVXy4dyACd2tAACq2MI8TYQ634_C_180_180.jpg,baby弦弦,5分,2015-09-11
苏州最好看的湖景，音乐喷泉、李公堤、月光码头都很好看,https://gs.ctrip.com/html5/you/comment/detail/25486/11/155458446.html,https://dimg04.c-ctrip.com/images/Z80r0t000000ibmwr3882_C_180_180.jpg,_CFT01****5423918,5分,2018-06-29
老苏州历史街区，代表老苏州风貌，还是不错的。感觉坐游船还是必要的，从水上看和狂街的体验应该是完全不同的。另外感觉评弹表演的时间太短。,https://gs.ctrip.com/html5/you/comment/detail/25486/11/154665897.html,https://dimg04.c-ctrip.com/images/Z80p180000013uw9yF21F_C_180_180.jpg,189****8789,4分,2018-05-02
古色古香，典型的江南水乡，蕴含着非常多的味道。时隔多年再次来到这里，感受着江南水乡的气息，体味着苏州厚实的文化，上有天堂，下有苏杭！,https://gs.ctrip.com/html5/you/comment/detail/25486/11/108916675.html,https://dimg04.c-ctrip.com/images/Z80s0e00000075qud80E7_C_180_180.jpg,橙色的梦2014,5分,2017-06-04
苏州山塘古街的夜色非常的美。当夜幕来临古街灯光初上时，熙熙攘攘的游人，苏州河边的小桥流水人家与河上的游船一起组成一幅让你难忘的画面。,https://gs.ctrip.com/html5/you/comment/detail/25486/11/105282633.html,https://dimg04.c-ctrip.com/images/Z80k0800000037uruD0C3_C_180_180.jpg,理想,5分,2017-05-08
山塘街曾是明清时期中国商贸，文化最为发达的街区之一，被誉为“神州第一古街”。山塘老街360米，被称之“老苏州的缩影，吴文化的窗口”。,https://gs.ctrip.com/html5/you/comment/detail/25486/11/99633980.html,https://dimg04.c-ctrip.com/images/Z80t0a0000004mkz297A3_C_180_180.jpg,delphian13,5分,2017-03-29
苏州山塘街来过好多次了关于七只狸猫的传说也颇为好玩据说这里是曹雪芹笔下最热闹的烟花场所如今只保留了一小段不过也非常热闹适合各种年龄段,https://gs.ctrip.com/html5/you/comment/detail/25486/11/90618408.html,https://dimg04.c-ctrip.com/images/t1/headphoto/982/089/752/f8c7b21182c94524ac4df328fdc7b3dc_C_180_180.jpg,马特莱杜预,5分,2016-10-27
坐船游河，两岸还有很多古老的房子和水边生活的痕迹。,https://gs.ctrip.com/html5/you/comment/detail/25486/11/157595427.html,https://dimg04.c-ctrip.com/images/Z80p180000013uw9yF21F_C_180_180.jpg,_M13****8015,5分,2019-01-08
七狸山塘街，乃人间第一繁华地。,https://gs.ctrip.com/html5/you/comment/detail/25486/11/155196100.html,https://dimg04.c-ctrip.com/images/Z80u0z000000mledq8868_C_180_180.jpg,不乐不归,5分,2018-06-09
建筑风格独特，尤其是地面的砖，都是古物。非常喜欢。,https://gs.ctrip.com/html5/you/comment/detail/25486/11/154871536.html,https://dimg04.c-ctrip.com/images/Z80p0n000000dy8s151C2_C_180_180.jpg,齐铁嘴,5分,2018-05-16
山塘街建议傍晚去，可以河边去松鹤楼吃饭店晚上很漂亮,https://gs.ctrip.com/html5/you/comment/detail/25486/11/154806961.html,https://dimg04.c-ctrip.com/images/fd/headphoto/g1/M0A/82/6E/CghzfFUo-nyAV6WWAAA1nQQcVtk612_C_180_180.jpg,carrie102799,5分,2018-05-11
游船还是白天做，可以到虎丘下船，晚上看不到什么东西,https://gs.ctrip.com/html5/you/comment/detail/25486/11/154392917.html,https://dimg04.c-ctrip.com/images/t1/headphoto/982/089/752/f8c7b21182c94524ac4df328fdc7b3dc_C_180_180.jpg,骁DGg,5分,2018-04-13
山塘街景色宜人，古街的建筑风格独特，古城周边水系和建筑形成一道亮丽的风景线。古街道、风味小吃，传统丝绸，吸引众多游客前往。值得一游,https://gs.ctrip.com/html5/you/comment/detail/25486/11/101325319.html,https://dimg04.c-ctrip.com/images/Z80p180000013uw9yF21F_C_180_180.jpg,110****536,5分,2017-04-14
山塘街是苏州保留得很好的一条古街，一走进这条街就能让你感到古香古色的气息，山塘街刚好沿着一条小河，可以坐游船一览整条街的古代气息？,https://gs.ctrip.com/html5/you/comment/detail/25486/11/97778130.html,https://dimg04.c-ctrip.com/images/Z80t0d0000006ra1q89B0_C_180_180.jpg,喜欢旅游的小伙子,5分,2017-02-16
在苏州停留时间有限 就去了山塘街 本来想坐划的船 觉得这样才有感觉 但是船家说就我一个人太贵了 让我去坐大船70一张票 谁叫自己不是土豪 作为北方人 很喜欢江南这种小桥流水人家的小情小调,https://gs.ctrip.com/html5/you/comment/detail/25486/11/95805728.html,https://dimg04.c-ctrip.com/images/Z80v0c0000006oq3yA14F_C_180_180.jpg,豆丁它姐的,5分,2017-01-21
去过苏州多次，也许以前也来过，但这次在苏州同学的向导下真正好好逛了一次山塘街。今天有点细雨，但游人依旧如潮！夜色下的古街魅力十足！,https://gs.ctrip.com/html5/you/comment/detail/25486/11/92483468.html,https://dimg04.c-ctrip.com/images/Z80h090000003rmjdA297_C_180_180.jpg,辰宁在心,4分,2016-11-26
去过苏州多次，也许以前也来过，但这次在苏州同学的向导下真正好好逛了一次山塘街。今天有点细雨，但游人依旧如潮！夜色下的古街魅力十足！,https://gs.ctrip.com/html5/you/comment/detail/25486/11/91789326.html,https://dimg04.c-ctrip.com/images/Z80h090000003rmjdA297_C_180_180.jpg,辰宁在心,4分,2016-11-20
七里山塘，不仅美在水，美在古建，还有它的文化底蕴。,https://gs.ctrip.com/html5/you/comment/detail/25486/11/57665955.html,https://dimg04.c-ctrip.com/images/t1/headphoto/136/299/437/649eb217e3e54746b7a53b8665e14b00_C_180_180.jpg,M21****258,5分,2015-08-07
七里山塘，有很多好吃的好玩的，人也很多，很适合和朋友家人一起去逛的呢。,https://gs.ctrip.com/html5/you/comment/detail/25486/11/11393314.html,https://dimg04.c-ctrip.com/images/t1/headphoto/436/574/766/c4ecd25ed2174b70b8359eb66bfe8f1d_C_180_180.jpg,小队长1907,5分,2014-11-13
山塘古街也不知道来了多少次了，但是照片是真的好好看！很有江南水乡的感觉，人基本上什么时候都很多，尽头有个猫空，感兴趣可以去看一看,https://gs.ctrip.com/html5/you/comment/detail/25486/11/154182672.html,https://dimg04.c-ctrip.com/images/0Z83e120008fumtas14F2_C_180_180.jpg,猫球球球球,4分,2018-03-31
山塘夜里很好看，很美，小吃特别的多，很有特色，晚上的游人很多，还有游船，很多的特色精品店，找时间我还是会去的，很好，很有苏州特色,https://gs.ctrip.com/html5/you/comment/detail/25486/11/144388501.html,https://dimg04.c-ctrip.com/images/Z8020n000000el8puD1C1_C_180_180.jpg,_WeCh****638582,5分,2017-12-21
苏州除了各式各样奇妙的苏州园林之外，还有许多保留着古朴的老街，其中山塘古街就是一条这样的大街，正值国庆假期老街也变得非常热闹了。,https://gs.ctrip.com/html5/you/comment/detail/25486/11/138793695.html,https://dimg04.c-ctrip.com/images/fd/headphoto/g2/M0A/0C/40/Cghzf1W-CVGATb0GAAAcOHbDx2Y972_C_180_180.jpg,whatever,5分,2017-10-08
带有江南水乡特色的商业街，和北京南锣鼓巷类似，只是一个有河一个小胡同很多。灯亮起来还是挺好看的。离留园很近，留园在山塘路另一边。,https://gs.ctrip.com/html5/you/comment/detail/25486/11/96750030.html,https://dimg04.c-ctrip.com/images/Z80911000000qscdn198A_C_180_180.jpg,凭楼僧语,4分,2017-02-07
山塘街江南水乡的的味道很重！典型的水乡！和乌镇类似！很喜欢！里面各种十元棉麻围巾特别多！,https://gs.ctrip.com/html5/you/comment/detail/25486/11/89896801.html,https://dimg04.c-ctrip.com/images/Z80r090000003pb0mF81C_C_180_180.jpg,姚豆豆,5分,2016-10-13
我最喜欢苏州的地方，若不坐游船，顺着河旁市井人家的小道一路走过去，体会静谧而温柔江南情调,https://gs.ctrip.com/html5/you/comment/detail/25486/11/58555673.html,https://dimg04.c-ctrip.com/images/Z80h180000013xc9e3F64_C_180_180.jpg,132****7560,5分,2015-10-01
山塘街是山塘河边的古老街道，走在山塘街上，体验苏州的味道。山塘街是免费的景点，值得一游。,https://gs.ctrip.com/html5/you/comment/detail/25486/11/13061662.html,https://dimg04.c-ctrip.com/images/Z80p180000013uw9yF21F_C_180_180.jpg,e19****85,5分,2015-01-28
更像条商业街，年代感不是很久。小吃一般，游船也一般，因为年代感不强，水质也不是十分干净。弹评男帅，商会可去可不去，玉堂也一般。,https://gs.ctrip.com/html5/you/comment/detail/25486/11/153749395.html,https://dimg04.c-ctrip.com/images/t1/headphoto/903/173/918/eb4b7bea9720440dac09eab89328ab00_C_180_180.jpg,七点半咖啡,4分,2018-03-07
逛吃山塘，夜风凉凉，夜色笼罩下的山塘街人声混杂着桨声，别有一番江南韵味。好吃的东西也特别多，海棠糕，狐狸家酸奶，装修超级苏式的星巴克，都不要错过哦,https://gs.ctrip.com/html5/you/comment/detail/25486/11/81784127.html,https://dimg04.c-ctrip.com/images/Z80h180000013xc9e3F64_C_180_180.jpg,恭哈雷檬,5分,2016-07-02
晚上去的很美景色，酒吧很有特色，还有大师在画画，买的百年卤味鸭肠有点苦，其它味道棒棒哒,https://gs.ctrip.com/html5/you/comment/detail/25486/11/74117632.html,https://dimg04.c-ctrip.com/images/Z80p180000013uw9yF21F_C_180_180.jpg,_WeCh****82486,5分,2016-05-05
和西塘很像，夜景蛮好看的。不用门票蛮好的，走走绕绕还行的。那里的大啊二生煎真的超好吃。,https://gs.ctrip.com/html5/you/comment/detail/25486/11/71509420.html,https://dimg04.c-ctrip.com/images/fd/headphoto/g2/M0B/75/F3/CghzgFVgWeWAP5ZdAAC9Sv_wH40636_C_180_180.jpg,_CFT01****5433217,5分,2016-03-12
这条街总体印象还是很不错的～可能是因为非常出名，人特别多，吃的也很多，坐船的也很多，如果喜欢安静地思春的朋友们还是不要来这里了,https://gs.ctrip.com/html5/you/comment/detail/25486/11/57875600.html,https://dimg04.c-ctrip.com/images/fd/headphoto/g3/M09/A5/C7/CggYGlXSwv2Ae5PIAAIv7FZYiA4916_C_180_180.jpg,audience,5分,2015-08-17
很有江南的特色，古街很不错，吃喝俱全，很休闲,https://gs.ctrip.com/html5/you/comment/detail/25486/11/155475480.html,https://dimg04.c-ctrip.com/images/0Z85u1200084c08x0EE53_C_180_180.jpg,NEYZD,5分,2018-07-01
非常美的一条街 特别的喜欢 下次有时间一定还要去,https://gs.ctrip.com/html5/you/comment/detail/25486/11/154526700.html,https://dimg04.c-ctrip.com/images/Z80e0r000000hc3nsBC99_C_180_180.jpg,浪子回头1,5分,2018-04-23
非常值得一游！工作人员态度也很好！我是带着狗狗去的，但是规定宠物不可以上船，她们就帮我照顾留在办公室！美女小曲唱的非常好听！,https://gs.ctrip.com/html5/you/comment/detail/25486/11/119921500.html,https://dimg04.c-ctrip.com/images/t1/headphoto/882/320/089/158cae5ddb6143c0b6ae18523614cf08_C_180_180.jpg,M15****268,5分,2017-08-29
景色还可以，就是太商业化了，有不少老字号，也掺杂不少小店。人太多。去玉涵堂看了昆曲表演，说实话，太一般，演杜丽娘的颜值太低。,https://gs.ctrip.com/html5/you/comment/detail/25486/11/118269536.html,https://dimg04.c-ctrip.com/images/t1/headphoto/397/132/243/542067aa29904ae9aca7e88f43eaeb6f_C_180_180.jpg,rommel,4分,2017-08-09
这个老街和其他街比起来物美廉价，很值得我们去，有一家干花店，我对比了杭州老街要便宜很多，真的很棒，我相信你们也都会很喜欢的~,https://gs.ctrip.com/html5/you/comment/detail/25486/11/101478355.html,https://dimg04.c-ctrip.com/images/Z80d050000000penpCAEC_C_180_180.jpg,玉宝宝,5分,2017-04-17
联票里，桃花坞年画馆已经关闭，不能参观，其他收费景点除了玉涵堂，其他都很糊弄人。但是山塘街本身的景致还是很不错的。另外，评弹只唱四小段，大概五分钟，还想听就要收钱。,https://gs.ctrip.com/html5/you/comment/detail/25486/11/116363654.html,https://dimg04.c-ctrip.com/images/Z80h180000013xc9e3F64_C_180_180.jpg,139****3490,4分,2017-03-23
山塘街是小吃一条街，吃的很多，主要是当地特色，一边是酒吧咖啡厅，每年都去，夜景还不错，离苏州火车站不远，吃的不算便宜，也还好,https://gs.ctrip.com/html5/you/comment/detail/25486/11/92560713.html,https://dimg04.c-ctrip.com/images/t1/headphoto/293/406/308/22631089f44a497495c005fce85f6a6f_C_180_180.jpg,罗恩蒙哥,4分,2016-12-01
有很多小吃，老街，风景挺好的，值得去一下啦！,https://gs.ctrip.com/html5/you/comment/detail/25486/11/86625123.html,https://dimg04.c-ctrip.com/images/fd/headphoto/g1/M06/86/2B/CghzfFUp_vGAW0HLAAAk5cN3HEk325_C_180_180.jpg,沉香叶,5分,2016-08-29
山塘街的风景和周庄差不多，但是沒有周庄面积大,https://gs.ctrip.com/html5/you/comment/detail/25486/11/68984843.html,https://dimg04.c-ctrip.com/images/fd/headphoto/g4/M08/D7/3D/CggYHlaD2uCAWK52AABIXk1niXo533_C_180_180.jpg,杨坤,5分,2015-12-30
"择阳光明媚之日再游山塘街。去了一家剪纸社，剪了头像一个。这家的猫不怕人，随便人摸。
       路遇一对黑人父子，有一阿姨伸手要摸黑人小孩，被父亲言辞：不要随便摸。国人确实需要培养良好的旅游习惯。",https://gs.ctrip.com/html5/you/comment/detail/25486/11/15948753.html,https://dimg04.c-ctrip.com/images/fd/headphoto/g2/M03/A8/59/Cghzf1VAInmAfxxxAAAXZAO-euY527_C_180_180.jpg,hentane,4分,2015-05-25
不错，白天去的，没有晚上热闹，都是古香古色,https://gs.ctrip.com/html5/you/comment/detail/25486/11/155924468.html,https://dimg04.c-ctrip.com/images/0Z80x1200083le7cuB0BC_C_180_180.jpg,DaisyZF,5分,2018-07-29
山塘街还是不错的去处，有老苏州的风韵，只是人太多太过喧嚣。应该下雨的时候或者夜色很晚的时候过去，独享一份江南的安静和从容。,https://gs.ctrip.com/html5/you/comment/detail/25486/11/155238269.html,https://dimg04.c-ctrip.com/images/Z80p1a0000019du49737C_C_180_180.jpg,山泉8667,4分,2018-06-12
苏州特色古街，适合晚上闲逛，配合灯光很漂亮,https://gs.ctrip.com/html5/you/comment/detail/25486/11/154698129.html,https://dimg04.c-ctrip.com/images/Z80b0x000000lherd4187_C_180_180.jpg,xuejl,5分,2018-05-04
这条古街，古香古色，很有韵味，还可以购物。,https://gs.ctrip.com/html5/you/comment/detail/25486/11/154412827.html,https://dimg04.c-ctrip.com/images/t1/headphoto/646/318/109/a865fe5f5465407d8befd5dc487a8554_C_180_180.jpg,M32****866,5分,2018-04-14
"这里位于苏州姑苏区山塘街，我是从干将桥开始
经闾门，山塘街，平门城墙等沿途风优美，小桥流水，做在游船上观两岸风景非常惬意，",https://gs.ctrip.com/html5/you/comment/detail/25486/11/121079123.html,https://dimg04.c-ctrip.com/images/Z80v0i0000009c4yyA377_C_180_180.jpg,阿汤哥2006,5分,2017-09-02
先听美女评弹 再游船 听船老大讲解。夜景很美。坐了大概4.50分钟,https://gs.ctrip.com/html5/you/comment/detail/25486/11/121069516.html,https://dimg04.c-ctrip.com/images/Z80p180000013uw9yF21F_C_180_180.jpg,M67****16,5分,2017-09-01
"坐船穿越七里山塘
临水而筑的破旧小楼
前门是街，后门是山塘河
典型的“水陆相邻，河街平行”的格局
画面感很强 
          ——七里山塘",https://gs.ctrip.com/html5/you/comment/detail/25486/11/117043533.html,https://dimg04.c-ctrip.com/images/Z80s0g0000007s9vnF02D_C_180_180.jpg,诸城刘裕,5分,2017-07-31
去过乌镇后再逛这里，感觉有点小，不过还是值得去的，晚上到苏州直接到山塘街入住，再出来逛逛，过桥有一段都是小酒吧，感觉不错。,https://gs.ctrip.com/html5/you/comment/detail/25486/11/93096251.html,https://dimg04.c-ctrip.com/images/fd/headphoto/g3/M04/86/26/CggYG1bP66qAEuCCAAAgtA8ClbE336_C_180_180.jpg,阿珏,5分,2016-12-09
我来过三次了，每一次都让我很留恋，特别喜欢这样的景，特别喜欢这样的江南韵味，这里的风情，，每一处都透漏着这座城市的古老文化,https://gs.ctrip.com/html5/you/comment/detail/25486/11/92523550.html,https://dimg04.c-ctrip.com/images/t1/headphoto/397/132/243/542067aa29904ae9aca7e88f43eaeb6f_C_180_180.jpg,M49****440,5分,2016-11-28
山塘街是一条历史悠久的经典水巷，从阊门一路步行到虎丘又被称作七里山塘。有最地道的风土民情。清晨的山塘街尽是吆喝声，好不热闹,https://gs.ctrip.com/html5/you/comment/detail/25486/11/74387331.html,https://dimg04.c-ctrip.com/images/0Z8091200086z1fvs9C37_C_180_180.jpg,lovemyfenghuang,5分,2016-05-26
是体现苏州底蕴的一条古街，游玩性价比较高。,https://gs.ctrip.com/html5/you/comment/detail/25486/11/58610844.html,https://dimg04.c-ctrip.com/images/t1/headphoto/463/352/613/9d877effaa3d4bd0b951bb4c60209b3b_C_180_180.jpg,M16****381,5分,2015-10-05
听说这里是古代的红灯区了哦，现在这里大红灯笼装饰的很漂亮，白居易上任时也是在这里。,https://gs.ctrip.com/html5/you/comment/detail/25486/11/5453929.html,https://dimg04.c-ctrip.com/images/headphoto/521/957/390/98bbccd79a0d4c9e9d1731ab77f34f75_C_180_180.jpg,行走于山水之间,5分,2014-07-08
"这里是市区最方便的古街，乘坐地铁2号线直接可以到达。

给大家推荐个高处唯一可以欣赏山塘景区的地方
从希岸酒店坐电梯到5层，然后走楼梯到6层，有个露台，是个清吧，但是白天不营业，可以免费牌照。

七里山塘唐宝历二年（825年），大诗人白居易从杭州调任苏州刺史，为了便利苏州水陆交通，开凿了一条西起虎丘东至阊门的山塘河，山塘河河北修建道路，称为“山塘街”，山塘河和山塘街长约七里，叫“七里山塘”。自古山塘街有“姑苏第一名街”之称。清乾隆帝壬午年(1762年)游江南，到七里山塘曾御笔书写“山塘寻胜”；如今山塘寻胜御碑亭仍然保存完好。乾隆帝对七里山塘情有独宠，回京后在颐和园后湖仿照七里山塘的模样修建了苏州街。七里山塘是苏州古代的金粉地、闹市区（类似南京的夫子庙），是近年开发的新景点。",https://gs.ctrip.com/html5/you/comment/detail/25486/11/165176523.html,https://dimg04.c-ctrip.com/images/Z80d15000000xoogr78D7_C_180_180.jpg,Cc cc,,2020-07-18
"山塘老街位于苏州的西北部，是一条非常悠久的街道。在老街上有部份店铺都已经“欢度春节”提前放假了，又因为是早上的原因，所以整个人气并没有特别的多，这样逛逛还是挺不错的。

小桥流水，是江南古镇的特色，山塘老街当然也不例外。再加上这里的布满了很多印有“山塘”字样的红灯笼，显得超级有年味，我相信在晚上应该会更有味道，也非常符合中国节日的喜庆。

此外，在山塘老街的美食也有很多，各色糕点，小吃，真的可一路从头吃到尾。老街的一头还有苏式评弹店意义欣赏，游船这个季节也是有，但是总体来说人不很多。

交通：苏州轨道交通2号线山塘街站下，步行5分钟。
门票：免费。",https://gs.ctrip.com/html5/you/comment/detail/25486/11/165176680.html,https://dimg04.c-ctrip.com/images/0Z84w1200044ipsg7F4D5_C_180_180.jpg,JC-JIANG,,2020-07-16
"苏州山塘书香府邸 

君到姑苏见，人家尽枕河

山塘府邸，坐落于著名的山塘街景区。酒店都是别墅，特别适合如今这非常时期出游的需求，一家人住一幢别墅里，和其他客人基本不会接触。
空调是分体式的，避免中央空调的潜在风险。在现在这个特殊时期酒店还给每个住店的客人都赠送一次性口罩，公共区域每日消杀。
用餐也可以在府邸里，府邸小宴套餐地道苏帮菜，价格特别实惠。
最主要的是酒店就在山塘街 景区内，酒店本身就是个苏州园林风格的，足不出户就可以观赏小桥流水、亭台楼阁，午后一壶茶，坐在庭院里欣赏美景。夜晚出门走走，欣赏山塘街美丽的夜景也是极妙的。
出门就是山塘街，可以沿着青石板路欣赏千年古街水陆并行的风景，体会“君到姑苏见，人家尽枕河”的江南风貌。大概15分钟就可以到达留园，游览这著名的苏州园林。
从山塘府邸步行几分钟就到了石路步行街，这里有石路国际等大型购物商场，可以逛街购物。
住在山塘府邸几乎无需乘坐公共交通工具，就可以享受到一个安心又完美的假期，这在今时今日这个特殊的时期无疑是一个最佳的选择了！",https://gs.ctrip.com/html5/you/comment/detail/25486/11/165178251.html,https://dimg04.c-ctrip.com/images/Z80d1b000001b2siaB0AA_C_180_180.jpg,_光影,,2020-06-11
"一条山塘街 · 半个姑苏城～

愿你走过的地方
都有我的印记

有人问我
你去了南方也有不少城市了，你喜欢哪里？
我答苏州
对哒，这里是我喜欢的南方城市

山塘街
地点：江苏省苏州市相城区前小朱弄

踩着青石板，贴着斑驳墙，漫步于山塘街上，这边停停，那边望望，浓浓的历史文化气息也跟着扑面而来…

当然山塘街还是属于吃货的特色街区
这里小吃很多～梅花糕、海棠糕、臭豆腐、生煎、红豆饼、麦芽糖……
比较出名的应该是赵元璋肉骨烧
几乎每次来苏州，都会在这儿吃一顿
不过相比前两年，去年味道差了很多
其他就看自己喜欢了～

如果你不喜欢步行，泛舟游玩山塘街，也是可以的；坐在小舟上游玩时，记得买些小吃带上去哦～

总体感觉这里还是不错的，推荐傍晚来，那个时候很适合拍照～",https://gs.ctrip.com/html5/you/comment/detail/25486/11/163565404.html,https://dimg04.c-ctrip.com/images/Z8031f000001gejuz379F_C_180_180.jpg,小泊儿,,2020-05-31
"苏州山塘街始建于唐代宝历年间，具有1100多年历史，被誉为“姑苏第一名街”。
唐代诗人白居易任苏州刺史时，修建了三塘河和三塘街，使这里的交通便利，市井繁华。苏州老百姓为感激他，将山塘街称为白公堤，还修建了白公祠，以作纪念。
山塘街分为东西两段，东段主要是商铺和住家，比较热闹；西段近郊外，自然景色比较优美，还有“五人墓”、“葛贤墓”等古迹。",https://gs.ctrip.com/html5/you/comment/detail/25486/11/163281082.html,https://dimg04.c-ctrip.com/images/zc02170000011l03o44C7_C_180_180.jpg,13BB13,,2020-04-20
"什么是苏式生活？
一杯在杯子里跳着舞的明前碧螺春，三五好友在古运河的船中午餐闲聊，一边听着旗袍小妹唱着软糯的评弹…
所有菜都是厨师在船上现做的，精致到不舍得吃的那种。
了解下这“古运河美食专线臻膳”，体验感实在一级棒！
一定要安利给来苏州的你。",https://gs.ctrip.com/html5/you/comment/detail/25486/11/163221970.html,https://dimg04.c-ctrip.com/images/Z80m1600000108gatFF0D_C_180_180.jpg,若有所思CS,,2020-04-11
"山塘街，苏州历史的缩影。

【景点攻略】
        
        1、山塘街是大诗人白居易执政苏州时为防水患开挖河道，用淤泥堆筑而成的一条街道，东起阊门西到虎丘，全长七华里，又称七里山塘；传说明朝时朱元璋为锁苏州龙气，命刘伯温在山塘河建七座桥，每座桥边置一尊石雕狸猫，这样桥如锁链，石狸似锁，把苏州的龙气困在地上，所以又称七狸山塘。

        2、山塘街以新民桥（广济路）为界，东边的一小段是开发的旅游景点，类似各个城市的老街，一直延续到阊门；西边一段基本没怎么开发，房子还是当地居民居住，街边是粮油铺呀、干果铺呀、水果铺呀，烟火起十足，一直延伸至虎丘。

        3、街上有很多小的纪念馆，大多在西段，东边有白居易纪念馆，西边有南社纪念馆、陕西会馆、李鸿章纪念馆、义风园、五人墓、贝氏祠堂、普福禅寺等，如果想深入了解下苏州的历史，可以去看看，时间紧张就算了，并不是很精彩的景点。

        4、山塘街有码头，有游船沟通上塘街和虎丘两个景点，比如下午游完虎丘，坐个小船去山塘街看看夜景，沿途看看沿水而居的苏州老房子，也是不错的选择。

        5、山塘街有昆曲和苏州评弹的表演，两个都是苏州非物质文化遗产，逛累了不妨泡一壶碧螺春，点一点小点心，听上那么一段。

交通攻略：
        地铁2号线有山塘街站

小Tips：
山塘街和留园很近，可以安排一起游玩",https://gs.ctrip.com/html5/you/comment/detail/25486/11/163155805.html,https://dimg04.c-ctrip.com/images/Z80n1b000001a7lo5E4B9_C_180_180.jpg,Star-Lee,,2020-04-01
