标题,标题链接,头像,user-detail__name,totalStarIcon1,resource_date
我和七里山塘是一次偶遇，因为一次走错路走进了七里山塘，刚进去就像从现代穿越进去了古代，那狭窄的石板路，那古色古香的民房和商埠那脚下流动的河水和精巧别致的小桥不就是我梦中江南的水乡吗？山塘街不长，我走了两遍，回到家后至今还在回味那山塘街那江南的神韵。,https://gs.ctrip.com/html5/you/comment/detail/25486/11/154535513.html,https://dimg04.c-ctrip.com/images/t1/headphoto/463/352/613/9d877effaa3d4bd0b951bb4c60209b3b_C_180_180.jpg,不拘泥与形,5分,2018-04-23
山塘街始建于唐代宝历年间，公元825年白居易奉命到苏州任刺史。上任不久，他坐了轿子到虎丘去，看到附近的河道淤塞，水路不通，回衙后，立即找来有关官吏商量，决定在虎丘山环山开河筑路，并着手开凿一条山塘河。它东起阊门渡僧桥附近，西至虎丘望山桥，长约7里，故俗称“七里山塘到虎丘”。,https://gs.ctrip.com/html5/you/comment/detail/25486/11/154393109.html,https://dimg04.c-ctrip.com/images/Z80m0c000000627if15D6_C_180_180.jpg,星辰016,5分,2018-04-13
报的团去的，挺好的，去了拙政园，博物馆，寒山寺，虎丘，水上游，山塘街。水上游上岸后就是山塘街，这里丝绸和小吃特别多，路两边都是卖丝绸的，逛了逛人还挺多的，如果有喜欢这类衣服的可以来逛逛，很值得来看看。,https://gs.ctrip.com/html5/you/comment/detail/25486/11/154012794.html,https://dimg04.c-ctrip.com/images/Z80c0q000000gd0sb556C_C_180_180.jpg,美宝88,5分,2018-03-21
"七里山塘，典型的江南水乡美景。一边是川流不息的马路，转身一下桥，却已古色古香，小桥流水人家从容地展现在眼前。古往今来，山塘向来是帝王国君、文人墨客的钟爱之地。无论是乾隆康熙，亦或是伯虎秋香，都曾流连于山塘河两岸。 ​​
说起江南，人们联想到的就是小桥流水，山塘虽然地方不大，应有的元素一样不少，不过我更喜欢后半段山塘街，没有被修饰过的商业气息，只有从前保留下来的江南古朴的气质，从这条隧道走过，仿佛穿越了时空。",https://gs.ctrip.com/html5/you/comment/detail/25486/11/153809985.html,https://dimg04.c-ctrip.com/images/Z80o1e000001ezoph1F34_C_180_180.jpg,vivian婷婷,5分,2018-03-12
山塘街是一条古街，沿着山塘河而建的有很多老的建筑，小桥流水，有江南古镇的味道，街道两侧布满小店，特色小吃，苏州丝绸，小商品，应有尽有，山塘街是苏州的第一名街，是苏州的象征，到苏州，一定要来看看山塘街。值得一游。,https://gs.ctrip.com/html5/you/comment/detail/25486/11/153589308.html,https://dimg04.c-ctrip.com/images/Z80h180000013xc9e3F64_C_180_180.jpg,136****9434,5分,2018-02-26
山塘老街离苏州火车站只有公交3站的距离，交通十分便利，我们只游玩了老街最热闹的一段，山塘河及通贵桥两岸，古建筑商铺林立，也是游客最多的地方，街边有采芝斋老字号，有松鹤楼，苏州小吃桂花糕等，老街的一头有家猫的天空之城概念书店，这是我在苏州去的第三家分店，特别喜欢里面的文艺小资氛围，各种摆设也是情调满满，特有感觉！老街还有玉涵堂等明代建筑，旁边不远处是一所集邮博物馆，可以学到一点小知识，建议进入看看……,https://gs.ctrip.com/html5/you/comment/detail/25486/11/153156226.html,https://dimg04.c-ctrip.com/images/Z80v12000000rvzqd7773_C_180_180.jpg,可儿,5分,2018-02-04
七里山塘独为乾隆帝所钟爱，江南水乡的情调和韵味在这里尤其突出。“君到姑苏见，人家尽枕河”便是最贴切的写照，借着月光，或凭栏桥上驻足，或漫步河道两岸，听闻着吴侬软语，感受着人群熙攘，再来碗藏书羊肉面吧……,https://gs.ctrip.com/html5/you/comment/detail/25486/11/141940617.html,https://dimg04.c-ctrip.com/images/Z80c180000014vqcbA615_C_180_180.jpg,Eternal732,5分,2017-11-27
山塘适合傍晚过去，边吃小吃边逛。小吃推荐梅花糕，海棠糕（个人更喜欢像粽子一样形状的梅花糕），鸡头米（略贵），卤味鸡腿，生煎；建议逛逛果茶店，有家虞小婷家茶比较物美价廉；猫的天空之城，是家文艺书店，但我觉得正对面向左手边那家文艺店更赞，价格会便宜一些，更重要的是他们家有一种花笔记本，用花朵制作的笔记本，超级美！！！当然价格是50一本。划船晚上会很有感觉，所以即使你下午就到达，但是还是选择晚上去坐船吧！,https://gs.ctrip.com/html5/you/comment/detail/25486/11/141577933.html,https://dimg04.c-ctrip.com/images/Z80e0c0000006ork2296B_C_180_180.jpg,Crystallacey,5分,2017-11-05
"我住的是山塘街门口的客栈，这里人真心多，可能是因为在离市区不远的地方吧，人比较集中，街不是特别长，一条主道，两边全是卖东西的，除了房子的样式是古城的样子，其余的毫无古城气息，商业化！如果住三塘附近，千万不要在地铁山塘街下，拖着行李箱石板路超级难走，建议石路站下车，路程差不多远
其实好多吃的都不好吃，又贵，建议去阊门牌楼外面，或者去红太阳广场附近吃，离得也近",https://gs.ctrip.com/html5/you/comment/detail/25486/11/138655296.html,https://dimg04.c-ctrip.com/images/Z80m0l000000cxpcj12C6_C_180_180.jpg,陈陈,5分,2017-10-04
在苏州老城不远，有地铁到山塘街直达，整个街不长，大概就一公里多，不过看的东西不少，还可以听戏，吃的也多，有一家五芳斋，小吃品种味道都不错，不过个人感觉山塘街的游船没意思，要做游船还是坐大运河的吧，看的东西多些，还能听评弹,https://gs.ctrip.com/html5/you/comment/detail/25486/11/138603220.html,https://dimg04.c-ctrip.com/images/Z804190000017z9lw488F_C_180_180.jpg,ColinP,5分,2017-10-03
偶然的机缘巧合发现了这座山塘街，是在介于上海和苏州之间吧，其实是在去吴江后觉得这里不错，干净，安静，就搜附近，然后就发现了这座山塘街。相比于那些出名的古镇，这里还保留着相对来说比较古朴的人文气息和古镇生活的本相。,https://gs.ctrip.com/html5/you/comment/detail/25486/11/120968594.html,https://dimg04.c-ctrip.com/images/Z80g14000000vol841788_C_180_180.jpg,Shuying,5分,2017-09-01
很多人都说山塘街商业化太浓，还是平江路生活气息重，可是我还是独独爱七里山塘。上有天堂，下有苏杭。杭州有西湖，苏州有山塘。可能每个人的感受不同，徜徉在那深深浅浅、曲曲折折的小巷里，仿佛走在西塘古镇，穿越时空，感受明清时期神州第一古街的盛世繁华。从白天到黑夜，看着红灯笼慢慢亮起来，夜晚的山塘街人更多，也更热闹~,https://gs.ctrip.com/html5/you/comment/detail/25486/11/119792401.html,https://dimg04.c-ctrip.com/images/Z8060p000000fw6esFBA6_C_180_180.jpg,秋香过年,5分,2017-08-23
我喜欢热闹所以先给个满分！一千多年的历史的古街非常的热闹人流涌动，酒吧，茶馆，小吃，小食品，热闹非凡，如果条件允许下个人建议在山塘街附近找个人旅店住下，先玩虎丘后去山塘街听听平坦，昆曲喝个小茶，放松一下非常不错哦！,https://gs.ctrip.com/html5/you/comment/detail/25486/11/118150773.html,https://dimg04.c-ctrip.com/images/fd/headphoto/g2/M07/70/05/Cghzf1WWkk2AIh_rAAAZLP1hDcU231_C_180_180.jpg,胖子,5分,2017-08-04
苏州山塘街地理位置优越，地处苏州护城河畔，有公交车个地铁直达，无需门票，里面多是商业店铺，售卖苏州本地特色小吃、苏绣和一些饰品啥的，极具江南水乡古镇特色风情，值得一逛！而且离石路步行街徒步不到十分钟，很方便！,https://gs.ctrip.com/html5/you/comment/detail/25486/11/109832035.html,https://dimg04.c-ctrip.com/images/0Z80g1200084xfmdm1EF9_C_180_180.jpg,远行-遇见你,5分,2017-06-10
山塘街始建于唐代宝历年间，公元825年白居易奉命到苏州任刺史。上任不久，他坐了轿子到虎丘去，看到附近的河道淤塞，水路不通，回衙后，立即找来有关官吏商量，决定在虎丘山环山开河筑路，并着手开凿一条山塘河。它东起阊门渡僧桥附近，西至虎丘望山桥，长约7里，故俗称“七里山塘到虎丘”。这条河在阊门与运河相接。在河塘旁筑堤，即山塘街。山塘河的开凿和山塘街的修建，大大便利了灌溉和交通，这一带成了热闹繁华的市井。苏州百姓非常感激白居易，他离任后，百姓即把山塘街称之为白公堤，还修建了白公祠，以作纪念。山塘街一头连接苏州的繁华商业区阊门，一头连着花农聚集的虎丘镇和名胜虎丘山，所以，自唐代以来它一直是商品的集散之地，南北商人的聚集之处。清乾隆年间，著名画家徐扬创作的《盛世滋生图》长卷(也称《姑苏繁华图卷》)，画了当时苏州的一村、一镇、一城、一街，其中一街画的就是山塘街，展现出“居货山积，行云流水，列肆招牌，灿若云锦”的繁华市井景象。曹雪芹在《红楼梦》第一回中也把阊门、山塘一带称为“最是红尘中一二等富贵风流之地”。,https://gs.ctrip.com/html5/you/comment/detail/25486/11/101271655.html,https://dimg04.c-ctrip.com/images/Z80s0d0000006rwcjA59A_C_180_180.jpg,爱旅行的小老头,5分,2017-04-13
七里山塘，典型的江南水乡美景。刚才还走在汽车川流不息的公路上，转身一下桥，却已古色古香，小桥流水人家从容地展现在我们眼前。家家户户前街后河，横跨河上的古桥有七座，最大的看点是通贵桥，桥洞和水中倒影连成了一个规则的圆，很多影视作品曾在这里取景。情人节的时候去的，山塘街人山人海，但是人群主要集中在主要的旅游街道，旁边的街道是完全没有游客的。七里山塘有典型江南水乡的风貌，,https://gs.ctrip.com/html5/you/comment/detail/25486/11/97896164.html,https://dimg04.c-ctrip.com/images/headphoto/027/016/207/eaa7054c6a7a45c4a6ac24b6cc8a9408_C_180_180.jpg,彪标,5分,2017-02-22
很热闹的一个地方，两边都是店铺，好多人啊～跟朋友一起，千万得跟紧了，别到时迷路走丢了！里面也有很多小商品，给朋友带些小礼物；看到什么想吃的，可以进去之间买！ps：不用带水不要带零嘴，路上会有很多很多好吃的；带上就OK了,https://gs.ctrip.com/html5/you/comment/detail/25486/11/89574664.html,https://dimg04.c-ctrip.com/images/t1/headphoto/272/077/772/76b262d0cc24492abc5c6784c903c2ab_C_180_180.jpg,阿秀_宝贝,5分,2016-10-13
十里山塘 还是很美的 山塘街、平江路、几个苏州园林都属于苏州必游景点 另外寒山寺也比较有代表意义  很秀美的一座城市 就是总是阴雨绵绵 倒正好衬托出江南的味道 来过好几次了 周围的周庄木渎也值得一去 更有水乡风情 交通很方便 高铁就可以 去周围水乡有公交也可打车 景区配套都很完善 吃住条件都可以 这也是我喜欢到江南玩的一个重要因素,https://gs.ctrip.com/html5/you/comment/detail/25486/11/89338948.html,https://dimg04.c-ctrip.com/images/Z80s090000003nben8B3C_C_180_180.jpg,__赛__,5分,2016-10-13
山塘街位于江苏省苏州古城西北，东西红尘中“一二等富贵风流之地”阊门，西至“吴中第一名胜”虎丘，全长约3600米，约合七华里，故称“七里山塘到虎丘”。山塘街历史文化悠久，唐宝历元年（825年），白居易任苏州刺史时，虎丘与古城交通不便，又河道不畅，易致水灾，于是组织百姓开凿水道，由阊门城河直达虎丘山麓，并与运河贯通，这条水道就是山塘河，其淤泥堆积于河边就成“白公堤”，天长日久，“堤”演变成“街”，即为山塘街，至今已有近1200年历史。白居易在《武丘寺路》中写道：“自开山寺路，水陆往来频。银勒牵骄马，花船载丽人。芰荷生欲遍，桃李种仍新。好住湖堤上，长留一道春。”白居易堪称“山塘始祖”。,https://gs.ctrip.com/html5/you/comment/detail/25486/11/89129198.html,https://dimg04.c-ctrip.com/images/t1/headphoto/770/596/837/b76a096fcf6b42349f4362aafd2ba2d5_C_180_180.jpg,Achilles_2014,5分,2016-10-02
沒有在山塘停留很久，主要去吃飯，順帶逛逛老街，一路走下來感覺與西塘相似，不過，西塘遊船更有特色，不似這裡的大船一點意境也沒，基本上小吃上海都看得到，唯一覺得新奇的是開珍珠，100元三個大蚌殼，不懂是不是便宜，不過我覺得還蠻實惠的,https://gs.ctrip.com/html5/you/comment/detail/25486/11/87491395.html,https://dimg04.c-ctrip.com/images/t1/headphoto/397/132/243/542067aa29904ae9aca7e88f43eaeb6f_C_180_180.jpg,格鲁吉亚乔蒂,5分,2016-09-15
山塘街说实话就是一个人多的小吃街。里面当然也有一些大饭店像什么松鹤楼之类的。里面还有五芳斋。dq等等的。实际上在山塘街出口处有家巨棒的书店。猫的天空之城概念书店。真的是我有生以来见过的最好的书店。基本上这个书店做的就是个明信片寄送服务。但是这不是普通的寄送。你可以随意写上时间。可以写明天。也可以为十年后的你寄一份明信片或者别的东西。只要交给前台并且付一定的钱。十年后就可以收到了这个书店有地方政府什么什么的支持和保障所以放心啦。里面还有好多书都特别好看(｡･ω･｡)ﾉ♡,https://gs.ctrip.com/html5/you/comment/detail/25486/11/84230824.html,https://dimg04.c-ctrip.com/images/Z807sa143as1htqy8A2B9_C_180_180.jpg,老白的后院,5分,2016-08-05
离虎丘很近，可以走着去，要从南门出，一路向南沿着山塘街走过去，前半段可以感受苏州弄堂的生活，还经过一个集市，很是热闹。后半段多为外地游客游览，很美，很有江南水乡的韵味，都说夜晚的山塘最美，可惜我因为赶车，没能感受山塘的夜色。,https://gs.ctrip.com/html5/you/comment/detail/25486/11/84001786.html,https://dimg04.c-ctrip.com/images/Z80j0700000021jzk5B4A_C_180_180.jpg,Giny_vv,5分,2016-07-21
山塘街是我在苏州去的最后一个地方，也是我最喜欢的。七里山塘，吸引了多少游客。里面充满复古的气息，来一碗桂花鸳鸯糖粥，以及梅花糕。真是人间美味,https://gs.ctrip.com/html5/you/comment/detail/25486/11/57787886.html,https://dimg04.c-ctrip.com/images/t1/headphoto/295/828/780/6e6c2151ed65497c850945d5d2b702ae_C_180_180.jpg,M23****574,5分,2015-08-13
下午五点多从酒店出发，那时候人已经挺多的了。我和爸妈都觉得饿了，就在刚进去的时候买了杯生榨椰汁和吃了生煎包，豆腐花。再往里走，两边都是商铺，很多小吃店丝绸店旗袍店，我妈逛着逛着就买了件。在接近码头游船的地方听了一小段评弹，吃了狐狸家的酸奶，真的很好吃！然后排了近10分钟的队伍就可以坐进画舫游船。走回来的时候已经七八点了，人超多超多，走动很缓慢，看到很多小酒吧。因为饿了，我们又买了臭豆腐，鸡爪，鸭脖，在一家店点了黑啤，扇骨和猪蹄，饱餐一顿,https://gs.ctrip.com/html5/you/comment/detail/25486/11/52710860.html,https://dimg04.c-ctrip.com/images/Z80p180000013uw9yF21F_C_180_180.jpg,300****833,4分,2015-06-20
"苏州有俗语七里山塘到虎丘，始建于唐代宝历年间,至今已有一千一百余年。据传说乃是唐代大诗人白居易所建。山塘街一直被誉为“姑苏第一名街”。

   夜晚的山塘街，短促而不失热度，游人似乎都清楚，晚上的七里山塘是最美的，在短短的街道上，流连在各式苏式老店中。

    站在街口，透过鼎沸的人声的，可以听到街那头茶铺里传出来的悠扬的苏州评弹声，依依呀呀的，好听极了。
面相游客的老街只有一条，但我们在回程的时候，不小心走错了道路，于是在街后的山塘人家的门前穿过，黑暗中，看不清门落的形象，只能看到翘脚的飞檐在黝黑的天空里划出一个个弧度。
   没想到一条不长的山塘街，其后面的民居却是那么复杂，我们走过好几条小路，却始终没能找到通向老街的入口，最后还是在一户人家的指引下，才渐渐的循着声音，走回到了喧闹的老街上。
   老街上，依旧人声鼎沸，而刚刚走过那段静谧路段的我们，仿佛是重新穿越回来，也重新投入那繁华中去了。",https://gs.ctrip.com/html5/you/comment/detail/25486/11/13555948.html,https://dimg04.c-ctrip.com/images/t1/headphoto/645/194/138/ba154c6373604e5a821d2bce5fd7318d_C_180_180.jpg,ma****ly,3分,2015-03-03
大年三十的晚上是在山塘河边的古街游荡的。街临水而居，小桥流水人家的繁华在灯影的迷离中更显繁华市井。因为大年三十的缘故，店铺少有营业。此时在青石板街面行走，更能体会一下面水而居的苏州人日常的生活场景。,https://gs.ctrip.com/html5/you/comment/detail/25486/11/158038129.html,https://dimg04.c-ctrip.com/images/fd/headphoto/g1/M01/BE/EC/CghzfVTOK8yAMHZnAAAq7g5Jn88053_C_180_180.jpg,huochexia,5分,2019-03-03
苏州天气不是很好，又冷又阴湿，不过周末的山塘街依然是人山人海的，山塘街可以说是分两部分的，往苏州商会博物馆走是景区，反方向则是很地道苏州人的生活区，很接地气。,https://gs.ctrip.com/html5/you/comment/detail/25486/11/157988883.html,https://dimg04.c-ctrip.com/images/Z80l11000000r9cgb74CB_C_180_180.jpg,东张西望望东西,4分,2019-02-24
七里山塘，繁华的只有一小段，各色各样的小店，美食，丝绸，小玩意儿，适合喜欢逛吃逛吃逛吃的人们！往虎丘的方向基本上都是住家了！小桥流水人家的生活，太惬意了感觉！,https://gs.ctrip.com/html5/you/comment/detail/25486/11/108409208.html,https://dimg04.c-ctrip.com/images/t1/headphoto/258/512/704/6bce7506eecc48f8a4a6d3177e0acf24_C_180_180.jpg,由由,5分,2017-05-28
七里山塘，有着各种特色小吃，和苏杭特产。猫的天空之城，是文艺青年必去的小店，也可以到这里品尝下外焦里嫩的臭豆腐，还有美味爽滑的狐狸家酸奶。,https://gs.ctrip.com/html5/you/comment/detail/25486/11/58524115.html,https://dimg04.c-ctrip.com/images/Z80s070000002fd9fB0D2_C_180_180.jpg,忘记流浪,5分,2015-09-28
"给船上播放的昆曲好评,很满意，很喜欢",https://gs.ctrip.com/html5/you/comment/detail/25486/11/158649769.html,https://dimg04.c-ctrip.com/images/t1/headphoto/757/757/889/3b86691007a54fe684f07e198432d09b_C_180_180.jpg,M31****2463,4分,2019-05-03
山塘街离火车站只有一站地铁交通方便山塘街闹中取静我们晚上去了茶室看看风景喝喝碧螺春非常惬意小吃有品尝酒酿饼胥城月饼蟹壳黄豆腐花苏式粽子虾仁面焖肉面奥灶面非常有特色苏式饭店有老阊门菜馆虾仁鸡米头很赞,https://gs.ctrip.com/html5/you/comment/detail/25486/11/90034608.html,https://dimg04.c-ctrip.com/images/Z80h180000013xc9e3F64_C_180_180.jpg,mi****1,5分,2016-10-22
山塘街有七里山塘之说，江南水乡，山塘街本身是没有门票的，夜晚华灯燃起时，可用绚丽来称赞，客流高峰也随着而来，人头攒动，可用拥挤来形容。游船码头乘船游览可要早点购票的伐，时间已晚旅行社可是集体的哦。,https://gs.ctrip.com/html5/you/comment/detail/25486/11/87756821.html,https://dimg04.c-ctrip.com/images/Z80m060000001sezg6BF2_C_180_180.jpg,Chanmaomi,5分,2016-09-18
评弹和昆曲都很好，但服务有待提高。,https://gs.ctrip.com/html5/you/comment/detail/25486/11/161388108.html,https://dimg04.c-ctrip.com/images/t1/headphoto/177/080/529/285e9abeede347d9a7c1cc5e1b4c9287_C_180_180.jpg,M29****8496,4分,2019-10-06
第二次去了，建议晚上去景色更耐看些,https://gs.ctrip.com/html5/you/comment/detail/25486/11/158720600.html,https://dimg04.c-ctrip.com/images/Z80p180000013uw9yF21F_C_180_180.jpg,150****4800,4分,2019-05-07
还可以，人太多，坐船没意思，太短。,https://gs.ctrip.com/html5/you/comment/detail/25486/11/158499240.html,https://dimg04.c-ctrip.com/images/0Z8311200080xsczf0B36_C_180_180.jpg,困惑,4分,2019-04-22
"山塘街一日游 跟我一起逛逛呗
七里山塘(山塘街) 取景地打卡 周末去哪儿 值得一去",https://gs.ctrip.com/html5/you/comment/detail/25486/11/165495495.html,https://dimg04.c-ctrip.com/images/100u11000000rg44l1E06_C_180_180.jpg,猫咪爱大雨,,2020-10-18
典型的江南古街，小桥流水人家商铺,https://gs.ctrip.com/html5/you/comment/detail/25486/11/159261610.html,https://dimg04.c-ctrip.com/images/Z80313000000vct3tD8B6_C_180_180.jpg,nj海虹,4分,2019-06-11
走在这里，脚步不由自主就会放慢，悠闲，淡雅，很有味道的小街，各种特色小吃,https://gs.ctrip.com/html5/you/comment/detail/25486/11/156920978.html,https://dimg04.c-ctrip.com/images/Z80i170000010pxyhD70D_C_180_180.jpg,漂亮可爱的小精灵,5分,2018-10-08
每一个有点历史的城市都会有这么一条古街。卖的东西不多，主要是小吃，也可以买点纪念品。靠河边有游船码头，来拍照还行，玩就没什么了。闲的慌可以去逛逛，要是人少的时候喝杯茶听听评弹也是个不错的去处。,https://gs.ctrip.com/html5/you/comment/detail/25486/11/156273344.html,https://dimg04.c-ctrip.com/images/Z80p180000013uw9yF21F_C_180_180.jpg,_M18****6113,3分,2018-08-23
这个地方我玩了两次，11月4号下午来的苏州，先去苏州博物馆，晚上到山塘街买东西，吃小吃，这里的鸡爪，热狗，还有兔腿，最好吃的是臭豆腐！不过也比较贵！这边卖苏州的地方特产比较多，可以买点东西回家,https://gs.ctrip.com/html5/you/comment/detail/25486/11/91059605.html,https://dimg04.c-ctrip.com/images/fd/headphoto/g1/M0A/E8/E2/CghzfFUT2NSAUHsRAAAnQztjY6M479_C_180_180.jpg,_CFT01****9828688,5分,2016-11-06
山塘之秋，非常有苏州''味道''，品位苏州文化''，品味苏州历史,https://gs.ctrip.com/html5/you/comment/detail/25486/11/59882220.html,https://dimg04.c-ctrip.com/images/t1/headphoto/062/938/215/f5f05c77006946428867e3c0dae6f4eb_C_180_180.jpg,M27****392,5分,2015-11-09
景色很不错，商业味道太浓。物价奇高，与东西不成正比。如果这样下去，只能是一锤子买卖了。希望景区的管理者和商家放缓挣钱的节奏，把服务搞上去，钱是赚不完的。,https://gs.ctrip.com/html5/you/comment/detail/25486/11/13871894.html,https://dimg04.c-ctrip.com/images/Z80c0j000000a0wwt4A0F_C_180_180.jpg,不信则无,4分,2015-04-08
兑换电子船票，不错的坐船旅行。,https://gs.ctrip.com/html5/you/comment/detail/25486/11/160169427.html,https://dimg04.c-ctrip.com/images/Z80j15000000y1m986698_C_180_180.jpg,沸格,4分,2019-08-07
晚上的夜景非常美，就是人太多了,https://gs.ctrip.com/html5/you/comment/detail/25486/11/159205187.html,https://dimg04.c-ctrip.com/images/t1/headphoto/463/352/613/9d877effaa3d4bd0b951bb4c60209b3b_C_180_180.jpg,M33****5732,4分,2019-06-07
冬季了  可能是游人不多的原因  山塘古街显得由来的静谧  非常安静  树上的杈枝头喜鹊显得悠然 石板街上游客信步前行 身边的商贾不在大声呦呵 乃 友好的笑容。。。。。一切多在沉寂中。   冬天的姑苏 另有一番趣味。 不错！,https://gs.ctrip.com/html5/you/comment/detail/25486/11/157513241.html,https://dimg04.c-ctrip.com/images/Z80w13000000vb8xl0BDA_C_180_180.jpg,杭州893,5分,2018-12-26
不长的一条街，跟其它城市的著名步行街区别不大，买东西，吃饭，闲逛，可以来看看。说是七里山塘，实际连一里也没有。,https://gs.ctrip.com/html5/you/comment/detail/25486/11/157485100.html,https://dimg04.c-ctrip.com/images/Z80l0n000000eebl3A6E6_C_180_180.jpg,西单大叔,5分,2018-12-21
难得下雨天的大清早去了趟山塘古街，人少了!可以静静的观赏古街的氛围!感觉这个时候的古街是最美的!只有这个时候才会有古街的本来面目!,https://gs.ctrip.com/html5/you/comment/detail/25486/11/157270418.html,https://dimg04.c-ctrip.com/images/fd/headphoto/g3/M06/55/43/CggYG1Yfq1CAZ3PwAAAZ7e-WWxc025_C_180_180.jpg,fuyanxiang,4分,2018-11-22
还可以吧。其实就这样 随船有讲解 既然来了苏州那不去 有些后悔 所以就来了 还是很有味道的 好像一瞬间进入了一个古老的时空,https://gs.ctrip.com/html5/you/comment/detail/25486/11/156134286.html,https://dimg04.c-ctrip.com/images/t1/headphoto/272/077/772/76b262d0cc24492abc5c6784c903c2ab_C_180_180.jpg,_WeCh****90395,4分,2018-08-13
来苏州必玩攻略之一，白天可以玩园林，博物馆，晚上一定要逛平江路。山塘街,https://gs.ctrip.com/html5/you/comment/detail/25486/11/155517138.html,https://dimg04.c-ctrip.com/images/Z80k0z000000neoyg4334_C_180_180.jpg,小小小鱼儿Ooo,5分,2018-07-05
