标题,标题链接,头像,user-detail__name,totalStarIcon1,resource_date
"苏州山塘街被誉为“姑苏第一名街”，自古就是姑苏城中的繁华街市，时光闪回明清时，曹雪芹笔下的“最是红尘中一二等富贵风流之地”。

据史料记载：它因山塘河而得名，是公元825年中国唐代诗人白居易任苏州刺史时募工凿河堆堤而成，是一条有1100多年历史的古街。山塘街位于苏州古城西北，东南从阊门起，西北至虎丘止，全长约3600米，约合七华里，故有“七里山塘”之称。甚至当年清朝乾隆皇帝壬午年间游江南时，于七里山塘书写“山塘寻胜”，现今碑刻在山塘桥旁御碑亭内保护着。乾隆回京后更是在颐和园后湖仿照七里山塘的模样修建了苏州街。

走在山塘街上，街河并行，河街相邻，小桥流水，枕河人家，建筑精致典雅、疏朗有致；店肆林立、会馆集聚，再现了山塘街的盛世繁华。许多人脑海中顿时都会浮现出一幅桨声灯影夜姑苏的画面，在这里，美食美景，皆让人流连。

其实要逛山塘街就得晚上来，我更喜欢夜色之下的山塘，犹如一副水墨画。当夜幕降临，红灯笼亮起来了，很漂亮；在河边漫步，微风扑面，这里灯火辉煌，水乡古镇风韵扑面而来。山塘街一半繁华，一半宁静，一半璀璨，一半淡雅，不同风格的夜景，总有一款是你喜欢的。

时光仿佛倒流，一夜笙歌的山塘街，河里轻轻划过去的花舟里，陈圆圆、董小宛们疲惫微醺的眼神深藏多少羡慕，却只能一声暗叹继续向野芳浜而去，空留船后波纹渐息......

旅游小贴士：
山塘街
交通：苏州地铁2号线【山塘街】站3号出口；
门票：街区不收费，玉涵堂、泉州会馆、绍兴会馆、古戏台、山塘阁、安泰救火会、江南成衣馆等七个景点门票联票45元；所以只游街区不游景点是不用买票的。
游玩美食攻略：
山塘街主街商业气息浓厚，如果想体验老苏州生活，可以由山塘街主入口牌坊处左转，一条巷子进去，这里都是原汁原味的老苏州。
目前山塘街内有山塘书院，通贵桥，吴一鹏故居，唐少傅白公祠，苏州南社纪念馆，玉涵堂、泉州会馆、绍兴会馆、古戏台、山塘阁、安泰救火会、江南成衣馆等景点，可以按自己喜好打卡。
来山塘街寻味，美食必不可少，推荐的特色餐馆有：2家百年老店陆稿荐和义昌福包子，老盛兴菜馆，阿国蛋糕店，龙兴记，长脚馄饨，万福兴糕团，山塘老街烧饼店，马栋佩烧麦，荣阳楼汤包店，阿坤卤菜店，新年点心店，品味坊，老山塘梅花糕海棠糕，狐狸家手工酸奶酪，百年老卤，闻其香臭豆腐，赵元章骨肉烧，朱文鑫酱骨烧，潘记藏书羊肉老店，鑫震源苏式生煎，孙盛兴奥灶面馆。",https://gs.ctrip.com/html5/you/comment/detail/25486/11/165841075.html,https://dimg04.c-ctrip.com/images/Z8090t000000ic9xd14B0_C_180_180.jpg,心灵宫殿,5分,2021-02-26
苏州是个水乡，河道多，桥多，而山塘街是最具苏州街巷特征的典型。它中间是山塘河，山塘街则紧傍河的北侧，通过一座座石桥与另一侧的街道连接。山塘街上店铺、住家鳞次栉比，这里的房屋多为前门沿街，后门临河，有的还建成特殊的过街楼，真是朱栏层楼，柳絮笙歌。,https://gs.ctrip.com/html5/you/comment/detail/25486/11/165466751.html,https://dimg04.c-ctrip.com/images/Z80813000000tuiq21A55_C_180_180.jpg,勇猛十温柔,5分,2021-01-04
"山塘街位于苏州西北，东至红尘中“一二等富贵风流之地”阊门，西至“吴中第一名胜”虎丘，全长约3600米，约合7华里，故称“七里山塘到虎丘”。

唐代，白居易任苏州刺史，对苏州城外西北河道进行疏浚，开挖成山塘河，傍河而建的古街被称为山塘街，沿街均为古建筑。古建筑大多是晚清和民国时期的建筑，为几落几进构成的建筑群体，纵向为落，横向为进。

2010年，山塘街获评“中国文化遗产保护典范单位”，被评为“中国历史文化名街”；2015年，山塘街被中国住建部、文物局评为首批“中国历史文化街区”。",https://gs.ctrip.com/html5/you/comment/detail/25486/11/165917390.html,https://dimg04.c-ctrip.com/images/t1/headphoto/672/170/677/24227789be7e4eb7ab34d2c693a5ab0f_C_180_180.jpg,悠悠星空,5分,2021-03-08
"“上有天堂，下有苏杭”，苏州是我国首批历史文化名城之一，一个有着将近2500年历史的现代化城市，园林建筑的标志性城市。在苏州的晚上，在夜色中穿梭山塘街，绝对是一段难忘的体验。山塘街全长3600米，始建于唐朝，距今已经有了上千年的历史，被评为“中国历史文化名街”。苏州是典型的江南水乡，山塘街则最具有苏州街巷特征，街道水陆并行，两旁的建筑精致典雅。山塘街是古苏州的精华所在，被称为“老苏州的缩影，吴文化的窗口”。

山塘街可以分为东西两段，东段从阊门渡僧桥起至半塘桥，西段指半塘桥至虎丘山。山塘街上河道多，桥多的特征充分体现了苏州这个水城的街巷特点。山塘河的东段民居大多都是临水构筑，水榭和水阁都是由木桩支撑着的。河的西段水面则疏朗宽阔，两岸种植花木绿树。水面上横跨的古桥或平或拱、或单孔或三孔。山塘沿街两侧的大多数古建筑，大多是晚清和民国时期的建筑，为几落几进构成的建筑群体，纵向为落，横向为进。在这里，逛逛古街是最大的乐趣，在这里可以找到苏州老字号比如：采芝斋、五芳斋等等，特色糕点和手工艺品的店铺真的超多。这里的民居基本上都是前门沿街，后门临河，是典型的水乡人家。山塘河从这些民居中缓缓流过，乌篷船停靠在岸边，两边的建筑红灯笼从高处垂下，非常的静谧，一瞬间就让你穿越回了古代。

我是顺时针，一个爱旅行爱摄影爱打卡的大龄青年，虽不是职业旅行人士，但旅行已是我生命中的必修课，也是我生活不可或缺的一部分，我爱随性随意的随拍，也爱分享我的旅程心得和体验，如果你觉得我的笔记有帮助到你，请随手给个赞鼓励哦。",https://gs.ctrip.com/html5/you/comment/detail/25486/11/164939638.html,https://dimg04.c-ctrip.com/images/Z80o0k000000boicv1497_C_180_180.jpg,顺时针1986,5分,2020-10-30
"去到苏州那当然是山塘街，逛逛观前街走走大裤衩下面拍拍照啦。
    反正我之苏州旅游就是这么干的，从上海到苏州安排了三天两夜，足够把苏州好好逛逛走走，好多店吃一吃喝一喝了。
   旅游不能停，吃喝不能停。",https://gs.ctrip.com/html5/you/comment/detail/25486/11/165865796.html,https://dimg04.c-ctrip.com/images/Z80h180000013xc9e3F64_C_180_180.jpg,yoyolove7788,5分,2021-03-01
"山塘街始建于唐代宝历年间，公元825年白居易奉命到苏州任刺史。上任不久，他坐了轿子到虎丘去，看 到附近的河道淤塞，水路不通，回衙后，立即找来有关官吏商量，决定在虎丘山环山开河筑路，并着手开凿一条山塘河。它东起阊门渡僧桥附近，西至虎丘望山桥，长约7里，故俗称""七里山塘到虎丘""。这条河在阊门与运河相接。在河塘旁筑堤，即山塘街。山塘河的开凿和山塘街的修建，大大便利了灌溉和交通，这一带成了热闹繁华的市井。苏州百姓非常感激白居易，他离任后，百姓即把山塘街称之为白公堤，还修建了白公祠，以作纪念。",https://gs.ctrip.com/html5/you/comment/detail/25486/11/165466649.html,https://dimg04.c-ctrip.com/images/Z8070a0000004m9t7BB14_C_180_180.jpg,周游列国,5分,2021-01-04
"在这里感受年味🎉🎉# 1,2,3,4 for 2021 #
心无一丝尘，福禄双临门。
三餐香甜味，四季平安人。年味正浓时！",https://gs.ctrip.com/html5/you/comment/detail/25486/11/165706671.html,https://dimg04.c-ctrip.com/images/Z80s0u000000j2gtc4892_C_180_180.jpg,elsashen0529,5分,2021-02-10
山塘街位于江苏省苏州古城西北，东至阊门，西至“吴中第一名胜”虎丘，唐代白居易任苏州刺史时对疏浚河道开挖而成山塘河，傍河而建的古街被称为山塘街，沿街均为古建筑。全长约3600米，约合7华里，故称“七里山塘到虎丘”。,https://gs.ctrip.com/html5/you/comment/detail/25486/11/165853034.html,https://dimg04.c-ctrip.com/images/fd/headphoto/g3/M02/95/E9/CggYGlZdJCuAJyQRAADkY4Wvzug356_C_180_180.jpg,格格,5分,2021-02-28
去山塘街是不需要门票的，不过你需要出示一下健康码 如果老年没有健康码的，可以局社区开一张证明给安保看一下就可以了 开放式的环境嘛，所以说戴不戴口罩随便你 不天的，如果觉得是人流太密集，那你要带也可以 但我现在大中国已经安全了 。,https://gs.ctrip.com/html5/you/comment/detail/25486/11/165871251.html,https://dimg04.c-ctrip.com/images/t1/headphoto/699/910/854/683dab66bb374136af9930ea204dfc7e_C_180_180.jpg,深蓝色的紫007,4分,2021-03-02
"免费景点，还是很值得去的地方，山塘街。
    山塘街的夜景其实我反而觉得就这样，可能因为去过太多的古镇水乡，实在觉得千篇一律。
    我反而喜欢山塘街白天的样子，生活化里掺杂一些些商业化，依旧接地气的让我喜欢。
    走走看看吃吃极好。",https://gs.ctrip.com/html5/you/comment/detail/25486/11/165454677.html,https://dimg04.c-ctrip.com/images/Z80h180000013xc9e3F64_C_180_180.jpg,yoyolove7788,5分,2021-01-03
一提苏州的古街，“山塘街”必须有姓名。山塘街位于江苏省苏州古城西北，东至红尘中“一二等富贵风流之地”阊门，西至“吴中第一名胜”虎丘，全长约3600米，约合7华里，故称“七里山塘到虎丘”。如果时间闲暇的话，不妨坐一坐山塘河的游船，听一听船上的评弹，喝一杯香茶，体会最地道的苏州风情。等到夜幕降临，就到了七里山塘最繁华的时候。河道两旁的红灯笼被点亮，灯火映在河面上，随着河水摇摇晃晃明明暗暗，点缀了老街的梦。,https://gs.ctrip.com/html5/you/comment/detail/25486/11/165358285.html,https://dimg04.c-ctrip.com/images/t1/headphoto/295/828/780/6e6c2151ed65497c850945d5d2b702ae_C_180_180.jpg,红色利物浦1985,5分,2020-12-21
大家记得，山塘街是免费的，不要去听谁说或者什么什么导游说要付费游览，骗人的，不要钱的，自己扫码出示健康码就可以搞定的事情了 。留一个小时逛差不多了，一个半也行,https://gs.ctrip.com/html5/you/comment/detail/25486/11/165549012.html,https://dimg04.c-ctrip.com/images/Z80h180000013xc9e3F64_C_180_180.jpg,yoyolove7788,5分,2021-01-15
有点类似于苏州的平江路历史街区，都是古香古色的，很有苏州文化领域，能够代表苏州的这种小桥流水人家的江南景色。因此有很多文创产品很值得去逛一下。,https://gs.ctrip.com/html5/you/comment/detail/25486/11/165846945.html,https://dimg04.c-ctrip.com/images/headphoto/425/574/648/a5c712d906684b4a854f86ac4c521f35_C_180_180.jpg,selma1982,4分,2021-02-27
苏州山塘街，很好逛的一个地方。一条街好好的走走逛逛可以逛两个小时呢！。一路上面有小吃店有特产店糕团店有手信和玩乐店。去苏州可以花点时间去走走。,https://gs.ctrip.com/html5/you/comment/detail/25486/11/165712954.html,https://dimg04.c-ctrip.com/images/Z80h180000013xc9e3F64_C_180_180.jpg,yoyolove7788,4分,2021-02-11
苏州的山塘街真的是一条非常有味道的老街，感觉是古香古色，非常能代表苏州古城的文化情致。这条街上有很多的店铺都非常有文艺色彩。很值得去逛一下。,https://gs.ctrip.com/html5/you/comment/detail/25486/11/165825210.html,https://dimg04.c-ctrip.com/images/headphoto/425/574/648/a5c712d906684b4a854f86ac4c521f35_C_180_180.jpg,selma1982,4分,2021-02-24
唐代，白居易任苏州刺史，对苏州城外西北河道进行疏浚，开挖成山塘河，傍河而建的古街被称为山塘街，沿街均为古建筑，它东起阊门渡僧桥附近，西至虎丘望山桥，长约7里，故俗称“七里山塘到虎丘”。晚唐诗人杜荀鹤有诗云：“君到姑苏见，人家尽枕河。古宫闲地少，水港小桥多。”在苏州众多的街巷之中，名胜山塘街，被称誉为“姑苏第一名街”。苏州是个水乡，河道多，桥多，而山塘街是最具苏州街巷特征的典型。它中间是山塘河，山塘街则紧傍河的北侧，通过一座座石桥与另一侧的街道连接。山塘街上店铺、住家鳞次栉比，真是朱栏层楼，柳絮笙歌。山塘街又是一条典型的水巷，河上装载着茉莉花、白兰花及其它货物的船只来来往往，游船画舫款款而过。,https://gs.ctrip.com/html5/you/comment/detail/25486/11/164470126.html,https://dimg04.c-ctrip.com/images/Z8020i0000009bqe17BF7_C_180_180.jpg,静静de黎明,5分,2020-09-18
适合晚上逛。夜景很好看。位于市中心，离地铁站很近。比较适合拍照打卡。白天来玩的话也可以乘船。街上有很多特色的小吃。一个小时左右便可逛完,https://gs.ctrip.com/html5/you/comment/detail/25486/11/165903233.html,https://dimg04.c-ctrip.com/images/Z80p1800000151w8d9891_C_180_180.jpg,hahagaotie,5分,2021-03-07
山塘街是一个去了苏州很多人都会去的场所，现在也是人气很旺的地方了。一路上小吃店挺多的，大多数糖粥或者赤豆糊小圆子都是12块钱一碗有点贵，免费景区还是应该定价实惠一点才行啊！,https://gs.ctrip.com/html5/you/comment/detail/25486/11/165525965.html,https://dimg04.c-ctrip.com/images/t1/headphoto/177/080/529/285e9abeede347d9a7c1cc5e1b4c9287_C_180_180.jpg,h小pp,5分,2021-01-12
苏州山塘街，反正每个城市都有一处老街就是啦，嘿嘿人们都喜欢怀旧就是啦。我也不例外的。走石板路记得一定要穿平底鞋哦知道吗？不然走的你生无可恋哦，还有好几座桥的，走起走起哦。,https://gs.ctrip.com/html5/you/comment/detail/25486/11/165627868.html,https://dimg04.c-ctrip.com/images/Z80h180000013xc9e3F64_C_180_180.jpg,yoyolove7788,5分,2021-01-28
山塘街位于江苏省苏州古城西北，东边是阊门，被誉为“一二等富贵风流之地”，西边是虎丘，被誉为“吴中第一名胜”，因此这是一条又被叫做是“七里山塘到虎丘”的街道，全长约三千六百米。,https://gs.ctrip.com/html5/you/comment/detail/25486/11/165750828.html,https://dimg04.c-ctrip.com/images/Z80n0l000000d8r2j8536_C_180_180.jpg,紅氿,4分,2021-02-16
山塘街位于江苏省苏州古城西北，东至阊门，西至虎丘，全长约3600米，约合7华里，故称“七里山塘到虎丘”。山塘街的古建筑大多是晚清和民国时期的建筑，为几落几进构成的建筑群体，纵向为落，横向为进。,https://gs.ctrip.com/html5/you/comment/detail/25486/11/165339478.html,https://dimg04.c-ctrip.com/images/Z803160000010g2bq615E_C_180_180.jpg,M22****5222,5分,2020-12-19
这边非常的古香古色，景色还是非常不错的，很值得休闲的时候去逛一下，而且附近有很多好吃的店。还有许多比较有文艺气息的店。感觉很文艺,https://gs.ctrip.com/html5/you/comment/detail/25486/11/165785717.html,https://dimg04.c-ctrip.com/images/headphoto/425/574/648/a5c712d906684b4a854f86ac4c521f35_C_180_180.jpg,selma1982,4分,2021-02-19
山塘街位于江苏省苏州古城西北，唐代，白居易任苏州刺史，对苏州城外西北河道进行疏浚，开挖成山塘河，傍河而建的古街被称为山塘街。山塘街东至红尘中“一二等富贵风流之地”阊门，西至“吴中第一名胜”虎丘，全长约3600米，约合7华里，故称“七里山塘到虎丘”。,https://gs.ctrip.com/html5/you/comment/detail/25486/11/165684894.html,https://dimg04.c-ctrip.com/images/Z803160000010g2bq615E_C_180_180.jpg,M22****5222,5分,2021-02-07
苏州是著名的江南水乡，城内水港交错，街衢纵横，晚唐诗人杜荀鹤有诗云：“君到姑苏见，人家尽枕河。古宫闲地少，水港小桥多。”在苏州众多的街巷之中，名胜山塘街，被称誉为“姑苏第一名街”。该街区以山塘传统风貌为主题，集旅游、休闲为一体，充分展示山塘丰厚的历史文化底蕴、典型的姑苏水巷风貌、鲜活的吴地民俗风情。,https://gs.ctrip.com/html5/you/comment/detail/25486/11/165018327.html,https://dimg04.c-ctrip.com/images/Z80u170000010qzwdFD74_C_180_180.jpg,戴戴戴小喵,5分,2020-11-08
山塘街上的河道众多，因此小桥也多，处处体现着苏州这个作为江南水乡的特色。附近的河道蜿蜒前行，长的甚至到虎丘有七里。现在商业味道过浓。,https://gs.ctrip.com/html5/you/comment/detail/25486/11/165750776.html,https://dimg04.c-ctrip.com/images/Z8090q000000gagjjF679_C_180_180.jpg,M15****345,4分,2021-02-16
山塘街位于江苏省苏州古城西北，全长约3600米，约合7华里。东至阊门，西至虎丘，故称“七里山塘到虎丘”。山塘街的古建筑大多是晚清和民国时期的建筑，为几落几进构成的建筑群体，纵向为落，横向为进。,https://gs.ctrip.com/html5/you/comment/detail/25486/11/165339623.html,https://dimg04.c-ctrip.com/images/fd/headphoto/g3/M02/95/E9/CggYGlZdJCuAJyQRAADkY4Wvzug356_C_180_180.jpg,格格,5分,2020-12-19
苏州的一个免费开放的景点七里山塘，是首批中国历史文化名街之一，主要景点集中在广济桥到东南门，山塘河边有各种购物餐饮店，是到苏州必游景点之一。,https://gs.ctrip.com/html5/you/comment/detail/25486/11/165604482.html,https://dimg04.c-ctrip.com/images/Z80t1g000001h30d7D8F4_C_180_180.jpg,202****751,5分,2021-01-24
"初冬时期的苏州，很少会刮北方的大风，不晴朗的天气下，有时会下如丝的小雨，细细绵绵，不到地下就飘散了。这时的江南还没有到冷到骨头缝里的时节，温差不大，还算是安逸和温暖。
苏州小桥流水的美，会使得发脾气的人也消了气，婉约而静气，干什么都是轻轻地，小心翼翼，生怕动作大了而伤了风情。",https://gs.ctrip.com/html5/you/comment/detail/25486/11/165168920.html,https://dimg04.c-ctrip.com/images/Z8061g000001h4ygkA34A_C_180_180.jpg,ca****y,5分,2020-11-26
每年去山塘街是为了吃糖粥和糖芋艿，饱口福！除了吃 还有这里的夜景也是非常吸引我的！山塘街的夜景，山塘街的夜景美不胜收，月光码头上 波光粼粼的湖面 把向往的江南水乡，体现的淋漓尽致 在这里走一走 喝上一杯 是很不错的选择哦,https://gs.ctrip.com/html5/you/comment/detail/25486/11/164561632.html,https://dimg04.c-ctrip.com/images/Z80m0z000000ntdld1164_C_180_180.jpg,tiramisu1130,5分,2020-09-29
山塘街是苏州最出名的步行街之一，也被称之为七里山塘，可以一直通到虎丘，夜景非常的漂亮，沿着河边两岸的店铺灯火通明，坐船也是不错的选择。,https://gs.ctrip.com/html5/you/comment/detail/25486/11/165922414.html,https://dimg04.c-ctrip.com/images/t1/headphoto/757/757/889/3b86691007a54fe684f07e198432d09b_C_180_180.jpg,wind3757,4分,2021-03-09
下了一场下了一场大雪，整个姑苏雪景的风味就出来了，感觉还是下雪的苏州更美一些，非常值得去欣赏一下苏州古城的美景。小桥流水全都白茫茫,https://gs.ctrip.com/html5/you/comment/detail/25486/11/165489535.html,https://dimg04.c-ctrip.com/images/headphoto/425/574/648/a5c712d906684b4a854f86ac4c521f35_C_180_180.jpg,selma1982,5分,2021-01-07
七里山塘--梦里水乡古城苏州是著名的江南水乡，城内水港交错，街衢纵横。景点攻略详细地址：东起：阊门渡僧桥西至：苏州名胜虎丘山的望山桥交通攻略：公交以及地铁都能去的开放时间：全天门票价格：免费亮点特色：山塘街堪称江南水乡街巷的典范。,https://gs.ctrip.com/html5/you/comment/detail/25486/11/165716545.html,https://dimg04.c-ctrip.com/images/t1/headphoto/857/872/237/edc9e981b00e436a8dcee595001d62fa_C_180_180.jpg,_wech****045076,3分,2021-02-12
山塘街位于江苏省苏州古城西北，东至红尘中“一二等富贵风流之地”阊门，西至“吴中第一名胜”虎丘，全长约3600米，约合七华里，故称“七里山塘到虎丘”。 山塘街以其独特的地理位置、优越的水陆交通条件和独具特色的街区风貌，逐渐成为吴文化的展示窗口和苏式生活的体验地，是古城苏州城市发展的独特资源和文化旅游的特色名片。,https://gs.ctrip.com/html5/you/comment/detail/25486/11/165169664.html,https://dimg04.c-ctrip.com/images/t1/headphoto/207/494/838/fa687736cf3f484480526cfc0eb6c073_C_180_180.jpg,M22****4422,5分,2020-11-27
"位置：到达山塘街南门，靠近山塘门，步行五分钟就是白居易祠堂，旁边就是白居易码头。
手续：凭身份证，到售票处换取纸质船票，到码头测体温、出示苏康码登船。
tips：建议登船前先去山塘街入口处星巴克对面厕所，否则游船全程45分钟时长，再加上等待全船客满的时间，会等不及上厕所。
靠窗一路看到的景色很好，比步行游山塘街的感受要好，毕竟国庆节人山人海，摩肩接踵。",https://gs.ctrip.com/html5/you/comment/detail/25486/11/164671718.html,https://dimg04.c-ctrip.com/images/Z80h180000013xc9e3F64_C_180_180.jpg,张老师永远18岁,5分,2020-10-06
景色优美，地理位置优越，好美的地方。,https://gs.ctrip.com/html5/you/comment/detail/25486/11/165942165.html,https://dimg04.c-ctrip.com/images/Z80f0q000000g8zd82D7A_C_180_180.jpg,Mister美树日记,5分,2021-03-12
苏州的山塘街每天很多游人去玩的，我们也是游客也去了。晚上的灯光虽然有点好看但是确实没什么特色，不久前去了西塘也是这样的，现在天冷了，路上热食生意好。,https://gs.ctrip.com/html5/you/comment/detail/25486/11/165503733.html,https://dimg04.c-ctrip.com/images/t1/headphoto/258/512/704/6bce7506eecc48f8a4a6d3177e0acf24_C_180_180.jpg,飘飘摇摇,4分,2021-01-09
坐船的人还是挺多的，一个接一个的排队，保安大叔在寒冷的天气里也是站的笔笔直，大家游玩的兴致都是很高的，我感觉零下的温度也阻挡不了人们的步伐。,https://gs.ctrip.com/html5/you/comment/detail/25486/11/165365137.html,https://dimg04.c-ctrip.com/images/Z80h180000013xc9e3F64_C_180_180.jpg,yoyolove7788,5分,2020-12-22
