标题,标题链接,头像,user-detail__name,totalStarIcon1,resource_date
"苏州人真真是有文化底蕴，图十八上这个名字殿春簃，让我这个桀骜不驯的家伙，大大地栽了一个跟斗，正当我指着匾，跟小朋友说，簃春殿的时候，耳边响起了一位老先生的苏白，“是殿春簃”！

好好好，回身微笑一顾，人家还将出处一并给指点了。旁边可是芍药花圃，此花开尽，春意阑珊，簃为小屋之意，故以殿春之名冠之～

再说说图五图六中，无意被我摄入镜头的小桥。此桥有寓意，南宋时期的一位太守得一子一女，其子拿苏白话曰二百五，其女兰心蕙质，饱读诗书，其父视如掌珍，暗藏玄机，故造此桥，进假山曰添福添禄，反之走则添禄添福。

网师园很小，却有明轩之版，盛名于外。

苏州精致，人文气息浓厚，哈哈，谢了一字师，两下里均欢欢喜喜。不料小朋友来了一句，妈妈，你读错了，你说我拿你怎么办才好啊？",https://gs.ctrip.com/html5/you/comment/detail/1826/11/141660074.html,https://dimg04.c-ctrip.com/images/fd/headphoto/g1/M09/AB/02/CghzflWFdrKAPyTIAAF3pzZ3qpQ204_C_180_180.jpg,陆小凤,4分,2017-11-09
夜花园很不错，有惊艳的感觉！导游带着游客边讲边游，串起景点和表演，夜色迷离，月到风来，乐声细细，带来江南特有的风致…散场后闲游夜色灯影中的国林，更有不知身在何处的感慨啊！力荐力荐！,https://gs.ctrip.com/html5/you/comment/detail/1826/11/118195628.html,https://dimg04.c-ctrip.com/images/t1/headphoto/293/406/308/22631089f44a497495c005fce85f6a6f_C_180_180.jpg,M22****7402,5分,2017-08-06
网师乃渔夫、渔翁之意，与“渔隐”同意，含有隐居江湖的意思，园内的山水布置和景点题名蕴含着浓郁的隐逸气息，去游玩时可以到处找找。我去玩的时候并不知道这些，只当是普通园子逛逛，直到遇到里面的一个管理人员，为大家讲了很多有意思关于网师园的东西，还讲了张大千的哥哥为了弟弟画虎特地养了一只老虎在网师园，后来老虎死了，他还立了墓碑。网师园有一个口只能出不让进，需要按箭头所指绕到正门。逛完园子只需半天左右的光景。,https://gs.ctrip.com/html5/you/comment/detail/1826/11/117012916.html,https://dimg04.c-ctrip.com/images/Z80m090000003wdw3BA6D_C_180_180.jpg,周易恬,4分,2017-07-29
去的是夜场，19点开始检票。还有工作人员假扮的员外引领大家进去。做个简单的介绍后有专业导引带大家分批参观。院子不大但景缺很美，亭台楼阁小桥流水贯穿其中。尤其是到了每个厅堂都可以听到当地有名的戏曲，评弹小调等有8场来回演出，真的是赚回票价了,https://gs.ctrip.com/html5/you/comment/detail/1826/11/89177884.html,https://dimg04.c-ctrip.com/images/fd/headphoto/g2/M08/04/AD/Cghzf1WSn-KANPmMAAAk9daqYqo534_C_180_180.jpg,172846899,4分,2016-10-05
感觉不怎么样，我个人觉得还是沧浪亭比较好，网师园性价比太差,https://gs.ctrip.com/html5/you/comment/detail/1826/11/160715145.html,https://dimg04.c-ctrip.com/images/Z80q190000016xh1l3182_C_180_180.jpg,快来西,3分,2019-08-31
一定要夜游网师园，园子不大但夜景很美，在那里可以欣赏到评弹、古筝、笛子、戏曲等，坐在长廊里小憩，听着不远处的弹奏声有种穿越回到古代的感觉。,https://gs.ctrip.com/html5/you/comment/detail/1826/11/105056236.html,https://dimg04.c-ctrip.com/images/Z80e0z000000mjhs33CB4_C_180_180.jpg,jing66321,5分,2017-05-04
匆匆而过。假山很多，了解不多，匆匆而过，印象不是很深刻。,https://gs.ctrip.com/html5/you/comment/detail/1826/11/156977595.html,https://dimg04.c-ctrip.com/images/t1/headphoto/882/320/089/158cae5ddb6143c0b6ae18523614cf08_C_180_180.jpg,M24****3132,5分,2018-10-15
环境超美，满满的中国园林的味道，最喜欢网师园了，每一处都有它的寓意，每一处都是一张水墨画，那里很适合写生，还有热情的保安叔叔给我免费讲课,https://gs.ctrip.com/html5/you/comment/detail/1826/11/156073159.html,https://dimg04.c-ctrip.com/images/Z80l0u000000je0ic6036_C_180_180.jpg,洋99洋,5分,2018-08-09
园子不大，我觉得白天去应该是蛮无聊的，晚上虽然贵点，但是有意思很多，就是八个节目好快啊23333,https://gs.ctrip.com/html5/you/comment/detail/1826/11/154996853.html,https://dimg04.c-ctrip.com/images/t1/headphoto/062/938/215/f5f05c77006946428867e3c0dae6f4eb_C_180_180.jpg,M47****327,5分,2018-05-24
非常推荐的苏州园林，人也不是很多，因此非常值得推荐。没有乾坤，两点有中文导游，里面的所有建筑摆设都是有讲究。非常有意思的。花园也很漂亮。,https://gs.ctrip.com/html5/you/comment/detail/1826/11/97872431.html,https://dimg04.c-ctrip.com/images/Z80k0d0000006wabi121C_C_180_180.jpg,三十四号,5分,2017-02-21
江苏苏州网师园真是太好看了。真是太漂亮了。真是太棒了。,https://gs.ctrip.com/html5/you/comment/detail/1826/11/155356012.html,https://dimg04.c-ctrip.com/images/t1/headphoto/699/910/854/683dab66bb374136af9930ea204dfc7e_C_180_180.jpg,M32****278,5分,2018-06-20
来苏州十几次了，逛过白天的网师园，这次逛网师园夜景.感受一下不同的风景，说有八场不同的演出，也就是应付似的演出，比较浆糊，没啥意思。,https://gs.ctrip.com/html5/you/comment/detail/1826/11/156944932.html,https://dimg04.c-ctrip.com/images/Z80s0b0000005jksw0AB0_C_180_180.jpg,初到“FY-1101”,4分,2018-10-10
网师园地理位置在十全街附近，离我们住宿的地方很近，非常值得一看，一步一景，苏州园林，好评。,https://gs.ctrip.com/html5/you/comment/detail/1826/11/157792455.html,https://dimg04.c-ctrip.com/images/Z80h180000013xc9e3F64_C_180_180.jpg,sunxutj,5分,2019-02-07
江南中小园林，和拙政园狮子林风格不同，但也自有其趣味。一步一景，移步换景。位置不是很繁华的地方，远离主街，十分清净，适合仔细游览。,https://gs.ctrip.com/html5/you/comment/detail/1826/11/96661411.html,https://dimg04.c-ctrip.com/images/t1/headphoto/882/320/089/158cae5ddb6143c0b6ae18523614cf08_C_180_180.jpg,_CFT01****6850167,5分,2017-02-03
非常好，游园惊梦，每一个场都很有特色，就是有点短,https://gs.ctrip.com/html5/you/comment/detail/1826/11/155667688.html,https://dimg04.c-ctrip.com/images/Z80h180000013xc9e3F64_C_180_180.jpg,206****997,5分,2018-07-12
非常有特色 在看完四大名园后 来这里赏夜景 看节目 别有一番情调 正值八月十六 灯光月光湖光互相映衬 更是唯美 有几处厅堂里面陈设很美 如果开放就更好了 另外有些园林小品灯光有些暗 虽然有点不足 但整体很完美实惠,https://gs.ctrip.com/html5/you/comment/detail/1826/11/138745690.html,https://dimg04.c-ctrip.com/images/t1/headphoto/757/757/889/3b86691007a54fe684f07e198432d09b_C_180_180.jpg,_WeCh****24821,5分,2017-10-06
几十块能看到这么多表演，还能逛园子，太超值了！网师园是小而精的典范，房间都是绕湖一周，因为有表演和灯光，流连忘返，评弹和昆曲很棒,https://gs.ctrip.com/html5/you/comment/detail/1826/11/99585940.html,https://dimg04.c-ctrip.com/images/Z8050e000000742l3A85E_C_180_180.jpg,ijoying,5分,2017-03-26
精致的小园林，人不多，值得一去，细细品味一下苏州大户人家的生活。正好住在附近，直接溜达过去了，在胡同里。有二维码的导游可以听。,https://gs.ctrip.com/html5/you/comment/detail/1826/11/156929218.html,https://dimg04.c-ctrip.com/images/Z80h180000013xc9e3F64_C_180_180.jpg,110****282,5分,2018-10-09
网师园的夜景配合8个不同的曲目也算是江南的雅致了，只是演员的水平。。。。。。不过要循环演出、天又大热，也难为演员和那个票价了。,https://gs.ctrip.com/html5/you/comment/detail/1826/11/156291799.html,https://dimg04.c-ctrip.com/images/Z80p180000013uw9yF21F_C_180_180.jpg,M60****01,5分,2018-08-25
网师园夜景很美，是典型的宅园合一的园林，先由工作人员带领依次欣赏昆曲、评弹、茶道、古筝等表演，而后可以慢慢遛园子欣赏夜景的美丽，坐在园中长廊内有种穿越回到古代的感觉?,https://gs.ctrip.com/html5/you/comment/detail/1826/11/116557275.html,https://dimg04.c-ctrip.com/images/Z80e0z000000mjhs33CB4_C_180_180.jpg,jing66321,5分,2017-05-02
小而全很精致的园子，每个地方都可以扫描语音讲解好，园子干净、整洁，清净，有时间一定在冬夏春再来一次凑足四季，领略四季不同景色,https://gs.ctrip.com/html5/you/comment/detail/1826/11/155524043.html,https://dimg04.c-ctrip.com/images/Z80h180000013xc9e3F64_C_180_180.jpg,E37****24,5分,2018-07-06
太值得去了，夜晚游园，八个经典的风俗节目，到每一个厅堂一个、很有味道，很美，很有意境,https://gs.ctrip.com/html5/you/comment/detail/1826/11/86613665.html,https://dimg04.c-ctrip.com/images/Z80w070000002q6cx789A_C_180_180.jpg,天籁之声96,5分,2016-08-28
很有创意的夜游被嘲杂的人流减分不少，本该闲庭漫步的悠哉悠哉被赶场子抢位子破坏殆尽。,https://gs.ctrip.com/html5/you/comment/detail/1826/11/156726284.html,https://dimg04.c-ctrip.com/images/Z801170000011qo3f9BCE_C_180_180.jpg,shir****e22,3分,2018-09-24
非常值得一游，一定要夜游，感受这边的文化。,https://gs.ctrip.com/html5/you/comment/detail/1826/11/154788146.html,https://dimg04.c-ctrip.com/images/Z80p180000013uw9yF21F_C_180_180.jpg,M13****219,5分,2018-05-10
国庆节去的，人相对平时多了好多，八个节目都是走马观花，五分钟一个吧。不过看完节目，可以自由活动，到了九点半以后人就少了。由于是晚上，还是得多转几遍才能把园子摸清。,https://gs.ctrip.com/html5/you/comment/detail/1826/11/138744247.html,https://dimg04.c-ctrip.com/images/Z80p180000013uw9yF21F_C_180_180.jpg,118****761,5分,2017-10-06
网师园是苏州园林代表作，我认为是最精致的一个院子。特地挑了夜游，基本就是一次传统戏曲的观摩课，看啦古筝、评弹、昆曲等几个项目，夜景还是比较漂亮。提点不足的话，感觉每个项目太短，有点走过场，如果每个项目一直堂演，让游客自个挑喜欢的看就更合适。另外，感觉夜景灯光单薄了点，光源也不够柔和，布点也不够均匀，出现许多景点亮暗不均，缺少光晕氛围。,https://gs.ctrip.com/html5/you/comment/detail/1826/11/156895627.html,https://dimg04.c-ctrip.com/images/Z80m0x000000l8yjs41B8_C_180_180.jpg,ka****008,4分,2018-10-06
网师园的规模不大，夜游却很有趣味。五一假期人很多，得分批次进入。一共有八段表演，其中由评弹、昆曲、古琴、合奏、地方剧、舞蹈等。每一段表演时间不长，约3-5分钟。顺着表演可以游玩整个园子。牡丹亭那两段在园子假山、草木、小径的衬托下，就像把游客带入了戏中。古琴演奏非常也隽永。五一节专门制作的盆栽也是一大亮点。如果对古典戏剧有兴趣，不妨一去。带小孩子就不太推荐了。晚上景区比较暗，小孩子容易磕碰，另外表演的内容小孩子估计看不懂。,https://gs.ctrip.com/html5/you/comment/detail/1826/11/154665802.html,https://dimg04.c-ctrip.com/images/Z80h180000013xc9e3F64_C_180_180.jpg,jumma,4分,2018-05-02
很值得一看，近距离看演员表演，很好很喜欢,https://gs.ctrip.com/html5/you/comment/detail/1826/11/154296148.html,https://dimg04.c-ctrip.com/images/Z80p180000013uw9yF21F_C_180_180.jpg,_zfb20****9202379,5分,2018-04-07
"七点半前就到了，门前已经有人在排队了，换了票进去，等到七点半开始，有导游很详尽的介绍,然后在园中随着进入不同厅然后观看了不同的演奏，还有昆曲、评弹的表演，对院子也了解了，总之挺有趣的，网师园是个小而精的园子，看完了还可以再转转，值得一看。",https://gs.ctrip.com/html5/you/comment/detail/1826/11/116796807.html,https://dimg04.c-ctrip.com/images/t1/headphoto/136/299/437/649eb217e3e54746b7a53b8665e14b00_C_180_180.jpg,M25****600,5分,2017-06-22
很不错，园林虽然不大，但蛮精致的，夜晚在多彩灯光的辉映下，更显美伦美幻。夜场中上演的昆曲、评弹、古筝伴舞等8个节目，让游客更加充分地领略了美丽苏州的文化和魅力。,https://gs.ctrip.com/html5/you/comment/detail/1826/11/116793002.html,https://dimg04.c-ctrip.com/images/Z80h180000013xc9e3F64_C_180_180.jpg,203****911,5分,2017-06-21
因为被推荐住在南林饭店，所以必须去网师园看看！院子不大，却也应有尽有，紧凑精巧细致！感觉很亲民，好像以前稍富裕的人家都应该住这样的地方，有墙壁为纸，树为画的别致，有池水为底，亭台楼阁泼墨的挥毫，虽然不是非去不可，但却是去了不后悔的地方,https://gs.ctrip.com/html5/you/comment/detail/1826/11/108887264.html,https://dimg04.c-ctrip.com/images/Z80h180000013xc9e3F64_C_180_180.jpg,草木青青,5分,2017-06-04
"地仅数亩，布局紧凑，却有迂回不尽的景致。万卷堂前的砖雕门楼为乾隆年间，雕工精细，为苏州同类门楼之冠。梯云室的木雕极为精细。殿春簃曾为张大千居住数年，此庭院一角还有张大千为纪念他饲养的老虎所书墓碑记。
清早逛完网师园，又听朋友推荐夜游网师园，欣赏园内的江南丝竹表演节目，白天看景、网上看戏，各有致趣。",https://gs.ctrip.com/html5/you/comment/detail/1826/11/116696410.html,https://dimg04.c-ctrip.com/images/Z80h180000013xc9e3F64_C_180_180.jpg,139****9500,5分,2017-05-31
非常超值的体验，穿插于文化古园林近距离享受当地8个很棒的节目，昆曲评弹都有，印象深刻就是表演围绕园林如此融入特别享受难忘，以后还会来也会推荐朋友看夜游，非常值得,https://gs.ctrip.com/html5/you/comment/detail/1826/11/116662831.html,https://dimg04.c-ctrip.com/images/t1/headphoto/646/318/109/a865fe5f5465407d8befd5dc487a8554_C_180_180.jpg,327style,5分,2017-05-27
网师园入踅向左，有引静桥，塘开亩许，南山北堂。山曰云冈，有步径可登，连濯缨水阁，与竹外一枝轩、看松读画轩隔塘相望。水鉴轩风，有诗书意。自二轩向东，为万卷堂、撷秀楼等厅室，砖额极尽精美。尤其万卷堂藻耀高翔门楼，上枋蔓草绵延，下枋福山寿海，两侧吊柱双狮戏球，额左右各有透,https://gs.ctrip.com/html5/you/comment/detail/1826/11/58656979.html,https://dimg04.c-ctrip.com/images/Z80p180000013uw9yF21F_C_180_180.jpg,185****4220,5分,2015-10-07
"【行走江南，且行且歌唱】“小园极则”的网师园，是苏州园林中极具艺术特色和文化价值的代表作品。

阴天，沿着小巷子走上20米左右，就望到网师园。仅仅20米的距离，将大街上的匆忙喧嚣、尘土雾霾统统分隔开，仿佛两个世界。清晨，游客寥寥，为我们掀开羞涩的面纱，一睹苏州园林的秀美真颜。

厅堂相颐，曲水扬波，亭台碑廊玲珑有致。小小庭院看尽天下风光，方寸之所已成流连忘返之地，游于景、游于艺、游于心。遥想当年那些文人大夫、商人大贾的私宅大院最终成了风景，不由感慨时光流转、光阴变迁。",https://gs.ctrip.com/html5/you/comment/detail/1826/11/13641042.html,https://dimg04.c-ctrip.com/images/fd/headphoto/g1/M02/BA/52/CghzfFT639mADbklAABfAKQNq_w076_C_180_180.jpg,只喝可乐的猫,5分,2015-03-13
网师园是座精巧的私家园林，前厅后园。大厅旁有一小书房，宽大的书案，阔大的书架，让我羡慕的眼睛发亮。待看到后面正式的书房时，更加嫉妒地不能自已，偌大的空间，有正式的桌椅，有小憩的卧榻，还有挥毫间，抚琴处，更有窗外美景如斯，可解疲劳。别忘了，还有一座雅致的花园可供休闲游玩，唉，人生如此，真是再无遗憾了。,https://gs.ctrip.com/html5/you/comment/detail/1826/11/4627369.html,https://dimg04.c-ctrip.com/images/fd/headphoto/g3/M08/32/18/CggYGVZXJq2AckjkAAAikYVRwn8262_C_180_180.jpg,落花流水春去也,5分,2014-05-10
网师园景区不太大，慢慢逛大概1个半小时，典型的苏州园林古典山水宅院代表。离沧浪亭不远。我两个景点都看了。其实看一个就行。都是一个类型，白天游玩个人认为沧浪亭好些。景点交通方便苏州站有多路公交车到景点,https://gs.ctrip.com/html5/you/comment/detail/1826/11/154326196.html,https://dimg04.c-ctrip.com/images/Z80h180000013xc9e3F64_C_180_180.jpg,M12****940,4分,2018-04-09
太热太多人！我们在网上买的，是有优惠,https://gs.ctrip.com/html5/you/comment/detail/1826/11/159946688.html,https://dimg04.c-ctrip.com/images/Z807080000002vm17B643_C_180_180.jpg,133****3091,3分,2019-07-27
网师园在苏州园林中算是比较小众的，不过小中见精致，尤其适合夜游，在灯光的点缀下特别有意境，再加上听昆曲和评弹，更美妙,https://gs.ctrip.com/html5/you/comment/detail/1826/11/155010642.html,https://dimg04.c-ctrip.com/images/t1/headphoto/982/089/752/f8c7b21182c94524ac4df328fdc7b3dc_C_180_180.jpg,M26****2549,5分,2018-05-25
非常值得一看的古典园林，藏在小巷深处，别有洞天，一步一景，底蕴深厚。游人不多，旅游品质舒适，尤其是晚上的网师园夜游，富有吴越文化的特色。,https://gs.ctrip.com/html5/you/comment/detail/1826/11/141786458.html,https://dimg04.c-ctrip.com/images/Z80h180000013xc9e3F64_C_180_180.jpg,dongr,5分,2017-11-16
小巧玲珑可爱型，走走逛逛心情愉快。,https://gs.ctrip.com/html5/you/comment/detail/1826/11/161880145.html,https://dimg04.c-ctrip.com/images/Z80v0z000000niwj159DD_C_180_180.jpg,小小喵喵喵喵,3分,2019-11-07
苏州园林大同小异，人不多，也可一游,https://gs.ctrip.com/html5/you/comment/detail/1826/11/161250111.html,https://dimg04.c-ctrip.com/images/t1/headphoto/646/318/109/a865fe5f5465407d8befd5dc487a8554_C_180_180.jpg,秋颜雪菲,3分,2019-10-02
节目与节目之间会互相影响。很一般。,https://gs.ctrip.com/html5/you/comment/detail/1826/11/160378499.html,https://dimg04.c-ctrip.com/images/t1/headphoto/882/320/089/158cae5ddb6143c0b6ae18523614cf08_C_180_180.jpg,_WeCh****733470,3分,2019-08-15
不是很值，声音小，互相干扰。不满意,https://gs.ctrip.com/html5/you/comment/detail/1826/11/159260291.html,https://dimg04.c-ctrip.com/images/t1/headphoto/685/724/771/3cd584c18f744104b47d3f3d075d10e3_C_180_180.jpg,_WeCh****120253,3分,2019-06-11
夜游网师园，很有趣，园子很古典，好几个节目一一看过来，虽然表演的也就一般般，但是在园子里一边游园一边观赏的氛围很好,https://gs.ctrip.com/html5/you/comment/detail/1826/11/157717598.html,https://dimg04.c-ctrip.com/images/headphoto/520/417/998/4f47c49d28004c9ea437628065399c0e_C_180_180.jpg,fensisish,5分,2019-01-28
小而精致，人也少多了，更接近现代人小而赋有功能分区的居住体验，又涵盖了必要的人文情怀，可惜所有园林的二楼都不能参观,https://gs.ctrip.com/html5/you/comment/detail/1826/11/156197037.html,https://dimg04.c-ctrip.com/images/Z80h180000013xc9e3F64_C_180_180.jpg,320****248,5分,2018-08-18
人多 走马观花 不能过分要求 随意玩玩,https://gs.ctrip.com/html5/you/comment/detail/1826/11/160847142.html,https://dimg04.c-ctrip.com/images/Z80h180000013xc9e3F64_C_180_180.jpg,M12****912,3分,2019-09-09
挺好的，有味道，江南水乡韵味。,https://gs.ctrip.com/html5/you/comment/detail/1826/11/160152916.html,https://dimg04.c-ctrip.com/images/Z80v0z000000niwj159DD_C_180_180.jpg,小小喵喵喵喵,3分,2019-08-07
没有限制人数，表演感觉水平一般,https://gs.ctrip.com/html5/you/comment/detail/1826/11/159971317.html,https://dimg04.c-ctrip.com/images/Z80h180000013xc9e3F64_C_180_180.jpg,宝宝不是永远,3分,2019-07-28
网师园很小，早上早点去，人少的时候，感觉好美。尤其是湖周围，有蓝天白云的时候，拍倒影，随手一拍都是大片的感觉！,https://gs.ctrip.com/html5/you/comment/detail/1826/11/157012790.html,https://dimg04.c-ctrip.com/images/t1/headphoto/646/318/109/a865fe5f5465407d8befd5dc487a8554_C_180_180.jpg,走走停停的风,5分,2018-10-18
体验不错 有表演有讲解而且管理者尽可能让观众看足所有的节目 好像共有八个 不管是何时入园的 别太晚就行 演员比较敬业 就是大门口不在街面上而是在小区里 夜里比较难找,https://gs.ctrip.com/html5/you/comment/detail/1826/11/156967188.html,https://dimg04.c-ctrip.com/images/fd/headphoto/g4/M07/31/93/CggYHFaPmZuAK-qoAAFxQV_SB7U215_C_180_180.jpg,billy5,4分,2018-10-13
感觉网师园很好玩，夜游别有一番风味。解说员很细致，为了照顾同行的外国友人，还用英语介绍一遍，表演很精彩，周一到的晚上人也不少。天气很好，玩得好开心。,https://gs.ctrip.com/html5/you/comment/detail/1826/11/116622217.html,https://dimg04.c-ctrip.com/images/t1/headphoto/903/173/918/eb4b7bea9720440dac09eab89328ab00_C_180_180.jpg,M31****750,5分,2017-05-15
小小的，一样的亭台楼阁园林，很古风，而且人不多，很清静。漫步小桥流水间，沐午后阳光，看光影之间的时光流转。,https://gs.ctrip.com/html5/you/comment/detail/1826/11/156080675.html,https://dimg04.c-ctrip.com/images/Z80f0i0000009gjz60B8F_C_180_180.jpg,在路上的心儿,5分,2018-08-09
网师园是朋友推荐的，园林不大，却很美，很有观赏价值！可以坐在园林中品品茶，观观景！还碰到一对新人拍结婚照！,https://gs.ctrip.com/html5/you/comment/detail/1826/11/154403279.html,https://dimg04.c-ctrip.com/images/Z8060s000000hqi6g6BBF_C_180_180.jpg,M26****2123,5分,2018-04-13
精彩的沉浸式游园，和白天游园感觉完全不同，票价很值得。尤其喜欢古琴演出，瞬间安静下来的感觉。昆曲演员都好漂亮，人也很好，休息时也愿意和游客合照聊天,https://gs.ctrip.com/html5/you/comment/detail/1826/11/121248573.html,https://dimg04.c-ctrip.com/images/Z80p180000013uw9yF21F_C_180_180.jpg,M11****611,5分,2017-09-10
跟日本朋友一起去的，看过后，朋友表示晚上的园林跟白天的确实不一样。表演虽然听不懂，但还是感受到浓浓的中国气息。近距离的欣赏节目，有感觉像穿越一样。,https://gs.ctrip.com/html5/you/comment/detail/1826/11/116643811.html,https://dimg04.c-ctrip.com/images/t1/headphoto/857/872/237/edc9e981b00e436a8dcee595001d62fa_C_180_180.jpg,M36****908,5分,2017-05-21
什么鬼订单，根本无法使用,https://gs.ctrip.com/html5/you/comment/detail/1826/11/165262169.html,https://dimg04.c-ctrip.com/images/t1/headphoto/757/757/889/3b86691007a54fe684f07e198432d09b_C_180_180.jpg,M32****136,1分,2020-12-08
梦回姑苏，咿咿呀呀声中还见高山流水，却不知知音何在，夜色将近，在网师园游园惊梦，绕梁三尺，仿若误入桃花林,https://gs.ctrip.com/html5/you/comment/detail/1826/11/154791071.html,https://dimg04.c-ctrip.com/images/Z80p0u000000jf53nD636_C_180_180.jpg,纪柒柒夏,5分,2018-05-10
网师园也是苏州园林中的4A级景区。所有的苏州园林，看起来似曾相识，但是每一个又都独具特色，不完全一样。无论哪一个园林，都有小桥流水，精致的亭台楼阁，巧妙的结构布局。,https://gs.ctrip.com/html5/you/comment/detail/1826/11/109863387.html,https://dimg04.c-ctrip.com/images/Z80l0g00000086ktw17FB_C_180_180.jpg,读万卷书_kingsley,4分,2017-06-13
特别的值，特别是夜景，夜游基本把所有的趣味和苏州的演绎都看到了！,https://gs.ctrip.com/html5/you/comment/detail/1826/11/15732884.html,https://dimg04.c-ctrip.com/images/fd/headphoto/g5/M05/3C/0C/CggYsFawro6AB9urAABHDe23q4o687_C_180_180.jpg,倔强的隼心,5分,2015-05-02
夜游主要是看演出：昆曲、评弹、江南丝竹、古琴、箫、古筝舞蹈，在古典园林中观看这些演出，别有一番风味。,https://gs.ctrip.com/html5/you/comment/detail/1826/11/156028329.html,https://dimg04.c-ctrip.com/images/Z80h180000013xc9e3F64_C_180_180.jpg,234****083,5分,2018-08-06
夜游网师园确实如大家所说，还是比较精彩的，有别于白天看的其他园林，晚上逛园子别有一番风味，8个节目的表演演员个人觉得有几个还可以热情一点，板着个脸算是怎么回事……好在门口迎宾的小哥和负责引路解说的小哥甚是热情。,https://gs.ctrip.com/html5/you/comment/detail/1826/11/121102057.html,https://dimg04.c-ctrip.com/images/Z80p180000013uw9yF21F_C_180_180.jpg,M10****766,4分,2017-09-03
网师园白天去和晚上去感觉非常不同，除了夜晚游园别有一番风味外，还能享受解说和八项表演节目，很推荐！,https://gs.ctrip.com/html5/you/comment/detail/1826/11/155144930.html,https://dimg04.c-ctrip.com/images/t1/headphoto/463/352/613/9d877effaa3d4bd0b951bb4c60209b3b_C_180_180.jpg,M26****1805,5分,2018-06-04
人很少，玩的很开心。真的不用去大院子，网师园就足够了，特别棒。可以慢悠悠的逛。,https://gs.ctrip.com/html5/you/comment/detail/1826/11/154538689.html,https://dimg04.c-ctrip.com/images/Z80h180000013xc9e3F64_C_180_180.jpg,202****637,5分,2018-04-24
