标题,标题链接,头像,user-detail__name,totalStarIcon1,resource_date
园子在居民区深处，和名字很贴切。园林不大，但非常精致，夜游的感觉很好，节目表演看得出来也是很用心。国庆人多了点，以后选个人少的季节来，想必感受会更好。,https://gs.ctrip.com/html5/you/comment/detail/1826/11/138765050.html,https://dimg04.c-ctrip.com/images/Z80p180000013uw9yF21F_C_180_180.jpg,Skyland,5分,2017-10-07
晚上来看还是不错的，算是很有特色的一个游园项目。内容相对少了些，但能近距离看节目，看完还能跟演员合影，再去逛园林。里面有个演阿鼠的老人家表演非常到位。,https://gs.ctrip.com/html5/you/comment/detail/1826/11/121276110.html,https://dimg04.c-ctrip.com/images/Z80p180000013uw9yF21F_C_180_180.jpg,noing,5分,2017-09-12
导游不错，节目也很好，人不多，,https://gs.ctrip.com/html5/you/comment/detail/1826/11/116913911.html,https://dimg04.c-ctrip.com/images/Z80h180000013xc9e3F64_C_180_180.jpg,丁丁的当当,5分,2017-07-15
还不错，白天太热，晚上比较风凉,https://gs.ctrip.com/html5/you/comment/detail/1826/11/116868209.html,https://dimg04.c-ctrip.com/images/Z8060i0000009bht34685_C_180_180.jpg,_WeCh****716946,5分,2017-07-07
晚上去的，还是可以去玩玩，网师园小细节很美，还可以听听评弹什么的，照出来感觉很好玩，虽然昆曲听不懂，不过昆曲跟园子搭配真是超协调。,https://gs.ctrip.com/html5/you/comment/detail/1826/11/109890981.html,https://dimg04.c-ctrip.com/images/t1/headphoto/177/080/529/285e9abeede347d9a7c1cc5e1b4c9287_C_180_180.jpg,西红柿221,5分,2017-06-15
出乎意料的好，本来还觉得票价有点贵，节目也都是戏曲啊乐器的担心无聊。但是八个节目每一个都很精致，喜欢的不得了，好几个节目还看了第二遍！推荐大家过来玩。,https://gs.ctrip.com/html5/you/comment/detail/1826/11/116655142.html,https://dimg04.c-ctrip.com/images/Z80k0f0000007mwde7335_C_180_180.jpg,E24****35,5分,2017-05-24
工作人员态度好，讲解到位，戏的水平参差不齐，总体还不错，晚上的景致不错,https://gs.ctrip.com/html5/you/comment/detail/1826/11/116395188.html,https://dimg04.c-ctrip.com/images/headphoto/778/972/986/39eb5cf0099142509ddbd0e1ac926e28_C_180_180.jpg,qqjjmm,4分,2017-04-02
苏州网师园的紫色辛夷，漂亮啊！,https://gs.ctrip.com/html5/you/comment/detail/1826/11/99586212.html,https://dimg04.c-ctrip.com/images/Z80p180000013uw9yF21F_C_180_180.jpg,美奈赵构,5分,2017-03-26
园林建筑，景致不错，人也不多。,https://gs.ctrip.com/html5/you/comment/detail/1826/11/74184424.html,https://dimg04.c-ctrip.com/images/fd/headphoto/g1/M06/D0/C1/CghzfFW8X0WAOhY6AAAcXoWjojc556_C_180_180.jpg,shirelyflower,4分,2016-05-10
小巧精致的园子，最重要的是人少清净。再美的园林一旦人山人海就没情趣了。,https://gs.ctrip.com/html5/you/comment/detail/1826/11/71804249.html,https://dimg04.c-ctrip.com/images/Z80p180000013uw9yF21F_C_180_180.jpg,300****010,5分,2016-04-05
景色秀美，庭院错落有致，尤其是映在湖里的楼台倒影很有意蕴，值得观赏。,https://gs.ctrip.com/html5/you/comment/detail/1826/11/153085444.html,https://dimg04.c-ctrip.com/images/Z80p180000013uw9yF21F_C_180_180.jpg,旋旋1978,5分,2018-01-31
赶在月底结束前去游玩了一下。园子不错，小而精致，晚上看不大真切但有另外一种意境。演出安排的短而精。建议稍微控制一下同一批参观的人数，这样效果能好些。,https://gs.ctrip.com/html5/you/comment/detail/1826/11/116103216.html,https://dimg04.c-ctrip.com/images/Z80p180000013uw9yF21F_C_180_180.jpg,teno,5分,2016-11-23
如果不是晚上去一次，我想你对园林的理解是不完整的。夜晚的院子别有风味。演出，我觉得还是不错的，水平没有之前评价的那么业余。老演员确实更有风度和激情。,https://gs.ctrip.com/html5/you/comment/detail/1826/11/115176874.html,https://dimg04.c-ctrip.com/images/Z80p180000013uw9yF21F_C_180_180.jpg,数码消费,5分,2015-07-25
夜游看了八个演出 很精彩 喜欢,https://gs.ctrip.com/html5/you/comment/detail/1826/11/137903232.html,https://dimg04.c-ctrip.com/images/t1/headphoto/646/318/109/a865fe5f5465407d8befd5dc487a8554_C_180_180.jpg,_CFT01****5458460,5分,2017-10-01
苏州网师园是苏州园林中唯一的一家，晚上营业的园林。特色：逛园林的同时，听昆曲，古筝，评弹，戏剧，非常有品位！适合带来苏州旅游的朋友，感受苏州文化。,https://gs.ctrip.com/html5/you/comment/detail/1826/11/121240587.html,https://dimg04.c-ctrip.com/images/Z80p180000013uw9yF21F_C_180_180.jpg,jun1230456,5分,2017-09-10
夜晚听箫，赏月，观园别有一番风味！最后一项弹古琴的太biang了！,https://gs.ctrip.com/html5/you/comment/detail/1826/11/121134103.html,https://dimg04.c-ctrip.com/images/Z80p180000013uw9yF21F_C_180_180.jpg,M52****285,5分,2017-09-04
这个园林应该是苏州几大名园中最小的，也是最有待色的，藏宝最多的一个，总共有8个节目，苏州特色的，老外特别多，导游中文英文都来一遍，特别棒，值得去。,https://gs.ctrip.com/html5/you/comment/detail/1826/11/116082948.html,https://dimg04.c-ctrip.com/images/Z80p180000013uw9yF21F_C_180_180.jpg,_zx403****011533,5分,2016-10-31
很值得一去。喜欢里面精致的园林，更喜欢夜间的网师园，仿佛时空穿越，误入旧时时光。园里安静至极，闹中取静。当戏曲在园中唱起，你会被激起鸡皮疙瘩的。,https://gs.ctrip.com/html5/you/comment/detail/1826/11/153504643.html,https://dimg04.c-ctrip.com/images/Z80p180000013uw9yF21F_C_180_180.jpg,136****0688,5分,2018-02-22
很精致的园林，感觉比拙政园要有意思，不过苏州的园林大体都差不多的,https://gs.ctrip.com/html5/you/comment/detail/1826/11/141310151.html,https://dimg04.c-ctrip.com/images/Z80p180000013uw9yF21F_C_180_180.jpg,竹叶青31,5分,2017-10-19
晚上去的，夜游网师园，有好几段唱戏的，走一路看一路，还是很有意思的，总体不大，但是夜游别有一番意境。我们几乎是当天最后一拨客人了，走的比较匆忙。,https://gs.ctrip.com/html5/you/comment/detail/1826/11/141263887.html,https://dimg04.c-ctrip.com/images/Z80w0z000000mpzubCBD7_C_180_180.jpg,revlised,5分,2017-10-17
还未进门，便见两口井，浓浓的江南风情。我能感受到它的生气，确实很美。烟雨蒙蒙，网师园好像一个秀秀气气的大家闺秀，有着江浙特有的温婉气质，真的很美,https://gs.ctrip.com/html5/you/comment/detail/1826/11/5346549.html,https://dimg04.c-ctrip.com/images/headphoto/691/949/864/d6ad08c12b3b411a871cdb076132eced_C_180_180.jpg,暗夜逍遥,5分,2014-06-30
园子很小，格局不错。表演不知是天气热还是怎的，有点走过场的感觉,https://gs.ctrip.com/html5/you/comment/detail/1826/11/156127392.html,https://dimg04.c-ctrip.com/images/Z80p180000013uw9yF21F_C_180_180.jpg,206****650,3分,2018-08-13
网师园布局精致，夜景配合昆曲等节目，感受到了苏州浓浓的文化韵味,https://gs.ctrip.com/html5/you/comment/detail/1826/11/141337965.html,https://dimg04.c-ctrip.com/images/Z80h180000013xc9e3F64_C_180_180.jpg,zhuhong0512,5分,2017-10-21
很精致的苏州小园林，夜游别有一番滋味，有专门的工作人员讲解，每个景点都有表演，评弹，昆曲，古琴很精彩，园子夜景也很漂亮，携程订票取票都很方便。,https://gs.ctrip.com/html5/you/comment/detail/1826/11/116980302.html,https://dimg04.c-ctrip.com/images/headphoto/472/478/066/2ab7a83c217b4bf39fb1d8506bed3e7d_C_180_180.jpg,tomzhao,5分,2017-07-24
第N次带外国客户来，老外们都非常喜欢。庭院小而别致，节目内容短但是极具传统特色。特别感谢志愿者的双语讲解，让我们对中国的传统文化有更深的理解。,https://gs.ctrip.com/html5/you/comment/detail/1826/11/116744986.html,https://dimg04.c-ctrip.com/images/fd/headphoto/g2/M00/DE/2D/CghzgVVo8OSAAsn0AACZ7tJM9Ro226_C_180_180.jpg,M18****549,5分,2017-06-14
服务好，环境好，价格合理，玲珑整洁，下次还来，介绍朋友来这里旅游居住。感谢所有的服务人员，感谢苏州人民,https://gs.ctrip.com/html5/you/comment/detail/1826/11/13540833.html,https://dimg04.c-ctrip.com/images/Z80p180000013uw9yF21F_C_180_180.jpg,hjdan65,5分,2015-03-01
入园管理混乱，网上购票现场换票排队处没有明显标示，购票后需要人工输入购票码兑换纸质票，但几十家网络平台均可购票，但授权换票人只有一位，导致大批网络购票者大排长队。晚上七点十分到达门口，因为没有明显排队标识，也没有工作人员指点，导致排错队，38度的天，在门口等了40分钟才入园。最关键是工作人员竟得意洋洋地说天天如此，太让人感觉气愤,https://gs.ctrip.com/html5/you/comment/detail/1826/11/160106538.html,https://dimg04.c-ctrip.com/images/Z80p180000013uw9yF21F_C_180_180.jpg,201****565,2分,2019-08-04
夜游的确是个卖点，但是：（1）晚上没法看清园林，（2）准备的那个节目有些敷衍了事，都特别短而且质量不佳，特别是昆曲部分，唱功差，而且声音特别小。园林还是白天去观赏，昆曲还是去专门的剧院听。这个就算了。,https://gs.ctrip.com/html5/you/comment/detail/1826/11/159337982.html,https://dimg04.c-ctrip.com/images/Z80p180000013uw9yF21F_C_180_180.jpg,e65****80,2分,2019-06-17
夜游的内容不错，有8个不同的表演，昆曲、评弹、古筝等，晚上游览别有一番风味。白天看拙政园和狮子林的园林假山那些比较视觉疲劳，晚上体验下别样园林风情，了解苏州的传统文艺还是很值得的。,https://gs.ctrip.com/html5/you/comment/detail/1826/11/6500713.html,https://dimg04.c-ctrip.com/images/fd/headphoto/g2/M08/68/27/CghzgVVe1dmARvz2AACdDtnPbjs077_C_180_180.jpg,300****577,4分,2014-07-30
非常赞！苏州的曲艺表演都很精彩～夜晚的苏州园林更是别具一格,https://gs.ctrip.com/html5/you/comment/detail/1826/11/123847658.html,https://dimg04.c-ctrip.com/images/Z80h180000013xc9e3F64_C_180_180.jpg,M77****20,5分,2017-09-30
携程上定门票便宜。取票方便，直接在景区门口报订单号就行。网师园夜游太值了，8场简短的表演，尽显江南风情。古色古香。绝对值得来，一定要夜游。,https://gs.ctrip.com/html5/you/comment/detail/1826/11/116741474.html,https://dimg04.c-ctrip.com/images/Z80h180000013xc9e3F64_C_180_180.jpg,雪儿87,5分,2017-06-10
去过苏州无数次，景点也算是如数家珍，网师园夜游是必选项目。,https://gs.ctrip.com/html5/you/comment/detail/1826/11/116584780.html,https://dimg04.c-ctrip.com/images/fd/headphoto/g2/M00/F9/E1/CghzgVTtlBiABYmlAAApl-b9Pl0843_C_180_180.jpg,echo5230,5分,2017-05-06
第一次近距离接触昆曲和评弹，夜游网师园给了我们不一般的感受,https://gs.ctrip.com/html5/you/comment/detail/1826/11/116539986.html,https://dimg04.c-ctrip.com/images/Z80h180000013xc9e3F64_C_180_180.jpg,清清飞,5分,2017-04-30
晨聚的市民、保安大叔都可以把这园林的历史故事、园名的由来、以及室内多幅对联的出处、典故等等，跟你娓娓道来，可见苏州人的文化底蕴和素养之高！,https://gs.ctrip.com/html5/you/comment/detail/1826/11/116098184.html,https://dimg04.c-ctrip.com/images/Z80p0d0000006r89o5591_C_180_180.jpg,享乐-旅行,5分,2016-11-17
景点很不错，很美。就是买票没什么优惠，再加上天气太热了，有点影响心情。不过景区整体还是很不错的，完全能够代表苏州园林的特点，不大但是很美。,https://gs.ctrip.com/html5/you/comment/detail/1826/11/115853446.html,https://dimg04.c-ctrip.com/images/t1/headphoto/258/512/704/6bce7506eecc48f8a4a6d3177e0acf24_C_180_180.jpg,288****946,5分,2016-06-24
表演很精彩时间足够晚上的话天气合适舒服换票容易准时服务周到,https://gs.ctrip.com/html5/you/comment/detail/1826/11/58567365.html,https://dimg04.c-ctrip.com/images/fd/headphoto/g4/M03/17/DB/CggYHlXAqiyAEHr-AAAhPg72auA128_C_180_180.jpg,320****673,5分,2015-10-02
这个地方我来过两次了！当时用学生证买票可以打五折！不过里面和其他得园林没多大得差别！喜欢园林和建筑的人可以去看看！体会一下苏州园林得奇妙！,https://gs.ctrip.com/html5/you/comment/detail/1826/11/5426847.html,https://dimg04.c-ctrip.com/images/headphoto/256/381/149/70da1f803fc148f29596a7745336bfe6_C_180_180.jpg,天蚕飞雪,5分,2014-07-06
苏州园林的典型代表，林子虽然有点小，但是却非常受外国游客的欢迎，带朋友去了好多次了，上次发现园林里面有座三步桥，很有趣，据说蛮有名的。。。,https://gs.ctrip.com/html5/you/comment/detail/1826/11/3375694.html,https://dimg04.c-ctrip.com/images/Z80p180000013uw9yF21F_C_180_180.jpg,daw****24,5分,2014-02-18
秒出票，刷二维码直接入园，很方便，价格跟售票处的淡季价格一样，但是售票处只收现金，携程购票还有一元优惠，不错的，小巧清雅网师园，值得一游,https://gs.ctrip.com/html5/you/comment/detail/1826/11/153806507.html,https://dimg04.c-ctrip.com/images/Z80p180000013uw9yF21F_C_180_180.jpg,抽屉里的皮皮,5分,2018-03-12
白天逛了其他的园林，发现晚上有夜游网师园，果断订票，真的不枉此行。既有导游，又有表演。物有所值！,https://gs.ctrip.com/html5/you/comment/detail/1826/11/121213456.html,https://dimg04.c-ctrip.com/images/Z80p180000013uw9yF21F_C_180_180.jpg,knnnn,5分,2017-09-08
如果说拙政园、留园虽大虽美但由于嘈杂的人流而淹没了本身的悠然气质，那么网狮园因为它恰到好处的名气和质量，成为了此行园林体验的最佳目的地。,https://gs.ctrip.com/html5/you/comment/detail/1826/11/91025196.html,https://dimg04.c-ctrip.com/images/Z80hhk133wgpyf24g274E_C_180_180.jpg,汤姆猫大王,4分,2016-11-04
不用换票，直接检票处扫码，非常方便，园子确实不大，但错落有致，韵味十足，一步一景，设计和构思都非常巧妙，建议慢慢体会，走马观花就没意思了,https://gs.ctrip.com/html5/you/comment/detail/1826/11/115992957.html,https://dimg04.c-ctrip.com/images/t1/headphoto/757/757/889/3b86691007a54fe684f07e198432d09b_C_180_180.jpg,M43****183,5分,2016-09-12
从南园宾馆走过去十分钟左右就到了 园林不大 十五分钟就能走完 建议跟讲解员游玩会比较有意思 一些细节听完会豁然开朗 人比拙政园少 所以更觉得清静优美,https://gs.ctrip.com/html5/you/comment/detail/1826/11/52864609.html,https://dimg04.c-ctrip.com/images/Z80h180000013xc9e3F64_C_180_180.jpg,201****760,4分,2015-07-13
很小的一个园林哦，以前是私人园林，现在不知道了，环境不错,https://gs.ctrip.com/html5/you/comment/detail/1826/11/15939012.html,https://dimg04.c-ctrip.com/images/zc05170000011gffv6AD5_C_180_180.jpg,Alex-456,5分,2015-05-24
里面的节目在游留园、虎丘的时候都可以免费欣赏到，每个节目的表演时间都很短，花85去看价值不大，给老外看看倒是挺新鲜的，取票还是比较方便的,https://gs.ctrip.com/html5/you/comment/detail/1826/11/4161346.html,https://dimg04.c-ctrip.com/images/Z80p180000013uw9yF21F_C_180_180.jpg,心中女神,5分,2014-04-11
比起拙政园，狮子林，的确给人感觉更像民居。就因为这样，才显出它的原汁原味，大厅，轿厅，万卷堂，携秀堂。。。想像着当年居住在此古人的生活。,https://gs.ctrip.com/html5/you/comment/detail/1826/11/3016635.html,,,,2004-06-28
不怎么样。热天去的。里面又潮又闷。还没什么看头。很小。,https://gs.ctrip.com/html5/you/comment/detail/1826/11/155428748.html,https://dimg04.c-ctrip.com/images/Z8030v000000k1udu95D2_C_180_180.jpg,derderderda,3分,2018-06-27
夜游网师园是我在苏州觉得最值得的一次，演员表演都很精彩，为之惊叹，网师园的历史故事也听德出神入化，虽不大，但晚上园内德观赏度还是极高。,https://gs.ctrip.com/html5/you/comment/detail/1826/11/119690867.html,https://dimg04.c-ctrip.com/images/Z80h180000013xc9e3F64_C_180_180.jpg,自幼愚钝的小会计,5分,2017-08-19
被搬进美国大都会博物馆的苏州园林，小巧玲珑，名不虚传。,https://gs.ctrip.com/html5/you/comment/detail/1826/11/116749525.html,https://dimg04.c-ctrip.com/images/fd/headphoto/g1/M02/AA/37/CghzfVTne-OAVh_QAAC3N9dwkNk781_C_180_180.jpg,马大可,5分,2017-06-11
点赞，之前已经来了一次了，今天是陪妈妈来的～她很喜欢?,https://gs.ctrip.com/html5/you/comment/detail/1826/11/116618786.html,https://dimg04.c-ctrip.com/images/t1/headphoto/685/724/771/3cd584c18f744104b47d3f3d075d10e3_C_180_180.jpg,MrbioDT,5分,2017-05-15
夜游两方面看点都不错：园子小巧但精致，细节处可见匠心。表演安排合理，游客虽多但有序，节目选取的是昆曲和评弹最有代表性的片段，展现精髓。,https://gs.ctrip.com/html5/you/comment/detail/1826/11/116618152.html,https://dimg04.c-ctrip.com/images/Z80h180000013xc9e3F64_C_180_180.jpg,极简半糖,5分,2017-05-15
挺漂亮的园子，规模也不大，但也很有精致的苏州园林风格。,https://gs.ctrip.com/html5/you/comment/detail/1826/11/69704300.html,https://dimg04.c-ctrip.com/images/Z80p180000013uw9yF21F_C_180_180.jpg,nuaa_highway,5分,2016-01-14
苏州的园林我觉得大都出不多吧，建议人少的时候去比较好！,https://gs.ctrip.com/html5/you/comment/detail/1826/11/10743613.html,https://dimg04.c-ctrip.com/images/Z80n170000010x8nw2B8A_C_180_180.jpg,萱北鼻啦啦啦,5分,2014-08-28
第二次来了，不同季节景色也不同～应该四季都要逛园子！,https://gs.ctrip.com/html5/you/comment/detail/1826/11/138747259.html,https://dimg04.c-ctrip.com/images/Z80h180000013xc9e3F64_C_180_180.jpg,108****392,5分,2017-10-07
在网师园逛了两圈。刚开始的节目声音太小了了，有点听不清，有扩音器和字幕牌就好了。后面几个节目比较热闹，比较喜欢。对了，第二个节目在亭子里看不是很美，在对面的表演台上更好看?,https://gs.ctrip.com/html5/you/comment/detail/1826/11/116622227.html,https://dimg04.c-ctrip.com/images/t1/headphoto/207/494/838/fa687736cf3f484480526cfc0eb6c073_C_180_180.jpg,_CFT01****9217400,4分,2017-05-15
夜花园比白天更值得去，人少，幽静，而且有节目演出，演昆曲这个小生特别帅！！强裂推荐夜花园！！,https://gs.ctrip.com/html5/you/comment/detail/1826/11/116617615.html,https://dimg04.c-ctrip.com/images/Z80h180000013xc9e3F64_C_180_180.jpg,宜修_,5分,2017-05-15
晚上的网师园很值得一去，苏州的一些特色全包含在里面了,https://gs.ctrip.com/html5/you/comment/detail/1826/11/116471898.html,https://dimg04.c-ctrip.com/images/t1/headphoto/903/173/918/eb4b7bea9720440dac09eab89328ab00_C_180_180.jpg,陌生,5分,2017-04-16
订票方便，取票北门离路口很近，夜游网师园，导游很专业，演员表演很敬业，虽然一天要表演好几场，还是很入戏。相对其他景点，这价格也值了。,https://gs.ctrip.com/html5/you/comment/detail/1826/11/115269461.html,https://dimg04.c-ctrip.com/images/Z80p180000013uw9yF21F_C_180_180.jpg,阿成,5分,2015-08-25
苏州网师园真是不错的。真是太漂亮了。以后还来游玩。,https://gs.ctrip.com/html5/you/comment/detail/1826/11/153930289.html,https://dimg04.c-ctrip.com/images/t1/headphoto/699/910/854/683dab66bb374136af9930ea204dfc7e_C_180_180.jpg,M32****278,5分,2018-03-20
挺有江南风情的园林！里面的景色很美！特别是古建筑！,https://gs.ctrip.com/html5/you/comment/detail/1826/11/144370119.html,https://dimg04.c-ctrip.com/images/t1/headphoto/699/910/854/683dab66bb374136af9930ea204dfc7e_C_180_180.jpg,M32****278,5分,2017-12-19
小而精的园林，建筑，水系，假山园林一体融合非常舒服,https://gs.ctrip.com/html5/you/comment/detail/1826/11/116525624.html,https://dimg04.c-ctrip.com/images/t1/headphoto/164/424/952/04eab99bd26f47acadef4fd3f95b9f37_C_180_180.jpg,limengzhe,5分,2017-04-29
网师园夜游演艺 不仅可以走进世界文化遗产 又可以欣赏昆曲古琴萧笛评弹的演出 只是天寒地冻 我们又去的晚 让人家为我们俩包场演出 实在不好意思！,https://gs.ctrip.com/html5/you/comment/detail/1826/11/116103744.html,https://dimg04.c-ctrip.com/images/Z80h180000013xc9e3F64_C_180_180.jpg,_WeCh****92836,5分,2016-11-24
很好，晚上去的，那里表演挺好看的，古筝演奏的特别好,https://gs.ctrip.com/html5/you/comment/detail/1826/11/15026768.html,https://dimg04.c-ctrip.com/images/Z80h180000013xc9e3F64_C_180_180.jpg,D14****630,5分,2015-05-01
看到与白天不一样的园林景观，这是唯一夜间开放的园林！强力推荐！这样的景致，只能记录在记忆里，无论拍照还是摄影，都无法记录它的美！,https://gs.ctrip.com/html5/you/comment/detail/1826/11/114899287.html,https://dimg04.c-ctrip.com/images/Z80p180000013uw9yF21F_C_180_180.jpg,139****0803,5分,2015-04-12
我觉得其实还是白天看更有意思，晚上节目有点无聊,https://gs.ctrip.com/html5/you/comment/detail/1826/11/156217615.html,https://dimg04.c-ctrip.com/images/Z80h180000013xc9e3F64_C_180_180.jpg,76****833,3分,2018-08-19
比较小却很精致的园子，夜晚去比较好，还有表演。,https://gs.ctrip.com/html5/you/comment/detail/1826/11/138821745.html,https://dimg04.c-ctrip.com/images/fd/headphoto/g1/M0A/3D/2D/CghzfFSeRzmAYceXAAAf6qptDY0038_C_180_180.jpg,E23****15,5分,2017-10-09
"也是一种了解苏州文化的方式
夜游时常有穿越的感觉，不过现代化的打光还是有些出戏。夜间不太适合拍照，包括表演快门声还是挺有影响的",https://gs.ctrip.com/html5/you/comment/detail/1826/11/119733344.html,https://dimg04.c-ctrip.com/images/t1/headphoto/757/757/889/3b86691007a54fe684f07e198432d09b_C_180_180.jpg,M41****486,4分,2017-08-21
夜游网师园真心不错 一次领略了南方小镇的特色剧目,https://gs.ctrip.com/html5/you/comment/detail/1826/11/61615893.html,https://dimg04.c-ctrip.com/images/t1/headphoto/177/080/529/285e9abeede347d9a7c1cc5e1b4c9287_C_180_180.jpg,M23****160,5分,2015-11-15
整个园林的特点是：建筑虽多不见其密，池不足亩而不觉其小。堪称中国园林以少胜多的典范。网师即渔夫之意。表明了园林主人渔隐之意。,https://gs.ctrip.com/html5/you/comment/detail/1826/11/141319867.html,https://dimg04.c-ctrip.com/images/Z80p180000013uw9yF21F_C_180_180.jpg,滨9192,5分,2017-10-20
园子很小，但很精致，配上8个节目，还是不错的，白天估计会少很多趣味。但晚上票价太贵了,https://gs.ctrip.com/html5/you/comment/detail/1826/11/121868093.html,https://dimg04.c-ctrip.com/images/Z80p180000013uw9yF21F_C_180_180.jpg,M17****499,5分,2017-09-14
有义务讲解员，讲解了网师园的来由、春夏秋冬观景厅（台）、还有最小的三步拱桥。园林精致，景色宜人，还有很多批外国游客前来游园。,https://gs.ctrip.com/html5/you/comment/detail/1826/11/121020829.html,https://dimg04.c-ctrip.com/images/Z80h180000013xc9e3F64_C_180_180.jpg,300****992,5分,2017-09-01
网师园虽小，园林的精髓却也都抓住了，夜游一般,https://gs.ctrip.com/html5/you/comment/detail/1826/11/58245034.html,https://dimg04.c-ctrip.com/images/Z80h180000013xc9e3F64_C_180_180.jpg,_cmb43****1997859,5分,2015-09-10
麻雀虽小，五脏俱全！网师园虽然是最小的园林，但是集合了多种苏州园林的风格。小巧别致！7月份去是最佳时间。,https://gs.ctrip.com/html5/you/comment/detail/1826/11/5305187.html,https://dimg04.c-ctrip.com/images/fd/headphoto/g1/M03/DD/F7/CghzfVSZeuOAIbJlAALT5bihUCA523_C_180_180.jpg,蓝色的郁金香88,3分,2014-06-30
很有味道的一个园林，闹中取静，夜游是他的特色，晚上有昆曲演出。还有一个很小的石拱桥！,https://gs.ctrip.com/html5/you/comment/detail/1826/11/4625921.html,https://dimg04.c-ctrip.com/images/Z80v0z000000n087v51B6_C_180_180.jpg,东方虚空,4分,2014-05-09
夜间游园倒是别有一番不同的情调，感觉不错。尤其是古筝，古琴，琵琶，笛子几位演员演奏得不错，昆曲主要是听不懂，只看情调罢了。,https://gs.ctrip.com/html5/you/comment/detail/1826/11/121164028.html,https://dimg04.c-ctrip.com/images/Z804070000002qf94B7DB_C_180_180.jpg,70后退休的凡凡,5分,2017-09-05
虽然天气闷热，但是演员们也都很努力的在表演，感谢演员们的付出和汗水让我们欣赏了完美的演出，网师园虽小，但胜在精致，值得一看,https://gs.ctrip.com/html5/you/comment/detail/1826/11/116988881.html,https://dimg04.c-ctrip.com/images/t1/headphoto/136/299/437/649eb217e3e54746b7a53b8665e14b00_C_180_180.jpg,M17****194,5分,2017-07-25
夜色很好。昆曲很美。就是人气有点高，人多！,https://gs.ctrip.com/html5/you/comment/detail/1826/11/116800219.html,https://dimg04.c-ctrip.com/images/t1/headphoto/463/352/613/9d877effaa3d4bd0b951bb4c60209b3b_C_180_180.jpg,_WeCh****183050,4分,2017-06-24
夜游网师园，体验一下昆曲和评弹的魅力，挺好,https://gs.ctrip.com/html5/you/comment/detail/1826/11/116575324.html,https://dimg04.c-ctrip.com/images/t1/headphoto/882/320/089/158cae5ddb6143c0b6ae18523614cf08_C_180_180.jpg,M22****614,5分,2017-05-04
