标题,标题链接,头像,user-detail__name,totalStarIcon1,resource_date
网师园算是几个园林中最好的一个了。只有网师园晚上才开。我们去看了晚上的表演，晚上坐在亭子那听听戏吹风，很舒服。,https://gs.ctrip.com/html5/you/comment/detail/1826/11/160092811.html,https://dimg04.c-ctrip.com/images/t1/headphoto/177/080/529/285e9abeede347d9a7c1cc5e1b4c9287_C_180_180.jpg,M15****791,5分,2019-08-04
上午懒散到九点出门，想找一个不那么大的园子逛逛，就选择了网师园！体验很棒，值得一游，园中水景最佳，假山、石笋众多。适合有一到两个小时旅游安排的游客们～,https://gs.ctrip.com/html5/you/comment/detail/1826/11/159241591.html,https://dimg04.c-ctrip.com/images/Z80k0d0000006qc5hD6CE_C_180_180.jpg,Molly,5分,2019-06-10
朋友推荐，唯一可以夜游听戏的园子，组织也很好，一个一个小组，不拥挤。对于游园绝对是一种新的体验。演员们表演很卖力。说重点，评弹小哥好帅！声音很好听！,https://gs.ctrip.com/html5/you/comment/detail/1826/11/160019583.html,https://dimg04.c-ctrip.com/images/t1/headphoto/463/352/613/9d877effaa3d4bd0b951bb4c60209b3b_C_180_180.jpg,M22****4801,5分,2019-07-31
不愧是精品园，冲着藻耀高翔门楼去的，值了，相比拙政园狮子林人不多。,https://gs.ctrip.com/html5/you/comment/detail/1826/11/164006299.html,https://dimg04.c-ctrip.com/images/Z80n13000000u16xtB909_C_180_180.jpg,隐形的翅膀VB,5分,2020-08-04
江南园林的美，尤其是那一池清荷，围池而建的长廊，亭、台，榭，在雨天，依兰而坐，静静地聆听雨声，真是惬意优雅,https://gs.ctrip.com/html5/you/comment/detail/1826/11/162227188.html,https://dimg04.c-ctrip.com/images/t1/headphoto/463/352/613/9d877effaa3d4bd0b951bb4c60209b3b_C_180_180.jpg,栉风沐雨风姿绰约,5分,2019-12-07
夜游网师园，唯一一个开放夜游的园林，还算有特色，表演不要报太高期望,https://gs.ctrip.com/html5/you/comment/detail/1826/11/161129292.html,https://dimg04.c-ctrip.com/images/t1/headphoto/699/910/854/683dab66bb374136af9930ea204dfc7e_C_180_180.jpg,M31****582,5分,2019-09-24
还不错吧，天气好的话会更漂亮。苏州的园林真的还是值得一看的。门口还有免费讲解，算好时间的话可以了解更多哦。,https://gs.ctrip.com/html5/you/comment/detail/1826/11/158392783.html,https://dimg04.c-ctrip.com/images/Z80p180000013uw9yF21F_C_180_180.jpg,e03****77,4分,2019-04-13
晚上7:30開始夜遊，一共有8個小節目分佈在園內的8處，基本可以遊了一圈，表演者多半是學生，要專業欣賞的請到別處，但想一覽蘇州傳統文化，聽曲聽樂的可以來欣賞一下，夜晚的園別有一種風味。,https://gs.ctrip.com/html5/you/comment/detail/1826/11/58628326.html,https://dimg04.c-ctrip.com/images/fd/headphoto/g4/M08/13/59/CggYHVYZRimAX88dAADT9yC_PXc070_C_180_180.jpg,莎度娜,5分,2015-10-06
表演安排不错，每场都在不同的院子里，就是时间太短了，还没进入状态就结束了，有点遗憾。防鼠测字和古琴好评,https://gs.ctrip.com/html5/you/comment/detail/1826/11/161478711.html,https://dimg04.c-ctrip.com/images/Z80p180000013uw9yF21F_C_180_180.jpg,xxbhqh2298,5分,2019-10-10
园子不大，晚上看看节目挺不错，可以看看，一共八个节目，很有特色,https://gs.ctrip.com/html5/you/comment/detail/1826/11/158523338.html,https://dimg04.c-ctrip.com/images/t1/headphoto/136/299/437/649eb217e3e54746b7a53b8665e14b00_C_180_180.jpg,M22****0910,5分,2019-04-24
还可以吧了景色一般，,https://gs.ctrip.com/html5/you/comment/detail/1826/11/165728195.html,https://dimg04.c-ctrip.com/images/Z804180000013uqy3DB02_C_180_180.jpg,M42****6501,2分,2021-02-13
苏州园林处处美，大同小异，网师园夜游加入了一些文化表演因素！,https://gs.ctrip.com/html5/you/comment/detail/1826/11/164201264.html,https://dimg04.c-ctrip.com/images/Z80p180000013uw9yF21F_C_180_180.jpg,巴伦西亚李斯,4分,2020-08-22
体验很好，值得推荐，景色不错，环境幽静，比拙政园的人少很多。,https://gs.ctrip.com/html5/you/comment/detail/1826/11/164028761.html,https://dimg04.c-ctrip.com/images/t1/headphoto/982/089/752/f8c7b21182c94524ac4df328fdc7b3dc_C_180_180.jpg,M27****5943,5分,2020-08-06
小巧迷你的私宅一座。,https://gs.ctrip.com/html5/you/comment/detail/1826/11/163685396.html,https://dimg04.c-ctrip.com/images/fd/headphoto/g4/M00/47/C6/CggYHlXLAXmAAozmAAAq9uJXZgg575_C_180_180.jpg,_M13****9225,5分,2020-06-20
晚上的园子很漂亮，小姐姐小哥哥们人美声甜，有个小姐姐唱完就立马下台喝了口奶茶，真实，表演大概30min时长，剩下时间逛逛园子拍拍照挺好，游客不是很多，晚进来的也能全部看完，这个好评,https://gs.ctrip.com/html5/you/comment/detail/1826/11/161458097.html,https://dimg04.c-ctrip.com/images/t1/headphoto/882/320/089/158cae5ddb6143c0b6ae18523614cf08_C_180_180.jpg,M32****8014,5分,2019-10-09
看的网上推荐才来的这里，网师园虽然小但是很精致，适合夜晚出游,https://gs.ctrip.com/html5/you/comment/detail/1826/11/161003119.html,https://dimg04.c-ctrip.com/images/t1/headphoto/424/398/503/0386f569fd0d4b488ff41b64bbc5743b_C_180_180.jpg,M23****776,5分,2019-09-19
网师园在苏州众多精致园林里，不算非常的有名，但是却别有一番风情，很有人文气质，曲径通幽，一汪碧水，特别的秀丽，人不算太多，还是很喜欢这里的！,https://gs.ctrip.com/html5/you/comment/detail/1826/11/158953406.html,https://dimg04.c-ctrip.com/images/headphoto/588/900/915/4e09946e563d4d8e9a60eedb96567d46_C_180_180.jpg,sha****anna,4分,2019-05-26
天气好，园内景点非常漂亮，虽然小但是精致，值得游玩，交通便利,https://gs.ctrip.com/html5/you/comment/detail/1826/11/158742248.html,https://dimg04.c-ctrip.com/images/fd/headphoto/g3/M0A/63/D1/CggYGlYJS1-Aa5wGAADcoT8oqtg529_C_180_180.jpg,琳琳爱旅游,5分,2019-05-08
初来苏州，初组织去了定园，感觉是在破坏祖宗留下的好东西，被狠狠坑了一下，晚上决定去一下网师园，100元门票不便宜，但文化遗产的园夜景只此一家，苏州当地人知道的也不多，打车去。也许期望值下降，所以游玩完感觉超好。八个真人演艺，彻底感受了江南文化，评弹，昆曲，十五贯，游园惊梦等，非常好，园不大，很有特点，保存的也非常好。美女导游讲解也很到位。皇家园林也很好，有时间可以好好玩一下。主要说一下游船有位五十多岁导游大哥，讲解真好，他的讲解让我对苏州增加了许多期待。,https://gs.ctrip.com/html5/you/comment/detail/1826/11/155921597.html,https://dimg04.c-ctrip.com/images/Z80m0400000004ea2FEEB_C_180_180.jpg,大江东去,5分,2018-07-29
网师园入口在小巷子中，一不留神容易错过，一定要看路牌和指示牌。然后晚上是有讲解员的，讲解员带着走一圈看8个表演，包括苏州评弹、南昆、北昆、古琴、箫、古筝＋跳舞以及合奏，表演很精彩（虽然有些听不懂吴侬软语），然后表演的**姐很美丽，自由参观时间也很长，好评,https://gs.ctrip.com/html5/you/comment/detail/1826/11/154911100.html,https://dimg04.c-ctrip.com/images/t1/headphoto/177/080/529/285e9abeede347d9a7c1cc5e1b4c9287_C_180_180.jpg,泗洪县弗莉达,5分,2018-05-18
真的很不错 很漂亮,https://gs.ctrip.com/html5/you/comment/detail/1826/11/163805792.html,https://dimg04.c-ctrip.com/images/fd/headphoto/g2/M0A/32/68/Cghzf1W2fouAZjY1AAAS18p6RpE689_C_180_180.jpg,M21****317,5分,2020-07-10
"位于苏州市区～出来就是热闹的十全街～
园内环境非常的优美！",https://gs.ctrip.com/html5/you/comment/detail/1826/11/163343071.html,https://dimg04.c-ctrip.com/images/Z80913000000usz2910F5_C_180_180.jpg,美丽的神话不是假的,4分,2020-05-01
苏州园林的代表，虽不如拙政园名气大，但景色也同样优美。,https://gs.ctrip.com/html5/you/comment/detail/1826/11/163693023.html,https://dimg04.c-ctrip.com/images/t1/headphoto/857/872/237/edc9e981b00e436a8dcee595001d62fa_C_180_180.jpg,M22****5282,4分,2020-06-21
非常好，值得看,https://gs.ctrip.com/html5/you/comment/detail/1826/11/161886024.html,https://dimg04.c-ctrip.com/images/fd/headphoto/g1/M04/87/85/CghzflTEoDKAXeaSAADLlfsE7KE418_C_180_180.jpg,五把刀,5分,2019-11-07
很棒滴！节目都不错，下次不是节假日的时候可以再去一次～,https://gs.ctrip.com/html5/you/comment/detail/1826/11/159255880.html,https://dimg04.c-ctrip.com/images/Z80fhk1436eh05lxf5A2E_C_180_180.jpg,clddsh888,5分,2019-06-11
很好的园林，丰富的文化底蕴，精致，典雅。图，文，字，画，花，筑皆可赏！夜游的节目也非常好看，夜景也很美，值得一去！在苏州是唯一可夜游的园林，不过园林在胡同里，不熟路不太好找。,https://gs.ctrip.com/html5/you/comment/detail/1826/11/158820516.html,https://dimg04.c-ctrip.com/images/Z80t0t000000i9t376D0A_C_180_180.jpg,心逸日休,5分,2019-05-16
体验很好，,https://gs.ctrip.com/html5/you/comment/detail/1826/11/163961386.html,https://dimg04.c-ctrip.com/images/t1/headphoto/903/173/918/eb4b7bea9720440dac09eab89328ab00_C_180_180.jpg,M46****339,5分,2020-07-30
值得推荐，,https://gs.ctrip.com/html5/you/comment/detail/1826/11/163781063.html,https://dimg04.c-ctrip.com/images/Z80o180000013ulur1D76_C_180_180.jpg,_WeCh****342435,5分,2020-07-06
8个表演有特色但是时间比较短，园子很小很快就逛完了，价格可以接受，毕竟要请演员表演的，夜景还是很漂亮哒。演员小哥哥小姐姐长得好看！,https://gs.ctrip.com/html5/you/comment/detail/1826/11/163589640.html,https://dimg04.c-ctrip.com/images/headphoto/035/536/126/2455d620484f45e19773fd361f9d96c7_C_180_180.jpg,啾啾小伊,4分,2020-06-05
值得推荐，有趣好玩，体验很好，景色不错，小巧别致,https://gs.ctrip.com/html5/you/comment/detail/1826/11/164306601.html,https://dimg04.c-ctrip.com/images/Z80a15000000xo0ah413F_C_180_180.jpg,郑榆静V8,5分,2020-09-01
不错哦，还可以，只是演员的衣服有点旧，灯光有些暗,https://gs.ctrip.com/html5/you/comment/detail/1826/11/161231120.html,https://dimg04.c-ctrip.com/images/zc0o170000011crio5D00_C_180_180.jpg,139****3333,5分,2019-10-01
网师园是我们专业里非常重要的园子，面积很小，但是我很喜欢月到风来亭，之前晚上夜游过，有表演晚上但是作为建筑人，白天才能看清房子。,https://gs.ctrip.com/html5/you/comment/detail/1826/11/160792574.html,https://dimg04.c-ctrip.com/images/Z80h180000013xc9e3F64_C_180_180.jpg,_m13****7511,5分,2019-09-05
网师园是苏州唯一一个夜游的园林！晚上人比较多，7:20开始排队换票入园，一共8个节目，随时入园都有讲解人员带领参观欣赏节目，虽然天气炎热，演员还是非常给力的，值得一去！,https://gs.ctrip.com/html5/you/comment/detail/1826/11/160093219.html,https://dimg04.c-ctrip.com/images/Z80h180000013xc9e3F64_C_180_180.jpg,138****6622,5分,2019-08-04
内容不错，就是人太多。如果人少些，体验就更好了,https://gs.ctrip.com/html5/you/comment/detail/1826/11/161429423.html,https://dimg04.c-ctrip.com/images/Z80h180000013xc9e3F64_C_180_180.jpg,roger0703,4分,2019-10-07
好有故事的一个故园，一个窗棂，一棵绿植，一角案几，处处都藏着玄机，最好多和院子里的工作人员攀谈，有一个保安很有学问，还有一些老苏州，多聊聊收获大，不要太听一些所谓导游的，比较浅白没深度。,https://gs.ctrip.com/html5/you/comment/detail/1826/11/155533831.html,https://dimg04.c-ctrip.com/images/t1/headphoto/177/080/529/285e9abeede347d9a7c1cc5e1b4c9287_C_180_180.jpg,_CFT****11451,5分,2018-07-06
夜游效果不错，虽然演出时间很短，但是晚上的园林很好看，灯光设计刚刚好，不夸张，价格低点就好了。不要赶着开园时间排队进去，节目是循环演出的，晚点进去人少些看得更舒服。,https://gs.ctrip.com/html5/you/comment/detail/1826/11/162923082.html,https://dimg04.c-ctrip.com/images/Z80p180000013uw9yF21F_C_180_180.jpg,139****5364,5分,2020-02-29
特别方便，网师园小园极则，很美，可观可玩性都很高，是苏州园林里不可错过的景点，性价比超高，布局巧妙合理，还有夜游也很不错的。,https://gs.ctrip.com/html5/you/comment/detail/1826/11/161952921.html,https://dimg04.c-ctrip.com/images/Z80p180000013uw9yF21F_C_180_180.jpg,_CFT01****5355342,5分,2019-11-13
江南特有味道的私家园林，很小，但是有很大，看你怎么理解了，里面的构造和结构很巧妙，亭台楼阁轩，假山流水名木，搭配着及时典故，真是对于现代人来说，美妙绝伦，妙不可言！,https://gs.ctrip.com/html5/you/comment/detail/1826/11/161565420.html,https://dimg04.c-ctrip.com/images/Z80o13000000ux33tF40D_C_180_180.jpg,LEOYANGHZ,5分,2019-10-16
听有趣的，晚上的网师园有别样的美有趣好玩，,https://gs.ctrip.com/html5/you/comment/detail/1826/11/163552145.html,https://dimg04.c-ctrip.com/images/t1/headphoto/057/777/943/0b93f8268d5546308915f4f9fcaa9483_C_180_180.jpg,_WeCh****618144,5分,2020-05-30
王诗源是国务院颁布的全国重点文物保护单位，也是苏州园林的佼佼代表。园林不大，但十分精巧，处处体现江南园林的特征和优美之处。,https://gs.ctrip.com/html5/you/comment/detail/1826/11/162028982.html,https://dimg04.c-ctrip.com/images/t1/headphoto/903/173/918/eb4b7bea9720440dac09eab89328ab00_C_180_180.jpg,晓芸Anne,4分,2019-11-19
游园今梦表演还可以，夜景比较漂亮，有小时候游玩感觉，印象深刻，比大都市演出有味道，值得一看。昆剧表演时间太少，有点小遗憾。,https://gs.ctrip.com/html5/you/comment/detail/1826/11/158828800.html,https://dimg04.c-ctrip.com/images/Z80k0z000000n0km1B7B8_C_180_180.jpg,岁月静就好,4分,2019-05-16
"详细地址：
姑苏区带城桥路阔家头巷11号，开车不太方便停车，而且十全街容易堵车，建议打车。
截止12月底可以抢购一元门票，每人限一次，购票时需要预约好时间，游园时直接刷身份证进，很方便！
这个期间周内去逛，人不算多，很适合来拍秋天的写真或者来修身养性。
园林不算很大，但该有的都有，也很精致，导游说连地上的石路都很有讲究。
园林出门就有各种网红咖啡厅，附近也适合吃吃喝喝逛逛！",https://gs.ctrip.com/html5/you/comment/detail/1826/11/165296152.html,https://dimg04.c-ctrip.com/images/Z80b0c00000062w71D5CC_C_180_180.jpg,卡卡-Y,,2020-12-10
"网师园 ，位于苏州市城区东南部带城桥路阔家头巷11号，是苏州园林中型古典山水宅园代表作品。网师园始建于南宋时期（公元1127～1279年），这里曾经是宋代藏书家、官至侍郎的扬州文人史正志的“万卷堂”故址，花园名为“渔隐”，后废。至清乾隆年间（约公元1770年），退休的光禄寺少卿宋宗元购之并重建，定园名为“网师园”。
网师园几易其主，园主多为文人雅士，各有诗文碑刻遗于园内，历经修葺整理。网师园占地约半公顷，是苏州园林中最小的一座。园内主要建筑有丛桂轩、濯缨水阁、看松读画轩、殿春簃等。网师园的亭台楼榭无不临水，全园处处有水可依，各种建筑配合得当，布局紧凑，以精巧见长。
网师园是典型的宅园合一的私家园林。住宅部分共四进，自轿厅、大客厅、撷秀楼、五峰书屋，沿中轴线依次展开，主厅“万卷堂”屋宇高敞，装饰雅致。",https://gs.ctrip.com/html5/you/comment/detail/1826/11/165250663.html,https://dimg04.c-ctrip.com/images/a20110000000oojss7321_C_180_180.jpg,杰杰陶TAO,,2020-12-04
"网师园是一座典型的宅院合一的私家园林，这是苏州园林古典山水宅园的代表作品。这里占地面积只有半公顷，住宅沿中轴线展开，一共四进院落，而且整个园子的亭台楼阁都是临水而建，全园处处有水可依。

这座园林建造于南宋时期，它是宋代藏书家、官至侍郎的扬州文人史正志的“万卷堂”故址，当年史正志被弹劾罢官后，他就退居姑苏在这里建造了一个园林，因为府中陈列了42厨，有万卷书卷，所以命名为万卷堂。清乾隆时期，曾官光禄寺少卿的宋宗元在万卷堂故址重治别业，用作归老计，就是用来奉养母亲的住所，于是便改名为网师园，名字一直沿用到今天。

旅行小贴士：
地址：苏州阔家头巷11号
开放时间：07:30-17:30
交通方式：529、931、55、47网师园站；游2、202网师园西站；204、501、511网师园北站。
门票：40元",https://gs.ctrip.com/html5/you/comment/detail/1826/11/165090663.html,https://dimg04.c-ctrip.com/images/0Z86u120008e1lpl83DBF_C_180_180.jpg,郝地瓜Cynthia,,2020-11-16
"艺圃
藏在巷子里，虽小但很美，园内多是些本地人，茶馆座无虚席，大多都是当地的老爷爷老奶奶在喝茶聊天，算是苏州最具市井气的小园林。

湘城老街
承载着时光的记忆，这里依然保持这九十年代的淳朴气息，青石板路，弹棉花店，老式理发店等等，怀旧感十足。

树山
这里虽然不是城区，但还是可以作为周末休闲的好去处。山上的木栈道可以徒步吸氧，春天满山梨花开，夏天还可以摘杨梅。现在的这里也是秋高气爽。

葑门横街
葑门横街是苏州最具市井气息的老街，也是最治愈的一条老街，承载着当地人日常的柴米油盐。时令水果，小吃吃到饱。夏末秋初家家户户都在剥新鲜的鸡头米，可以买点尝尝。

平江路
苏州的历史名街，保存最完整的古城区，老城区依然留存着老苏州的生活气息，随便一条小巷子钻进去，说不定就会偶遇小众园林，白墙黛瓦。

苏州太湖大桥
苏州的“小镰仓”，名副其实的网红打卡地，桥边两侧是颜望不到边的太湖，绕着环岛公路边走边吹风，简直太舒服了。

网师园
小巧精致，典雅别致，推荐夜游网师园，园林实景演出，一步一景，古筝，评弹，昆曲都能体验，（白天网师园，沧浪亭可一起游玩，晚上可去网红“双塔市集”吃苏式小吃）

苏州博物馆
黑白灰的建筑风格颇具江南特色，可算是苏州第一打卡景点了。记得提前预约，周一闭馆。

独墅湖
隐匿的欧式风情教堂，白鹭公园，湖中的十字架是这里独有的美，超级适合情侣约会，拍婚纱照。也可以带上满满的零食野餐，或是穿一身漂亮的裙子过来拍照。

谭金土老照片收藏馆
这里虽然不收门票，也不卖旧照片，只是出于对古旧文化的热爱，古香的房间，都是收藏的老式照片，还有摆件，古玩等，都透露着时间的沉淀，感兴趣的小伙伴可以去参观哦！

十全街
听说这里是当地小资女性最爱逛的地方，唱片店，咖啡店，建筑都很有格调，路两旁还有古老的梧桐树，这里也不失为一个街拍的好地方。

昆曲传习所
自带的院子，可以看实景版《牡丹亭》，早点去喝喝茶，还可以看到演员化妆。非常特别的体验。",https://gs.ctrip.com/html5/you/comment/detail/1826/11/164689723.html,https://dimg04.c-ctrip.com/images/0Z81d120008f9ynhmBBB2_C_180_180.jpg,郑格儿,,2020-10-06
体验很好，有趣好玩，景色不错，值得推荐，,https://gs.ctrip.com/html5/you/comment/detail/1826/11/164414127.html,https://dimg04.c-ctrip.com/images/headphoto/128/574/192/c19910eaf0ab472aa3909304d0371116_C_180_180.jpg,qia****fang,5分,2020-09-12
体验很好，值得推荐，景色不错，有趣好玩，,https://gs.ctrip.com/html5/you/comment/detail/1826/11/164302470.html,https://dimg04.c-ctrip.com/images/Z80h180000013xc9e3F64_C_180_180.jpg,飞扬的逍遥仙,5分,2020-08-31
景色不错，值得推荐，体验很好，有趣好玩，,https://gs.ctrip.com/html5/you/comment/detail/1826/11/164187297.html,https://dimg04.c-ctrip.com/images/Z80p180000013uw9yF21F_C_180_180.jpg,M85****24,5分,2020-08-20
1元玩园林，非常不错，院子不大，人也不多,https://gs.ctrip.com/html5/you/comment/detail/1826/11/164095892.html,https://dimg04.c-ctrip.com/images/Z80h180000013xc9e3F64_C_180_180.jpg,_wf****53,4分,2020-08-12
体验很好，值得推荐，景色不错，有趣好玩，,https://gs.ctrip.com/html5/you/comment/detail/1826/11/163880304.html,https://dimg04.c-ctrip.com/images/t1/headphoto/724/518/802/e201a429d7a54f72ade0df32a3d59b2f_C_180_180.jpg,M24****6803,5分,2020-07-20
景色不错，值得推荐，体验很好，有趣好玩，,https://gs.ctrip.com/html5/you/comment/detail/1826/11/163709432.html,https://dimg04.c-ctrip.com/images/Z80p180000013uw9yF21F_C_180_180.jpg,chenjizhi,5分,2020-06-24
值得推荐，体验很好，景色不错，有趣好玩，,https://gs.ctrip.com/html5/you/comment/detail/1826/11/163697339.html,https://dimg04.c-ctrip.com/images/Z80p13000000vdundAE50_C_180_180.jpg,_WeCh****42235,5分,2020-06-22
夜游网师园是我一直种了很久的草，最近终于成行。晚上游客不少，检票后需要等10分钟左右，导游会带着一拨游客一起游览，观看8个节目，再介绍一下园子。节目都很短，就像超市体验装一样，只能看个意思，带孩子来看可以一次见识好几种民族乐器和戏曲种类。用的来说值得一看，但是期望值不要太高，演员的水平有点业余的。希望如果能提高一下表演的水准就更好了。,https://gs.ctrip.com/html5/you/comment/detail/1826/11/159435680.html,https://dimg04.c-ctrip.com/images/Z80h180000013xc9e3F64_C_180_180.jpg,202****391,4分,2019-06-25
一直都想夜游网师园的，这次如愿以偿。美中不足就是人多，这边还在看表演，那边游客自由走动开始大声喧哗，影响了安静体验的感受,https://gs.ctrip.com/html5/you/comment/detail/1826/11/158945306.html,https://dimg04.c-ctrip.com/images/Z80h180000013xc9e3F64_C_180_180.jpg,小又鸟,5分,2019-05-25
来过苏州无数次，却从未静下心慢慢体会苏州园林的精致。恰好住在南园，网师园在对面的小巷子里。网师园始建于公元1174年（宋淳熙初年），始称“渔隐”，几经沧桑变更，至公元1765年（清乾隆三十年）前后，退休的光禄寺少卿宋宗元购之并重建，定园名为“网师园”。网师园几易其主，园主多为文人雅士，各有诗文碑刻遗于园内，历经修葺整理。网师园虽然规模不大，却布局精巧，结构紧凑，园内的山水布置和景点题名蕴含着浓郁的隐逸气息。走累了随便坐下发发呆，感受它的低调与雅致真的是极好的。,https://gs.ctrip.com/html5/you/comment/detail/1826/11/157172832.html,https://dimg04.c-ctrip.com/images/headphoto/243/490/103/2e6ab84958bb48c5810b5d57ff28fa48_C_180_180.jpg,chrisbobo,5分,2018-11-08
夜游网师园 看游园今梦演出 别有一番情趣 据说网师园是唯一一个开放夜游的苏州园林 自然不能错过 携程网上订票比现场一百元购票优惠五元 而且取票方便 有导游陪同 看八个演出 古琴 古筝 昆曲 评弹等 园子本身不大 但是精致紧凑 很有看点 因为演出是循环的 所以不用太着急入园 八点之后游人更少 观看效果更佳,https://gs.ctrip.com/html5/you/comment/detail/1826/11/156897209.html,https://dimg04.c-ctrip.com/images/Z80c1c000001e3aii8020_C_180_180.jpg,西西是我,5分,2018-10-07
