标题,标题链接,头像,user-detail__name,resource_date
各色郁金香都看到了，景区各小景致很有特色，超值,https://gs.ctrip.com/html5/you/comment/detail/1772/11/116849592.html,https://dimg04.c-ctrip.com/images/Z80p180000013uw9yF21F_C_180_180.jpg,m99****06,2017-07-04
玩的很好，接近春天的第一步，梅花正旺，香气正浓,https://gs.ctrip.com/html5/you/comment/detail/1772/11/116315523.html,https://dimg04.c-ctrip.com/images/t1/headphoto/491/056/464/eb3c7472323e4c3598f58ffa8a6fce99_C_180_180.jpg,M41****434,2017-03-04
好。,https://gs.ctrip.com/html5/you/comment/detail/1772/11/158067377.html,https://dimg04.c-ctrip.com/images/Z80412000000s7i9996AC_C_180_180.jpg,琴麻岛向左,2019-03-07
现在去稍微早了些 梅花没有完全盛开 不过还是不错,https://gs.ctrip.com/html5/you/comment/detail/1772/11/153581356.html,https://dimg04.c-ctrip.com/images/t1/headphoto/258/512/704/6bce7506eecc48f8a4a6d3177e0acf24_C_180_180.jpg,M47****753,2018-02-25
2月12日来的。梅花还含苞待放呢。再晚半个月应该会开的更好哦！园子很大整个逛下来走走停停拍拍照约需三个小时。麻麻特别爱拍照。园子休闲下还是不错的。趣闻性上欠缺了点。,https://gs.ctrip.com/html5/you/comment/detail/1772/11/70802381.html,https://dimg04.c-ctrip.com/images/Z80h180000013xc9e3F64_C_180_180.jpg,M82****44,2016-02-12
从火车站坐地铁到梅园下车，携程订票价格优惠。,https://gs.ctrip.com/html5/you/comment/detail/1772/11/68249378.html,https://dimg04.c-ctrip.com/images/Z80p180000013uw9yF21F_C_180_180.jpg,快乐奚,2015-12-13
刷二维码就直接进了，梅花都没了，然后郁金香所剩无几了，其它小花和园林庭院可以拍拍。,https://gs.ctrip.com/html5/you/comment/detail/1772/11/154321026.html,https://dimg04.c-ctrip.com/images/headphoto/565/180/661/ea794df959a54d3cbe19120d09ca64f2_C_180_180.jpg,yolandazhly,2018-04-08
梅园是不错的旅游地，离鼋头渚很近，开车十几分钟，园子很大，走下来也要三四个小时吧可以边赏花边闲逛，这个时期已经没有了梅花，但也有开的樱花桃花点缀其中，很是让人喜欢,https://gs.ctrip.com/html5/you/comment/detail/1772/11/154125237.html,https://dimg04.c-ctrip.com/images/fd/headphoto/g1/M01/00/E4/CghzfVVXXXmAYxLcAAAbfBrV6cU463_C_180_180.jpg,m33****60,2018-03-27
初冬的腊梅，雨后的芬芳。园子不大，梅花树挺多，就是还太早，只开了一种梅花，一场阵雨过后，空气格外清新，梅花的香气扑鼻而来。,https://gs.ctrip.com/html5/you/comment/detail/1772/11/152361296.html,https://dimg04.c-ctrip.com/images/fd/headphoto/g2/M03/8B/EC/Cghzf1Uqe_2ARU_BAADZt_A1vkc796_C_180_180.jpg,M84****80,2017-12-30
梅花是无锡的市花，是全国四大梅园之一，所以冬春来无锡的话梅园是一定要去的。每年基本上都有新品种的梅花。我有个亲戚家就住在那里，风景一年四季都很好，到处都很美，尤其是初春的时节更是，暗香扑鼻！由于梅园是在太有名气了，双休日游客很多，最好挑平时去。园内还有各种其他的活动，个人觉得去无锡，梅园是必去的地方！,https://gs.ctrip.com/html5/you/comment/detail/1772/11/99569308.html,https://dimg04.c-ctrip.com/images/t1/headphoto/130/574/880/8586f4e0956c4731a14b358ba44f0457_C_180_180.jpg,长空利剑12,2017-03-25
这个时节正是梅花盛开的时候，梅园里的各色梅花姹紫嫣红，颇为好看！我分别看到了红色的、白色的、绿色的、黄色的和粉色的梅花！,https://gs.ctrip.com/html5/you/comment/detail/1772/11/97828990.html,https://dimg04.c-ctrip.com/images/t1/headphoto/646/318/109/a865fe5f5465407d8befd5dc487a8554_C_180_180.jpg,M50****583,2017-02-18
"趁着2号线开通，和家人一起到梅园逛逛。梅园原本是无锡资本家荣德生家的。现在里面还有许多荣氏家族的痕迹。
有荣毅仁先生的铜像，有纪念馆，读书堂，墩厚堂等等。
梅园最出名的就是梅花。据说有好几百个品种。只是现在还没到时间，全部是光秃秃的树木。
腊梅到是会讨巧，赶着寒风，悄悄的张开了笑脸，阵阵淡雅的清香，沁人心脾。
奇石园内，各种型状的石头，蛮有看头。
开原寺还是老样子，香客不断。
冬天的花溪已没了流水，热带植物园也关着。
园内最近多了个冰雕展。还得另外收费，不看了。
大片的郁金香已经撒好种子，待开春时，再来欣赏花容。
到了春天，梅园将是一个花的海洋。",https://gs.ctrip.com/html5/you/comment/detail/1772/11/14026548.html,https://dimg04.c-ctrip.com/images/Z80p180000013uw9yF21F_C_180_180.jpg,悦悦猪,2015-04-22
"好像以前是私家的宅子,真是感叹无锡这鱼米之乡的富庶,造就这么多私家豪宅,里面的布局很讲究,除了居住之所以外,还有大片的梅园,也就是现在名字的由来吧,去的时候不是梅花盛开的季节,所以没法欣赏,还是推荐冬天去看吧",https://gs.ctrip.com/html5/you/comment/detail/1772/11/5239725.html,https://dimg04.c-ctrip.com/images/fd/headphoto/g1/M07/70/B7/CghzfFSUV9CAcJD5AADs5XwLJPs904_C_180_180.jpg,Mrs猪,2014-06-26
整个下来还是比较划算的，性价比还是高的，但是景点的亮点不是很多，除了鼋头渚，其他几个就是所谓的公园性质的园子，没什么看他，看得出来现代化气息很浓厚，园子神马的都是后人借助典故后建的，个人觉得就鼋头渚还不错，游船真心还不错。。。,https://gs.ctrip.com/html5/you/comment/detail/1772/11/3327672.html,https://dimg04.c-ctrip.com/images/Z80h180000013xc9e3F64_C_180_180.jpg,maggie0411,2014-01-17
梅园原为荣家私家园林，内有荣氏长辈喜欢静读的农庄，有荣氏香雪海，每年逢冬春之季，梅、桃、郁金香按季开放，吸引游人不断前往。梅园的招牌当然就是梅花，但一年四季中还有腊梅、郁金香，每当花季来临，大花园里是最美的时候。,https://gs.ctrip.com/html5/you/comment/detail/1772/11/3297479.html,https://dimg04.c-ctrip.com/images/headphoto/614/190/847/a1eef10d2ca04decbce4594bdaa18692_C_180_180.jpg,之昂,2013-12-28
已经过了梅花最美时间。一般。周末人也多,https://gs.ctrip.com/html5/you/comment/detail/1772/11/158143566.html,https://dimg04.c-ctrip.com/images/fd/headphoto/g2/M01/01/DD/CghzgFWGpp6ALozWAAC0ZGS34nI861_C_180_180.jpg,fengxiao0515,2019-03-18
在梅园最好看的是梅花，春节过后梅花谢了，但是很快就可以观看郁金香。紧接着就可以欣赏樱花。，总之，在梅园一年四季都可以欣赏鲜花。梅园其实也不大逛两个小时已足够。,https://gs.ctrip.com/html5/you/comment/detail/1772/11/154236331.html,https://dimg04.c-ctrip.com/images/t1/headphoto/857/872/237/edc9e981b00e436a8dcee595001d62fa_C_180_180.jpg,我就是传说,2018-04-03
很美，山水间透着干净，空气中漫着花香。,https://gs.ctrip.com/html5/you/comment/detail/1772/11/116549842.html,https://dimg04.c-ctrip.com/images/t1/headphoto/685/724/771/3cd584c18f744104b47d3f3d075d10e3_C_180_180.jpg,fairy,2017-05-01
地方很大，可惜去的时候不对，很多梅花都还只有很小的花苞，盛开的时候应该很漂亮,https://gs.ctrip.com/html5/you/comment/detail/1772/11/157883254.html,https://dimg04.c-ctrip.com/images/Z80h180000013xc9e3F64_C_180_180.jpg,_ZFB20****2246321,2019-02-13
梅花观赏季，人很多。停车特别不方便！,https://gs.ctrip.com/html5/you/comment/detail/1772/11/153714509.html,https://dimg04.c-ctrip.com/images/Z80g180000014nhx3192E_C_180_180.jpg,qinger_813101,2018-03-05
"很美，人也很多，值
交通也很方便。",https://gs.ctrip.com/html5/you/comment/detail/1772/11/116340193.html,https://dimg04.c-ctrip.com/images/t1/headphoto/207/494/838/fa687736cf3f484480526cfc0eb6c073_C_180_180.jpg,韩斯达,2017-03-14
春天从梅园开始，每年早春二月无锡人必去，有各种梅花斗艳。还有荣氏家族的历史。,https://gs.ctrip.com/html5/you/comment/detail/1772/11/71276745.html,https://dimg04.c-ctrip.com/images/t1/headphoto/982/089/752/f8c7b21182c94524ac4df328fdc7b3dc_C_180_180.jpg,M20****894,2016-02-27
梅园，梅园，顾名思义赏梅是最好的啦，梅花种类多，就是人有点多，季节性很强，特意去没有太大的必要！,https://gs.ctrip.com/html5/you/comment/detail/1772/11/4621210.html,https://dimg04.c-ctrip.com/images/fd/headphoto/g2/M0A/E8/E5/Cghzf1T_yS2AdW6KAAB-x629ob8235_C_180_180.jpg,desi123,2014-05-08
总的来说还不错，去晚了梅花已经落了，不过郁金香很好看！,https://gs.ctrip.com/html5/you/comment/detail/1772/11/158194468.html,https://dimg04.c-ctrip.com/images/t1/headphoto/463/352/613/9d877effaa3d4bd0b951bb4c60209b3b_C_180_180.jpg,M31****3624,2019-03-25
这个时间点腊梅开得正盛，其他品种的梅花处于含苞待放中，再过一个月来会更好。,https://gs.ctrip.com/html5/you/comment/detail/1772/11/157763476.html,https://dimg04.c-ctrip.com/images/Z80h180000013xc9e3F64_C_180_180.jpg,300****936,2019-02-03
春天梅花盛开，让人流连忘返，大爱！,https://gs.ctrip.com/html5/you/comment/detail/1772/11/154143277.html,https://dimg04.c-ctrip.com/images/Z80h180000013xc9e3F64_C_180_180.jpg,_cs53****2722,2018-03-28
梅园很美，下回还会去玩吧。很开心。,https://gs.ctrip.com/html5/you/comment/detail/1772/11/116723819.html,https://dimg04.c-ctrip.com/images/t1/headphoto/491/056/464/eb3c7472323e4c3598f58ffa8a6fce99_C_180_180.jpg,虾米Melissa,2017-06-04
用的无锡园林一卡通，非常方便，这个季节去已经没有梅花了，但是郁金香来的很好，还有桃花，都很好看,https://gs.ctrip.com/html5/you/comment/detail/1772/11/100369483.html,https://dimg04.c-ctrip.com/images/fd/headphoto/g5/M02/6C/B4/CggYsFb2scaABiuJAAERiJ8gbhY904_C_180_180.jpg,kit_lee,2017-04-04
就是梅花还在含苞欲放，估计还要半个月才能你无关全部开,https://gs.ctrip.com/html5/you/comment/detail/1772/11/153251147.html,https://dimg04.c-ctrip.com/images/Z80p180000013uw9yF21F_C_180_180.jpg,DDV0530,2018-02-10
国民族工业之首户荣宗敬、荣德生仲昆本着为天下布芳馨之宏愿，于1912年在此购地筑园 地方不算太大 梅花开的值得一起 经常搞活动 活动票价值 如果原价的话可能有些贵,https://gs.ctrip.com/html5/you/comment/detail/1772/11/152310092.html,https://dimg04.c-ctrip.com/images/Z80p180000013uw9yF21F_C_180_180.jpg,M65****01,2017-12-27
孩子很是喜欢，但是范围不大，5号去的，入园后还时有小雨的，但是人不多，孩子看的很尽兴，希望下次场地大点，花样多点,https://gs.ctrip.com/html5/you/comment/detail/1772/11/138830196.html,https://dimg04.c-ctrip.com/images/t1/headphoto/903/173/918/eb4b7bea9720440dac09eab89328ab00_C_180_180.jpg,M58****106,2017-10-09
超级划算的一次游玩，订票方便取票方便，关键是价格超划算，下次游玩还在这订,https://gs.ctrip.com/html5/you/comment/detail/1772/11/116432715.html,https://dimg04.c-ctrip.com/images/t1/headphoto/293/406/308/22631089f44a497495c005fce85f6a6f_C_180_180.jpg,_WeCh****10557,2017-04-06
很漂亮。。。。。。。。。。。。。,https://gs.ctrip.com/html5/you/comment/detail/1772/11/116410405.html,https://dimg04.c-ctrip.com/images/Z80d0f00000079v6c524E_C_180_180.jpg,_WeCh****42608,2017-04-03
梅花真的开的好美丽，值得游玩！,https://gs.ctrip.com/html5/you/comment/detail/1772/11/153622110.html,https://dimg04.c-ctrip.com/images/t1/headphoto/177/080/529/285e9abeede347d9a7c1cc5e1b4c9287_C_180_180.jpg,M26****8735,2018-02-27
非常漂亮，人太多，看小丑表演时站在后面看不到，都是海洋系列的灯真的很美,https://gs.ctrip.com/html5/you/comment/detail/1772/11/122161897.html,https://dimg04.c-ctrip.com/images/Z80p180000013uw9yF21F_C_180_180.jpg,M47****044,2017-09-18
九元门票真的很划算，坐2号地铁直达，交通方便，不用担心停车位，里面花多景美，孩子很开心，以后多带孩子出去走走。,https://gs.ctrip.com/html5/you/comment/detail/1772/11/116557373.html,https://dimg04.c-ctrip.com/images/Z80n0f0000007mj8x7D1A_C_180_180.jpg,橙子zff2011,2017-05-02
梅园如花海，赏花好去处！超赞！,https://gs.ctrip.com/html5/you/comment/detail/1772/11/100327168.html,https://dimg04.c-ctrip.com/images/Z80u0g0000007ujhb553C_C_180_180.jpg,欣悦看景,2017-04-02
"梅园，无锡的几大园林之一。

在无锡众多的免费与收费公园中梅园也算是我去的最多的一家了。

之前每年都会买园林卡，因此基本一年都要去个好几次。

冬天看腊梅、梅花，梅园的梅花真是出了名的好，",https://gs.ctrip.com/html5/you/comment/detail/1772/11/11732862.html,https://dimg04.c-ctrip.com/images/t1/headphoto/860/239/528/d59a66b756cf4372be5cf86d565694b9_C_180_180.jpg,赛巴斯酱,2014-12-06
景色还不错，其实最好的时间应该是三月份吧，同时人文历史气息也挺浓厚。,https://gs.ctrip.com/html5/you/comment/detail/1772/11/154937642.html,https://dimg04.c-ctrip.com/images/t1/headphoto/424/398/503/0386f569fd0d4b488ff41b64bbc5743b_C_180_180.jpg,_WeCh****831263,2018-05-20
总体还可以，就是这个季节花的品种不多，还有从性价比来说门票价格高了些,https://gs.ctrip.com/html5/you/comment/detail/1772/11/154726871.html,https://dimg04.c-ctrip.com/images/Z80h180000013xc9e3F64_C_180_180.jpg,katezhao,2018-05-05
梅园位于无锡西郊，园内遍植梅树，是江南著名的赏梅胜地之一，国家重点公园。园林设计者根据地势高低，以梅饰山，别具特色。园内植梅5500多株，品种繁多。,https://gs.ctrip.com/html5/you/comment/detail/1772/11/101495656.html,https://dimg04.c-ctrip.com/images/t1/headphoto/724/518/802/e201a429d7a54f72ade0df32a3d59b2f_C_180_180.jpg,静风,2017-04-18
今年梅园的郁金香开得比较早，三月底已开得非常盛了。各色郁金香争奇斗艳，引来了无数游客的关注，纷纷拿起手机、相机，与花儿留下合影。,https://gs.ctrip.com/html5/you/comment/detail/1772/11/100304923.html,https://dimg04.c-ctrip.com/images/t1/headphoto/646/318/109/a865fe5f5465407d8befd5dc487a8554_C_180_180.jpg,M50****583,2017-03-31
很好，梅园里的梅花很漂亮，就是从地铁到公园需要步行，交通不太方便,https://gs.ctrip.com/html5/you/comment/detail/1772/11/157896208.html,https://dimg04.c-ctrip.com/images/t1/headphoto/857/872/237/edc9e981b00e436a8dcee595001d62fa_C_180_180.jpg,M39****852,2019-02-14
从火车站坐地铁到梅园下车，建议游玩4-5小时，携程订票价格优惠。,https://gs.ctrip.com/html5/you/comment/detail/1772/11/68308686.html,https://dimg04.c-ctrip.com/images/Z80p180000013uw9yF21F_C_180_180.jpg,快乐奚,2015-12-17
地方挺大的，风景挺好的，人特别多，人山人海来形容很合适。还行吧,https://gs.ctrip.com/html5/you/comment/detail/1772/11/158103637.html,https://dimg04.c-ctrip.com/images/fd/headphoto/g5/M03/32/EF/CggYsVbNsl-AGSdDAACbh_JIomg516_C_180_180.jpg,大叔young,2019-03-12
作为无锡人，已经有好多年没去过了，带老婆和小朋友去一下，还不错,https://gs.ctrip.com/html5/you/comment/detail/1772/11/155657335.html,https://dimg04.c-ctrip.com/images/Z80p180000013uw9yF21F_C_180_180.jpg,138****1619,2018-07-11
礼拜天去得人挺多的，梅花落了不少，一直不知道里面好大呀，不错的,https://gs.ctrip.com/html5/you/comment/detail/1772/11/71417247.html,https://dimg04.c-ctrip.com/images/fd/headphoto/g4/M04/94/E2/CggYHlba1SuAXDkkAAAt23WxI0Y380_C_180_180.jpg,一花一世界,2016-03-07
看梅花的时候正好下雨，撑伞看梅花。梅花都落在伞上～很浪漫的说～,https://gs.ctrip.com/html5/you/comment/detail/1772/11/13726795.html,https://dimg04.c-ctrip.com/images/fd/headphoto/g2/M0A/8B/F7/Cghzf1TkkxeAf3UyAACmebvmSX4436_C_180_180.jpg,137****8492,2015-03-23
景区都是以景为主，需要走上好久，没有什么特色特别吸住人的项目,https://gs.ctrip.com/html5/you/comment/detail/1772/11/154763945.html,https://dimg04.c-ctrip.com/images/t1/headphoto/218/411/802/4a736fe94ebc486d86ed3466f0d76919_C_180_180.jpg,_cft01****0463192,2018-05-08
天气转好，带孩子去梅园赏梅，看到梅花正逐步开放，新蕾养眼，幽香怡人，孩子玩的很开森，是赏梅的好地处.,https://gs.ctrip.com/html5/you/comment/detail/1772/11/153598957.html,https://dimg04.c-ctrip.com/images/t1/headphoto/491/056/464/eb3c7472323e4c3598f58ffa8a6fce99_C_180_180.jpg,微笑向日葵1618,2018-02-26
院子蛮大的梅花品种很多，就是去的时候梅花都没开！这点很遗憾！如果是梅花都开的情况下还是很值得一游的！,https://gs.ctrip.com/html5/you/comment/detail/1772/11/153249075.html,https://dimg04.c-ctrip.com/images/fd/headphoto/g1/M01/5A/42/CghzfFVvUrmALmyGAAC6YZQ_QZQ940_C_180_180.jpg,泰国老司机^_^,2018-02-10
无锡的春天从梅园开始，非常值得去的地方，红梅、白梅、黄梅开放的时间不同。可根据个人喜好选择去的时间。,https://gs.ctrip.com/html5/you/comment/detail/1772/11/107198810.html,https://dimg04.c-ctrip.com/images/Z80h180000013xc9e3F64_C_180_180.jpg,冬懂,2017-05-16
元旦来的，梅花还没有开，有些失望，园子不算小，因为赶时间，加上梅花没有开放，所以匆匆逛了逛就出园了。,https://gs.ctrip.com/html5/you/comment/detail/1772/11/95061885.html,https://dimg04.c-ctrip.com/images/Z80d0c00000064drvE5DF_C_180_180.jpg,沐心1005,2017-01-11
梅花开的不多，基本上都是花苞，估计春节后会很漂亮，有点遗憾,https://gs.ctrip.com/html5/you/comment/detail/1772/11/157730111.html,https://dimg04.c-ctrip.com/images/t1/headphoto/857/872/237/edc9e981b00e436a8dcee595001d62fa_C_180_180.jpg,_WeCh****265697,2019-01-29
这里是以前有钱人的私家花园，现在进去看看景色还是不错的哟。,https://gs.ctrip.com/html5/you/comment/detail/1772/11/155233732.html,https://dimg04.c-ctrip.com/images/Z80p180000013uw9yF21F_C_180_180.jpg,zhuqun1970,2018-06-12
梅花品种比较多，去的时候正逢周末，人超级多，停车价格合理。,https://gs.ctrip.com/html5/you/comment/detail/1772/11/154849670.html,https://dimg04.c-ctrip.com/images/Z80h180000013xc9e3F64_C_180_180.jpg,170****608,2018-05-14
挺大的，估计四月份花开的季节去看效果会更好。五月份有风筝节,https://gs.ctrip.com/html5/you/comment/detail/1772/11/116547511.html,https://dimg04.c-ctrip.com/images/Z80p180000013uw9yF21F_C_180_180.jpg,320****070,2017-05-01
从无锡火车站坐车过去很方便，携程订票价格优惠，取票也方便。,https://gs.ctrip.com/html5/you/comment/detail/1772/11/60023511.html,https://dimg04.c-ctrip.com/images/Z80p180000013uw9yF21F_C_180_180.jpg,快乐奚,2015-11-13
今天去的人很多，郁金香华正开的艳丽时候。转的很累。踏青不错，类似公园。总体还行。携程一元票很经典,https://gs.ctrip.com/html5/you/comment/detail/1772/11/116420467.html,https://dimg04.c-ctrip.com/images/Z80b0f00000079kryADA1_C_180_180.jpg,这世界任凭践踏,2017-04-04
不愧是江南名园之一，梅花开的非常好看。有机会一定再来。,https://gs.ctrip.com/html5/you/comment/detail/1772/11/157785010.html,https://dimg04.c-ctrip.com/images/Z80p180000013uw9yF21F_C_180_180.jpg,小岳岳爱小菊菊,2019-02-06
正值梅花盛开，春日花开，阳光明媚，万紫千红，煞是好看！,https://gs.ctrip.com/html5/you/comment/detail/1772/11/153798130.html,https://dimg04.c-ctrip.com/images/Z80p180000013uw9yF21F_C_180_180.jpg,136****5989,2018-03-11
从火车站坐89路车，建议游玩3小时，携程订票价格优惠。,https://gs.ctrip.com/html5/you/comment/detail/1772/11/66714059.html,https://dimg04.c-ctrip.com/images/Z80p180000013uw9yF21F_C_180_180.jpg,快乐奚,2015-11-22
梅花盛开的时间值得一去，园内梅花品种多一，修剪得也好,https://gs.ctrip.com/html5/you/comment/detail/1772/11/156837780.html,https://dimg04.c-ctrip.com/images/Z80u0j000000a8lqa040B_C_180_180.jpg,冬天之光,2018-10-04
梅园很美，在梅花盛开的季节，各种各样的梅花争相开放。,https://gs.ctrip.com/html5/you/comment/detail/1772/11/155452763.html,https://dimg04.c-ctrip.com/images/Z80p180000013uw9yF21F_C_180_180.jpg,赛达阿姆斯壮,2018-06-29
可能去的有点晚了，有些谢了，但是还是有很多很多，挺美的风景！大学时去过，现在是来故地重游的！,https://gs.ctrip.com/html5/you/comment/detail/1772/11/153898183.html,https://dimg04.c-ctrip.com/images/t1/headphoto/882/320/089/158cae5ddb6143c0b6ae18523614cf08_C_180_180.jpg,M26****5104,2018-03-18
携程上当天订的票，结果到公园门口一看没有一毛钱的优惠。里面的梅花还是蛮香的，其他也没啥可以玩的，就随便逛逛，这个门票钱还真有点冤枉,https://gs.ctrip.com/html5/you/comment/detail/1772/11/157702138.html,https://dimg04.c-ctrip.com/images/Z80p180000013uw9yF21F_C_180_180.jpg,sam****971,2019-01-25
妇女节去的，天气有点阴冷，梅花开得正好，非常漂亮！,https://gs.ctrip.com/html5/you/comment/detail/1772/11/153761780.html,https://dimg04.c-ctrip.com/images/t1/headphoto/903/173/918/eb4b7bea9720440dac09eab89328ab00_C_180_180.jpg,M25****6428,2018-03-08
说实话梅花得等到 3月初才会开！,https://gs.ctrip.com/html5/you/comment/detail/1772/11/153404050.html,https://dimg04.c-ctrip.com/images/Z80p180000013uw9yF21F_C_180_180.jpg,fi****nc,2018-02-19
这真是值得我们去玩的好地方呀。,https://gs.ctrip.com/html5/you/comment/detail/1772/11/100580364.html,https://dimg04.c-ctrip.com/images/fd/headphoto/g3/M09/37/5C/CggYG1YeOLiAKXkyAAAb4mtvXf4616_C_180_180.jpg,RJX一生无悔,2017-04-12
梅园是荣家在扬州的度假地。园林做的非常糟糕，只是随意种了一片桃园。规模虽然很大，但是没有看头。荣家在这边盖的别墅规模非常小，而且也很简陋，没有太多欣赏价值。如果你时间不富裕，不建议来这儿。,https://gs.ctrip.com/html5/you/comment/detail/1772/11/163692648.html,https://dimg04.c-ctrip.com/images/Z80p180000013uw9yF21F_C_180_180.jpg,walterlx,2020-06-21
来的不是时候，梅花还没怎么开，所以总体感觉一般般,https://gs.ctrip.com/html5/you/comment/detail/1772/11/157793455.html,https://dimg04.c-ctrip.com/images/Z8020f00000079ufj45A7_C_180_180.jpg,张卉儿,2019-02-07
园林。喜欢景色可以逛一逛。最好秋季樱花开的时候。,https://gs.ctrip.com/html5/you/comment/detail/1772/11/157086973.html,https://dimg04.c-ctrip.com/images/t1/headphoto/272/077/772/76b262d0cc24492abc5c6784c903c2ab_C_180_180.jpg,细雨中慢行,2018-10-27
时间不怎么对，没看到几棵绽放梅花，郁金香很漂亮。,https://gs.ctrip.com/html5/you/comment/detail/1772/11/154502666.html,https://dimg04.c-ctrip.com/images/Z80h180000013xc9e3F64_C_180_180.jpg,yingying5339,2018-04-21
梅园是无锡的老牌景点。现在景区扩大了，门票也涨价了。三四月份郁金香花盛开了，早些时候是桃花。冬天看腊梅花，反正一年四季都有花看。,https://gs.ctrip.com/html5/you/comment/detail/1772/11/100557913.html,https://dimg04.c-ctrip.com/images/t1/headphoto/679/527/870/d185987cdf0f40f0a272e56d5c41fa79_C_180_180.jpg,hbl1113,2017-04-12
一年四季都有花期，春天，从梅园开始，是他家的广告语，然后有郁金香，美人蕉，菖蒲，荷花，桂花，菊花，腊梅等等，当然，梅花是最好看。,https://gs.ctrip.com/html5/you/comment/detail/1772/11/89179623.html,https://dimg04.c-ctrip.com/images/Z80h180000013xc9e3F64_C_180_180.jpg,e34****23,2016-10-05
去了还想去，真的挺不错的，令我流连忘返。很喜欢，很赞！推荐给大家！！当时跟着剧组一块儿去的大梅沙，第一次到海边，如果算是的话，听着海浪拍击海岸的声音，有种莫名的幸福感。,https://gs.ctrip.com/html5/you/comment/detail/1772/11/13669345.html,https://dimg04.c-ctrip.com/images/Z80p180000013uw9yF21F_C_180_180.jpg,_WB1****546,2015-03-16
春节玩的，梅花满园，春意盎然，城市里面的好公园,https://gs.ctrip.com/html5/you/comment/detail/1772/11/154248410.html,https://dimg04.c-ctrip.com/images/Z80p180000013uw9yF21F_C_180_180.jpg,110****352,2018-04-04
真的很大，还没有全部走完～十里桃花，走一遭 美景尽收～郁金香含苞待放 别有一番春意在心头～,https://gs.ctrip.com/html5/you/comment/detail/1772/11/154103480.html,https://dimg04.c-ctrip.com/images/t1/headphoto/136/299/437/649eb217e3e54746b7a53b8665e14b00_C_180_180.jpg,deerandlu,2018-03-25
买的特价票9元，园内腊梅开花了，不过腊梅数量很少，要是梅花开放的季节园内景致一定很好。,https://gs.ctrip.com/html5/you/comment/detail/1772/11/144398054.html,https://dimg04.c-ctrip.com/images/t1/headphoto/397/132/243/542067aa29904ae9aca7e88f43eaeb6f_C_180_180.jpg,田心影像,2017-12-22
本就是无锡人，因为离家近，因此经常去，梅园一年中活动也很多，有灯展，有冰雕展，都是很赞的。秋天桂花开，冬天梅花开，春天桃花开，夏有郁金香。一年四季都有美美的花可欣赏。,https://gs.ctrip.com/html5/you/comment/detail/1772/11/122130753.html,https://dimg04.c-ctrip.com/images/t1/headphoto/062/938/215/f5f05c77006946428867e3c0dae6f4eb_C_180_180.jpg,M23****7181,2017-09-16
看来现在去不是时候，很多梅花还没有盛开，即便已经开的，也不是很香。还是等到3月去比较合适。另外，公园内已经栽种了荷兰郁金香了。,https://gs.ctrip.com/html5/you/comment/detail/1772/11/96754080.html,https://dimg04.c-ctrip.com/images/headphoto/689/073/243/50f58ce599ca4113aec886ddf4c63e40_C_180_180.jpg,你已被人使用,2017-02-08
